INFO:optuna.study.study:Trial 73 finished with value: 0.07470909506082535 and parameters: {'n_max': 804, 'n_layers': 4, 'n_out': 11, 'mean_type': 'constant', 'kernel_type': 'rbf', 'lr': 0.06836325704346913, 'batch_size': 1024, 'num_inducing': 1073, 'initialize_fe': False, 'minit': 'random'}. Best is trial 16 with value: 0.06854934990406036.
INFO:root:After model training
INFO:root:59.58349609375
INFO:root:128.0
INFO:optuna.study.study:Trial 74 finished with value: 0.07212719321250916 and parameters: {'n_max': 740, 'n_layers': 4, 'n_out': 12, 'mean_type': 'constant', 'kernel_type': 'rbf', 'lr': 0.05235262567996142, 'batch_size': 1024, 'num_inducing': 885, 'initialize_fe': False, 'minit': 'random'}. Best is trial 16 with value: 0.06854934990406036.
INFO:root:After model training
INFO:root:58.83642578125
INFO:root:126.0
INFO:optuna.study.study:Trial 75 finished with value: 0.07714609801769257 and parameters: {'n_max': 759, 'n_layers': 4, 'n_out': 16, 'mean_type': 'constant', 'kernel_type': 'rbf', 'lr': 0.027998877753432808, 'batch_size': 1024, 'num_inducing': 769, 'initialize_fe': False, 'minit': 'random'}. Best is trial 16 with value: 0.06854934990406036.
INFO:root:After model training
INFO:root:74.20263671875
INFO:root:180.0
INFO:optuna.study.study:Trial 76 finished with value: 0.07548344135284424 and parameters: {'n_max': 872, 'n_layers': 5, 'n_out': 14, 'mean_type': 'constant', 'kernel_type': 'rbf', 'lr': 0.09919819822404881, 'batch_size': 1024, 'num_inducing': 1875, 'initialize_fe': False, 'minit': 'random'}. Best is trial 16 with value: 0.06854934990406036.
INFO:root:After model training
INFO:root:56.96142578125
INFO:root:128.0
INFO:optuna.study.study:Trial 77 finished with value: 0.10006454586982727 and parameters: {'n_max': 831, 'n_layers': 3, 'n_out': 19, 'mean_type': 'constant', 'kernel_type': 'matern0.5', 'lr': 0.07499531495567999, 'batch_size': 1024, 'num_inducing': 514, 'initialize_fe': False, 'minit': 'random'}. Best is trial 16 with value: 0.06854934990406036.
INFO:root:After model training
INFO:root:56.609375
INFO:root:126.0
INFO:optuna.study.study:Trial 78 finished with value: 0.08689883351325989 and parameters: {'n_max': 693, 'n_layers': 4, 'n_out': 15, 'mean_type': 'constant', 'kernel_type': 'rbf', 'lr': 0.05671598289487538, 'batch_size': 512, 'num_inducing': 438, 'initialize_fe': False, 'minit': 'kmeans'}. Best is trial 16 with value: 0.06854934990406036.
INFO:root:After model training
INFO:root:54.21923828125
INFO:root:124.0
INFO:optuna.study.study:Trial 79 finished with value: 0.09044860303401947 and parameters: {'n_max': 815, 'n_layers': 2, 'n_out': 6, 'mean_type': 'constant', 'kernel_type': 'rbf', 'lr': 0.041327304719842105, 'batch_size': 1024, 'num_inducing': 241, 'initialize_fe': False, 'minit': 'random'}. Best is trial 16 with value: 0.06854934990406036.
INFO:root:After model training
INFO:root:58.81396484375
INFO:root:126.0
INFO:optuna.study.study:Trial 80 finished with value: 0.06883230805397034 and parameters: {'n_max': 767, 'n_layers': 4, 'n_out': 10, 'mean_type': 'constant', 'kernel_type': 'rbf', 'lr': 0.08329522238485512, 'batch_size': 1024, 'num_inducing': 606, 'initialize_fe': False, 'minit': 'random'}. Best is trial 16 with value: 0.06854934990406036.
INFO:root:After model training
INFO:root:58.8623046875
INFO:root:126.0
INFO:optuna.study.study:Trial 81 finished with value: 0.06847505271434784 and parameters: {'n_max': 757, 'n_layers': 4, 'n_out': 10, 'mean_type': 'constant', 'kernel_type': 'rbf', 'lr': 0.06764903672057537, 'batch_size': 1024, 'num_inducing': 626, 'initialize_fe': False, 'minit': 'random'}. Best is trial 81 with value: 0.06847505271434784.
INFO:root:After model training
INFO:root:58.7783203125
INFO:root:126.0
INFO:optuna.study.study:Trial 82 finished with value: 0.06928017735481262 and parameters: {'n_max': 763, 'n_layers': 4, 'n_out': 11, 'mean_type': 'constant', 'kernel_type': 'rbf', 'lr': 0.0686741488357507, 'batch_size': 1024, 'num_inducing': 644, 'initialize_fe': False, 'minit': 'random'}. Best is trial 81 with value: 0.06847505271434784.
INFO:root:After model training
INFO:root:57.3935546875
INFO:root:126.0
INFO:optuna.study.study:Trial 83 finished with value: 0.07063670456409454 and parameters: {'n_max': 631, 'n_layers': 4, 'n_out': 9, 'mean_type': 'constant', 'kernel_type': 'rbf', 'lr': 0.06483855279588946, 'batch_size': 1024, 'num_inducing': 612, 'initialize_fe': False, 'minit': 'random'}. Best is trial 81 with value: 0.06847505271434784.
INFO:root:After model training
INFO:root:57.22705078125
INFO:root:132.0
INFO:optuna.study.study:Trial 84 finished with value: 0.07617289572954178 and parameters: {'n_max': 762, 'n_layers': 4, 'n_out': 11, 'mean_type': 'constant', 'kernel_type': 'rbf', 'lr': 0.05085980755362268, 'batch_size': 1024, 'num_inducing': 499, 'initialize_fe': False, 'minit': 'random'}. Best is trial 81 with value: 0.06847505271434784.
INFO:root:After model training
INFO:root:58.89794921875
INFO:root:126.0
INFO:optuna.study.study:Trial 85 finished with value: 0.06997033208608627 and parameters: {'n_max': 766, 'n_layers': 4, 'n_out': 10, 'mean_type': 'constant', 'kernel_type': 'rbf', 'lr': 0.082452640470359, 'batch_size': 1024, 'num_inducing': 678, 'initialize_fe': False, 'minit': 'random'}. Best is trial 81 with value: 0.06847505271434784.
INFO:root:After model training
INFO:root:58.27734375
INFO:root:128.0
INFO:optuna.study.study:Trial 86 finished with value: 0.09234224259853363 and parameters: {'n_max': 711, 'n_layers': 5, 'n_out': 10, 'mean_type': 'linear', 'kernel_type': 'rbf', 'lr': 0.036443497242591175, 'batch_size': 1024, 'num_inducing': 591, 'initialize_fe': True, 'minit': 'random'}. Best is trial 81 with value: 0.06847505271434784.
INFO:root:After model training
INFO:root:56.65478515625
INFO:root:128.0
INFO:optuna.study.study:Trial 87 finished with value: 0.07346762716770172 and parameters: {'n_max': 769, 'n_layers': 4, 'n_out': 12, 'mean_type': 'constant', 'kernel_type': 'rbf', 'lr': 0.0834943096240951, 'batch_size': 1024, 'num_inducing': 359, 'initialize_fe': False, 'minit': 'random'}. Best is trial 81 with value: 0.06847505271434784.
INFO:root:After model training
INFO:root:58.68798828125
INFO:root:126.0
INFO:optuna.study.study:Trial 88 finished with value: 0.07781398296356201 and parameters: {'n_max': 699, 'n_layers': 4, 'n_out': 9, 'mean_type': 'constant', 'kernel_type': 'rbf', 'lr': 0.013999802062819646, 'batch_size': 1024, 'num_inducing': 794, 'initialize_fe': False, 'minit': 'random'}. Best is trial 81 with value: 0.06847505271434784.
INFO:root:After model training
INFO:root:59.1357421875
INFO:root:124.0
INFO:optuna.study.study:Trial 89 finished with value: 0.0785173773765564 and parameters: {'n_max': 739, 'n_layers': 3, 'n_out': 11, 'mean_type': 'constant', 'kernel_type': 'rbf', 'lr': 0.029024660933839264, 'batch_size': 1024, 'num_inducing': 932, 'initialize_fe': False, 'minit': 'random'}. Best is trial 81 with value: 0.06847505271434784.
INFO:root:After model training
INFO:root:57.3759765625
INFO:root:126.0
INFO:optuna.study.study:Trial 90 finished with value: 0.07013300061225891 and parameters: {'n_max': 663, 'n_layers': 4, 'n_out': 13, 'mean_type': 'constant', 'kernel_type': 'rbf', 'lr': 0.06640314876320122, 'batch_size': 1024, 'num_inducing': 554, 'initialize_fe': False, 'minit': 'kmeans'}. Best is trial 81 with value: 0.06847505271434784.
INFO:root:After model training
INFO:root:58.6064453125
INFO:root:126.0
INFO:optuna.study.study:Trial 91 finished with value: 0.07036980986595154 and parameters: {'n_max': 669, 'n_layers': 4, 'n_out': 13, 'mean_type': 'constant', 'kernel_type': 'rbf', 'lr': 0.06491539119819673, 'batch_size': 1024, 'num_inducing': 659, 'initialize_fe': False, 'minit': 'random'}. Best is trial 81 with value: 0.06847505271434784.
INFO:root:After model training
INFO:root:58.5908203125
INFO:root:126.0
INFO:optuna.study.study:Trial 92 finished with value: 0.07067486643791199 and parameters: {'n_max': 670, 'n_layers': 4, 'n_out': 13, 'mean_type': 'constant', 'kernel_type': 'rbf', 'lr': 0.06654056294424804, 'batch_size': 1024, 'num_inducing': 663, 'initialize_fe': False, 'minit': 'kmeans'}. Best is trial 81 with value: 0.06847505271434784.
INFO:root:After model training
INFO:root:56.6474609375
INFO:root:126.0
INFO:optuna.study.study:Trial 93 finished with value: 0.0763503760099411 and parameters: {'n_max': 598, 'n_layers': 4, 'n_out': 13, 'mean_type': 'constant', 'kernel_type': 'rbf', 'lr': 0.057275712028722954, 'batch_size': 1024, 'num_inducing': 535, 'initialize_fe': False, 'minit': 'kmeans'}. Best is trial 81 with value: 0.06847505271434784.
INFO:root:After model training
INFO:root:56.20751953125
INFO:root:130.0
INFO:optuna.study.study:Trial 94 finished with value: 0.07738510519266129 and parameters: {'n_max': 562, 'n_layers': 4, 'n_out': 14, 'mean_type': 'constant', 'kernel_type': 'rbf', 'lr': 0.04394181991721302, 'batch_size': 1024, 'num_inducing': 475, 'initialize_fe': False, 'minit': 'kmeans'}. Best is trial 81 with value: 0.06847505271434784.
INFO:root:After model training
INFO:root:57.603515625
INFO:root:130.0
INFO:optuna.study.study:Trial 95 finished with value: 0.07500658929347992 and parameters: {'n_max': 755, 'n_layers': 4, 'n_out': 11, 'mean_type': 'constant', 'kernel_type': 'rbf', 'lr': 0.08618328484489605, 'batch_size': 1024, 'num_inducing': 578, 'initialize_fe': False, 'minit': 'kmeans'}. Best is trial 81 with value: 0.06847505271434784.
INFO:root:After model training
INFO:root:56.71435546875
INFO:root:126.0
INFO:optuna.study.study:Trial 96 finished with value: 0.0723646804690361 and parameters: {'n_max': 478, 'n_layers': 4, 'n_out': 12, 'mean_type': 'constant', 'kernel_type': 'rbf', 'lr': 0.06724546488453342, 'batch_size': 1024, 'num_inducing': 628, 'initialize_fe': False, 'minit': 'kmeans'}. Best is trial 81 with value: 0.06847505271434784.
INFO:root:After model training
INFO:root:59.09912109375
INFO:root:128.0
INFO:optuna.study.study:Trial 97 finished with value: 0.081844761967659 and parameters: {'n_max': 653, 'n_layers': 4, 'n_out': 10, 'mean_type': 'constant', 'kernel_type': 'rbf', 'lr': 0.05081872690219349, 'batch_size': 512, 'num_inducing': 877, 'initialize_fe': False, 'minit': 'random'}. Best is trial 81 with value: 0.06847505271434784.
INFO:root:After model training
INFO:root:58.8916015625
INFO:root:128.0
INFO:optuna.study.study:Trial 98 finished with value: 0.07429641485214233 and parameters: {'n_max': 776, 'n_layers': 4, 'n_out': 12, 'mean_type': 'constant', 'kernel_type': 'rbf', 'lr': 0.07820649145273759, 'batch_size': 1024, 'num_inducing': 690, 'initialize_fe': False, 'minit': 'random'}. Best is trial 81 with value: 0.06847505271434784.
INFO:root:After model training
INFO:root:57.318359375
INFO:root:128.0
INFO:optuna.study.study:Trial 99 finished with value: 0.125379279255867 and parameters: {'n_max': 847, 'n_layers': 4, 'n_out': 14, 'mean_type': 'linear', 'kernel_type': 'rbf', 'lr': 0.060779852537396886, 'batch_size': 1024, 'num_inducing': 414, 'initialize_fe': True, 'minit': 'kmeans'}. Best is trial 81 with value: 0.06847505271434784.
INFO:root:Outer Run: 5: MSE - 0.01894228346645832, MAE - 0.11102020740509033. MAX - 0.37461769580841064
INFO:openml.datasets.dataset:pickle load data wine_quality
INFO:optuna.storages._in_memory:A new study created in memory with name: Nested Resampling VDKL 1
INFO:root:After model training
INFO:root:19.32080078125
INFO:root:68.0
INFO:optuna.study.study:Trial 0 finished with value: 0.0012299371883273125 and parameters: {'n_max': 1024, 'n_layers': 4, 'n_out': 2, 'mean_type': 'constant', 'kernel_type': 'rbf', 'lr': 0.01, 'batch_size': 2048, 'num_inducing': 1000, 'initialize_fe': False, 'minit': 'random'}. Best is trial 0 with value: 0.0012299371883273125.
INFO:root:After model training
INFO:root:8.46240234375
INFO:root:46.0
INFO:optuna.study.study:Trial 1 finished with value: 0.0017786636017262936 and parameters: {'n_max': 184, 'n_layers': 3, 'n_out': 15, 'mean_type': 'linear', 'kernel_type': 'matern1.5', 'lr': 0.00010299767340600597, 'batch_size': 1024, 'num_inducing': 409, 'initialize_fe': False, 'minit': 'kmeans'}. Best is trial 0 with value: 0.0012299371883273125.
INFO:root:After model training
INFO:root:6.2373046875
INFO:root:20.0
INFO:optuna.study.study:Trial 2 finished with value: 0.0008615317055955529 and parameters: {'n_max': 997, 'n_layers': 3, 'n_out': 19, 'mean_type': 'constant', 'kernel_type': 'matern0.5', 'lr': 0.002262183614088781, 'batch_size': 2048, 'num_inducing': 70, 'initialize_fe': False, 'minit': 'random'}. Best is trial 2 with value: 0.0008615317055955529.
INFO:root:After model training
INFO:root:20.92529296875
INFO:root:66.0
INFO:optuna.study.study:Trial 3 finished with value: 0.004671575501561165 and parameters: {'n_max': 837, 'n_layers': 3, 'n_out': 8, 'mean_type': 'linear', 'kernel_type': 'matern1.5', 'lr': 0.037604512414792166, 'batch_size': 1024, 'num_inducing': 1246, 'initialize_fe': True, 'minit': 'random'}. Best is trial 2 with value: 0.0008615317055955529.
INFO:root:After model training
INFO:root:1.48828125
INFO:root:14.0
INFO:optuna.study.study:Trial 4 finished with value: 0.0019889131654053926 and parameters: {'n_max': 456, 'n_layers': 2, 'n_out': 9, 'mean_type': 'linear', 'kernel_type': 'matern1.5', 'lr': 0.019266218209311535, 'batch_size': 512, 'num_inducing': 140, 'initialize_fe': True, 'minit': 'random'}. Best is trial 2 with value: 0.0008615317055955529.
INFO:root:After model training
INFO:root:10.3681640625
INFO:root:32.0
INFO:optuna.study.study:Trial 5 finished with value: 0.0006289499578997493 and parameters: {'n_max': 600, 'n_layers': 4, 'n_out': 15, 'mean_type': 'constant', 'kernel_type': 'matern0.5', 'lr': 0.011307151717056558, 'batch_size': 1024, 'num_inducing': 505, 'initialize_fe': False, 'minit': 'kmeans'}. Best is trial 5 with value: 0.0006289499578997493.
INFO:root:After model training
INFO:root:23.66357421875
INFO:root:74.0
INFO:optuna.study.study:Trial 6 finished with value: 0.006507387384772301 and parameters: {'n_max': 152, 'n_layers': 5, 'n_out': 2, 'mean_type': 'constant', 'kernel_type': 'rbf', 'lr': 0.0005532381086357547, 'batch_size': 2048, 'num_inducing': 1505, 'initialize_fe': True, 'minit': 'kmeans'}. Best is trial 5 with value: 0.0006289499578997493.
INFO:root:After model training
INFO:root:18.95947265625
INFO:root:104.0
INFO:optuna.study.study:Trial 7 finished with value: 0.0021364379208534956 and parameters: {'n_max': 704, 'n_layers': 5, 'n_out': 2, 'mean_type': 'linear', 'kernel_type': 'matern1.5', 'lr': 0.007049487378917083, 'batch_size': 1024, 'num_inducing': 1104, 'initialize_fe': True, 'minit': 'random'}. Best is trial 5 with value: 0.0006289499578997493.
INFO:root:After model training
INFO:root:7.9326171875
INFO:root:48.0
INFO:optuna.study.study:Trial 8 finished with value: 0.011683598160743713 and parameters: {'n_max': 155, 'n_layers': 2, 'n_out': 13, 'mean_type': 'constant', 'kernel_type': 'matern1.5', 'lr': 0.00011998497441870208, 'batch_size': 1024, 'num_inducing': 337, 'initialize_fe': True, 'minit': 'random'}. Best is trial 5 with value: 0.0006289499578997493.
INFO:root:After model training
INFO:root:10.00927734375
INFO:root:42.0
INFO:optuna.study.study:Trial 9 finished with value: 0.043125756084918976 and parameters: {'n_max': 433, 'n_layers': 3, 'n_out': 18, 'mean_type': 'linear', 'kernel_type': 'rbf', 'lr': 0.0046634926365877955, 'batch_size': 2048, 'num_inducing': 518, 'initialize_fe': False, 'minit': 'random'}. Best is trial 5 with value: 0.0006289499578997493.
INFO:root:After model training
INFO:root:3.06689453125
INFO:root:30.0
INFO:optuna.study.study:Trial 10 finished with value: 0.003512158989906311 and parameters: {'n_max': 652, 'n_layers': 4, 'n_out': 16, 'mean_type': 'constant', 'kernel_type': 'matern0.5', 'lr': 0.0935980897680492, 'batch_size': 512, 'num_inducing': 161, 'initialize_fe': False, 'minit': 'kmeans'}. Best is trial 5 with value: 0.0006289499578997493.
INFO:root:After model training
INFO:root:7.61572265625
INFO:root:28.0
INFO:optuna.study.study:Trial 11 finished with value: 0.0011346825631335378 and parameters: {'n_max': 999, 'n_layers': 4, 'n_out': 20, 'mean_type': 'constant', 'kernel_type': 'matern0.5', 'lr': 0.0012975654616633905, 'batch_size': 2048, 'num_inducing': 53, 'initialize_fe': False, 'minit': 'kmeans'}. Best is trial 5 with value: 0.0006289499578997493.
INFO:root:After model training
INFO:root:5.56396484375
INFO:root:26.0
INFO:optuna.study.study:Trial 12 finished with value: 0.0011593984672799706 and parameters: {'n_max': 839, 'n_layers': 3, 'n_out': 20, 'mean_type': 'constant', 'kernel_type': 'matern0.5', 'lr': 0.001595444166104161, 'batch_size': 2048, 'num_inducing': 56, 'initialize_fe': False, 'minit': 'kmeans'}. Best is trial 5 with value: 0.0006289499578997493.
INFO:root:After model training
INFO:root:5.4130859375
INFO:root:32.0
INFO:optuna.study.study:Trial 13 finished with value: 0.0004658530233427882 and parameters: {'n_max': 345, 'n_layers': 4, 'n_out': 12, 'mean_type': 'constant', 'kernel_type': 'matern0.5', 'lr': 0.002190606053372728, 'batch_size': 1024, 'num_inducing': 158, 'initialize_fe': False, 'minit': 'kmeans'}. Best is trial 13 with value: 0.0004658530233427882.
INFO:root:After model training
INFO:root:5.65185546875
INFO:root:32.0
INFO:optuna.study.study:Trial 14 finished with value: 0.0005377691122703254 and parameters: {'n_max': 318, 'n_layers': 5, 'n_out': 12, 'mean_type': 'constant', 'kernel_type': 'matern0.5', 'lr': 0.0007066419906374795, 'batch_size': 1024, 'num_inducing': 176, 'initialize_fe': False, 'minit': 'kmeans'}. Best is trial 13 with value: 0.0004658530233427882.
INFO:root:After model training
INFO:root:5.24462890625
INFO:root:32.0
INFO:optuna.study.study:Trial 15 finished with value: 0.0014314732979983091 and parameters: {'n_max': 312, 'n_layers': 5, 'n_out': 11, 'mean_type': 'constant', 'kernel_type': 'matern0.5', 'lr': 0.00041329843674795615, 'batch_size': 1024, 'num_inducing': 131, 'initialize_fe': False, 'minit': 'kmeans'}. Best is trial 13 with value: 0.0004658530233427882.
INFO:root:After model training
INFO:root:5.90966796875
INFO:root:32.0
INFO:optuna.study.study:Trial 16 finished with value: 0.0005659318412654102 and parameters: {'n_max': 288, 'n_layers': 5, 'n_out': 6, 'mean_type': 'constant', 'kernel_type': 'matern0.5', 'lr': 0.0006179690619740085, 'batch_size': 1024, 'num_inducing': 216, 'initialize_fe': False, 'minit': 'kmeans'}. Best is trial 13 with value: 0.0004658530233427882.
INFO:root:After model training
INFO:root:4.97900390625
INFO:root:30.0
INFO:optuna.study.study:Trial 17 finished with value: 0.001138218678534031 and parameters: {'n_max': 338, 'n_layers': 5, 'n_out': 12, 'mean_type': 'constant', 'kernel_type': 'matern0.5', 'lr': 0.00029581253213096056, 'batch_size': 1024, 'num_inducing': 89, 'initialize_fe': False, 'minit': 'kmeans'}. Best is trial 13 with value: 0.0004658530233427882.
INFO:root:After model training
INFO:root:1.99658203125
INFO:root:14.0
INFO:optuna.study.study:Trial 18 finished with value: 0.00045865430729463696 and parameters: {'n_max': 72, 'n_layers': 4, 'n_out': 10, 'mean_type': 'constant', 'kernel_type': 'matern0.5', 'lr': 0.0009201501280309539, 'batch_size': 512, 'num_inducing': 242, 'initialize_fe': False, 'minit': 'kmeans'}. Best is trial 18 with value: 0.00045865430729463696.
INFO:root:After model training
INFO:root:2.05859375
INFO:root:10.0
INFO:optuna.study.study:Trial 19 finished with value: 0.0006371262716129422 and parameters: {'n_max': 88, 'n_layers': 4, 'n_out': 5, 'mean_type': 'constant', 'kernel_type': 'matern0.5', 'lr': 0.00396400696630383, 'batch_size': 512, 'num_inducing': 252, 'initialize_fe': False, 'minit': 'kmeans'}. Best is trial 18 with value: 0.00045865430729463696.
INFO:root:Outer Run: 1: MSE - 6.845478492323309e-05, MAE - 0.005733714904636145. MAX - 0.04922527074813843
INFO:optuna.storages._in_memory:A new study created in memory with name: Nested Resampling VDKL 2
INFO:root:After model training
INFO:root:23.6923828125
INFO:root:76.0
INFO:optuna.study.study:Trial 0 finished with value: 0.001441749045625329 and parameters: {'n_max': 1024, 'n_layers': 4, 'n_out': 2, 'mean_type': 'constant', 'kernel_type': 'rbf', 'lr': 0.01, 'batch_size': 2048, 'num_inducing': 1000, 'initialize_fe': False, 'minit': 'kmeans'}. Best is trial 0 with value: 0.001441749045625329.
INFO:root:After model training
INFO:root:17.189453125
INFO:root:60.0
INFO:optuna.study.study:Trial 1 finished with value: 0.007422149181365967 and parameters: {'n_max': 887, 'n_layers': 3, 'n_out': 2, 'mean_type': 'linear', 'kernel_type': 'matern0.5', 'lr': 0.04617276362554212, 'batch_size': 2048, 'num_inducing': 538, 'initialize_fe': True, 'minit': 'kmeans'}. Best is trial 0 with value: 0.001441749045625329.
INFO:root:After model training
INFO:root:7.14794921875
INFO:root:22.0
INFO:optuna.study.study:Trial 2 finished with value: 0.0005245257052592933 and parameters: {'n_max': 617, 'n_layers': 2, 'n_out': 10, 'mean_type': 'linear', 'kernel_type': 'matern1.5', 'lr': 0.00012847523019843266, 'batch_size': 512, 'num_inducing': 373, 'initialize_fe': True, 'minit': 'random'}. Best is trial 2 with value: 0.0005245257052592933.
INFO:root:After model training
INFO:root:11.63037109375
INFO:root:36.0
INFO:optuna.study.study:Trial 3 finished with value: 0.008673842996358871 and parameters: {'n_max': 691, 'n_layers': 4, 'n_out': 3, 'mean_type': 'linear', 'kernel_type': 'matern1.5', 'lr': 0.0003491909695841764, 'batch_size': 2048, 'num_inducing': 229, 'initialize_fe': True, 'minit': 'kmeans'}. Best is trial 2 with value: 0.0005245257052592933.
INFO:root:After model training
INFO:root:37.27734375
INFO:root:76.0
