INFO:optuna.study.study:Trial 20 finished with value: 0.08503217995166779 and parameters: {'n_max': 308, 'n_layers': 2, 'n_out': 10, 'mean_type': 'constant', 'kernel_type': 'matern1.5', 'lr': 0.027271169045865535, 'batch_size': 1024, 'num_inducing': 608, 'initialize_fe': False, 'minit': 'random'}. Best is trial 16 with value: 0.06854934990406036.
INFO:root:After model training
INFO:root:70.859375
INFO:root:152.0
INFO:optuna.study.study:Trial 21 finished with value: 0.07390894740819931 and parameters: {'n_max': 660, 'n_layers': 4, 'n_out': 2, 'mean_type': 'constant', 'kernel_type': 'rbf', 'lr': 0.0050288194956834365, 'batch_size': 1024, 'num_inducing': 1852, 'initialize_fe': False, 'minit': 'random'}. Best is trial 16 with value: 0.06854934990406036.
INFO:root:After model training
INFO:root:66.9970703125
INFO:root:140.0
INFO:optuna.study.study:Trial 22 finished with value: 0.07669119536876678 and parameters: {'n_max': 674, 'n_layers': 3, 'n_out': 3, 'mean_type': 'constant', 'kernel_type': 'rbf', 'lr': 0.00416940798113783, 'batch_size': 1024, 'num_inducing': 1664, 'initialize_fe': False, 'minit': 'random'}. Best is trial 16 with value: 0.06854934990406036.
INFO:root:After model training
INFO:root:55.20751953125
INFO:root:126.0
INFO:optuna.study.study:Trial 23 finished with value: 0.07275079935789108 and parameters: {'n_max': 532, 'n_layers': 5, 'n_out': 7, 'mean_type': 'constant', 'kernel_type': 'rbf', 'lr': 0.0016284863892601508, 'batch_size': 1024, 'num_inducing': 86, 'initialize_fe': False, 'minit': 'random'}. Best is trial 16 with value: 0.06854934990406036.
INFO:root:After model training
INFO:root:55.16357421875
INFO:root:128.0
INFO:optuna.study.study:Trial 24 finished with value: 0.0768279880285263 and parameters: {'n_max': 523, 'n_layers': 5, 'n_out': 7, 'mean_type': 'constant', 'kernel_type': 'rbf', 'lr': 0.0012106423492592607, 'batch_size': 1024, 'num_inducing': 88, 'initialize_fe': False, 'minit': 'random'}. Best is trial 16 with value: 0.06854934990406036.
INFO:root:After model training
INFO:root:55.11328125
INFO:root:128.0
INFO:optuna.study.study:Trial 25 finished with value: 0.0749424546957016 and parameters: {'n_max': 489, 'n_layers': 5, 'n_out': 7, 'mean_type': 'constant', 'kernel_type': 'rbf', 'lr': 0.0008258407332400021, 'batch_size': 1024, 'num_inducing': 147, 'initialize_fe': False, 'minit': 'random'}. Best is trial 16 with value: 0.06854934990406036.
INFO:root:After model training
INFO:root:60.91796875
INFO:root:126.0
INFO:optuna.study.study:Trial 26 finished with value: 0.07238704711198807 and parameters: {'n_max': 345, 'n_layers': 5, 'n_out': 4, 'mean_type': 'constant', 'kernel_type': 'rbf', 'lr': 0.0021418224416341674, 'batch_size': 2048, 'num_inducing': 73, 'initialize_fe': False, 'minit': 'random'}. Best is trial 16 with value: 0.06854934990406036.
INFO:root:After model training
INFO:root:61.46484375
INFO:root:126.0
INFO:optuna.study.study:Trial 27 finished with value: 0.0773414596915245 and parameters: {'n_max': 334, 'n_layers': 2, 'n_out': 4, 'mean_type': 'constant', 'kernel_type': 'rbf', 'lr': 0.05966951605670835, 'batch_size': 2048, 'num_inducing': 186, 'initialize_fe': False, 'minit': 'random'}. Best is trial 16 with value: 0.06854934990406036.
INFO:root:After model training
INFO:root:62.88330078125
INFO:root:126.0
INFO:optuna.study.study:Trial 28 finished with value: 0.08461599797010422 and parameters: {'n_max': 449, 'n_layers': 5, 'n_out': 18, 'mean_type': 'constant', 'kernel_type': 'rbf', 'lr': 0.0005154004978224496, 'batch_size': 2048, 'num_inducing': 274, 'initialize_fe': False, 'minit': 'random'}. Best is trial 16 with value: 0.06854934990406036.
INFO:root:After model training
INFO:root:60.4130859375
INFO:root:126.0
INFO:optuna.study.study:Trial 29 finished with value: 0.07214660197496414 and parameters: {'n_max': 330, 'n_layers': 4, 'n_out': 2, 'mean_type': 'constant', 'kernel_type': 'matern1.5', 'lr': 0.007080818976475164, 'batch_size': 2048, 'num_inducing': 73, 'initialize_fe': False, 'minit': 'random'}. Best is trial 16 with value: 0.06854934990406036.
INFO:root:After model training
INFO:root:62.97265625
INFO:root:130.0
INFO:optuna.study.study:Trial 30 finished with value: 0.07575687766075134 and parameters: {'n_max': 929, 'n_layers': 4, 'n_out': 2, 'mean_type': 'constant', 'kernel_type': 'matern1.5', 'lr': 0.019361098000781764, 'batch_size': 2048, 'num_inducing': 124, 'initialize_fe': False, 'minit': 'random'}. Best is trial 16 with value: 0.06854934990406036.
INFO:root:After model training
INFO:root:60.42431640625
INFO:root:126.0
INFO:optuna.study.study:Trial 31 finished with value: 0.07348087430000305 and parameters: {'n_max': 335, 'n_layers': 4, 'n_out': 2, 'mean_type': 'constant', 'kernel_type': 'matern1.5', 'lr': 0.002453295596547212, 'batch_size': 2048, 'num_inducing': 73, 'initialize_fe': False, 'minit': 'random'}. Best is trial 16 with value: 0.06854934990406036.
INFO:root:After model training
INFO:root:61.73046875
INFO:root:128.0
INFO:optuna.study.study:Trial 32 finished with value: 0.07338227331638336 and parameters: {'n_max': 595, 'n_layers': 5, 'n_out': 4, 'mean_type': 'constant', 'kernel_type': 'matern1.5', 'lr': 0.006486366496668258, 'batch_size': 2048, 'num_inducing': 71, 'initialize_fe': False, 'minit': 'random'}. Best is trial 16 with value: 0.06854934990406036.
INFO:root:After model training
INFO:root:68.7958984375
INFO:root:176.0
INFO:optuna.study.study:Trial 33 finished with value: 0.07261863350868225 and parameters: {'n_max': 267, 'n_layers': 4, 'n_out': 4, 'mean_type': 'constant', 'kernel_type': 'matern1.5', 'lr': 0.03702486820595671, 'batch_size': 2048, 'num_inducing': 737, 'initialize_fe': False, 'minit': 'random'}. Best is trial 16 with value: 0.06854934990406036.
INFO:root:After model training
INFO:root:60.29443359375
INFO:root:126.0
INFO:optuna.study.study:Trial 34 finished with value: 0.07637644559144974 and parameters: {'n_max': 352, 'n_layers': 3, 'n_out': 6, 'mean_type': 'constant', 'kernel_type': 'matern0.5', 'lr': 0.006847584007764132, 'batch_size': 2048, 'num_inducing': 74, 'initialize_fe': True, 'minit': 'random'}. Best is trial 16 with value: 0.06854934990406036.
INFO:root:After model training
INFO:root:61.81298828125
INFO:root:128.0
INFO:optuna.study.study:Trial 35 finished with value: 0.13760265707969666 and parameters: {'n_max': 465, 'n_layers': 5, 'n_out': 9, 'mean_type': 'linear', 'kernel_type': 'matern1.5', 'lr': 0.00384056346139906, 'batch_size': 2048, 'num_inducing': 146, 'initialize_fe': False, 'minit': 'random'}. Best is trial 16 with value: 0.06854934990406036.
INFO:root:After model training
INFO:root:60.73388671875
INFO:root:126.0
INFO:optuna.study.study:Trial 36 finished with value: 0.0788019597530365 and parameters: {'n_max': 263, 'n_layers': 3, 'n_out': 3, 'mean_type': 'constant', 'kernel_type': 'rbf', 'lr': 0.016127375134533422, 'batch_size': 2048, 'num_inducing': 100, 'initialize_fe': False, 'minit': 'random'}. Best is trial 16 with value: 0.06854934990406036.
INFO:root:After model training
INFO:root:66.3330078125
INFO:root:140.0
INFO:optuna.study.study:Trial 37 finished with value: 0.1301608383655548 and parameters: {'n_max': 392, 'n_layers': 4, 'n_out': 2, 'mean_type': 'linear', 'kernel_type': 'matern0.5', 'lr': 0.008478877304368991, 'batch_size': 2048, 'num_inducing': 520, 'initialize_fe': True, 'minit': 'kmeans'}. Best is trial 16 with value: 0.06854934990406036.
INFO:root:After model training
INFO:root:75.0712890625
INFO:root:186.0
INFO:optuna.study.study:Trial 38 finished with value: 0.07876894623041153 and parameters: {'n_max': 571, 'n_layers': 4, 'n_out': 14, 'mean_type': 'constant', 'kernel_type': 'rbf', 'lr': 0.034414891991919765, 'batch_size': 2048, 'num_inducing': 1136, 'initialize_fe': False, 'minit': 'random'}. Best is trial 16 with value: 0.06854934990406036.
INFO:root:After model training
INFO:root:57.54345703125
INFO:root:126.0
INFO:optuna.study.study:Trial 39 finished with value: 0.09574541449546814 and parameters: {'n_max': 188, 'n_layers': 5, 'n_out': 6, 'mean_type': 'linear', 'kernel_type': 'matern1.5', 'lr': 0.002007134260784412, 'batch_size': 512, 'num_inducing': 845, 'initialize_fe': True, 'minit': 'kmeans'}. Best is trial 16 with value: 0.06854934990406036.
INFO:root:After model training
INFO:root:64.8515625
INFO:root:124.0
INFO:optuna.study.study:Trial 40 finished with value: 0.08912651240825653 and parameters: {'n_max': 107, 'n_layers': 3, 'n_out': 15, 'mean_type': 'constant', 'kernel_type': 'matern0.5', 'lr': 0.05946322178783823, 'batch_size': 2048, 'num_inducing': 422, 'initialize_fe': False, 'minit': 'random'}. Best is trial 16 with value: 0.06854934990406036.
INFO:root:After model training
INFO:root:62.67578125
INFO:root:140.0
INFO:optuna.study.study:Trial 41 finished with value: 0.07285863161087036 and parameters: {'n_max': 280, 'n_layers': 4, 'n_out': 4, 'mean_type': 'constant', 'kernel_type': 'matern1.5', 'lr': 0.03263392493212664, 'batch_size': 2048, 'num_inducing': 319, 'initialize_fe': False, 'minit': 'random'}. Best is trial 16 with value: 0.06854934990406036.
INFO:root:After model training
INFO:root:72.14111328125
INFO:root:176.0
INFO:optuna.study.study:Trial 42 finished with value: 0.0723198652267456 and parameters: {'n_max': 224, 'n_layers': 4, 'n_out': 3, 'mean_type': 'constant', 'kernel_type': 'matern1.5', 'lr': 0.046728349728475664, 'batch_size': 2048, 'num_inducing': 941, 'initialize_fe': False, 'minit': 'random'}. Best is trial 16 with value: 0.06854934990406036.
INFO:root:After model training
INFO:root:76.3974609375
INFO:root:136.0
INFO:optuna.study.study:Trial 43 finished with value: 0.07078031450510025 and parameters: {'n_max': 187, 'n_layers': 4, 'n_out': 3, 'mean_type': 'constant', 'kernel_type': 'matern1.5', 'lr': 0.07546405787283945, 'batch_size': 2048, 'num_inducing': 1228, 'initialize_fe': False, 'minit': 'random'}. Best is trial 16 with value: 0.06854934990406036.
INFO:root:After model training
INFO:root:59.19140625
INFO:root:128.0
INFO:optuna.study.study:Trial 44 finished with value: 0.1120300441980362 and parameters: {'n_max': 220, 'n_layers': 4, 'n_out': 3, 'mean_type': 'constant', 'kernel_type': 'matern1.5', 'lr': 0.07067798966472727, 'batch_size': 512, 'num_inducing': 1044, 'initialize_fe': False, 'minit': 'random'}. Best is trial 16 with value: 0.06854934990406036.
INFO:root:After model training
INFO:root:76.8359375
INFO:root:144.0
INFO:optuna.study.study:Trial 45 finished with value: 0.13398151099681854 and parameters: {'n_max': 148, 'n_layers': 4, 'n_out': 8, 'mean_type': 'linear', 'kernel_type': 'matern1.5', 'lr': 0.04570892827374089, 'batch_size': 2048, 'num_inducing': 1274, 'initialize_fe': True, 'minit': 'kmeans'}. Best is trial 16 with value: 0.06854934990406036.
INFO:root:After model training
INFO:root:57.26708984375
INFO:root:124.0
INFO:optuna.study.study:Trial 46 finished with value: 0.08304564654827118 and parameters: {'n_max': 119, 'n_layers': 3, 'n_out': 5, 'mean_type': 'constant', 'kernel_type': 'matern1.5', 'lr': 0.07642543723539995, 'batch_size': 1024, 'num_inducing': 828, 'initialize_fe': False, 'minit': 'random'}. Best is trial 16 with value: 0.06854934990406036.
INFO:root:After model training
INFO:root:79.85546875
INFO:root:148.0
INFO:optuna.study.study:Trial 47 finished with value: 0.08671275526285172 and parameters: {'n_max': 220, 'n_layers': 4, 'n_out': 11, 'mean_type': 'constant', 'kernel_type': 'matern1.5', 'lr': 0.014839557586357455, 'batch_size': 2048, 'num_inducing': 1419, 'initialize_fe': False, 'minit': 'random'}. Best is trial 16 with value: 0.06854934990406036.
INFO:root:After model training
INFO:root:55.7177734375
INFO:root:124.0
INFO:optuna.study.study:Trial 48 finished with value: 0.10379652678966522 and parameters: {'n_max': 203, 'n_layers': 4, 'n_out': 6, 'mean_type': 'constant', 'kernel_type': 'matern1.5', 'lr': 0.04947108040068894, 'batch_size': 512, 'num_inducing': 569, 'initialize_fe': False, 'minit': 'kmeans'}. Best is trial 16 with value: 0.06854934990406036.
INFO:root:After model training
INFO:root:57.1494140625
INFO:root:124.0
INFO:optuna.study.study:Trial 49 finished with value: 0.07292644679546356 and parameters: {'n_max': 730, 'n_layers': 3, 'n_out': 3, 'mean_type': 'constant', 'kernel_type': 'matern1.5', 'lr': 0.09681938826890062, 'batch_size': 1024, 'num_inducing': 663, 'initialize_fe': False, 'minit': 'random'}. Best is trial 16 with value: 0.06854934990406036.
INFO:root:After model training
INFO:root:72.677734375
INFO:root:176.0
INFO:optuna.study.study:Trial 50 finished with value: 0.12233918160200119 and parameters: {'n_max': 414, 'n_layers': 4, 'n_out': 19, 'mean_type': 'linear', 'kernel_type': 'matern1.5', 'lr': 0.025854936361011785, 'batch_size': 2048, 'num_inducing': 986, 'initialize_fe': True, 'minit': 'random'}. Best is trial 16 with value: 0.06854934990406036.
INFO:root:After model training
INFO:root:62.849609375
INFO:root:140.0
INFO:optuna.study.study:Trial 51 finished with value: 0.08189190179109573 and parameters: {'n_max': 240, 'n_layers': 5, 'n_out': 2, 'mean_type': 'constant', 'kernel_type': 'rbf', 'lr': 0.00018882982510773773, 'batch_size': 2048, 'num_inducing': 347, 'initialize_fe': False, 'minit': 'random'}. Best is trial 16 with value: 0.06854934990406036.
INFO:root:After model training
INFO:root:60.91748046875
INFO:root:130.0
INFO:optuna.study.study:Trial 52 finished with value: 0.0765967145562172 and parameters: {'n_max': 369, 'n_layers': 5, 'n_out': 5, 'mean_type': 'constant', 'kernel_type': 'rbf', 'lr': 0.0028176449133403237, 'batch_size': 2048, 'num_inducing': 64, 'initialize_fe': False, 'minit': 'random'}. Best is trial 16 with value: 0.06854934990406036.
INFO:root:After model training
INFO:root:64.77978515625
INFO:root:124.0
INFO:optuna.study.study:Trial 53 finished with value: 0.0697045549750328 and parameters: {'n_max': 275, 'n_layers': 4, 'n_out': 3, 'mean_type': 'constant', 'kernel_type': 'rbf', 'lr': 0.06801493818470518, 'batch_size': 2048, 'num_inducing': 455, 'initialize_fe': False, 'minit': 'random'}. Best is trial 16 with value: 0.06854934990406036.
INFO:root:After model training
INFO:root:55.0732421875
INFO:root:126.0
INFO:optuna.study.study:Trial 54 finished with value: 0.07658050209283829 and parameters: {'n_max': 151, 'n_layers': 4, 'n_out': 3, 'mean_type': 'constant', 'kernel_type': 'matern0.5', 'lr': 0.06257141707215022, 'batch_size': 1024, 'num_inducing': 454, 'initialize_fe': False, 'minit': 'random'}. Best is trial 16 with value: 0.06854934990406036.
INFO:root:After model training
INFO:root:69.74755859375
INFO:root:140.0
INFO:optuna.study.study:Trial 55 finished with value: 0.07160653173923492 and parameters: {'n_max': 301, 'n_layers': 4, 'n_out': 3, 'mean_type': 'constant', 'kernel_type': 'matern1.5', 'lr': 0.045465870678189975, 'batch_size': 2048, 'num_inducing': 730, 'initialize_fe': False, 'minit': 'random'}. Best is trial 16 with value: 0.06854934990406036.
INFO:root:After model training
INFO:root:55.3056640625
INFO:root:124.0
INFO:optuna.study.study:Trial 56 finished with value: 0.0746757909655571 and parameters: {'n_max': 303, 'n_layers': 2, 'n_out': 2, 'mean_type': 'constant', 'kernel_type': 'rbf', 'lr': 0.07805972157589847, 'batch_size': 1024, 'num_inducing': 518, 'initialize_fe': False, 'minit': 'random'}. Best is trial 16 with value: 0.06854934990406036.
INFO:root:After model training
INFO:root:62.41357421875
INFO:root:140.0
INFO:optuna.study.study:Trial 57 finished with value: 0.0729881078004837 and parameters: {'n_max': 302, 'n_layers': 4, 'n_out': 5, 'mean_type': 'constant', 'kernel_type': 'rbf', 'lr': 0.03137623473458027, 'batch_size': 2048, 'num_inducing': 269, 'initialize_fe': False, 'minit': 'random'}. Best is trial 16 with value: 0.06854934990406036.
INFO:root:After model training
INFO:root:58.81591796875
INFO:root:126.0
INFO:optuna.study.study:Trial 58 finished with value: 0.07055360823869705 and parameters: {'n_max': 805, 'n_layers': 4, 'n_out': 4, 'mean_type': 'constant', 'kernel_type': 'matern1.5', 'lr': 0.09932130684142776, 'batch_size': 1024, 'num_inducing': 705, 'initialize_fe': False, 'minit': 'random'}. Best is trial 16 with value: 0.06854934990406036.
INFO:root:After model training
INFO:root:58.18115234375
INFO:root:124.0
INFO:optuna.study.study:Trial 59 finished with value: 0.07561884820461273 and parameters: {'n_max': 852, 'n_layers': 3, 'n_out': 4, 'mean_type': 'constant', 'kernel_type': 'rbf', 'lr': 0.08809378867829025, 'batch_size': 1024, 'num_inducing': 665, 'initialize_fe': False, 'minit': 'kmeans'}. Best is trial 16 with value: 0.06854934990406036.
INFO:root:After model training
INFO:root:58.908203125
INFO:root:126.0
INFO:optuna.study.study:Trial 60 finished with value: 0.07095026969909668 and parameters: {'n_max': 788, 'n_layers': 4, 'n_out': 12, 'mean_type': 'constant', 'kernel_type': 'rbf', 'lr': 0.09869915491621732, 'batch_size': 1024, 'num_inducing': 734, 'initialize_fe': False, 'minit': 'random'}. Best is trial 16 with value: 0.06854934990406036.
INFO:root:After model training
INFO:root:58.85693359375
INFO:root:126.0
INFO:optuna.study.study:Trial 61 finished with value: 0.07030343264341354 and parameters: {'n_max': 800, 'n_layers': 4, 'n_out': 10, 'mean_type': 'constant', 'kernel_type': 'rbf', 'lr': 0.05133603896216803, 'batch_size': 1024, 'num_inducing': 722, 'initialize_fe': False, 'minit': 'random'}. Best is trial 16 with value: 0.06854934990406036.
INFO:root:After model training
INFO:root:56.85205078125
INFO:root:124.0
INFO:optuna.study.study:Trial 62 finished with value: 0.07180529832839966 and parameters: {'n_max': 792, 'n_layers': 4, 'n_out': 12, 'mean_type': 'constant', 'kernel_type': 'rbf', 'lr': 0.06579728759850022, 'batch_size': 1024, 'num_inducing': 378, 'initialize_fe': False, 'minit': 'random'}. Best is trial 16 with value: 0.06854934990406036.
INFO:root:After model training
INFO:root:59.45947265625
INFO:root:124.0
INFO:optuna.study.study:Trial 63 finished with value: 0.0708053857088089 and parameters: {'n_max': 911, 'n_layers': 4, 'n_out': 10, 'mean_type': 'constant', 'kernel_type': 'rbf', 'lr': 0.0963781437352819, 'batch_size': 1024, 'num_inducing': 736, 'initialize_fe': False, 'minit': 'random'}. Best is trial 16 with value: 0.06854934990406036.
INFO:root:After model training
INFO:root:57.98291015625
INFO:root:126.0
INFO:optuna.study.study:Trial 64 finished with value: 0.07845579832792282 and parameters: {'n_max': 915, 'n_layers': 4, 'n_out': 10, 'mean_type': 'constant', 'kernel_type': 'rbf', 'lr': 0.0530700983128467, 'batch_size': 1024, 'num_inducing': 474, 'initialize_fe': False, 'minit': 'random'}. Best is trial 16 with value: 0.06854934990406036.
INFO:root:After model training
INFO:root:60.7861328125
INFO:root:128.0
INFO:optuna.study.study:Trial 65 finished with value: 0.0906040221452713 and parameters: {'n_max': 964, 'n_layers': 2, 'n_out': 10, 'mean_type': 'constant', 'kernel_type': 'rbf', 'lr': 0.07711070165086628, 'batch_size': 1024, 'num_inducing': 1190, 'initialize_fe': False, 'minit': 'random'}. Best is trial 16 with value: 0.06854934990406036.
INFO:root:After model training
INFO:root:58.38671875
INFO:root:128.0
INFO:optuna.study.study:Trial 66 finished with value: 0.07564298063516617 and parameters: {'n_max': 891, 'n_layers': 4, 'n_out': 8, 'mean_type': 'constant', 'kernel_type': 'rbf', 'lr': 0.02213978068586721, 'batch_size': 1024, 'num_inducing': 583, 'initialize_fe': False, 'minit': 'random'}. Best is trial 16 with value: 0.06854934990406036.
INFO:root:After model training
INFO:root:58.98388671875
INFO:root:128.0
INFO:optuna.study.study:Trial 67 finished with value: 0.07416892796754837 and parameters: {'n_max': 723, 'n_layers': 4, 'n_out': 8, 'mean_type': 'constant', 'kernel_type': 'rbf', 'lr': 0.03725450528763295, 'batch_size': 1024, 'num_inducing': 819, 'initialize_fe': False, 'minit': 'random'}. Best is trial 16 with value: 0.06854934990406036.
INFO:root:After model training
INFO:root:57.87451171875
INFO:root:128.0
INFO:optuna.study.study:Trial 68 finished with value: 0.07482269406318665 and parameters: {'n_max': 832, 'n_layers': 4, 'n_out': 13, 'mean_type': 'constant', 'kernel_type': 'rbf', 'lr': 0.05899924540829716, 'batch_size': 1024, 'num_inducing': 549, 'initialize_fe': False, 'minit': 'random'}. Best is trial 16 with value: 0.06854934990406036.
INFO:root:After model training
INFO:root:66.22705078125
INFO:root:128.0
INFO:optuna.study.study:Trial 69 finished with value: 0.07877269387245178 and parameters: {'n_max': 626, 'n_layers': 3, 'n_out': 9, 'mean_type': 'constant', 'kernel_type': 'rbf', 'lr': 0.07868759048609636, 'batch_size': 1024, 'num_inducing': 1615, 'initialize_fe': False, 'minit': 'random'}. Best is trial 16 with value: 0.06854934990406036.
INFO:root:After model training
INFO:root:58.025390625
INFO:root:126.0
INFO:optuna.study.study:Trial 70 finished with value: 0.11116449534893036 and parameters: {'n_max': 972, 'n_layers': 4, 'n_out': 16, 'mean_type': 'linear', 'kernel_type': 'rbf', 'lr': 0.041101983344290584, 'batch_size': 1024, 'num_inducing': 394, 'initialize_fe': True, 'minit': 'random'}. Best is trial 16 with value: 0.06854934990406036.
INFO:root:After model training
INFO:root:58.87744140625
INFO:root:126.0
INFO:optuna.study.study:Trial 71 finished with value: 0.07022051513195038 and parameters: {'n_max': 790, 'n_layers': 4, 'n_out': 12, 'mean_type': 'constant', 'kernel_type': 'rbf', 'lr': 0.09688741507833411, 'batch_size': 1024, 'num_inducing': 713, 'initialize_fe': False, 'minit': 'random'}. Best is trial 16 with value: 0.06854934990406036.
INFO:root:After model training
INFO:root:58.67529296875
INFO:root:126.0
INFO:optuna.study.study:Trial 72 finished with value: 0.07323253154754639 and parameters: {'n_max': 692, 'n_layers': 4, 'n_out': 17, 'mean_type': 'constant', 'kernel_type': 'rbf', 'lr': 0.09526760772863782, 'batch_size': 1024, 'num_inducing': 651, 'initialize_fe': False, 'minit': 'random'}. Best is trial 16 with value: 0.06854934990406036.
INFO:root:After model training
INFO:root:61.5361328125
INFO:root:130.0
