INFO:optuna.study.study:Trial 57 finished with value: 0.07130422443151474 and parameters: {'n_max': 820, 'n_layers': 5, 'n_out': 3, 'mean_type': 'constant', 'kernel_type': 'rbf', 'lr': 0.0005858389938770756, 'batch_size': 1024, 'num_inducing': 59, 'initialize_fe': False, 'minit': 'kmeans'}. Best is trial 53 with value: 0.0690351128578186.
INFO:root:After model training
INFO:root:11.6884765625
INFO:root:48.0
INFO:optuna.study.study:Trial 58 finished with value: 0.09379762411117554 and parameters: {'n_max': 681, 'n_layers': 5, 'n_out': 2, 'mean_type': 'linear', 'kernel_type': 'matern0.5', 'lr': 0.05389349410413076, 'batch_size': 2048, 'num_inducing': 100, 'initialize_fe': False, 'minit': 'random'}. Best is trial 53 with value: 0.0690351128578186.
INFO:root:After model training
INFO:root:4.31396484375
INFO:root:30.0
INFO:optuna.study.study:Trial 59 finished with value: 0.0862957239151001 and parameters: {'n_max': 756, 'n_layers': 3, 'n_out': 3, 'mean_type': 'constant', 'kernel_type': 'rbf', 'lr': 0.070701762971138, 'batch_size': 512, 'num_inducing': 72, 'initialize_fe': False, 'minit': 'random'}. Best is trial 53 with value: 0.0690351128578186.
INFO:root:After model training
INFO:root:22.52392578125
INFO:root:58.0
INFO:optuna.study.study:Trial 60 finished with value: 0.07316906750202179 and parameters: {'n_max': 853, 'n_layers': 4, 'n_out': 2, 'mean_type': 'constant', 'kernel_type': 'rbf', 'lr': 0.04272013383143807, 'batch_size': 2048, 'num_inducing': 852, 'initialize_fe': True, 'minit': 'random'}. Best is trial 53 with value: 0.0690351128578186.
INFO:root:After model training
INFO:root:9.72705078125
INFO:root:46.0
INFO:optuna.study.study:Trial 61 finished with value: 0.07549715787172318 and parameters: {'n_max': 201, 'n_layers': 5, 'n_out': 5, 'mean_type': 'constant', 'kernel_type': 'rbf', 'lr': 0.08816242131737123, 'batch_size': 2048, 'num_inducing': 134, 'initialize_fe': False, 'minit': 'random'}. Best is trial 53 with value: 0.0690351128578186.
INFO:root:After model training
INFO:root:13.72265625
INFO:root:46.0
INFO:optuna.study.study:Trial 62 finished with value: 0.07284492999315262 and parameters: {'n_max': 963, 'n_layers': 5, 'n_out': 4, 'mean_type': 'constant', 'kernel_type': 'rbf', 'lr': 0.078013504186447, 'batch_size': 2048, 'num_inducing': 107, 'initialize_fe': False, 'minit': 'random'}. Best is trial 53 with value: 0.0690351128578186.
INFO:root:After model training
INFO:root:13.1591796875
INFO:root:66.0
INFO:optuna.study.study:Trial 63 finished with value: 0.07288782298564911 and parameters: {'n_max': 890, 'n_layers': 5, 'n_out': 5, 'mean_type': 'constant', 'kernel_type': 'rbf', 'lr': 0.05939383107666553, 'batch_size': 2048, 'num_inducing': 115, 'initialize_fe': False, 'minit': 'random'}. Best is trial 53 with value: 0.0690351128578186.
INFO:root:After model training
INFO:root:8.76025390625
INFO:root:44.0
INFO:optuna.study.study:Trial 64 finished with value: 0.08604554086923599 and parameters: {'n_max': 1010, 'n_layers': 2, 'n_out': 8, 'mean_type': 'constant', 'kernel_type': 'rbf', 'lr': 0.09771624256531, 'batch_size': 2048, 'num_inducing': 50, 'initialize_fe': False, 'minit': 'random'}. Best is trial 53 with value: 0.0690351128578186.
INFO:root:After model training
INFO:root:13.45361328125
INFO:root:70.0
INFO:optuna.study.study:Trial 65 finished with value: 0.06991029530763626 and parameters: {'n_max': 827, 'n_layers': 5, 'n_out': 7, 'mean_type': 'constant', 'kernel_type': 'rbf', 'lr': 0.023436599952999657, 'batch_size': 2048, 'num_inducing': 121, 'initialize_fe': False, 'minit': 'random'}. Best is trial 53 with value: 0.0690351128578186.
INFO:root:After model training
INFO:root:32.3310546875
INFO:root:72.0
INFO:optuna.study.study:Trial 66 finished with value: 0.07238304615020752 and parameters: {'n_max': 836, 'n_layers': 5, 'n_out': 7, 'mean_type': 'constant', 'kernel_type': 'rbf', 'lr': 0.022464043343974498, 'batch_size': 2048, 'num_inducing': 1406, 'initialize_fe': False, 'minit': 'random'}. Best is trial 53 with value: 0.0690351128578186.
INFO:root:After model training
INFO:root:12.93896484375
INFO:root:68.0
INFO:optuna.study.study:Trial 67 finished with value: 0.08164849877357483 and parameters: {'n_max': 813, 'n_layers': 5, 'n_out': 3, 'mean_type': 'constant', 'kernel_type': 'rbf', 'lr': 0.00199136570020362, 'batch_size': 2048, 'num_inducing': 74, 'initialize_fe': False, 'minit': 'random'}. Best is trial 53 with value: 0.0690351128578186.
INFO:root:After model training
INFO:root:11.3623046875
INFO:root:66.0
INFO:optuna.study.study:Trial 68 finished with value: 0.07460843771696091 and parameters: {'n_max': 687, 'n_layers': 5, 'n_out': 6, 'mean_type': 'constant', 'kernel_type': 'rbf', 'lr': 0.013338153970674347, 'batch_size': 2048, 'num_inducing': 88, 'initialize_fe': False, 'minit': 'kmeans'}. Best is trial 53 with value: 0.0690351128578186.
INFO:root:After model training
INFO:root:38.7705078125
INFO:root:96.0
INFO:optuna.study.study:Trial 69 finished with value: 0.07222766429185867 and parameters: {'n_max': 766, 'n_layers': 5, 'n_out': 4, 'mean_type': 'constant', 'kernel_type': 'rbf', 'lr': 0.037901457765939756, 'batch_size': 2048, 'num_inducing': 1737, 'initialize_fe': False, 'minit': 'random'}. Best is trial 53 with value: 0.0690351128578186.
INFO:root:After model training
INFO:root:12.37841796875
INFO:root:32.0
INFO:optuna.study.study:Trial 70 finished with value: 0.12478834390640259 and parameters: {'n_max': 862, 'n_layers': 4, 'n_out': 19, 'mean_type': 'linear', 'kernel_type': 'matern1.5', 'lr': 0.03197591665573913, 'batch_size': 2048, 'num_inducing': 158, 'initialize_fe': False, 'minit': 'random'}. Best is trial 53 with value: 0.0690351128578186.
INFO:root:After model training
INFO:root:13.6650390625
INFO:root:52.0
INFO:optuna.study.study:Trial 71 finished with value: 0.07065117359161377 and parameters: {'n_max': 927, 'n_layers': 5, 'n_out': 5, 'mean_type': 'constant', 'kernel_type': 'rbf', 'lr': 0.07415517730115596, 'batch_size': 2048, 'num_inducing': 117, 'initialize_fe': False, 'minit': 'random'}. Best is trial 53 with value: 0.0690351128578186.
INFO:root:After model training
INFO:root:13.9482421875
INFO:root:52.0
INFO:optuna.study.study:Trial 72 finished with value: 0.07114434242248535 and parameters: {'n_max': 959, 'n_layers': 5, 'n_out': 7, 'mean_type': 'constant', 'kernel_type': 'rbf', 'lr': 0.048855497458354324, 'batch_size': 2048, 'num_inducing': 132, 'initialize_fe': False, 'minit': 'random'}. Best is trial 53 with value: 0.0690351128578186.
INFO:root:After model training
INFO:root:44.78076171875
INFO:root:138.0
INFO:optuna.study.study:Trial 73 finished with value: 0.07205887883901596 and parameters: {'n_max': 893, 'n_layers': 5, 'n_out': 6, 'mean_type': 'constant', 'kernel_type': 'rbf', 'lr': 0.021683573106469747, 'batch_size': 2048, 'num_inducing': 1981, 'initialize_fe': False, 'minit': 'random'}. Best is trial 53 with value: 0.0690351128578186.
INFO:root:After model training
INFO:root:27.6181640625
INFO:root:124.0
INFO:optuna.study.study:Trial 74 finished with value: 0.07437678426504135 and parameters: {'n_max': 806, 'n_layers': 5, 'n_out': 8, 'mean_type': 'constant', 'kernel_type': 'rbf', 'lr': 0.06117234095094217, 'batch_size': 2048, 'num_inducing': 1186, 'initialize_fe': False, 'minit': 'random'}. Best is trial 53 with value: 0.0690351128578186.
INFO:root:After model training
INFO:root:8.79833984375
INFO:root:30.0
INFO:optuna.study.study:Trial 75 finished with value: 0.07356391847133636 and parameters: {'n_max': 997, 'n_layers': 5, 'n_out': 4, 'mean_type': 'constant', 'kernel_type': 'rbf', 'lr': 0.04475037277809578, 'batch_size': 512, 'num_inducing': 167, 'initialize_fe': False, 'minit': 'random'}. Best is trial 53 with value: 0.0690351128578186.
INFO:root:After model training
INFO:root:7.841796875
INFO:root:30.0
INFO:optuna.study.study:Trial 76 finished with value: 0.07547496259212494 and parameters: {'n_max': 923, 'n_layers': 5, 'n_out': 3, 'mean_type': 'constant', 'kernel_type': 'rbf', 'lr': 0.07678295121048119, 'batch_size': 1024, 'num_inducing': 216, 'initialize_fe': False, 'minit': 'random'}. Best is trial 53 with value: 0.0690351128578186.
INFO:root:After model training
INFO:root:11.45361328125
INFO:root:46.0
INFO:optuna.study.study:Trial 77 finished with value: 0.07283449918031693 and parameters: {'n_max': 717, 'n_layers': 5, 'n_out': 2, 'mean_type': 'constant', 'kernel_type': 'matern0.5', 'lr': 0.032394836555743906, 'batch_size': 2048, 'num_inducing': 78, 'initialize_fe': True, 'minit': 'random'}. Best is trial 53 with value: 0.0690351128578186.
INFO:root:After model training
INFO:root:13.28515625
INFO:root:50.0
INFO:optuna.study.study:Trial 78 finished with value: 0.06997598707675934 and parameters: {'n_max': 901, 'n_layers': 5, 'n_out': 5, 'mean_type': 'constant', 'kernel_type': 'rbf', 'lr': 0.08249484541098723, 'batch_size': 2048, 'num_inducing': 66, 'initialize_fe': False, 'minit': 'random'}. Best is trial 53 with value: 0.0690351128578186.
INFO:root:After model training
INFO:root:12.57470703125
INFO:root:50.0
INFO:optuna.study.study:Trial 79 finished with value: 0.09082509577274323 and parameters: {'n_max': 872, 'n_layers': 5, 'n_out': 6, 'mean_type': 'constant', 'kernel_type': 'rbf', 'lr': 0.0001567544860766212, 'batch_size': 2048, 'num_inducing': 68, 'initialize_fe': False, 'minit': 'random'}. Best is trial 53 with value: 0.0690351128578186.
INFO:root:After model training
INFO:root:33.6015625
INFO:root:80.0
INFO:optuna.study.study:Trial 80 finished with value: 0.0729534775018692 and parameters: {'n_max': 950, 'n_layers': 4, 'n_out': 7, 'mean_type': 'constant', 'kernel_type': 'rbf', 'lr': 0.0262593509658897, 'batch_size': 2048, 'num_inducing': 1445, 'initialize_fe': False, 'minit': 'random'}. Best is trial 53 with value: 0.0690351128578186.
INFO:root:After model training
INFO:root:13.26806640625
INFO:root:50.0
INFO:optuna.study.study:Trial 81 finished with value: 0.07457436621189117 and parameters: {'n_max': 905, 'n_layers': 5, 'n_out': 5, 'mean_type': 'constant', 'kernel_type': 'rbf', 'lr': 0.0874858092887341, 'batch_size': 2048, 'num_inducing': 66, 'initialize_fe': False, 'minit': 'random'}. Best is trial 53 with value: 0.0690351128578186.
INFO:root:After model training
INFO:root:14.5380859375
INFO:root:62.0
INFO:optuna.study.study:Trial 82 finished with value: 0.07533223181962967 and parameters: {'n_max': 988, 'n_layers': 5, 'n_out': 5, 'mean_type': 'constant', 'kernel_type': 'rbf', 'lr': 0.056161583727323834, 'batch_size': 2048, 'num_inducing': 91, 'initialize_fe': False, 'minit': 'random'}. Best is trial 53 with value: 0.0690351128578186.
INFO:root:After model training
INFO:root:13.6884765625
INFO:root:50.0
INFO:optuna.study.study:Trial 83 finished with value: 0.07261431217193604 and parameters: {'n_max': 884, 'n_layers': 5, 'n_out': 4, 'mean_type': 'constant', 'kernel_type': 'rbf', 'lr': 0.09841881358134208, 'batch_size': 2048, 'num_inducing': 101, 'initialize_fe': False, 'minit': 'random'}. Best is trial 53 with value: 0.0690351128578186.
INFO:root:After model training
INFO:root:10.5302734375
INFO:root:50.0
INFO:optuna.study.study:Trial 84 finished with value: 0.07227843999862671 and parameters: {'n_max': 491, 'n_layers': 5, 'n_out': 9, 'mean_type': 'constant', 'kernel_type': 'rbf', 'lr': 0.0681824795788611, 'batch_size': 2048, 'num_inducing': 116, 'initialize_fe': False, 'minit': 'random'}. Best is trial 53 with value: 0.0690351128578186.
INFO:root:After model training
INFO:root:12.708984375
INFO:root:34.0
INFO:optuna.study.study:Trial 85 finished with value: 0.07148268073797226 and parameters: {'n_max': 837, 'n_layers': 5, 'n_out': 6, 'mean_type': 'constant', 'kernel_type': 'rbf', 'lr': 0.037417516034815385, 'batch_size': 2048, 'num_inducing': 84, 'initialize_fe': False, 'minit': 'random'}. Best is trial 53 with value: 0.0690351128578186.
INFO:root:After model training
INFO:root:34.44580078125
INFO:root:94.0
INFO:optuna.study.study:Trial 86 finished with value: 0.08496488630771637 and parameters: {'n_max': 1019, 'n_layers': 5, 'n_out': 2, 'mean_type': 'linear', 'kernel_type': 'rbf', 'lr': 0.05234615320431389, 'batch_size': 2048, 'num_inducing': 1363, 'initialize_fe': False, 'minit': 'kmeans'}. Best is trial 53 with value: 0.0690351128578186.
INFO:root:After model training
INFO:root:36.39697265625
INFO:root:76.0
INFO:optuna.study.study:Trial 87 finished with value: 0.07327999174594879 and parameters: {'n_max': 792, 'n_layers': 5, 'n_out': 3, 'mean_type': 'constant', 'kernel_type': 'matern1.5', 'lr': 0.081250304780159, 'batch_size': 2048, 'num_inducing': 1650, 'initialize_fe': False, 'minit': 'random'}. Best is trial 53 with value: 0.0690351128578186.
INFO:root:After model training
INFO:root:13.037109375
INFO:root:32.0
INFO:optuna.study.study:Trial 88 finished with value: 0.07130459696054459 and parameters: {'n_max': 917, 'n_layers': 5, 'n_out': 5, 'mean_type': 'constant', 'kernel_type': 'rbf', 'lr': 0.0433073928239306, 'batch_size': 512, 'num_inducing': 1104, 'initialize_fe': False, 'minit': 'random'}. Best is trial 53 with value: 0.0690351128578186.
INFO:root:After model training
INFO:root:5.9775390625
INFO:root:28.0
INFO:optuna.study.study:Trial 89 finished with value: 0.07428435236215591 and parameters: {'n_max': 400, 'n_layers': 5, 'n_out': 4, 'mean_type': 'constant', 'kernel_type': 'rbf', 'lr': 0.06555190410576729, 'batch_size': 1024, 'num_inducing': 609, 'initialize_fe': True, 'minit': 'random'}. Best is trial 53 with value: 0.0690351128578186.
INFO:root:After model training
INFO:root:17.9013671875
INFO:root:80.0
INFO:optuna.study.study:Trial 90 finished with value: 0.07921254634857178 and parameters: {'n_max': 967, 'n_layers': 4, 'n_out': 6, 'mean_type': 'constant', 'kernel_type': 'matern0.5', 'lr': 0.056916623300487336, 'batch_size': 2048, 'num_inducing': 496, 'initialize_fe': False, 'minit': 'random'}. Best is trial 53 with value: 0.0690351128578186.
INFO:root:After model training
INFO:root:11.259765625
INFO:root:46.0
INFO:optuna.study.study:Trial 91 finished with value: 0.07714514434337616 and parameters: {'n_max': 900, 'n_layers': 3, 'n_out': 7, 'mean_type': 'constant', 'kernel_type': 'rbf', 'lr': 0.0320837970809254, 'batch_size': 2048, 'num_inducing': 149, 'initialize_fe': False, 'minit': 'random'}. Best is trial 53 with value: 0.0690351128578186.
INFO:root:After model training
INFO:root:14.57080078125
INFO:root:62.0
INFO:optuna.study.study:Trial 92 finished with value: 0.06909319013357162 and parameters: {'n_max': 942, 'n_layers': 5, 'n_out': 8, 'mean_type': 'constant', 'kernel_type': 'rbf', 'lr': 0.01883089999135782, 'batch_size': 2048, 'num_inducing': 192, 'initialize_fe': False, 'minit': 'random'}. Best is trial 53 with value: 0.0690351128578186.
INFO:root:After model training
INFO:root:14.78515625
INFO:root:64.0
INFO:optuna.study.study:Trial 93 finished with value: 0.07367599010467529 and parameters: {'n_max': 941, 'n_layers': 5, 'n_out': 8, 'mean_type': 'constant', 'kernel_type': 'rbf', 'lr': 0.018264888175862245, 'batch_size': 2048, 'num_inducing': 213, 'initialize_fe': False, 'minit': 'random'}. Best is trial 53 with value: 0.0690351128578186.
INFO:root:After model training
INFO:root:12.9697265625
INFO:root:48.0
INFO:optuna.study.study:Trial 94 finished with value: 0.07429236173629761 and parameters: {'n_max': 854, 'n_layers': 5, 'n_out': 6, 'mean_type': 'constant', 'kernel_type': 'rbf', 'lr': 0.024290962254813753, 'batch_size': 2048, 'num_inducing': 126, 'initialize_fe': False, 'minit': 'random'}. Best is trial 53 with value: 0.0690351128578186.
INFO:root:After model training
INFO:root:15.5029296875
INFO:root:64.0
INFO:optuna.study.study:Trial 95 finished with value: 0.07275620847940445 and parameters: {'n_max': 985, 'n_layers': 5, 'n_out': 7, 'mean_type': 'constant', 'kernel_type': 'rbf', 'lr': 0.014408087198528551, 'batch_size': 2048, 'num_inducing': 186, 'initialize_fe': False, 'minit': 'random'}. Best is trial 53 with value: 0.0690351128578186.
INFO:root:After model training
INFO:root:14.0849609375
INFO:root:62.0
INFO:optuna.study.study:Trial 96 finished with value: 0.07007727026939392 and parameters: {'n_max': 940, 'n_layers': 5, 'n_out': 8, 'mean_type': 'constant', 'kernel_type': 'rbf', 'lr': 0.0472155434598081, 'batch_size': 2048, 'num_inducing': 145, 'initialize_fe': False, 'minit': 'random'}. Best is trial 53 with value: 0.0690351128578186.
INFO:root:After model training
INFO:root:15.66015625
INFO:root:76.0
INFO:optuna.study.study:Trial 97 finished with value: 0.0744151845574379 and parameters: {'n_max': 958, 'n_layers': 5, 'n_out': 10, 'mean_type': 'constant', 'kernel_type': 'rbf', 'lr': 0.005446884388221938, 'batch_size': 2048, 'num_inducing': 287, 'initialize_fe': False, 'minit': 'random'}. Best is trial 53 with value: 0.0690351128578186.
INFO:root:After model training
INFO:root:16.3642578125
INFO:root:80.0
INFO:optuna.study.study:Trial 98 finished with value: 0.07552854716777802 and parameters: {'n_max': 935, 'n_layers': 5, 'n_out': 9, 'mean_type': 'constant', 'kernel_type': 'rbf', 'lr': 0.010322335347040983, 'batch_size': 2048, 'num_inducing': 227, 'initialize_fe': False, 'minit': 'kmeans'}. Best is trial 53 with value: 0.0690351128578186.
INFO:root:After model training
INFO:root:14.2294921875
INFO:root:64.0
INFO:optuna.study.study:Trial 99 finished with value: 0.13432234525680542 and parameters: {'n_max': 969, 'n_layers': 5, 'n_out': 8, 'mean_type': 'linear', 'kernel_type': 'rbf', 'lr': 0.020816220060024745, 'batch_size': 2048, 'num_inducing': 149, 'initialize_fe': False, 'minit': 'random'}. Best is trial 53 with value: 0.0690351128578186.
INFO:root:Outer Run: 2: MSE - 0.015395318157970905, MAE - 0.10046105831861496. MAX - 0.3309760093688965
INFO:optuna.storages._in_memory:A new study created in memory with name: Nested Resampling VDKL 3
INFO:root:After model training
INFO:root:153.27978515625
INFO:root:184.0
INFO:optuna.study.study:Trial 0 finished with value: 0.07499805092811584 and parameters: {'n_max': 1024, 'n_layers': 4, 'n_out': 2, 'mean_type': 'constant', 'kernel_type': 'rbf', 'lr': 0.01, 'batch_size': 1024, 'num_inducing': 1000, 'initialize_fe': False, 'minit': 'random'}. Best is trial 0 with value: 0.07499805092811584.
INFO:root:After model training
INFO:root:148.00537109375
INFO:root:180.0
INFO:optuna.study.study:Trial 1 finished with value: 0.10190936923027039 and parameters: {'n_max': 859, 'n_layers': 4, 'n_out': 5, 'mean_type': 'linear', 'kernel_type': 'rbf', 'lr': 0.0003310904317754543, 'batch_size': 512, 'num_inducing': 92, 'initialize_fe': True, 'minit': 'random'}. Best is trial 0 with value: 0.07499805092811584.
INFO:root:After model training
INFO:root:145.4404296875
INFO:root:176.0
INFO:optuna.study.study:Trial 2 finished with value: 0.10059072822332382 and parameters: {'n_max': 524, 'n_layers': 3, 'n_out': 5, 'mean_type': 'linear', 'kernel_type': 'matern0.5', 'lr': 0.00285680474472325, 'batch_size': 1024, 'num_inducing': 89, 'initialize_fe': False, 'minit': 'random'}. Best is trial 0 with value: 0.07499805092811584.
INFO:root:After model training
INFO:root:160.7119140625
INFO:root:208.0
INFO:optuna.study.study:Trial 3 finished with value: 0.08678273111581802 and parameters: {'n_max': 904, 'n_layers': 5, 'n_out': 20, 'mean_type': 'constant', 'kernel_type': 'rbf', 'lr': 0.00027012236104675616, 'batch_size': 2048, 'num_inducing': 565, 'initialize_fe': False, 'minit': 'kmeans'}. Best is trial 0 with value: 0.07499805092811584.
INFO:root:After model training
INFO:root:145.1923828125
INFO:root:180.0
INFO:optuna.study.study:Trial 4 finished with value: 0.10696807503700256 and parameters: {'n_max': 165, 'n_layers': 3, 'n_out': 6, 'mean_type': 'linear', 'kernel_type': 'matern0.5', 'lr': 0.00042996923024436913, 'batch_size': 512, 'num_inducing': 196, 'initialize_fe': False, 'minit': 'kmeans'}. Best is trial 0 with value: 0.07499805092811584.
INFO:root:After model training
INFO:root:144.84619140625
INFO:root:178.0
INFO:optuna.study.study:Trial 5 finished with value: 0.11577971279621124 and parameters: {'n_max': 134, 'n_layers': 2, 'n_out': 12, 'mean_type': 'linear', 'kernel_type': 'matern0.5', 'lr': 0.00013381343383084483, 'batch_size': 512, 'num_inducing': 53, 'initialize_fe': False, 'minit': 'kmeans'}. Best is trial 0 with value: 0.07499805092811584.
INFO:root:After model training
INFO:root:146.947265625
INFO:root:180.0
INFO:optuna.study.study:Trial 6 finished with value: 0.10304193943738937 and parameters: {'n_max': 783, 'n_layers': 3, 'n_out': 4, 'mean_type': 'linear', 'kernel_type': 'matern0.5', 'lr': 0.03300437304988955, 'batch_size': 1024, 'num_inducing': 382, 'initialize_fe': False, 'minit': 'random'}. Best is trial 0 with value: 0.07499805092811584.
INFO:root:After model training
INFO:root:146.052734375
INFO:root:180.0
INFO:optuna.study.study:Trial 7 finished with value: 0.08395136147737503 and parameters: {'n_max': 576, 'n_layers': 4, 'n_out': 19, 'mean_type': 'constant', 'kernel_type': 'rbf', 'lr': 0.001868548345699768, 'batch_size': 1024, 'num_inducing': 70, 'initialize_fe': False, 'minit': 'kmeans'}. Best is trial 0 with value: 0.07499805092811584.
INFO:root:After model training
INFO:root:144.8916015625
INFO:root:176.0
INFO:optuna.study.study:Trial 8 finished with value: 0.10196235030889511 and parameters: {'n_max': 549, 'n_layers': 2, 'n_out': 4, 'mean_type': 'linear', 'kernel_type': 'matern1.5', 'lr': 0.026617325565048342, 'batch_size': 512, 'num_inducing': 76, 'initialize_fe': True, 'minit': 'kmeans'}. Best is trial 0 with value: 0.07499805092811584.
INFO:root:After model training
INFO:root:164.716796875
INFO:root:228.0
INFO:optuna.study.study:Trial 9 finished with value: 0.10065710544586182 and parameters: {'n_max': 736, 'n_layers': 2, 'n_out': 8, 'mean_type': 'constant', 'kernel_type': 'matern0.5', 'lr': 0.00014936737225082773, 'batch_size': 2048, 'num_inducing': 1103, 'initialize_fe': False, 'minit': 'random'}. Best is trial 0 with value: 0.07499805092811584.
INFO:root:After model training
INFO:root:168.08056640625
INFO:root:208.0
