INFO:optuna.study.study:Trial 63 finished with value: 0.06748781353235245 and parameters: {'n_max': 841, 'n_layers': 5, 'n_out': 13, 'mean_type': 'constant', 'kernel_type': 'rbf', 'lr': 0.0754937370675182, 'batch_size': 2048, 'num_inducing': 122, 'initialize_fe': True, 'minit': 'random'}. Best is trial 43 with value: 0.06729082763195038.
INFO:root:After model training
INFO:root:154.62451171875
INFO:root:198.0
INFO:optuna.study.study:Trial 64 finished with value: 0.07001884281635284 and parameters: {'n_max': 848, 'n_layers': 5, 'n_out': 13, 'mean_type': 'constant', 'kernel_type': 'rbf', 'lr': 0.08128893216976647, 'batch_size': 2048, 'num_inducing': 88, 'initialize_fe': True, 'minit': 'random'}. Best is trial 43 with value: 0.06729082763195038.
INFO:root:After model training
INFO:root:155.72119140625
INFO:root:202.0
INFO:optuna.study.study:Trial 65 finished with value: 0.07248452305793762 and parameters: {'n_max': 904, 'n_layers': 5, 'n_out': 16, 'mean_type': 'constant', 'kernel_type': 'rbf', 'lr': 0.054586360471873464, 'batch_size': 2048, 'num_inducing': 172, 'initialize_fe': True, 'minit': 'random'}. Best is trial 43 with value: 0.06729082763195038.
INFO:root:After model training
INFO:root:149.3642578125
INFO:root:180.0
INFO:optuna.study.study:Trial 66 finished with value: 0.06987091898918152 and parameters: {'n_max': 952, 'n_layers': 5, 'n_out': 12, 'mean_type': 'constant', 'kernel_type': 'rbf', 'lr': 0.022674806230874527, 'batch_size': 1024, 'num_inducing': 120, 'initialize_fe': True, 'minit': 'random'}. Best is trial 43 with value: 0.06729082763195038.
INFO:root:After model training
INFO:root:149.14013671875
INFO:root:180.0
INFO:optuna.study.study:Trial 67 finished with value: 0.07457467168569565 and parameters: {'n_max': 883, 'n_layers': 5, 'n_out': 10, 'mean_type': 'constant', 'kernel_type': 'rbf', 'lr': 0.07636135570566283, 'batch_size': 512, 'num_inducing': 202, 'initialize_fe': True, 'minit': 'random'}. Best is trial 43 with value: 0.06729082763195038.
INFO:root:After model training
INFO:root:154.73876953125
INFO:root:198.0
INFO:optuna.study.study:Trial 68 finished with value: 0.0701020359992981 and parameters: {'n_max': 811, 'n_layers': 5, 'n_out': 13, 'mean_type': 'constant', 'kernel_type': 'rbf', 'lr': 0.012925330569218716, 'batch_size': 2048, 'num_inducing': 112, 'initialize_fe': True, 'minit': 'kmeans'}. Best is trial 43 with value: 0.06729082763195038.
INFO:root:After model training
INFO:root:154.00927734375
INFO:root:194.0
INFO:optuna.study.study:Trial 69 finished with value: 0.16539925336837769 and parameters: {'n_max': 734, 'n_layers': 5, 'n_out': 11, 'mean_type': 'linear', 'kernel_type': 'rbf', 'lr': 0.004220624642267465, 'batch_size': 2048, 'num_inducing': 61, 'initialize_fe': True, 'minit': 'random'}. Best is trial 43 with value: 0.06729082763195038.
INFO:root:After model training
INFO:root:148.74609375
INFO:root:184.0
INFO:optuna.study.study:Trial 70 finished with value: 0.0732898861169815 and parameters: {'n_max': 1011, 'n_layers': 4, 'n_out': 9, 'mean_type': 'constant', 'kernel_type': 'matern0.5', 'lr': 0.055453358521415905, 'batch_size': 1024, 'num_inducing': 227, 'initialize_fe': True, 'minit': 'random'}. Best is trial 43 with value: 0.06729082763195038.
INFO:root:After model training
INFO:root:154.8505859375
INFO:root:200.0
INFO:optuna.study.study:Trial 71 finished with value: 0.07715119421482086 and parameters: {'n_max': 779, 'n_layers': 5, 'n_out': 14, 'mean_type': 'constant', 'kernel_type': 'rbf', 'lr': 0.06512136032133828, 'batch_size': 2048, 'num_inducing': 133, 'initialize_fe': True, 'minit': 'random'}. Best is trial 43 with value: 0.06729082763195038.
INFO:root:After model training
INFO:root:155.1953125
INFO:root:198.0
INFO:optuna.study.study:Trial 72 finished with value: 0.07225865870714188 and parameters: {'n_max': 839, 'n_layers': 5, 'n_out': 15, 'mean_type': 'constant', 'kernel_type': 'rbf', 'lr': 0.08055308420406507, 'batch_size': 2048, 'num_inducing': 148, 'initialize_fe': True, 'minit': 'random'}. Best is trial 43 with value: 0.06729082763195038.
INFO:root:After model training
INFO:root:156.02978515625
INFO:root:184.0
INFO:optuna.study.study:Trial 73 finished with value: 0.07020794600248337 and parameters: {'n_max': 910, 'n_layers': 5, 'n_out': 14, 'mean_type': 'constant', 'kernel_type': 'rbf', 'lr': 0.0402535160390759, 'batch_size': 2048, 'num_inducing': 103, 'initialize_fe': True, 'minit': 'random'}. Best is trial 43 with value: 0.06729082763195038.
INFO:root:After model training
INFO:root:155.130859375
INFO:root:196.0
INFO:optuna.study.study:Trial 74 finished with value: 0.1239137053489685 and parameters: {'n_max': 878, 'n_layers': 5, 'n_out': 13, 'mean_type': 'constant', 'kernel_type': 'rbf', 'lr': 0.00010973409834801009, 'batch_size': 2048, 'num_inducing': 129, 'initialize_fe': True, 'minit': 'random'}. Best is trial 43 with value: 0.06729082763195038.
INFO:root:After model training
INFO:root:151.7353515625
INFO:root:194.0
INFO:optuna.study.study:Trial 75 finished with value: 0.08114111423492432 and parameters: {'n_max': 109, 'n_layers': 5, 'n_out': 16, 'mean_type': 'constant', 'kernel_type': 'rbf', 'lr': 0.09981591775678297, 'batch_size': 2048, 'num_inducing': 181, 'initialize_fe': True, 'minit': 'random'}. Best is trial 43 with value: 0.06729082763195038.
INFO:root:After model training
INFO:root:153.17822265625
INFO:root:202.0
INFO:optuna.study.study:Trial 76 finished with value: 0.07246296107769012 and parameters: {'n_max': 700, 'n_layers': 5, 'n_out': 17, 'mean_type': 'constant', 'kernel_type': 'rbf', 'lr': 0.057665801320339785, 'batch_size': 2048, 'num_inducing': 90, 'initialize_fe': True, 'minit': 'random'}. Best is trial 43 with value: 0.06729082763195038.
INFO:root:After model training
INFO:root:147.0576171875
INFO:root:184.0
INFO:optuna.study.study:Trial 77 finished with value: 0.08309294283390045 and parameters: {'n_max': 555, 'n_layers': 5, 'n_out': 12, 'mean_type': 'constant', 'kernel_type': 'matern0.5', 'lr': 0.008227606503927213, 'batch_size': 1024, 'num_inducing': 326, 'initialize_fe': False, 'minit': 'random'}. Best is trial 43 with value: 0.06729082763195038.
INFO:root:After model training
INFO:root:152.33056640625
INFO:root:186.0
INFO:optuna.study.study:Trial 78 finished with value: 0.06970132887363434 and parameters: {'n_max': 445, 'n_layers': 5, 'n_out': 14, 'mean_type': 'constant', 'kernel_type': 'matern1.5', 'lr': 0.029580644998973067, 'batch_size': 2048, 'num_inducing': 149, 'initialize_fe': True, 'minit': 'random'}. Best is trial 43 with value: 0.06729082763195038.
INFO:root:After model training
INFO:root:150.10595703125
INFO:root:184.0
INFO:optuna.study.study:Trial 79 finished with value: 0.07131855934858322 and parameters: {'n_max': 986, 'n_layers': 5, 'n_out': 13, 'mean_type': 'constant', 'kernel_type': 'rbf', 'lr': 0.045537550086754884, 'batch_size': 512, 'num_inducing': 278, 'initialize_fe': True, 'minit': 'kmeans'}. Best is trial 43 with value: 0.06729082763195038.
INFO:root:After model training
INFO:root:154.31787109375
INFO:root:202.0
INFO:optuna.study.study:Trial 80 finished with value: 0.1286437213420868 and parameters: {'n_max': 934, 'n_layers': 4, 'n_out': 11, 'mean_type': 'linear', 'kernel_type': 'rbf', 'lr': 0.08412498696956779, 'batch_size': 2048, 'num_inducing': 123, 'initialize_fe': True, 'minit': 'random'}. Best is trial 43 with value: 0.06729082763195038.
INFO:root:After model training
INFO:root:154.11181640625
INFO:root:196.0
INFO:optuna.study.study:Trial 81 finished with value: 0.0718766376376152 and parameters: {'n_max': 733, 'n_layers': 5, 'n_out': 19, 'mean_type': 'constant', 'kernel_type': 'rbf', 'lr': 0.018004245002896827, 'batch_size': 2048, 'num_inducing': 69, 'initialize_fe': True, 'minit': 'random'}. Best is trial 43 with value: 0.06729082763195038.
INFO:root:After model training
INFO:root:153.0830078125
INFO:root:196.0
INFO:optuna.study.study:Trial 82 finished with value: 0.07148595154285431 and parameters: {'n_max': 705, 'n_layers': 5, 'n_out': 20, 'mean_type': 'constant', 'kernel_type': 'rbf', 'lr': 0.0674874198757306, 'batch_size': 2048, 'num_inducing': 75, 'initialize_fe': True, 'minit': 'random'}. Best is trial 43 with value: 0.06729082763195038.
INFO:root:After model training
INFO:root:153.4375
INFO:root:198.0
INFO:optuna.study.study:Trial 83 finished with value: 0.07179046422243118 and parameters: {'n_max': 617, 'n_layers': 5, 'n_out': 18, 'mean_type': 'constant', 'kernel_type': 'rbf', 'lr': 0.035949514691676045, 'batch_size': 2048, 'num_inducing': 169, 'initialize_fe': True, 'minit': 'random'}. Best is trial 43 with value: 0.06729082763195038.
INFO:root:After model training
INFO:root:154.2763671875
INFO:root:200.0
INFO:optuna.study.study:Trial 84 finished with value: 0.07088477909564972 and parameters: {'n_max': 816, 'n_layers': 5, 'n_out': 15, 'mean_type': 'constant', 'kernel_type': 'rbf', 'lr': 0.05462506027998918, 'batch_size': 2048, 'num_inducing': 61, 'initialize_fe': True, 'minit': 'random'}. Best is trial 43 with value: 0.06729082763195038.
INFO:root:After model training
INFO:root:153.08349609375
INFO:root:180.0
INFO:optuna.study.study:Trial 85 finished with value: 0.07226016372442245 and parameters: {'n_max': 654, 'n_layers': 5, 'n_out': 10, 'mean_type': 'constant', 'kernel_type': 'matern1.5', 'lr': 0.08322902446218496, 'batch_size': 2048, 'num_inducing': 114, 'initialize_fe': True, 'minit': 'random'}. Best is trial 43 with value: 0.06729082763195038.
INFO:root:After model training
INFO:root:145.0849609375
INFO:root:182.0
INFO:optuna.study.study:Trial 86 finished with value: 0.06896787136793137 and parameters: {'n_max': 181, 'n_layers': 5, 'n_out': 14, 'mean_type': 'constant', 'kernel_type': 'rbf', 'lr': 0.02551941067539469, 'batch_size': 1024, 'num_inducing': 95, 'initialize_fe': True, 'minit': 'random'}. Best is trial 43 with value: 0.06729082763195038.
INFO:root:After model training
INFO:root:145.0146484375
INFO:root:178.0
INFO:optuna.study.study:Trial 87 finished with value: 0.07852420955896378 and parameters: {'n_max': 202, 'n_layers': 3, 'n_out': 14, 'mean_type': 'constant', 'kernel_type': 'rbf', 'lr': 0.04562467633501531, 'batch_size': 1024, 'num_inducing': 103, 'initialize_fe': True, 'minit': 'random'}. Best is trial 43 with value: 0.06729082763195038.
INFO:root:After model training
INFO:root:145.33837890625
INFO:root:180.0
INFO:optuna.study.study:Trial 88 finished with value: 0.07185467332601547 and parameters: {'n_max': 288, 'n_layers': 5, 'n_out': 15, 'mean_type': 'constant', 'kernel_type': 'rbf', 'lr': 0.06803409549487374, 'batch_size': 1024, 'num_inducing': 96, 'initialize_fe': False, 'minit': 'random'}. Best is trial 43 with value: 0.06729082763195038.
INFO:root:After model training
INFO:root:145.11474609375
INFO:root:180.0
INFO:optuna.study.study:Trial 89 finished with value: 0.1002972275018692 and parameters: {'n_max': 142, 'n_layers': 5, 'n_out': 12, 'mean_type': 'constant', 'kernel_type': 'matern1.5', 'lr': 0.001334028861946764, 'batch_size': 1024, 'num_inducing': 142, 'initialize_fe': True, 'minit': 'random'}. Best is trial 43 with value: 0.06729082763195038.
INFO:root:After model training
INFO:root:144.91650390625
INFO:root:180.0
INFO:optuna.study.study:Trial 90 finished with value: 0.07486823946237564 and parameters: {'n_max': 68, 'n_layers': 5, 'n_out': 13, 'mean_type': 'constant', 'kernel_type': 'rbf', 'lr': 0.026371142846175217, 'batch_size': 1024, 'num_inducing': 83, 'initialize_fe': True, 'minit': 'kmeans'}. Best is trial 43 with value: 0.06729082763195038.
INFO:root:After model training
INFO:root:145.23193359375
INFO:root:182.0
INFO:optuna.study.study:Trial 91 finished with value: 0.07473893463611603 and parameters: {'n_max': 220, 'n_layers': 5, 'n_out': 12, 'mean_type': 'constant', 'kernel_type': 'rbf', 'lr': 0.09042220525035082, 'batch_size': 1024, 'num_inducing': 131, 'initialize_fe': True, 'minit': 'random'}. Best is trial 43 with value: 0.06729082763195038.
INFO:root:After model training
INFO:root:174.56982421875
INFO:root:244.0
INFO:optuna.study.study:Trial 92 finished with value: 0.07333797961473465 and parameters: {'n_max': 796, 'n_layers': 5, 'n_out': 20, 'mean_type': 'constant', 'kernel_type': 'rbf', 'lr': 0.05900280255418983, 'batch_size': 2048, 'num_inducing': 1424, 'initialize_fe': True, 'minit': 'random'}. Best is trial 43 with value: 0.06729082763195038.
INFO:root:After model training
INFO:root:151.24951171875
INFO:root:196.0
INFO:optuna.study.study:Trial 93 finished with value: 0.07547150552272797 and parameters: {'n_max': 360, 'n_layers': 5, 'n_out': 13, 'mean_type': 'constant', 'kernel_type': 'rbf', 'lr': 0.01435307355000284, 'batch_size': 2048, 'num_inducing': 73, 'initialize_fe': True, 'minit': 'random'}. Best is trial 43 with value: 0.06729082763195038.
INFO:root:After model training
INFO:root:155.74072265625
INFO:root:198.0
INFO:optuna.study.study:Trial 94 finished with value: 0.06986897438764572 and parameters: {'n_max': 865, 'n_layers': 5, 'n_out': 14, 'mean_type': 'constant', 'kernel_type': 'rbf', 'lr': 0.0716982451436533, 'batch_size': 2048, 'num_inducing': 193, 'initialize_fe': True, 'minit': 'random'}. Best is trial 43 with value: 0.06729082763195038.
INFO:root:After model training
INFO:root:148.912109375
INFO:root:178.0
INFO:optuna.study.study:Trial 95 finished with value: 0.07442128658294678 and parameters: {'n_max': 844, 'n_layers': 5, 'n_out': 17, 'mean_type': 'constant', 'kernel_type': 'rbf', 'lr': 0.04826942703232425, 'batch_size': 1024, 'num_inducing': 151, 'initialize_fe': True, 'minit': 'random'}. Best is trial 43 with value: 0.06729082763195038.
INFO:root:After model training
INFO:root:154.59033203125
INFO:root:198.0
INFO:optuna.study.study:Trial 96 finished with value: 0.07083438336849213 and parameters: {'n_max': 768, 'n_layers': 5, 'n_out': 11, 'mean_type': 'constant', 'kernel_type': 'rbf', 'lr': 0.03771060563194778, 'batch_size': 2048, 'num_inducing': 111, 'initialize_fe': True, 'minit': 'random'}. Best is trial 43 with value: 0.06729082763195038.
INFO:root:After model training
INFO:root:153.431640625
INFO:root:192.0
INFO:optuna.study.study:Trial 97 finished with value: 0.10875029861927032 and parameters: {'n_max': 290, 'n_layers': 5, 'n_out': 8, 'mean_type': 'linear', 'kernel_type': 'matern0.5', 'lr': 0.08794975437893618, 'batch_size': 2048, 'num_inducing': 252, 'initialize_fe': True, 'minit': 'random'}. Best is trial 43 with value: 0.06729082763195038.
INFO:root:After model training
INFO:root:146.185546875
INFO:root:182.0
INFO:optuna.study.study:Trial 98 finished with value: 0.07036030292510986 and parameters: {'n_max': 526, 'n_layers': 5, 'n_out': 7, 'mean_type': 'constant', 'kernel_type': 'rbf', 'lr': 0.03223299056045752, 'batch_size': 512, 'num_inducing': 50, 'initialize_fe': True, 'minit': 'random'}. Best is trial 43 with value: 0.06729082763195038.
INFO:root:After model training
INFO:root:154.8876953125
INFO:root:200.0
INFO:optuna.study.study:Trial 99 finished with value: 0.06965269893407822 and parameters: {'n_max': 896, 'n_layers': 5, 'n_out': 16, 'mean_type': 'constant', 'kernel_type': 'matern1.5', 'lr': 0.01957145352295464, 'batch_size': 2048, 'num_inducing': 91, 'initialize_fe': True, 'minit': 'random'}. Best is trial 43 with value: 0.06729082763195038.
INFO:root:Outer Run: 3: MSE - 0.02209841087460518, MAE - 0.11656869947910309. MAX - 0.37025463581085205
INFO:optuna.storages._in_memory:A new study created in memory with name: Nested Resampling VDKL 4
INFO:root:After model training
INFO:root:34.00390625
INFO:root:110.0
INFO:optuna.study.study:Trial 0 finished with value: 0.06891942769289017 and parameters: {'n_max': 1024, 'n_layers': 4, 'n_out': 2, 'mean_type': 'constant', 'kernel_type': 'rbf', 'lr': 0.01, 'batch_size': 1024, 'num_inducing': 1000, 'initialize_fe': False, 'minit': 'random'}. Best is trial 0 with value: 0.06891942769289017.
INFO:root:After model training
INFO:root:25.45556640625
INFO:root:110.0
INFO:optuna.study.study:Trial 1 finished with value: 0.08848366141319275 and parameters: {'n_max': 924, 'n_layers': 2, 'n_out': 18, 'mean_type': 'constant', 'kernel_type': 'rbf', 'lr': 0.0006081849470759835, 'batch_size': 1024, 'num_inducing': 64, 'initialize_fe': False, 'minit': 'random'}. Best is trial 0 with value: 0.06891942769289017.
INFO:root:After model training
INFO:root:25.6982421875
INFO:root:108.0
INFO:optuna.study.study:Trial 2 finished with value: 0.08542601764202118 and parameters: {'n_max': 673, 'n_layers': 2, 'n_out': 15, 'mean_type': 'constant', 'kernel_type': 'rbf', 'lr': 0.022302974957954424, 'batch_size': 1024, 'num_inducing': 193, 'initialize_fe': False, 'minit': 'kmeans'}. Best is trial 0 with value: 0.06891942769289017.
INFO:root:After model training
INFO:root:37.95947265625
INFO:root:112.0
INFO:optuna.study.study:Trial 3 finished with value: 0.1103261411190033 and parameters: {'n_max': 983, 'n_layers': 3, 'n_out': 2, 'mean_type': 'linear', 'kernel_type': 'rbf', 'lr': 0.00020122817470234847, 'batch_size': 512, 'num_inducing': 1543, 'initialize_fe': True, 'minit': 'random'}. Best is trial 0 with value: 0.06891942769289017.
INFO:root:After model training
INFO:root:25.5263671875
INFO:root:110.0
INFO:optuna.study.study:Trial 4 finished with value: 0.09633944928646088 and parameters: {'n_max': 118, 'n_layers': 4, 'n_out': 7, 'mean_type': 'constant', 'kernel_type': 'matern1.5', 'lr': 0.0025642667411543106, 'batch_size': 512, 'num_inducing': 116, 'initialize_fe': True, 'minit': 'random'}. Best is trial 0 with value: 0.06891942769289017.
INFO:root:After model training
INFO:root:32.4638671875
INFO:root:112.0
INFO:optuna.study.study:Trial 5 finished with value: 0.13564690947532654 and parameters: {'n_max': 275, 'n_layers': 4, 'n_out': 16, 'mean_type': 'linear', 'kernel_type': 'rbf', 'lr': 0.0011330947457626724, 'batch_size': 2048, 'num_inducing': 180, 'initialize_fe': False, 'minit': 'kmeans'}. Best is trial 0 with value: 0.06891942769289017.
INFO:root:After model training
INFO:root:50.12353515625
INFO:root:156.0
INFO:optuna.study.study:Trial 6 finished with value: 0.1473904699087143 and parameters: {'n_max': 412, 'n_layers': 5, 'n_out': 17, 'mean_type': 'linear', 'kernel_type': 'matern0.5', 'lr': 0.00033474555148727957, 'batch_size': 2048, 'num_inducing': 1295, 'initialize_fe': False, 'minit': 'kmeans'}. Best is trial 0 with value: 0.06891942769289017.
INFO:root:After model training
INFO:root:25.6875
INFO:root:108.0
INFO:optuna.study.study:Trial 7 finished with value: 0.08298921585083008 and parameters: {'n_max': 112, 'n_layers': 2, 'n_out': 13, 'mean_type': 'constant', 'kernel_type': 'rbf', 'lr': 0.002071845749733811, 'batch_size': 1024, 'num_inducing': 205, 'initialize_fe': False, 'minit': 'random'}. Best is trial 0 with value: 0.06891942769289017.
INFO:root:After model training
INFO:root:26.380859375
INFO:root:108.0
INFO:optuna.study.study:Trial 8 finished with value: 0.07926012575626373 and parameters: {'n_max': 221, 'n_layers': 4, 'n_out': 10, 'mean_type': 'constant', 'kernel_type': 'rbf', 'lr': 0.00012213377798286071, 'batch_size': 1024, 'num_inducing': 363, 'initialize_fe': False, 'minit': 'random'}. Best is trial 0 with value: 0.06891942769289017.
INFO:root:After model training
INFO:root:25.4951171875
INFO:root:108.0
INFO:optuna.study.study:Trial 9 finished with value: 0.07774142175912857 and parameters: {'n_max': 1006, 'n_layers': 2, 'n_out': 2, 'mean_type': 'constant', 'kernel_type': 'matern0.5', 'lr': 0.0002669910532777762, 'batch_size': 1024, 'num_inducing': 116, 'initialize_fe': False, 'minit': 'random'}. Best is trial 0 with value: 0.06891942769289017.
INFO:root:After model training
INFO:root:29.9775390625
INFO:root:108.0
INFO:optuna.study.study:Trial 10 finished with value: 0.0815005749464035 and parameters: {'n_max': 719, 'n_layers': 5, 'n_out': 6, 'mean_type': 'linear', 'kernel_type': 'matern1.5', 'lr': 0.03876541099859086, 'batch_size': 512, 'num_inducing': 624, 'initialize_fe': True, 'minit': 'kmeans'}. Best is trial 0 with value: 0.06891942769289017.
INFO:root:After model training
INFO:root:29.41015625
INFO:root:108.0
INFO:optuna.study.study:Trial 11 finished with value: 0.0838720053434372 and parameters: {'n_max': 830, 'n_layers': 3, 'n_out': 2, 'mean_type': 'constant', 'kernel_type': 'matern0.5', 'lr': 0.007993615620580118, 'batch_size': 1024, 'num_inducing': 694, 'initialize_fe': False, 'minit': 'random'}. Best is trial 0 with value: 0.06891942769289017.
INFO:root:After model training
INFO:root:27.22509765625
INFO:root:110.0
INFO:optuna.study.study:Trial 12 finished with value: 0.07321640849113464 and parameters: {'n_max': 976, 'n_layers': 3, 'n_out': 5, 'mean_type': 'constant', 'kernel_type': 'matern0.5', 'lr': 0.007074187742973117, 'batch_size': 1024, 'num_inducing': 61, 'initialize_fe': False, 'minit': 'random'}. Best is trial 0 with value: 0.06891942769289017.
INFO:root:After model training
INFO:root:26.0166015625
INFO:root:110.0
INFO:optuna.study.study:Trial 13 finished with value: 0.07360950112342834 and parameters: {'n_max': 569, 'n_layers': 3, 'n_out': 6, 'mean_type': 'constant', 'kernel_type': 'matern0.5', 'lr': 0.009187447852677128, 'batch_size': 1024, 'num_inducing': 61, 'initialize_fe': False, 'minit': 'random'}. Best is trial 0 with value: 0.06891942769289017.
INFO:root:After model training
INFO:root:31.6181640625
INFO:root:112.0
INFO:optuna.study.study:Trial 14 finished with value: 0.08162537962198257 and parameters: {'n_max': 819, 'n_layers': 4, 'n_out': 9, 'mean_type': 'constant', 'kernel_type': 'matern0.5', 'lr': 0.08859107784505764, 'batch_size': 1024, 'num_inducing': 823, 'initialize_fe': False, 'minit': 'random'}. Best is trial 0 with value: 0.06891942769289017.
INFO:root:After model training
INFO:root:37.26171875
INFO:root:126.0
