INFO:optuna.study.study:Trial 87 finished with value: 0.00025426584761589766 and parameters: {'n_max': 379, 'n_layers': 2, 'n_out': 15, 'mean_type': 'constant', 'kernel_type': 'matern1.5', 'lr': 0.0018771365732502675, 'batch_size': 512, 'num_inducing': 139, 'initialize_fe': True, 'minit': 'random'}. Best is trial 53 with value: 7.535546319559216e-05.
INFO:root:After model training
INFO:root:22.806640625
INFO:root:70.0
INFO:optuna.study.study:Trial 88 finished with value: 0.0001195228542201221 and parameters: {'n_max': 734, 'n_layers': 2, 'n_out': 4, 'mean_type': 'constant', 'kernel_type': 'rbf', 'lr': 0.003436110340056702, 'batch_size': 512, 'num_inducing': 86, 'initialize_fe': True, 'minit': 'random'}. Best is trial 53 with value: 7.535546319559216e-05.
INFO:root:After model training
INFO:root:23.63818359375
INFO:root:68.0
INFO:optuna.study.study:Trial 89 finished with value: 0.00023164390586316586 and parameters: {'n_max': 588, 'n_layers': 3, 'n_out': 6, 'mean_type': 'constant', 'kernel_type': 'matern0.5', 'lr': 0.002702026705999621, 'batch_size': 512, 'num_inducing': 168, 'initialize_fe': True, 'minit': 'random'}. Best is trial 53 with value: 7.535546319559216e-05.
INFO:root:After model training
INFO:root:23.8203125
INFO:root:70.0
INFO:optuna.study.study:Trial 90 finished with value: 0.0003054104745388031 and parameters: {'n_max': 535, 'n_layers': 4, 'n_out': 5, 'mean_type': 'linear', 'kernel_type': 'rbf', 'lr': 0.008013467921375491, 'batch_size': 512, 'num_inducing': 108, 'initialize_fe': True, 'minit': 'random'}. Best is trial 53 with value: 7.535546319559216e-05.
INFO:root:After model training
INFO:root:22.818359375
INFO:root:66.0
INFO:optuna.study.study:Trial 91 finished with value: 7.505461690016091e-05 and parameters: {'n_max': 805, 'n_layers': 2, 'n_out': 4, 'mean_type': 'constant', 'kernel_type': 'rbf', 'lr': 0.003533869197167341, 'batch_size': 512, 'num_inducing': 91, 'initialize_fe': True, 'minit': 'random'}. Best is trial 91 with value: 7.505461690016091e-05.
INFO:root:After model training
INFO:root:22.8193359375
INFO:root:66.0
INFO:optuna.study.study:Trial 92 finished with value: 7.225995068438351e-05 and parameters: {'n_max': 503, 'n_layers': 2, 'n_out': 6, 'mean_type': 'constant', 'kernel_type': 'rbf', 'lr': 0.0020892533314430133, 'batch_size': 512, 'num_inducing': 95, 'initialize_fe': True, 'minit': 'random'}. Best is trial 92 with value: 7.225995068438351e-05.
INFO:root:After model training
INFO:root:22.8154296875
INFO:root:66.0
INFO:optuna.study.study:Trial 93 finished with value: 8.919335959944874e-05 and parameters: {'n_max': 493, 'n_layers': 2, 'n_out': 4, 'mean_type': 'constant', 'kernel_type': 'rbf', 'lr': 0.002118909307417191, 'batch_size': 512, 'num_inducing': 95, 'initialize_fe': True, 'minit': 'random'}. Best is trial 92 with value: 7.225995068438351e-05.
INFO:root:After model training
INFO:root:22.810546875
INFO:root:68.0
INFO:optuna.study.study:Trial 94 finished with value: 0.00012955788406543434 and parameters: {'n_max': 512, 'n_layers': 2, 'n_out': 4, 'mean_type': 'constant', 'kernel_type': 'rbf', 'lr': 0.0022359056857314593, 'batch_size': 512, 'num_inducing': 92, 'initialize_fe': True, 'minit': 'random'}. Best is trial 92 with value: 7.225995068438351e-05.
INFO:root:After model training
INFO:root:22.7705078125
INFO:root:66.0
INFO:optuna.study.study:Trial 95 finished with value: 0.00015525329217780381 and parameters: {'n_max': 456, 'n_layers': 2, 'n_out': 3, 'mean_type': 'constant', 'kernel_type': 'rbf', 'lr': 0.005412119913550338, 'batch_size': 512, 'num_inducing': 71, 'initialize_fe': True, 'minit': 'random'}. Best is trial 92 with value: 7.225995068438351e-05.
INFO:root:After model training
INFO:root:28.55615234375
INFO:root:84.0
INFO:optuna.study.study:Trial 96 finished with value: 0.0012583103962242603 and parameters: {'n_max': 668, 'n_layers': 2, 'n_out': 4, 'mean_type': 'constant', 'kernel_type': 'rbf', 'lr': 0.004232101961523297, 'batch_size': 2048, 'num_inducing': 78, 'initialize_fe': True, 'minit': 'random'}. Best is trial 92 with value: 7.225995068438351e-05.
INFO:root:After model training
INFO:root:22.8212890625
INFO:root:66.0
INFO:optuna.study.study:Trial 97 finished with value: 0.0001928224810399115 and parameters: {'n_max': 701, 'n_layers': 2, 'n_out': 5, 'mean_type': 'constant', 'kernel_type': 'rbf', 'lr': 0.0032278879341912066, 'batch_size': 512, 'num_inducing': 93, 'initialize_fe': True, 'minit': 'random'}. Best is trial 92 with value: 7.225995068438351e-05.
INFO:root:After model training
INFO:root:22.8740234375
INFO:root:68.0
INFO:optuna.study.study:Trial 98 finished with value: 0.00011010788148269057 and parameters: {'n_max': 497, 'n_layers': 2, 'n_out': 3, 'mean_type': 'constant', 'kernel_type': 'matern1.5', 'lr': 0.001385499522218771, 'batch_size': 512, 'num_inducing': 126, 'initialize_fe': True, 'minit': 'random'}. Best is trial 92 with value: 7.225995068438351e-05.
INFO:root:After model training
INFO:root:22.740234375
INFO:root:66.0
INFO:optuna.study.study:Trial 99 finished with value: 0.00023020834487397224 and parameters: {'n_max': 181, 'n_layers': 2, 'n_out': 4, 'mean_type': 'constant', 'kernel_type': 'rbf', 'lr': 0.0017039588555329728, 'batch_size': 512, 'num_inducing': 56, 'initialize_fe': True, 'minit': 'random'}. Best is trial 92 with value: 7.225995068438351e-05.
INFO:root:Outer Run: 5: MSE - 7.505889243475394e-08, MAE - 0.00020278194278944284. MAX - 0.0020391345024108887
