INFO:optuna.storages._in_memory:A new study created in memory with name: Nested Resampling VDKL 1
INFO:root:After model training
INFO:root:8.68359375
INFO:root:30.0
INFO:optuna.study.study:Trial 0 finished with value: 0.0758851170539856 and parameters: {'n_max': 1024, 'n_layers': 4, 'n_out': 2, 'mean_type': 'constant', 'kernel_type': 'rbf', 'lr': 0.01, 'batch_size': 512, 'num_inducing': 1000, 'initialize_fe': False, 'minit': 'random'}. Best is trial 0 with value: 0.0758851170539856.
INFO:root:After model training
INFO:root:2.29345703125
INFO:root:32.0
INFO:optuna.study.study:Trial 1 finished with value: 0.12261344492435455 and parameters: {'n_max': 610, 'n_layers': 5, 'n_out': 3, 'mean_type': 'linear', 'kernel_type': 'matern0.5', 'lr': 0.00015037078617776697, 'batch_size': 512, 'num_inducing': 180, 'initialize_fe': True, 'minit': 'random'}. Best is trial 0 with value: 0.0758851170539856.
INFO:root:After model training
INFO:root:16.2041015625
INFO:root:38.0
INFO:optuna.study.study:Trial 2 finished with value: 0.1121101826429367 and parameters: {'n_max': 110, 'n_layers': 2, 'n_out': 6, 'mean_type': 'linear', 'kernel_type': 'matern0.5', 'lr': 0.00019925593292859575, 'batch_size': 1024, 'num_inducing': 1904, 'initialize_fe': False, 'minit': 'random'}. Best is trial 0 with value: 0.0758851170539856.
INFO:root:After model training
INFO:root:7.1943359375
INFO:root:28.0
INFO:optuna.study.study:Trial 3 finished with value: 0.07673870772123337 and parameters: {'n_max': 72, 'n_layers': 3, 'n_out': 6, 'mean_type': 'constant', 'kernel_type': 'matern0.5', 'lr': 0.04110163236944518, 'batch_size': 2048, 'num_inducing': 192, 'initialize_fe': True, 'minit': 'kmeans'}. Best is trial 0 with value: 0.0758851170539856.
INFO:root:After model training
INFO:root:14.38232421875
INFO:root:54.0
INFO:optuna.study.study:Trial 4 finished with value: 0.1505609005689621 and parameters: {'n_max': 822, 'n_layers': 5, 'n_out': 11, 'mean_type': 'linear', 'kernel_type': 'rbf', 'lr': 0.0012588584840624673, 'batch_size': 2048, 'num_inducing': 527, 'initialize_fe': True, 'minit': 'kmeans'}. Best is trial 0 with value: 0.0758851170539856.
INFO:root:After model training
INFO:root:7.84033203125
INFO:root:36.0
INFO:optuna.study.study:Trial 5 finished with value: 0.23283562064170837 and parameters: {'n_max': 338, 'n_layers': 2, 'n_out': 4, 'mean_type': 'linear', 'kernel_type': 'rbf', 'lr': 0.00033976080807206904, 'batch_size': 2048, 'num_inducing': 253, 'initialize_fe': True, 'minit': 'kmeans'}. Best is trial 0 with value: 0.0758851170539856.
INFO:root:After model training
INFO:root:12.015625
INFO:root:76.0
INFO:optuna.study.study:Trial 6 finished with value: 0.09135657548904419 and parameters: {'n_max': 686, 'n_layers': 4, 'n_out': 20, 'mean_type': 'constant', 'kernel_type': 'rbf', 'lr': 0.001490754056358112, 'batch_size': 2048, 'num_inducing': 468, 'initialize_fe': False, 'minit': 'kmeans'}. Best is trial 0 with value: 0.0758851170539856.
INFO:root:After model training
INFO:root:30.27197265625
INFO:root:74.0
INFO:optuna.study.study:Trial 7 finished with value: 0.08485030382871628 and parameters: {'n_max': 565, 'n_layers': 5, 'n_out': 20, 'mean_type': 'constant', 'kernel_type': 'matern1.5', 'lr': 0.007185875601183548, 'batch_size': 2048, 'num_inducing': 1563, 'initialize_fe': False, 'minit': 'random'}. Best is trial 0 with value: 0.0758851170539856.
INFO:root:After model training
INFO:root:13.9794921875
INFO:root:96.0
INFO:optuna.study.study:Trial 8 finished with value: 0.0811556875705719 and parameters: {'n_max': 839, 'n_layers': 5, 'n_out': 2, 'mean_type': 'constant', 'kernel_type': 'matern1.5', 'lr': 0.0017557575706816247, 'batch_size': 2048, 'num_inducing': 308, 'initialize_fe': True, 'minit': 'random'}. Best is trial 0 with value: 0.0758851170539856.
INFO:root:After model training
INFO:root:36.9052734375
INFO:root:64.0
INFO:optuna.study.study:Trial 9 finished with value: 0.08255007863044739 and parameters: {'n_max': 484, 'n_layers': 3, 'n_out': 4, 'mean_type': 'constant', 'kernel_type': 'rbf', 'lr': 0.002080112270473073, 'batch_size': 2048, 'num_inducing': 1874, 'initialize_fe': True, 'minit': 'kmeans'}. Best is trial 0 with value: 0.0758851170539856.
INFO:root:After model training
INFO:root:3.69775390625
INFO:root:30.0
INFO:optuna.study.study:Trial 10 finished with value: 0.07820149511098862 and parameters: {'n_max': 999, 'n_layers': 4, 'n_out': 11, 'mean_type': 'constant', 'kernel_type': 'rbf', 'lr': 0.024229275834061502, 'batch_size': 512, 'num_inducing': 53, 'initialize_fe': False, 'minit': 'random'}. Best is trial 0 with value: 0.0758851170539856.
INFO:root:After model training
INFO:root:0.38525390625
INFO:root:8.0
INFO:optuna.study.study:Trial 11 finished with value: 0.09835371375083923 and parameters: {'n_max': 116, 'n_layers': 3, 'n_out': 9, 'mean_type': 'constant', 'kernel_type': 'matern0.5', 'lr': 0.09447287843358645, 'batch_size': 512, 'num_inducing': 117, 'initialize_fe': False, 'minit': 'kmeans'}. Best is trial 0 with value: 0.0758851170539856.
INFO:root:After model training
INFO:root:3.78466796875
INFO:root:26.0
INFO:optuna.study.study:Trial 12 finished with value: 0.09341787546873093 and parameters: {'n_max': 312, 'n_layers': 3, 'n_out': 7, 'mean_type': 'constant', 'kernel_type': 'matern0.5', 'lr': 0.031427170587758985, 'batch_size': 1024, 'num_inducing': 811, 'initialize_fe': True, 'minit': 'kmeans'}. Best is trial 0 with value: 0.0758851170539856.
INFO:root:After model training
INFO:root:0.74462890625
INFO:root:6.0
INFO:optuna.study.study:Trial 13 finished with value: 0.07808241248130798 and parameters: {'n_max': 342, 'n_layers': 4, 'n_out': 6, 'mean_type': 'constant', 'kernel_type': 'matern0.5', 'lr': 0.008989234778180491, 'batch_size': 512, 'num_inducing': 105, 'initialize_fe': False, 'minit': 'random'}. Best is trial 0 with value: 0.0758851170539856.
INFO:root:After model training
INFO:root:6.357421875
INFO:root:26.0
INFO:optuna.study.study:Trial 14 finished with value: 0.09879208356142044 and parameters: {'n_max': 976, 'n_layers': 3, 'n_out': 15, 'mean_type': 'constant', 'kernel_type': 'matern1.5', 'lr': 0.07135857677759525, 'batch_size': 512, 'num_inducing': 925, 'initialize_fe': True, 'minit': 'kmeans'}. Best is trial 0 with value: 0.0758851170539856.
INFO:root:After model training
INFO:root:0.671875
INFO:root:12.0
INFO:optuna.study.study:Trial 15 finished with value: 0.07922199368476868 and parameters: {'n_max': 233, 'n_layers': 4, 'n_out': 15, 'mean_type': 'constant', 'kernel_type': 'rbf', 'lr': 0.008448931776213559, 'batch_size': 1024, 'num_inducing': 168, 'initialize_fe': False, 'minit': 'random'}. Best is trial 0 with value: 0.0758851170539856.
INFO:root:After model training
INFO:root:1.7568359375
INFO:root:24.0
INFO:optuna.study.study:Trial 16 finished with value: 0.0764794647693634 and parameters: {'n_max': 460, 'n_layers': 2, 'n_out': 8, 'mean_type': 'constant', 'kernel_type': 'matern0.5', 'lr': 0.026925830504715417, 'batch_size': 512, 'num_inducing': 511, 'initialize_fe': False, 'minit': 'kmeans'}. Best is trial 0 with value: 0.0758851170539856.
INFO:root:After model training
INFO:root:5.0703125
INFO:root:28.0
INFO:optuna.study.study:Trial 17 finished with value: 0.08694814145565033 and parameters: {'n_max': 457, 'n_layers': 2, 'n_out': 14, 'mean_type': 'constant', 'kernel_type': 'rbf', 'lr': 0.016495885369716377, 'batch_size': 512, 'num_inducing': 993, 'initialize_fe': False, 'minit': 'random'}. Best is trial 0 with value: 0.0758851170539856.
INFO:root:After model training
INFO:root:1.8095703125
INFO:root:26.0
INFO:optuna.study.study:Trial 18 finished with value: 0.1164182722568512 and parameters: {'n_max': 753, 'n_layers': 2, 'n_out': 9, 'mean_type': 'linear', 'kernel_type': 'matern0.5', 'lr': 0.004327756363696303, 'batch_size': 512, 'num_inducing': 518, 'initialize_fe': False, 'minit': 'random'}. Best is trial 0 with value: 0.0758851170539856.
INFO:root:After model training
INFO:root:5.5458984375
INFO:root:26.0
INFO:optuna.study.study:Trial 19 finished with value: 0.09221936762332916 and parameters: {'n_max': 890, 'n_layers': 4, 'n_out': 13, 'mean_type': 'constant', 'kernel_type': 'matern1.5', 'lr': 0.0006603755262338064, 'batch_size': 512, 'num_inducing': 695, 'initialize_fe': False, 'minit': 'kmeans'}. Best is trial 0 with value: 0.0758851170539856.
INFO:root:After model training
INFO:root:7.5634765625
INFO:root:28.0
INFO:optuna.study.study:Trial 20 finished with value: 0.08305637538433075 and parameters: {'n_max': 639, 'n_layers': 2, 'n_out': 8, 'mean_type': 'constant', 'kernel_type': 'rbf', 'lr': 0.015237342476344938, 'batch_size': 512, 'num_inducing': 1251, 'initialize_fe': False, 'minit': 'random'}. Best is trial 0 with value: 0.0758851170539856.
INFO:root:After model training
INFO:root:1.16845703125
INFO:root:10.0
INFO:optuna.study.study:Trial 21 finished with value: 0.1005665734410286 and parameters: {'n_max': 67, 'n_layers': 3, 'n_out': 5, 'mean_type': 'constant', 'kernel_type': 'matern0.5', 'lr': 0.04476442785548023, 'batch_size': 512, 'num_inducing': 383, 'initialize_fe': True, 'minit': 'kmeans'}. Best is trial 0 with value: 0.0758851170539856.
INFO:root:After model training
INFO:root:8.55029296875
INFO:root:58.0
INFO:optuna.study.study:Trial 22 finished with value: 0.07350383698940277 and parameters: {'n_max': 241, 'n_layers': 3, 'n_out': 2, 'mean_type': 'constant', 'kernel_type': 'matern0.5', 'lr': 0.04704147677640264, 'batch_size': 2048, 'num_inducing': 267, 'initialize_fe': False, 'minit': 'kmeans'}. Best is trial 22 with value: 0.07350383698940277.
INFO:root:After model training
INFO:root:3.21728515625
INFO:root:30.0
INFO:optuna.study.study:Trial 23 finished with value: 0.07781286537647247 and parameters: {'n_max': 470, 'n_layers': 4, 'n_out': 2, 'mean_type': 'constant', 'kernel_type': 'matern0.5', 'lr': 0.015444790467375583, 'batch_size': 1024, 'num_inducing': 641, 'initialize_fe': False, 'minit': 'kmeans'}. Best is trial 22 with value: 0.07350383698940277.
INFO:root:After model training
INFO:root:0.853515625
INFO:root:8.0
INFO:optuna.study.study:Trial 24 finished with value: 0.08026815205812454 and parameters: {'n_max': 175, 'n_layers': 2, 'n_out': 2, 'mean_type': 'constant', 'kernel_type': 'matern0.5', 'lr': 0.00462629266438205, 'batch_size': 512, 'num_inducing': 300, 'initialize_fe': False, 'minit': 'kmeans'}. Best is trial 22 with value: 0.07350383698940277.
INFO:root:After model training
INFO:root:21.05126953125
INFO:root:74.0
INFO:optuna.study.study:Trial 25 finished with value: 0.08200840651988983 and parameters: {'n_max': 402, 'n_layers': 3, 'n_out': 4, 'mean_type': 'constant', 'kernel_type': 'matern0.5', 'lr': 0.05305856271317463, 'batch_size': 2048, 'num_inducing': 1151, 'initialize_fe': False, 'minit': 'kmeans'}. Best is trial 22 with value: 0.07350383698940277.
INFO:root:After model training
INFO:root:1.55224609375
INFO:root:16.0
INFO:optuna.study.study:Trial 26 finished with value: 0.07584790885448456 and parameters: {'n_max': 244, 'n_layers': 4, 'n_out': 9, 'mean_type': 'constant', 'kernel_type': 'matern0.5', 'lr': 0.023465935725849988, 'batch_size': 512, 'num_inducing': 425, 'initialize_fe': False, 'minit': 'kmeans'}. Best is trial 22 with value: 0.07350383698940277.
INFO:root:After model training
INFO:root:0.916015625
INFO:root:12.0
INFO:optuna.study.study:Trial 27 finished with value: 0.12012553960084915 and parameters: {'n_max': 247, 'n_layers': 4, 'n_out': 18, 'mean_type': 'linear', 'kernel_type': 'matern1.5', 'lr': 0.011063862384621644, 'batch_size': 1024, 'num_inducing': 248, 'initialize_fe': False, 'minit': 'kmeans'}. Best is trial 22 with value: 0.07350383698940277.
INFO:root:After model training
INFO:root:1.3876953125
INFO:root:12.0
INFO:optuna.study.study:Trial 28 finished with value: 0.08723064512014389 and parameters: {'n_max': 232, 'n_layers': 4, 'n_out': 12, 'mean_type': 'constant', 'kernel_type': 'matern0.5', 'lr': 0.005106886025353561, 'batch_size': 512, 'num_inducing': 390, 'initialize_fe': False, 'minit': 'random'}. Best is trial 22 with value: 0.07350383698940277.
INFO:root:After model training
INFO:root:8.71044921875
INFO:root:30.0
INFO:optuna.study.study:Trial 29 finished with value: 0.1331591010093689 and parameters: {'n_max': 584, 'n_layers': 5, 'n_out': 3, 'mean_type': 'linear', 'kernel_type': 'rbf', 'lr': 0.02027184930687712, 'batch_size': 2048, 'num_inducing': 180, 'initialize_fe': False, 'minit': 'random'}. Best is trial 22 with value: 0.07350383698940277.
INFO:root:After model training
INFO:root:0.36328125
INFO:root:4.0
INFO:optuna.study.study:Trial 30 finished with value: 0.07227209955453873 and parameters: {'n_max': 162, 'n_layers': 4, 'n_out': 17, 'mean_type': 'constant', 'kernel_type': 'matern0.5', 'lr': 0.002788642608391813, 'batch_size': 512, 'num_inducing': 63, 'initialize_fe': False, 'minit': 'kmeans'}. Best is trial 30 with value: 0.07227209955453873.
INFO:root:After model training
INFO:root:0.3515625
INFO:root:4.0
INFO:optuna.study.study:Trial 31 finished with value: 0.07153354585170746 and parameters: {'n_max': 162, 'n_layers': 4, 'n_out': 18, 'mean_type': 'constant', 'kernel_type': 'matern0.5', 'lr': 0.0028656493829313555, 'batch_size': 512, 'num_inducing': 55, 'initialize_fe': False, 'minit': 'kmeans'}. Best is trial 31 with value: 0.07153354585170746.
INFO:root:After model training
INFO:root:0.34326171875
INFO:root:10.0
INFO:optuna.study.study:Trial 32 finished with value: 0.07300859689712524 and parameters: {'n_max': 158, 'n_layers': 4, 'n_out': 17, 'mean_type': 'constant', 'kernel_type': 'matern0.5', 'lr': 0.002622117268366911, 'batch_size': 512, 'num_inducing': 53, 'initialize_fe': False, 'minit': 'kmeans'}. Best is trial 31 with value: 0.07153354585170746.
INFO:root:After model training
INFO:root:0.3466796875
INFO:root:6.0
INFO:optuna.study.study:Trial 33 finished with value: 0.07578645646572113 and parameters: {'n_max': 162, 'n_layers': 4, 'n_out': 17, 'mean_type': 'constant', 'kernel_type': 'matern0.5', 'lr': 0.00287374893997947, 'batch_size': 512, 'num_inducing': 52, 'initialize_fe': False, 'minit': 'kmeans'}. Best is trial 31 with value: 0.07153354585170746.
INFO:root:After model training
INFO:root:0.37548828125
INFO:root:6.0
INFO:optuna.study.study:Trial 34 finished with value: 0.07466678321361542 and parameters: {'n_max': 162, 'n_layers': 4, 'n_out': 18, 'mean_type': 'constant', 'kernel_type': 'matern0.5', 'lr': 0.001003386701881261, 'batch_size': 512, 'num_inducing': 70, 'initialize_fe': False, 'minit': 'kmeans'}. Best is trial 31 with value: 0.07153354585170746.
INFO:root:After model training
INFO:root:0.44970703125
INFO:root:6.0
INFO:optuna.study.study:Trial 35 finished with value: 0.07110118120908737 and parameters: {'n_max': 281, 'n_layers': 3, 'n_out': 17, 'mean_type': 'constant', 'kernel_type': 'matern0.5', 'lr': 0.0006216834147008764, 'batch_size': 512, 'num_inducing': 74, 'initialize_fe': False, 'minit': 'kmeans'}. Best is trial 35 with value: 0.07110118120908737.
INFO:root:After model training
INFO:root:0.73681640625
INFO:root:10.0
INFO:optuna.study.study:Trial 36 finished with value: 0.08496232330799103 and parameters: {'n_max': 297, 'n_layers': 5, 'n_out': 17, 'mean_type': 'linear', 'kernel_type': 'matern0.5', 'lr': 0.00010545931063202877, 'batch_size': 512, 'num_inducing': 76, 'initialize_fe': False, 'minit': 'kmeans'}. Best is trial 35 with value: 0.07110118120908737.
INFO:root:After model training
INFO:root:0.30859375
INFO:root:8.0
INFO:optuna.study.study:Trial 37 finished with value: 0.0693875327706337 and parameters: {'n_max': 123, 'n_layers': 3, 'n_out': 16, 'mean_type': 'constant', 'kernel_type': 'matern0.5', 'lr': 0.0004537417326947398, 'batch_size': 512, 'num_inducing': 71, 'initialize_fe': False, 'minit': 'kmeans'}. Best is trial 37 with value: 0.0693875327706337.
INFO:root:After model training
INFO:root:0.31640625
INFO:root:4.0
INFO:optuna.study.study:Trial 38 finished with value: 0.07162126153707504 and parameters: {'n_max': 113, 'n_layers': 3, 'n_out': 19, 'mean_type': 'constant', 'kernel_type': 'matern0.5', 'lr': 0.00032727587499953385, 'batch_size': 512, 'num_inducing': 78, 'initialize_fe': False, 'minit': 'kmeans'}. Best is trial 37 with value: 0.0693875327706337.
INFO:root:After model training
INFO:root:0.361328125
INFO:root:10.0
INFO:optuna.study.study:Trial 39 finished with value: 0.11792317032814026 and parameters: {'n_max': 112, 'n_layers': 3, 'n_out': 19, 'mean_type': 'linear', 'kernel_type': 'matern0.5', 'lr': 0.0003424483511929944, 'batch_size': 512, 'num_inducing': 103, 'initialize_fe': False, 'minit': 'kmeans'}. Best is trial 37 with value: 0.0693875327706337.
INFO:root:After model training
INFO:root:0.31884765625
INFO:root:8.0
INFO:optuna.study.study:Trial 40 finished with value: 0.06960123777389526 and parameters: {'n_max': 91, 'n_layers': 3, 'n_out': 15, 'mean_type': 'constant', 'kernel_type': 'matern0.5', 'lr': 0.00028865860348341674, 'batch_size': 512, 'num_inducing': 86, 'initialize_fe': False, 'minit': 'kmeans'}. Best is trial 37 with value: 0.0693875327706337.
INFO:root:After model training
INFO:root:0.3056640625
INFO:root:6.0
INFO:optuna.study.study:Trial 41 finished with value: 0.06996683776378632 and parameters: {'n_max': 71, 'n_layers': 3, 'n_out': 15, 'mean_type': 'constant', 'kernel_type': 'matern0.5', 'lr': 0.0002819830303799008, 'batch_size': 512, 'num_inducing': 83, 'initialize_fe': False, 'minit': 'kmeans'}. Best is trial 37 with value: 0.0693875327706337.
INFO:root:After model training
INFO:root:0.41357421875
INFO:root:10.0
INFO:optuna.study.study:Trial 42 finished with value: 0.07416097819805145 and parameters: {'n_max': 64, 'n_layers': 3, 'n_out': 14, 'mean_type': 'constant', 'kernel_type': 'matern0.5', 'lr': 0.00021151802437748316, 'batch_size': 512, 'num_inducing': 139, 'initialize_fe': False, 'minit': 'kmeans'}. Best is trial 37 with value: 0.0693875327706337.
INFO:root:After model training
INFO:root:0.37939453125
INFO:root:8.0
INFO:optuna.study.study:Trial 43 finished with value: 0.07002680003643036 and parameters: {'n_max': 196, 'n_layers': 3, 'n_out': 16, 'mean_type': 'constant', 'kernel_type': 'matern0.5', 'lr': 0.0006177738150278341, 'batch_size': 512, 'num_inducing': 83, 'initialize_fe': False, 'minit': 'kmeans'}. Best is trial 37 with value: 0.0693875327706337.
INFO:root:After model training
INFO:root:0.474609375
INFO:root:8.0
INFO:optuna.study.study:Trial 44 finished with value: 0.06954244524240494 and parameters: {'n_max': 286, 'n_layers': 3, 'n_out': 16, 'mean_type': 'constant', 'kernel_type': 'matern0.5', 'lr': 0.0005724866527844219, 'batch_size': 512, 'num_inducing': 86, 'initialize_fe': False, 'minit': 'kmeans'}. Best is trial 37 with value: 0.0693875327706337.
INFO:root:After model training
INFO:root:0.615234375
INFO:root:6.0
INFO:optuna.study.study:Trial 45 finished with value: 0.07432523369789124 and parameters: {'n_max': 383, 'n_layers': 3, 'n_out': 15, 'mean_type': 'constant', 'kernel_type': 'matern0.5', 'lr': 0.0005795078873002768, 'batch_size': 512, 'num_inducing': 92, 'initialize_fe': True, 'minit': 'kmeans'}. Best is trial 37 with value: 0.0693875327706337.
INFO:root:After model training
INFO:root:0.5
INFO:root:10.0
INFO:optuna.study.study:Trial 46 finished with value: 0.06935665011405945 and parameters: {'n_max': 203, 'n_layers': 3, 'n_out': 16, 'mean_type': 'constant', 'kernel_type': 'matern0.5', 'lr': 0.00022668874436590567, 'batch_size': 1024, 'num_inducing': 141, 'initialize_fe': False, 'minit': 'kmeans'}. Best is trial 46 with value: 0.06935665011405945.
INFO:root:After model training
INFO:root:0.42431640625
INFO:root:8.0
INFO:optuna.study.study:Trial 47 finished with value: 0.07223476469516754 and parameters: {'n_max': 100, 'n_layers': 3, 'n_out': 13, 'mean_type': 'constant', 'kernel_type': 'matern1.5', 'lr': 0.00022398351119143757, 'batch_size': 1024, 'num_inducing': 138, 'initialize_fe': False, 'minit': 'kmeans'}. Best is trial 46 with value: 0.06935665011405945.
INFO:root:After model training
INFO:root:0.46923828125
INFO:root:12.0
INFO:optuna.study.study:Trial 48 finished with value: 0.08246370404958725 and parameters: {'n_max': 203, 'n_layers': 3, 'n_out': 16, 'mean_type': 'constant', 'kernel_type': 'matern0.5', 'lr': 0.00013213086890946133, 'batch_size': 1024, 'num_inducing': 127, 'initialize_fe': True, 'minit': 'kmeans'}. Best is trial 46 with value: 0.06935665011405945.
INFO:root:After model training
INFO:root:0.34814453125
INFO:root:12.0
INFO:optuna.study.study:Trial 49 finished with value: 0.07138985395431519 and parameters: {'n_max': 124, 'n_layers': 3, 'n_out': 14, 'mean_type': 'constant', 'kernel_type': 'matern0.5', 'lr': 0.00039747475235765755, 'batch_size': 1024, 'num_inducing': 94, 'initialize_fe': False, 'minit': 'kmeans'}. Best is trial 46 with value: 0.06935665011405945.
INFO:root:After model training
INFO:root:0.8232421875
INFO:root:6.0
INFO:optuna.study.study:Trial 50 finished with value: 0.1067729964852333 and parameters: {'n_max': 523, 'n_layers': 3, 'n_out': 16, 'mean_type': 'linear', 'kernel_type': 'matern0.5', 'lr': 0.0009462110967124221, 'batch_size': 1024, 'num_inducing': 64, 'initialize_fe': False, 'minit': 'kmeans'}. Best is trial 46 with value: 0.06935665011405945.
INFO:root:After model training
INFO:root:0.3955078125
INFO:root:6.0
INFO:optuna.study.study:Trial 51 finished with value: 0.07018573582172394 and parameters: {'n_max': 202, 'n_layers': 3, 'n_out': 16, 'mean_type': 'constant', 'kernel_type': 'matern0.5', 'lr': 0.0004501772518599405, 'batch_size': 512, 'num_inducing': 89, 'initialize_fe': False, 'minit': 'kmeans'}. Best is trial 46 with value: 0.06935665011405945.
INFO:root:After model training
INFO:root:0.62744140625
INFO:root:12.0
