INFO:optuna.study.study:Trial 4 finished with value: 0.00040303042624145746 and parameters: {'n_max': 385, 'n_layers': 2, 'n_out': 14, 'mean_type': 'constant', 'kernel_type': 'matern1.5', 'lr': 0.0012719526628285046, 'batch_size': 2048, 'num_inducing': 1957, 'initialize_fe': True, 'minit': 'kmeans'}. Best is trial 4 with value: 0.00040303042624145746.
INFO:root:After model training
INFO:root:9.677734375
INFO:root:30.0
INFO:optuna.study.study:Trial 5 finished with value: 0.007688011974096298 and parameters: {'n_max': 405, 'n_layers': 5, 'n_out': 5, 'mean_type': 'linear', 'kernel_type': 'rbf', 'lr': 0.0007769641195882279, 'batch_size': 2048, 'num_inducing': 101, 'initialize_fe': False, 'minit': 'kmeans'}. Best is trial 4 with value: 0.00040303042624145746.
INFO:root:After model training
INFO:root:14.76806640625
INFO:root:72.0
INFO:optuna.study.study:Trial 6 finished with value: 0.001734988996759057 and parameters: {'n_max': 455, 'n_layers': 3, 'n_out': 17, 'mean_type': 'linear', 'kernel_type': 'rbf', 'lr': 0.0007920748671914459, 'batch_size': 1024, 'num_inducing': 594, 'initialize_fe': True, 'minit': 'random'}. Best is trial 4 with value: 0.00040303042624145746.
INFO:root:After model training
INFO:root:14.46484375
INFO:root:34.0
INFO:optuna.study.study:Trial 7 finished with value: 0.0007529901340603828 and parameters: {'n_max': 1024, 'n_layers': 5, 'n_out': 5, 'mean_type': 'constant', 'kernel_type': 'matern1.5', 'lr': 0.017622160666520656, 'batch_size': 1024, 'num_inducing': 107, 'initialize_fe': True, 'minit': 'random'}. Best is trial 4 with value: 0.00040303042624145746.
INFO:root:After model training
INFO:root:10.2744140625
INFO:root:30.0
INFO:optuna.study.study:Trial 8 finished with value: 0.0049909246154129505 and parameters: {'n_max': 403, 'n_layers': 5, 'n_out': 8, 'mean_type': 'constant', 'kernel_type': 'matern0.5', 'lr': 0.07281193123054397, 'batch_size': 2048, 'num_inducing': 78, 'initialize_fe': False, 'minit': 'random'}. Best is trial 4 with value: 0.00040303042624145746.
INFO:root:After model training
INFO:root:17.927734375
INFO:root:72.0
INFO:optuna.study.study:Trial 9 finished with value: 0.0006704297265969217 and parameters: {'n_max': 786, 'n_layers': 4, 'n_out': 2, 'mean_type': 'linear', 'kernel_type': 'matern1.5', 'lr': 0.011275865184214966, 'batch_size': 1024, 'num_inducing': 750, 'initialize_fe': False, 'minit': 'random'}. Best is trial 4 with value: 0.00040303042624145746.
INFO:root:After model training
INFO:root:27.16650390625
INFO:root:88.0
INFO:optuna.study.study:Trial 10 finished with value: 0.00031168112764135003 and parameters: {'n_max': 80, 'n_layers': 2, 'n_out': 17, 'mean_type': 'constant', 'kernel_type': 'matern1.5', 'lr': 0.0022482470140978684, 'batch_size': 512, 'num_inducing': 1977, 'initialize_fe': True, 'minit': 'kmeans'}. Best is trial 10 with value: 0.00031168112764135003.
INFO:root:After model training
INFO:root:27.53125
INFO:root:74.0
INFO:optuna.study.study:Trial 11 finished with value: 0.00029816702590323985 and parameters: {'n_max': 104, 'n_layers': 2, 'n_out': 17, 'mean_type': 'constant', 'kernel_type': 'matern1.5', 'lr': 0.0027827115682351818, 'batch_size': 512, 'num_inducing': 1961, 'initialize_fe': True, 'minit': 'kmeans'}. Best is trial 11 with value: 0.00029816702590323985.
INFO:root:After model training
INFO:root:28.31591796875
INFO:root:108.0
INFO:optuna.study.study:Trial 12 finished with value: 0.0003284161211922765 and parameters: {'n_max': 64, 'n_layers': 2, 'n_out': 20, 'mean_type': 'constant', 'kernel_type': 'matern1.5', 'lr': 0.002893366605478363, 'batch_size': 512, 'num_inducing': 1995, 'initialize_fe': True, 'minit': 'kmeans'}. Best is trial 11 with value: 0.00029816702590323985.
INFO:root:After model training
INFO:root:15.44921875
INFO:root:26.0
INFO:optuna.study.study:Trial 13 finished with value: 0.0003104578354395926 and parameters: {'n_max': 90, 'n_layers': 3, 'n_out': 15, 'mean_type': 'constant', 'kernel_type': 'matern1.5', 'lr': 0.004461416170839806, 'batch_size': 512, 'num_inducing': 1215, 'initialize_fe': True, 'minit': 'kmeans'}. Best is trial 11 with value: 0.00029816702590323985.
INFO:root:After model training
INFO:root:14.86572265625
INFO:root:54.0
INFO:optuna.study.study:Trial 14 finished with value: 0.0002146852493751794 and parameters: {'n_max': 228, 'n_layers': 3, 'n_out': 14, 'mean_type': 'constant', 'kernel_type': 'matern1.5', 'lr': 0.0053948012681617865, 'batch_size': 512, 'num_inducing': 1112, 'initialize_fe': True, 'minit': 'kmeans'}. Best is trial 14 with value: 0.0002146852493751794.
INFO:root:After model training
INFO:root:6.30615234375
INFO:root:16.0
INFO:optuna.study.study:Trial 15 finished with value: 0.0004877462051808834 and parameters: {'n_max': 233, 'n_layers': 3, 'n_out': 13, 'mean_type': 'constant', 'kernel_type': 'matern0.5', 'lr': 0.006072438259682128, 'batch_size': 512, 'num_inducing': 212, 'initialize_fe': True, 'minit': 'kmeans'}. Best is trial 14 with value: 0.0002146852493751794.
INFO:root:After model training
INFO:root:13.97705078125
INFO:root:34.0
INFO:optuna.study.study:Trial 16 finished with value: 0.0007436189334839582 and parameters: {'n_max': 214, 'n_layers': 2, 'n_out': 20, 'mean_type': 'constant', 'kernel_type': 'matern1.5', 'lr': 0.027656709745539333, 'batch_size': 512, 'num_inducing': 1098, 'initialize_fe': True, 'minit': 'kmeans'}. Best is trial 14 with value: 0.0002146852493751794.
INFO:root:After model training
INFO:root:7.333984375
INFO:root:20.0
INFO:optuna.study.study:Trial 17 finished with value: 0.0003728963783942163 and parameters: {'n_max': 245, 'n_layers': 3, 'n_out': 11, 'mean_type': 'constant', 'kernel_type': 'matern1.5', 'lr': 0.002010820191433954, 'batch_size': 512, 'num_inducing': 387, 'initialize_fe': True, 'minit': 'kmeans'}. Best is trial 14 with value: 0.0002146852493751794.
INFO:root:After model training
INFO:root:16.857421875
INFO:root:40.0
INFO:optuna.study.study:Trial 18 finished with value: 0.0008859028457663953 and parameters: {'n_max': 303, 'n_layers': 2, 'n_out': 17, 'mean_type': 'constant', 'kernel_type': 'rbf', 'lr': 0.0003168713919375981, 'batch_size': 512, 'num_inducing': 1320, 'initialize_fe': False, 'minit': 'kmeans'}. Best is trial 14 with value: 0.0002146852493751794.
INFO:root:After model training
INFO:root:11.43505859375
INFO:root:52.0
INFO:optuna.study.study:Trial 19 finished with value: 0.000309698807541281 and parameters: {'n_max': 520, 'n_layers': 3, 'n_out': 13, 'mean_type': 'constant', 'kernel_type': 'matern0.5', 'lr': 0.006924521560347918, 'batch_size': 512, 'num_inducing': 787, 'initialize_fe': True, 'minit': 'kmeans'}. Best is trial 14 with value: 0.0002146852493751794.
INFO:root:Outer Run: 2: MSE - 3.761365951504558e-05, MAE - 0.004829152021557093. MAX - 0.018508553504943848
INFO:optuna.storages._in_memory:A new study created in memory with name: Nested Resampling VDKL 3
INFO:root:After model training
INFO:root:66.4267578125
INFO:root:144.0
INFO:optuna.study.study:Trial 0 finished with value: 0.0014307446544989944 and parameters: {'n_max': 1024, 'n_layers': 4, 'n_out': 2, 'mean_type': 'constant', 'kernel_type': 'rbf', 'lr': 0.01, 'batch_size': 2048, 'num_inducing': 1000, 'initialize_fe': False, 'minit': 'random'}. Best is trial 0 with value: 0.0014307446544989944.
INFO:root:After model training
INFO:root:56.23828125
INFO:root:112.0
INFO:optuna.study.study:Trial 1 finished with value: 0.0063211205415427685 and parameters: {'n_max': 998, 'n_layers': 5, 'n_out': 16, 'mean_type': 'linear', 'kernel_type': 'matern0.5', 'lr': 0.00216145931261157, 'batch_size': 2048, 'num_inducing': 70, 'initialize_fe': True, 'minit': 'kmeans'}. Best is trial 0 with value: 0.0014307446544989944.
INFO:root:After model training
INFO:root:56.51953125
INFO:root:110.0
INFO:optuna.study.study:Trial 2 finished with value: 0.0030303301755338907 and parameters: {'n_max': 933, 'n_layers': 2, 'n_out': 17, 'mean_type': 'linear', 'kernel_type': 'matern0.5', 'lr': 0.0008856809466067382, 'batch_size': 1024, 'num_inducing': 492, 'initialize_fe': True, 'minit': 'random'}. Best is trial 0 with value: 0.0014307446544989944.
INFO:root:After model training
INFO:root:73.9736328125
INFO:root:168.0
INFO:optuna.study.study:Trial 3 finished with value: 0.005187461152672768 and parameters: {'n_max': 847, 'n_layers': 2, 'n_out': 18, 'mean_type': 'constant', 'kernel_type': 'matern1.5', 'lr': 0.08423548690573918, 'batch_size': 1024, 'num_inducing': 1585, 'initialize_fe': False, 'minit': 'kmeans'}. Best is trial 0 with value: 0.0014307446544989944.
INFO:root:After model training
INFO:root:54.08935546875
INFO:root:108.0
INFO:optuna.study.study:Trial 4 finished with value: 0.0025684430729597807 and parameters: {'n_max': 242, 'n_layers': 2, 'n_out': 7, 'mean_type': 'constant', 'kernel_type': 'rbf', 'lr': 0.06925260121082293, 'batch_size': 2048, 'num_inducing': 367, 'initialize_fe': True, 'minit': 'random'}. Best is trial 0 with value: 0.0014307446544989944.
INFO:root:After model training
INFO:root:56.23193359375
INFO:root:110.0
INFO:optuna.study.study:Trial 5 finished with value: 0.0016490248963236809 and parameters: {'n_max': 624, 'n_layers': 4, 'n_out': 4, 'mean_type': 'linear', 'kernel_type': 'matern1.5', 'lr': 0.0006770438328035418, 'batch_size': 512, 'num_inducing': 889, 'initialize_fe': True, 'minit': 'kmeans'}. Best is trial 0 with value: 0.0014307446544989944.
INFO:root:After model training
INFO:root:51.68310546875
INFO:root:110.0
INFO:optuna.study.study:Trial 6 finished with value: 0.0008343650843016803 and parameters: {'n_max': 148, 'n_layers': 4, 'n_out': 5, 'mean_type': 'linear', 'kernel_type': 'matern0.5', 'lr': 0.0022992436823050253, 'batch_size': 1024, 'num_inducing': 97, 'initialize_fe': True, 'minit': 'kmeans'}. Best is trial 6 with value: 0.0008343650843016803.
INFO:root:After model training
INFO:root:48.39501953125
INFO:root:110.0
INFO:optuna.study.study:Trial 7 finished with value: 0.0017821465153247118 and parameters: {'n_max': 449, 'n_layers': 2, 'n_out': 14, 'mean_type': 'constant', 'kernel_type': 'matern1.5', 'lr': 0.0715203765747805, 'batch_size': 512, 'num_inducing': 89, 'initialize_fe': False, 'minit': 'kmeans'}. Best is trial 6 with value: 0.0008343650843016803.
INFO:root:After model training
INFO:root:59.25048828125
INFO:root:122.0
INFO:optuna.study.study:Trial 8 finished with value: 0.0007428823155350983 and parameters: {'n_max': 382, 'n_layers': 2, 'n_out': 13, 'mean_type': 'linear', 'kernel_type': 'rbf', 'lr': 0.01457977794534475, 'batch_size': 512, 'num_inducing': 1310, 'initialize_fe': True, 'minit': 'random'}. Best is trial 8 with value: 0.0007428823155350983.
INFO:root:After model training
INFO:root:79.03857421875
INFO:root:168.0
INFO:optuna.study.study:Trial 9 finished with value: 0.002833979669958353 and parameters: {'n_max': 848, 'n_layers': 2, 'n_out': 20, 'mean_type': 'constant', 'kernel_type': 'rbf', 'lr': 0.07723393584301046, 'batch_size': 2048, 'num_inducing': 1898, 'initialize_fe': False, 'minit': 'kmeans'}. Best is trial 8 with value: 0.0007428823155350983.
INFO:root:After model training
INFO:root:49.142578125
INFO:root:110.0
INFO:optuna.study.study:Trial 10 finished with value: 0.0007191549520939589 and parameters: {'n_max': 394, 'n_layers': 3, 'n_out': 10, 'mean_type': 'linear', 'kernel_type': 'rbf', 'lr': 0.00011057511270596554, 'batch_size': 512, 'num_inducing': 189, 'initialize_fe': True, 'minit': 'random'}. Best is trial 10 with value: 0.0007191549520939589.
INFO:root:After model training
INFO:root:49.2138671875
INFO:root:110.0
INFO:optuna.study.study:Trial 11 finished with value: 0.0004922139924019575 and parameters: {'n_max': 398, 'n_layers': 3, 'n_out': 10, 'mean_type': 'linear', 'kernel_type': 'rbf', 'lr': 0.00010703300428786301, 'batch_size': 512, 'num_inducing': 202, 'initialize_fe': True, 'minit': 'random'}. Best is trial 11 with value: 0.0004922139924019575.
INFO:root:After model training
INFO:root:49.583984375
INFO:root:112.0
INFO:optuna.study.study:Trial 12 finished with value: 0.001299175783060491 and parameters: {'n_max': 616, 'n_layers': 3, 'n_out': 9, 'mean_type': 'linear', 'kernel_type': 'rbf', 'lr': 0.00010109194471867259, 'batch_size': 512, 'num_inducing': 190, 'initialize_fe': True, 'minit': 'random'}. Best is trial 11 with value: 0.0004922139924019575.
INFO:root:After model training
INFO:root:49.01025390625
INFO:root:114.0
INFO:optuna.study.study:Trial 13 finished with value: 0.000591839721892029 and parameters: {'n_max': 318, 'n_layers': 3, 'n_out': 10, 'mean_type': 'linear', 'kernel_type': 'rbf', 'lr': 0.00010622915660603343, 'batch_size': 512, 'num_inducing': 184, 'initialize_fe': True, 'minit': 'random'}. Best is trial 11 with value: 0.0004922139924019575.
INFO:root:After model training
INFO:root:48.9150390625
INFO:root:108.0
INFO:optuna.study.study:Trial 14 finished with value: 0.0009392095380462706 and parameters: {'n_max': 258, 'n_layers': 3, 'n_out': 12, 'mean_type': 'linear', 'kernel_type': 'rbf', 'lr': 0.00029540365869444487, 'batch_size': 512, 'num_inducing': 178, 'initialize_fe': True, 'minit': 'random'}. Best is trial 11 with value: 0.0004922139924019575.
INFO:optuna.storages._in_memory:A new study created in memory with name: Nested Resampling VDKL 1
INFO:root:After model training
INFO:root:21.65234375
INFO:root:72.0
INFO:optuna.study.study:Trial 0 finished with value: 0.0006861086003482342 and parameters: {'n_max': 1024, 'n_layers': 4, 'n_out': 2, 'mean_type': 'constant', 'kernel_type': 'rbf', 'lr': 0.01, 'batch_size': 2048, 'num_inducing': 1000, 'initialize_fe': False, 'minit': 'kmeans'}. Best is trial 0 with value: 0.0006861086003482342.
INFO:root:After model training
INFO:root:2.27880859375
INFO:root:22.0
INFO:optuna.study.study:Trial 1 finished with value: 0.03621774911880493 and parameters: {'n_max': 323, 'n_layers': 5, 'n_out': 19, 'mean_type': 'linear', 'kernel_type': 'matern0.5', 'lr': 0.05105660581997934, 'batch_size': 1024, 'num_inducing': 511, 'initialize_fe': True, 'minit': 'random'}. Best is trial 0 with value: 0.0006861086003482342.
INFO:root:After model training
INFO:root:1.2724609375
INFO:root:10.0
INFO:optuna.study.study:Trial 2 finished with value: 0.0023708357475697994 and parameters: {'n_max': 333, 'n_layers': 4, 'n_out': 6, 'mean_type': 'linear', 'kernel_type': 'rbf', 'lr': 0.0015917569027355117, 'batch_size': 1024, 'num_inducing': 309, 'initialize_fe': False, 'minit': 'kmeans'}. Best is trial 0 with value: 0.0006861086003482342.
INFO:root:After model training
INFO:root:7.40185546875
INFO:root:30.0
INFO:optuna.study.study:Trial 3 finished with value: 0.0011013566982001066 and parameters: {'n_max': 473, 'n_layers': 5, 'n_out': 12, 'mean_type': 'constant', 'kernel_type': 'rbf', 'lr': 0.0017794373205172723, 'batch_size': 1024, 'num_inducing': 1129, 'initialize_fe': True, 'minit': 'random'}. Best is trial 0 with value: 0.0006861086003482342.
INFO:root:After model training
INFO:root:15.1650390625
INFO:root:64.0
INFO:optuna.study.study:Trial 4 finished with value: 0.0017964227590709925 and parameters: {'n_max': 538, 'n_layers': 4, 'n_out': 2, 'mean_type': 'constant', 'kernel_type': 'rbf', 'lr': 0.004590773185455328, 'batch_size': 2048, 'num_inducing': 705, 'initialize_fe': False, 'minit': 'random'}. Best is trial 0 with value: 0.0006861086003482342.
INFO:root:After model training
INFO:root:2.6728515625
INFO:root:30.0
INFO:optuna.study.study:Trial 5 finished with value: 0.00047106927377171814 and parameters: {'n_max': 737, 'n_layers': 4, 'n_out': 9, 'mean_type': 'constant', 'kernel_type': 'matern0.5', 'lr': 0.011631245990104285, 'batch_size': 1024, 'num_inducing': 281, 'initialize_fe': True, 'minit': 'random'}. Best is trial 5 with value: 0.00047106927377171814.
INFO:root:After model training
INFO:root:1.88671875
INFO:root:32.0
INFO:optuna.study.study:Trial 6 finished with value: 0.0014446433633565903 and parameters: {'n_max': 328, 'n_layers': 2, 'n_out': 9, 'mean_type': 'linear', 'kernel_type': 'matern0.5', 'lr': 0.000482446965387005, 'batch_size': 1024, 'num_inducing': 537, 'initialize_fe': True, 'minit': 'random'}. Best is trial 5 with value: 0.00047106927377171814.
INFO:root:After model training
INFO:root:2.044921875
INFO:root:32.0
INFO:optuna.study.study:Trial 7 finished with value: 0.001025476143695414 and parameters: {'n_max': 784, 'n_layers': 3, 'n_out': 12, 'mean_type': 'constant', 'kernel_type': 'matern0.5', 'lr': 0.00040037537399733794, 'batch_size': 1024, 'num_inducing': 292, 'initialize_fe': True, 'minit': 'random'}. Best is trial 5 with value: 0.00047106927377171814.
INFO:root:After model training
INFO:root:23.6279296875
INFO:root:92.0
INFO:optuna.study.study:Trial 8 finished with value: 0.005443047732114792 and parameters: {'n_max': 819, 'n_layers': 4, 'n_out': 2, 'mean_type': 'linear', 'kernel_type': 'matern1.5', 'lr': 0.03119516581382092, 'batch_size': 2048, 'num_inducing': 1147, 'initialize_fe': True, 'minit': 'kmeans'}. Best is trial 5 with value: 0.00047106927377171814.
INFO:root:After model training
INFO:root:3.24462890625
INFO:root:30.0
INFO:optuna.study.study:Trial 9 finished with value: 0.00034174785832874477 and parameters: {'n_max': 1013, 'n_layers': 3, 'n_out': 15, 'mean_type': 'constant', 'kernel_type': 'matern1.5', 'lr': 0.006389924695253072, 'batch_size': 1024, 'num_inducing': 396, 'initialize_fe': False, 'minit': 'random'}. Best is trial 9 with value: 0.00034174785832874477.
INFO:root:After model training
INFO:root:0.39208984375
INFO:root:4.0
INFO:optuna.study.study:Trial 10 finished with value: 0.0004744023608509451 and parameters: {'n_max': 1006, 'n_layers': 2, 'n_out': 18, 'mean_type': 'constant', 'kernel_type': 'matern1.5', 'lr': 0.0001269684821218512, 'batch_size': 512, 'num_inducing': 93, 'initialize_fe': False, 'minit': 'random'}. Best is trial 9 with value: 0.00034174785832874477.
INFO:root:After model training
INFO:root:1.5458984375
INFO:root:28.0
INFO:optuna.study.study:Trial 11 finished with value: 0.0002558775304351002 and parameters: {'n_max': 753, 'n_layers': 3, 'n_out': 15, 'mean_type': 'constant', 'kernel_type': 'matern1.5', 'lr': 0.012405110725249701, 'batch_size': 512, 'num_inducing': 143, 'initialize_fe': False, 'minit': 'random'}. Best is trial 11 with value: 0.0002558775304351002.
INFO:root:After model training
INFO:root:0.33642578125
INFO:root:10.0
INFO:optuna.study.study:Trial 12 finished with value: 0.00027650222182273865 and parameters: {'n_max': 65, 'n_layers': 3, 'n_out': 16, 'mean_type': 'constant', 'kernel_type': 'matern1.5', 'lr': 0.016950433110216285, 'batch_size': 512, 'num_inducing': 101, 'initialize_fe': False, 'minit': 'random'}. Best is trial 11 with value: 0.0002558775304351002.
INFO:root:After model training
INFO:root:0.318359375
INFO:root:10.0
INFO:optuna.study.study:Trial 13 finished with value: 0.0006602227222174406 and parameters: {'n_max': 69, 'n_layers': 3, 'n_out': 16, 'mean_type': 'constant', 'kernel_type': 'matern1.5', 'lr': 0.02627544204652056, 'batch_size': 512, 'num_inducing': 90, 'initialize_fe': False, 'minit': 'random'}. Best is trial 11 with value: 0.0002558775304351002.
INFO:root:After model training
INFO:root:0.24267578125
INFO:root:6.0
INFO:optuna.study.study:Trial 14 finished with value: 0.0030912584625184536 and parameters: {'n_max': 80, 'n_layers': 2, 'n_out': 15, 'mean_type': 'constant', 'kernel_type': 'matern1.5', 'lr': 0.0796024193685259, 'batch_size': 512, 'num_inducing': 50, 'initialize_fe': False, 'minit': 'random'}. Best is trial 11 with value: 0.0002558775304351002.
INFO:root:After model training
INFO:root:1.32421875
INFO:root:16.0
INFO:optuna.study.study:Trial 15 finished with value: 0.00035517074866220355 and parameters: {'n_max': 659, 'n_layers': 3, 'n_out': 20, 'mean_type': 'constant', 'kernel_type': 'matern1.5', 'lr': 0.017490009742352663, 'batch_size': 512, 'num_inducing': 153, 'initialize_fe': False, 'minit': 'kmeans'}. Best is trial 11 with value: 0.0002558775304351002.
INFO:root:After model training
INFO:root:0.5537109375
INFO:root:10.0
INFO:optuna.study.study:Trial 16 finished with value: 0.0001780153252184391 and parameters: {'n_max': 222, 'n_layers': 3, 'n_out': 17, 'mean_type': 'constant', 'kernel_type': 'matern1.5', 'lr': 0.00275399605586189, 'batch_size': 512, 'num_inducing': 157, 'initialize_fe': False, 'minit': 'random'}. Best is trial 16 with value: 0.0001780153252184391.
INFO:root:After model training
INFO:root:0.48876953125
INFO:root:10.0
INFO:optuna.study.study:Trial 17 finished with value: 0.00014549537445418537 and parameters: {'n_max': 194, 'n_layers': 2, 'n_out': 13, 'mean_type': 'constant', 'kernel_type': 'matern1.5', 'lr': 0.0031280405917187394, 'batch_size': 512, 'num_inducing': 172, 'initialize_fe': False, 'minit': 'random'}. Best is trial 17 with value: 0.00014549537445418537.
INFO:root:After model training
INFO:root:0.54638671875
INFO:root:10.0
INFO:optuna.study.study:Trial 18 finished with value: 0.0001758269063429907 and parameters: {'n_max': 219, 'n_layers': 2, 'n_out': 13, 'mean_type': 'linear', 'kernel_type': 'matern1.5', 'lr': 0.0020237326618101955, 'batch_size': 512, 'num_inducing': 194, 'initialize_fe': False, 'minit': 'kmeans'}. Best is trial 17 with value: 0.00014549537445418537.
INFO:root:After model training
INFO:root:0.5830078125
INFO:root:12.0
INFO:optuna.study.study:Trial 19 finished with value: 0.0023479112423956394 and parameters: {'n_max': 216, 'n_layers': 2, 'n_out': 10, 'mean_type': 'linear', 'kernel_type': 'matern1.5', 'lr': 0.000744983718830508, 'batch_size': 512, 'num_inducing': 209, 'initialize_fe': False, 'minit': 'kmeans'}. Best is trial 17 with value: 0.00014549537445418537.
INFO:root:After model training
INFO:root:0.2548828125
INFO:root:6.0
