INFO:optuna.study.study:Trial 10 finished with value: 0.07532937824726105 and parameters: {'n_max': 1017, 'n_layers': 5, 'n_out': 12, 'mean_type': 'constant', 'kernel_type': 'matern1.5', 'lr': 0.09423277019519437, 'batch_size': 1024, 'num_inducing': 1956, 'initialize_fe': True, 'minit': 'random'}. Best is trial 0 with value: 0.07499805092811584.
INFO:root:After model training
INFO:root:167.3505859375
INFO:root:254.0
INFO:optuna.study.study:Trial 11 finished with value: 0.06972867995500565 and parameters: {'n_max': 1010, 'n_layers': 5, 'n_out': 13, 'mean_type': 'constant', 'kernel_type': 'matern1.5', 'lr': 0.07587560031564006, 'batch_size': 1024, 'num_inducing': 1944, 'initialize_fe': True, 'minit': 'random'}. Best is trial 11 with value: 0.06972867995500565.
INFO:root:After model training
INFO:root:164.66064453125
INFO:root:192.0
INFO:optuna.study.study:Trial 12 finished with value: 0.08028282225131989 and parameters: {'n_max': 1013, 'n_layers': 5, 'n_out': 16, 'mean_type': 'constant', 'kernel_type': 'matern1.5', 'lr': 0.011167680694312006, 'batch_size': 1024, 'num_inducing': 1740, 'initialize_fe': True, 'minit': 'random'}. Best is trial 11 with value: 0.06972867995500565.
INFO:root:After model training
INFO:root:148.78466796875
INFO:root:180.0
INFO:optuna.study.study:Trial 13 finished with value: 0.09679438918828964 and parameters: {'n_max': 323, 'n_layers': 4, 'n_out': 9, 'mean_type': 'constant', 'kernel_type': 'matern1.5', 'lr': 0.010251060351613921, 'batch_size': 1024, 'num_inducing': 842, 'initialize_fe': True, 'minit': 'random'}. Best is trial 11 with value: 0.06972867995500565.
INFO:root:After model training
INFO:root:153.16748046875
INFO:root:182.0
INFO:optuna.study.study:Trial 14 finished with value: 0.07266625016927719 and parameters: {'n_max': 641, 'n_layers': 5, 'n_out': 15, 'mean_type': 'constant', 'kernel_type': 'rbf', 'lr': 0.09335277528938805, 'batch_size': 1024, 'num_inducing': 1141, 'initialize_fe': True, 'minit': 'random'}. Best is trial 11 with value: 0.06972867995500565.
INFO:root:After model training
INFO:root:148.3876953125
INFO:root:184.0
INFO:optuna.study.study:Trial 15 finished with value: 0.0680578202009201 and parameters: {'n_max': 672, 'n_layers': 5, 'n_out': 15, 'mean_type': 'constant', 'kernel_type': 'rbf', 'lr': 0.09662013863684665, 'batch_size': 1024, 'num_inducing': 213, 'initialize_fe': True, 'minit': 'random'}. Best is trial 15 with value: 0.0680578202009201.
INFO:root:After model training
INFO:root:152.2841796875
INFO:root:184.0
INFO:optuna.study.study:Trial 16 finished with value: 0.07845276594161987 and parameters: {'n_max': 394, 'n_layers': 5, 'n_out': 15, 'mean_type': 'constant', 'kernel_type': 'matern1.5', 'lr': 0.040096284540943786, 'batch_size': 2048, 'num_inducing': 165, 'initialize_fe': True, 'minit': 'random'}. Best is trial 15 with value: 0.0680578202009201.
INFO:root:After model training
INFO:root:148.79150390625
INFO:root:190.0
INFO:optuna.study.study:Trial 17 finished with value: 0.1080598384141922 and parameters: {'n_max': 720, 'n_layers': 5, 'n_out': 17, 'mean_type': 'constant', 'kernel_type': 'matern1.5', 'lr': 0.0011900499798478182, 'batch_size': 1024, 'num_inducing': 250, 'initialize_fe': True, 'minit': 'random'}. Best is trial 15 with value: 0.0680578202009201.
INFO:root:After model training
INFO:root:149.076171875
INFO:root:178.0
INFO:optuna.study.study:Trial 18 finished with value: 0.08026888966560364 and parameters: {'n_max': 858, 'n_layers': 4, 'n_out': 13, 'mean_type': 'constant', 'kernel_type': 'rbf', 'lr': 0.051774362058329325, 'batch_size': 1024, 'num_inducing': 430, 'initialize_fe': True, 'minit': 'random'}. Best is trial 15 with value: 0.0680578202009201.
INFO:root:After model training
INFO:root:151.8466796875
INFO:root:184.0
INFO:optuna.study.study:Trial 19 finished with value: 0.0722586065530777 and parameters: {'n_max': 403, 'n_layers': 5, 'n_out': 10, 'mean_type': 'constant', 'kernel_type': 'matern1.5', 'lr': 0.017458865875540002, 'batch_size': 2048, 'num_inducing': 119, 'initialize_fe': True, 'minit': 'random'}. Best is trial 15 with value: 0.0680578202009201.
INFO:root:After model training
INFO:root:146.95654296875
INFO:root:182.0
INFO:optuna.study.study:Trial 20 finished with value: 0.10251951217651367 and parameters: {'n_max': 661, 'n_layers': 4, 'n_out': 18, 'mean_type': 'constant', 'kernel_type': 'rbf', 'lr': 0.004822369381373266, 'batch_size': 1024, 'num_inducing': 288, 'initialize_fe': True, 'minit': 'random'}. Best is trial 15 with value: 0.0680578202009201.
INFO:root:After model training
INFO:root:152.10107421875
INFO:root:184.0
INFO:optuna.study.study:Trial 21 finished with value: 0.07364723086357117 and parameters: {'n_max': 399, 'n_layers': 5, 'n_out': 10, 'mean_type': 'constant', 'kernel_type': 'matern1.5', 'lr': 0.01956988067714173, 'batch_size': 2048, 'num_inducing': 146, 'initialize_fe': True, 'minit': 'random'}. Best is trial 15 with value: 0.0680578202009201.
INFO:root:After model training
INFO:root:151.55029296875
INFO:root:180.0
INFO:optuna.study.study:Trial 22 finished with value: 0.06894819438457489 and parameters: {'n_max': 275, 'n_layers': 5, 'n_out': 14, 'mean_type': 'constant', 'kernel_type': 'matern1.5', 'lr': 0.06283413483765458, 'batch_size': 2048, 'num_inducing': 131, 'initialize_fe': True, 'minit': 'random'}. Best is trial 15 with value: 0.0680578202009201.
INFO:root:After model training
INFO:root:153.27197265625
INFO:root:192.0
INFO:optuna.study.study:Trial 23 finished with value: 0.07210972905158997 and parameters: {'n_max': 330, 'n_layers': 5, 'n_out': 13, 'mean_type': 'constant', 'kernel_type': 'matern1.5', 'lr': 0.0627921362423899, 'batch_size': 2048, 'num_inducing': 230, 'initialize_fe': True, 'minit': 'random'}. Best is trial 15 with value: 0.0680578202009201.
INFO:root:After model training
INFO:root:157.30126953125
INFO:root:216.0
INFO:optuna.study.study:Trial 24 finished with value: 0.07446534186601639 and parameters: {'n_max': 75, 'n_layers': 5, 'n_out': 14, 'mean_type': 'constant', 'kernel_type': 'matern1.5', 'lr': 0.05741781282771749, 'batch_size': 2048, 'num_inducing': 644, 'initialize_fe': True, 'minit': 'random'}. Best is trial 15 with value: 0.0680578202009201.
INFO:root:After model training
INFO:root:151.2451171875
INFO:root:182.0
INFO:optuna.study.study:Trial 25 finished with value: 0.07753092795610428 and parameters: {'n_max': 237, 'n_layers': 4, 'n_out': 17, 'mean_type': 'constant', 'kernel_type': 'matern1.5', 'lr': 0.0863261683037856, 'batch_size': 2048, 'num_inducing': 118, 'initialize_fe': True, 'minit': 'random'}. Best is trial 15 with value: 0.0680578202009201.
INFO:root:After model training
INFO:root:146.9833984375
INFO:root:184.0
INFO:optuna.study.study:Trial 26 finished with value: 0.0798853188753128 and parameters: {'n_max': 501, 'n_layers': 5, 'n_out': 15, 'mean_type': 'constant', 'kernel_type': 'rbf', 'lr': 0.0058255272558272245, 'batch_size': 1024, 'num_inducing': 377, 'initialize_fe': True, 'minit': 'random'}. Best is trial 15 with value: 0.0680578202009201.
INFO:root:After model training
INFO:root:148.33544921875
INFO:root:182.0
INFO:optuna.study.study:Trial 27 finished with value: 0.07864292711019516 and parameters: {'n_max': 944, 'n_layers': 4, 'n_out': 11, 'mean_type': 'constant', 'kernel_type': 'matern1.5', 'lr': 0.02407584804701755, 'batch_size': 512, 'num_inducing': 176, 'initialize_fe': True, 'minit': 'kmeans'}. Best is trial 15 with value: 0.0680578202009201.
INFO:root:After model training
INFO:root:148.7001953125
INFO:root:182.0
INFO:optuna.study.study:Trial 28 finished with value: 0.07248969376087189 and parameters: {'n_max': 798, 'n_layers': 5, 'n_out': 13, 'mean_type': 'constant', 'kernel_type': 'matern1.5', 'lr': 0.04549059734381907, 'batch_size': 1024, 'num_inducing': 128, 'initialize_fe': True, 'minit': 'random'}. Best is trial 15 with value: 0.0680578202009201.
INFO:root:After model training
INFO:root:156.884765625
INFO:root:210.0
INFO:optuna.study.study:Trial 29 finished with value: 0.07632634788751602 and parameters: {'n_max': 456, 'n_layers': 4, 'n_out': 17, 'mean_type': 'constant', 'kernel_type': 'rbf', 'lr': 0.014148987894037332, 'batch_size': 2048, 'num_inducing': 561, 'initialize_fe': True, 'minit': 'random'}. Best is trial 15 with value: 0.0680578202009201.
INFO:root:After model training
INFO:root:145.32421875
INFO:root:180.0
INFO:optuna.study.study:Trial 30 finished with value: 0.08344701677560806 and parameters: {'n_max': 256, 'n_layers': 3, 'n_out': 11, 'mean_type': 'constant', 'kernel_type': 'rbf', 'lr': 0.007133491798184884, 'batch_size': 1024, 'num_inducing': 215, 'initialize_fe': True, 'minit': 'random'}. Best is trial 15 with value: 0.0680578202009201.
INFO:root:After model training
INFO:root:153.04345703125
INFO:root:180.0
INFO:optuna.study.study:Trial 31 finished with value: 0.07150334119796753 and parameters: {'n_max': 267, 'n_layers': 5, 'n_out': 13, 'mean_type': 'constant', 'kernel_type': 'matern1.5', 'lr': 0.06071667512796528, 'batch_size': 2048, 'num_inducing': 262, 'initialize_fe': True, 'minit': 'random'}. Best is trial 15 with value: 0.0680578202009201.
INFO:root:After model training
INFO:root:153.09228515625
INFO:root:194.0
INFO:optuna.study.study:Trial 32 finished with value: 0.07331372052431107 and parameters: {'n_max': 250, 'n_layers': 5, 'n_out': 14, 'mean_type': 'constant', 'kernel_type': 'matern1.5', 'lr': 0.06630594737150344, 'batch_size': 2048, 'num_inducing': 284, 'initialize_fe': True, 'minit': 'random'}. Best is trial 15 with value: 0.0680578202009201.
INFO:root:After model training
INFO:root:154.4501953125
INFO:root:192.0
INFO:optuna.study.study:Trial 33 finished with value: 0.07294461131095886 and parameters: {'n_max': 181, 'n_layers': 5, 'n_out': 14, 'mean_type': 'constant', 'kernel_type': 'matern1.5', 'lr': 0.03377292010949681, 'batch_size': 2048, 'num_inducing': 332, 'initialize_fe': True, 'minit': 'random'}. Best is trial 15 with value: 0.0680578202009201.
INFO:root:After model training
INFO:root:156.01953125
INFO:root:198.0
INFO:optuna.study.study:Trial 34 finished with value: 0.14659523963928223 and parameters: {'n_max': 343, 'n_layers': 5, 'n_out': 16, 'mean_type': 'linear', 'kernel_type': 'matern1.5', 'lr': 0.09817492702998935, 'batch_size': 2048, 'num_inducing': 476, 'initialize_fe': True, 'minit': 'random'}. Best is trial 15 with value: 0.0680578202009201.
INFO:root:After model training
INFO:root:152.1767578125
INFO:root:200.0
INFO:optuna.study.study:Trial 35 finished with value: 0.07128306478261948 and parameters: {'n_max': 613, 'n_layers': 4, 'n_out': 12, 'mean_type': 'constant', 'kernel_type': 'rbf', 'lr': 0.05144322073847764, 'batch_size': 2048, 'num_inducing': 100, 'initialize_fe': True, 'minit': 'random'}. Best is trial 15 with value: 0.0680578202009201.
INFO:root:After model training
INFO:root:146.26513671875
INFO:root:180.0
INFO:optuna.study.study:Trial 36 finished with value: 0.11659768223762512 and parameters: {'n_max': 622, 'n_layers': 4, 'n_out': 8, 'mean_type': 'linear', 'kernel_type': 'rbf', 'lr': 0.0007731531324810666, 'batch_size': 512, 'num_inducing': 100, 'initialize_fe': True, 'minit': 'kmeans'}. Best is trial 15 with value: 0.0680578202009201.
INFO:root:After model training
INFO:root:145.32763671875
INFO:root:178.0
INFO:optuna.study.study:Trial 37 finished with value: 0.08349095284938812 and parameters: {'n_max': 484, 'n_layers': 3, 'n_out': 10, 'mean_type': 'constant', 'kernel_type': 'rbf', 'lr': 0.03485597356566393, 'batch_size': 1024, 'num_inducing': 64, 'initialize_fe': False, 'minit': 'random'}. Best is trial 15 with value: 0.0680578202009201.
INFO:root:After model training
INFO:root:152.48828125
INFO:root:200.0
INFO:optuna.study.study:Trial 38 finished with value: 0.14281481504440308 and parameters: {'n_max': 693, 'n_layers': 4, 'n_out': 12, 'mean_type': 'linear', 'kernel_type': 'rbf', 'lr': 0.023367327103491556, 'batch_size': 2048, 'num_inducing': 95, 'initialize_fe': False, 'minit': 'kmeans'}. Best is trial 15 with value: 0.0680578202009201.
INFO:root:After model training
INFO:root:145.52392578125
INFO:root:180.0
INFO:optuna.study.study:Trial 39 finished with value: 0.07342596352100372 and parameters: {'n_max': 576, 'n_layers': 3, 'n_out': 19, 'mean_type': 'constant', 'kernel_type': 'matern0.5', 'lr': 0.003066121338353593, 'batch_size': 512, 'num_inducing': 53, 'initialize_fe': True, 'minit': 'random'}. Best is trial 15 with value: 0.0680578202009201.
INFO:root:After model training
INFO:root:148.103515625
INFO:root:180.0
INFO:optuna.study.study:Trial 40 finished with value: 0.12661992013454437 and parameters: {'n_max': 930, 'n_layers': 4, 'n_out': 7, 'mean_type': 'linear', 'kernel_type': 'rbf', 'lr': 0.043435531230688725, 'batch_size': 1024, 'num_inducing': 82, 'initialize_fe': False, 'minit': 'kmeans'}. Best is trial 15 with value: 0.0680578202009201.
INFO:root:After model training
INFO:root:156.35009765625
INFO:root:186.0
INFO:optuna.study.study:Trial 41 finished with value: 0.07341340184211731 and parameters: {'n_max': 789, 'n_layers': 5, 'n_out': 2, 'mean_type': 'constant', 'kernel_type': 'matern0.5', 'lr': 0.062230009894774535, 'batch_size': 2048, 'num_inducing': 185, 'initialize_fe': True, 'minit': 'random'}. Best is trial 15 with value: 0.0680578202009201.
INFO:root:After model training
INFO:root:155.248046875
INFO:root:198.0
INFO:optuna.study.study:Trial 42 finished with value: 0.06866351515054703 and parameters: {'n_max': 855, 'n_layers': 5, 'n_out': 12, 'mean_type': 'constant', 'kernel_type': 'rbf', 'lr': 0.0741535493027314, 'batch_size': 2048, 'num_inducing': 149, 'initialize_fe': True, 'minit': 'random'}. Best is trial 15 with value: 0.0680578202009201.
INFO:root:After model training
INFO:root:155.18603515625
INFO:root:198.0
INFO:optuna.study.study:Trial 43 finished with value: 0.06729082763195038 and parameters: {'n_max': 846, 'n_layers': 5, 'n_out': 12, 'mean_type': 'constant', 'kernel_type': 'rbf', 'lr': 0.07750176008866504, 'batch_size': 2048, 'num_inducing': 146, 'initialize_fe': True, 'minit': 'random'}. Best is trial 43 with value: 0.06729082763195038.
INFO:root:After model training
INFO:root:156.029296875
INFO:root:196.0
INFO:optuna.study.study:Trial 44 finished with value: 0.07005482912063599 and parameters: {'n_max': 970, 'n_layers': 5, 'n_out': 14, 'mean_type': 'constant', 'kernel_type': 'rbf', 'lr': 0.028952394624125077, 'batch_size': 2048, 'num_inducing': 159, 'initialize_fe': True, 'minit': 'random'}. Best is trial 43 with value: 0.06729082763195038.
INFO:root:After model training
INFO:root:155.115234375
INFO:root:198.0
INFO:optuna.study.study:Trial 45 finished with value: 0.0675370991230011 and parameters: {'n_max': 841, 'n_layers': 5, 'n_out': 11, 'mean_type': 'constant', 'kernel_type': 'rbf', 'lr': 0.07555517856466107, 'batch_size': 2048, 'num_inducing': 141, 'initialize_fe': True, 'minit': 'random'}. Best is trial 43 with value: 0.06729082763195038.
INFO:root:After model training
INFO:root:155.22265625
INFO:root:198.0
INFO:optuna.study.study:Trial 46 finished with value: 0.06830497086048126 and parameters: {'n_max': 864, 'n_layers': 5, 'n_out': 9, 'mean_type': 'constant', 'kernel_type': 'rbf', 'lr': 0.07481918747571822, 'batch_size': 2048, 'num_inducing': 145, 'initialize_fe': True, 'minit': 'random'}. Best is trial 43 with value: 0.06729082763195038.
INFO:root:After model training
INFO:root:155.9130859375
INFO:root:182.0
INFO:optuna.study.study:Trial 47 finished with value: 0.07251908630132675 and parameters: {'n_max': 870, 'n_layers': 5, 'n_out': 9, 'mean_type': 'constant', 'kernel_type': 'rbf', 'lr': 0.0981738411942299, 'batch_size': 2048, 'num_inducing': 210, 'initialize_fe': False, 'minit': 'random'}. Best is trial 43 with value: 0.06729082763195038.
INFO:root:After model training
INFO:root:155.05029296875
INFO:root:184.0
INFO:optuna.study.study:Trial 48 finished with value: 0.07366744428873062 and parameters: {'n_max': 826, 'n_layers': 5, 'n_out': 9, 'mean_type': 'constant', 'kernel_type': 'rbf', 'lr': 0.04069443700419615, 'batch_size': 2048, 'num_inducing': 140, 'initialize_fe': True, 'minit': 'random'}. Best is trial 43 with value: 0.06729082763195038.
INFO:root:After model training
INFO:root:154.546875
INFO:root:202.0
INFO:optuna.study.study:Trial 49 finished with value: 0.28840744495391846 and parameters: {'n_max': 759, 'n_layers': 5, 'n_out': 7, 'mean_type': 'linear', 'kernel_type': 'rbf', 'lr': 0.0002189906270857697, 'batch_size': 2048, 'num_inducing': 111, 'initialize_fe': True, 'minit': 'kmeans'}. Best is trial 43 with value: 0.06729082763195038.
INFO:root:After model training
INFO:root:155.71923828125
INFO:root:182.0
INFO:optuna.study.study:Trial 50 finished with value: 0.06974747031927109 and parameters: {'n_max': 884, 'n_layers': 5, 'n_out': 11, 'mean_type': 'constant', 'kernel_type': 'rbf', 'lr': 0.07677273985693496, 'batch_size': 2048, 'num_inducing': 186, 'initialize_fe': True, 'minit': 'random'}. Best is trial 43 with value: 0.06729082763195038.
INFO:root:After model training
INFO:root:155.01611328125
INFO:root:198.0
INFO:optuna.study.study:Trial 51 finished with value: 0.0700150802731514 and parameters: {'n_max': 812, 'n_layers': 5, 'n_out': 12, 'mean_type': 'constant', 'kernel_type': 'rbf', 'lr': 0.04786636387380176, 'batch_size': 2048, 'num_inducing': 140, 'initialize_fe': True, 'minit': 'random'}. Best is trial 43 with value: 0.06729082763195038.
INFO:root:After model training
INFO:root:155.26904296875
INFO:root:196.0
INFO:optuna.study.study:Trial 52 finished with value: 0.07054733484983444 and parameters: {'n_max': 834, 'n_layers': 5, 'n_out': 10, 'mean_type': 'constant', 'kernel_type': 'rbf', 'lr': 0.06971873567194252, 'batch_size': 2048, 'num_inducing': 159, 'initialize_fe': True, 'minit': 'random'}. Best is trial 43 with value: 0.06729082763195038.
INFO:root:After model training
INFO:root:155.318359375
INFO:root:198.0
INFO:optuna.study.study:Trial 53 finished with value: 0.06828437745571136 and parameters: {'n_max': 913, 'n_layers': 5, 'n_out': 16, 'mean_type': 'constant', 'kernel_type': 'rbf', 'lr': 0.07545140933523825, 'batch_size': 2048, 'num_inducing': 129, 'initialize_fe': True, 'minit': 'random'}. Best is trial 43 with value: 0.06729082763195038.
INFO:root:After model training
INFO:root:156.04443359375
INFO:root:180.0
INFO:optuna.study.study:Trial 54 finished with value: 0.07357147336006165 and parameters: {'n_max': 901, 'n_layers': 5, 'n_out': 16, 'mean_type': 'constant', 'kernel_type': 'rbf', 'lr': 0.03072971975123054, 'batch_size': 2048, 'num_inducing': 107, 'initialize_fe': True, 'minit': 'random'}. Best is trial 43 with value: 0.06729082763195038.
INFO:root:After model training
INFO:root:149.50146484375
INFO:root:178.0
INFO:optuna.study.study:Trial 55 finished with value: 0.09232477843761444 and parameters: {'n_max': 971, 'n_layers': 5, 'n_out': 18, 'mean_type': 'constant', 'kernel_type': 'rbf', 'lr': 0.08001169590413276, 'batch_size': 512, 'num_inducing': 82, 'initialize_fe': True, 'minit': 'random'}. Best is trial 43 with value: 0.06729082763195038.
INFO:root:After model training
INFO:root:152.35888671875
INFO:root:176.0
INFO:optuna.study.study:Trial 56 finished with value: 0.08495788276195526 and parameters: {'n_max': 759, 'n_layers': 2, 'n_out': 8, 'mean_type': 'constant', 'kernel_type': 'rbf', 'lr': 0.0005016877971271933, 'batch_size': 2048, 'num_inducing': 236, 'initialize_fe': True, 'minit': 'random'}. Best is trial 43 with value: 0.06729082763195038.
INFO:root:After model training
INFO:root:154.05712890625
INFO:root:200.0
INFO:optuna.study.study:Trial 57 finished with value: 0.06930381059646606 and parameters: {'n_max': 716, 'n_layers': 5, 'n_out': 20, 'mean_type': 'constant', 'kernel_type': 'rbf', 'lr': 0.01687051852327148, 'batch_size': 2048, 'num_inducing': 68, 'initialize_fe': True, 'minit': 'random'}. Best is trial 43 with value: 0.06729082763195038.
INFO:root:After model training
INFO:root:155.59716796875
INFO:root:196.0
INFO:optuna.study.study:Trial 58 finished with value: 0.07238857448101044 and parameters: {'n_max': 919, 'n_layers': 5, 'n_out': 15, 'mean_type': 'constant', 'kernel_type': 'rbf', 'lr': 0.03787412574256957, 'batch_size': 2048, 'num_inducing': 155, 'initialize_fe': False, 'minit': 'random'}. Best is trial 43 with value: 0.06729082763195038.
INFO:root:After model training
INFO:root:157.34375
INFO:root:202.0
INFO:optuna.study.study:Trial 59 finished with value: 0.08443647623062134 and parameters: {'n_max': 973, 'n_layers': 5, 'n_out': 5, 'mean_type': 'constant', 'kernel_type': 'matern0.5', 'lr': 0.0022404072109175567, 'batch_size': 2048, 'num_inducing': 200, 'initialize_fe': True, 'minit': 'random'}. Best is trial 43 with value: 0.06729082763195038.
INFO:root:After model training
INFO:root:155.00146484375
INFO:root:200.0
INFO:optuna.study.study:Trial 60 finished with value: 0.07484106719493866 and parameters: {'n_max': 858, 'n_layers': 5, 'n_out': 11, 'mean_type': 'constant', 'kernel_type': 'rbf', 'lr': 0.0979762570589754, 'batch_size': 2048, 'num_inducing': 124, 'initialize_fe': True, 'minit': 'random'}. Best is trial 43 with value: 0.06729082763195038.
INFO:root:After model training
INFO:root:154.82568359375
INFO:root:200.0
INFO:optuna.study.study:Trial 61 finished with value: 0.06969677656888962 and parameters: {'n_max': 763, 'n_layers': 5, 'n_out': 12, 'mean_type': 'constant', 'kernel_type': 'rbf', 'lr': 0.06913063259593545, 'batch_size': 2048, 'num_inducing': 136, 'initialize_fe': True, 'minit': 'random'}. Best is trial 43 with value: 0.06729082763195038.
INFO:root:After model training
INFO:root:154.7021484375
INFO:root:200.0
INFO:optuna.study.study:Trial 62 finished with value: 0.07135798037052155 and parameters: {'n_max': 673, 'n_layers': 5, 'n_out': 15, 'mean_type': 'constant', 'kernel_type': 'rbf', 'lr': 0.049102322251165995, 'batch_size': 2048, 'num_inducing': 164, 'initialize_fe': True, 'minit': 'random'}. Best is trial 43 with value: 0.06729082763195038.
INFO:root:After model training
INFO:root:154.93408203125
INFO:root:200.0
