INFO:optuna.study.study:Trial 28 finished with value: 0.00017770679551176727 and parameters: {'n_max': 695, 'n_layers': 2, 'n_out': 12, 'mean_type': 'linear', 'kernel_type': 'rbf', 'lr': 0.0005887702823798105, 'batch_size': 512, 'num_inducing': 434, 'initialize_fe': True, 'minit': 'random'}. Best is trial 22 with value: 0.00010434334399178624.
INFO:root:After model training
INFO:root:44.6845703125
INFO:root:112.0
INFO:optuna.study.study:Trial 29 finished with value: 0.017641764134168625 and parameters: {'n_max': 448, 'n_layers': 2, 'n_out': 17, 'mean_type': 'linear', 'kernel_type': 'matern1.5', 'lr': 0.002088738448707165, 'batch_size': 2048, 'num_inducing': 732, 'initialize_fe': True, 'minit': 'kmeans'}. Best is trial 22 with value: 0.00010434334399178624.
INFO:root:After model training
INFO:root:36.80712890625
INFO:root:68.0
INFO:optuna.study.study:Trial 30 finished with value: 0.0014698505401611328 and parameters: {'n_max': 978, 'n_layers': 3, 'n_out': 2, 'mean_type': 'linear', 'kernel_type': 'rbf', 'lr': 0.01406899466119353, 'batch_size': 1024, 'num_inducing': 901, 'initialize_fe': True, 'minit': 'random'}. Best is trial 22 with value: 0.00010434334399178624.
INFO:root:After model training
INFO:root:33.50244140625
INFO:root:70.0
INFO:optuna.study.study:Trial 31 finished with value: 0.00020336448505986482 and parameters: {'n_max': 64, 'n_layers': 2, 'n_out': 14, 'mean_type': 'linear', 'kernel_type': 'matern1.5', 'lr': 0.00017114172294029742, 'batch_size': 512, 'num_inducing': 729, 'initialize_fe': True, 'minit': 'random'}. Best is trial 22 with value: 0.00010434334399178624.
INFO:root:After model training
INFO:root:31.21728515625
INFO:root:72.0
INFO:optuna.study.study:Trial 32 finished with value: 0.00037858617724850774 and parameters: {'n_max': 133, 'n_layers': 2, 'n_out': 16, 'mean_type': 'linear', 'kernel_type': 'matern1.5', 'lr': 0.00031025703935191895, 'batch_size': 512, 'num_inducing': 465, 'initialize_fe': True, 'minit': 'random'}. Best is trial 22 with value: 0.00010434334399178624.
INFO:root:After model training
INFO:root:30.7314453125
INFO:root:74.0
INFO:optuna.study.study:Trial 33 finished with value: 0.0002459969837218523 and parameters: {'n_max': 319, 'n_layers': 2, 'n_out': 14, 'mean_type': 'linear', 'kernel_type': 'matern1.5', 'lr': 0.00014686952001599223, 'batch_size': 512, 'num_inducing': 347, 'initialize_fe': True, 'minit': 'random'}. Best is trial 22 with value: 0.00010434334399178624.
INFO:root:After model training
INFO:root:38.2412109375
INFO:root:86.0
INFO:optuna.study.study:Trial 34 finished with value: 0.02594311162829399 and parameters: {'n_max': 136, 'n_layers': 5, 'n_out': 12, 'mean_type': 'linear', 'kernel_type': 'matern0.5', 'lr': 0.06642084762926923, 'batch_size': 2048, 'num_inducing': 281, 'initialize_fe': True, 'minit': 'random'}. Best is trial 22 with value: 0.00010434334399178624.
INFO:root:After model training
INFO:root:30.9560546875
INFO:root:70.0
INFO:optuna.study.study:Trial 35 finished with value: 0.0002465775469318032 and parameters: {'n_max': 239, 'n_layers': 2, 'n_out': 18, 'mean_type': 'constant', 'kernel_type': 'matern1.5', 'lr': 0.000270393375608011, 'batch_size': 512, 'num_inducing': 404, 'initialize_fe': True, 'minit': 'random'}. Best is trial 22 with value: 0.00010434334399178624.
INFO:root:After model training
INFO:root:33.630859375
INFO:root:74.0
INFO:optuna.study.study:Trial 36 finished with value: 0.00021733500761911273 and parameters: {'n_max': 107, 'n_layers': 2, 'n_out': 16, 'mean_type': 'linear', 'kernel_type': 'matern1.5', 'lr': 0.00014489095755636252, 'batch_size': 512, 'num_inducing': 841, 'initialize_fe': True, 'minit': 'kmeans'}. Best is trial 22 with value: 0.00010434334399178624.
INFO:root:After model training
INFO:root:42.98974609375
INFO:root:116.0
INFO:optuna.study.study:Trial 37 finished with value: 0.010054735466837883 and parameters: {'n_max': 427, 'n_layers': 3, 'n_out': 10, 'mean_type': 'linear', 'kernel_type': 'matern1.5', 'lr': 0.03679469089606517, 'batch_size': 2048, 'num_inducing': 520, 'initialize_fe': False, 'minit': 'random'}. Best is trial 22 with value: 0.00010434334399178624.
INFO:root:After model training
INFO:root:30.666015625
INFO:root:70.0
INFO:optuna.study.study:Trial 38 finished with value: 0.00030964799225330353 and parameters: {'n_max': 65, 'n_layers': 4, 'n_out': 18, 'mean_type': 'constant', 'kernel_type': 'matern0.5', 'lr': 0.0005080572979389566, 'batch_size': 512, 'num_inducing': 329, 'initialize_fe': True, 'minit': 'random'}. Best is trial 22 with value: 0.00010434334399178624.
INFO:root:After model training
INFO:root:30.27587890625
INFO:root:72.0
INFO:optuna.study.study:Trial 39 finished with value: 0.004006119444966316 and parameters: {'n_max': 176, 'n_layers': 5, 'n_out': 11, 'mean_type': 'linear', 'kernel_type': 'matern1.5', 'lr': 0.0007751103130668704, 'batch_size': 512, 'num_inducing': 147, 'initialize_fe': False, 'minit': 'kmeans'}. Best is trial 22 with value: 0.00010434334399178624.
INFO:root:After model training
INFO:root:35.68408203125
INFO:root:68.0
INFO:optuna.study.study:Trial 40 finished with value: 0.0009113410487771034 and parameters: {'n_max': 537, 'n_layers': 2, 'n_out': 14, 'mean_type': 'constant', 'kernel_type': 'rbf', 'lr': 0.0001047757557534133, 'batch_size': 1024, 'num_inducing': 1094, 'initialize_fe': True, 'minit': 'random'}. Best is trial 22 with value: 0.00010434334399178624.
INFO:root:After model training
INFO:root:32.06201171875
INFO:root:70.0
INFO:optuna.study.study:Trial 41 finished with value: 0.00014601902512367815 and parameters: {'n_max': 190, 'n_layers': 2, 'n_out': 15, 'mean_type': 'linear', 'kernel_type': 'matern1.5', 'lr': 0.00036947687638332353, 'batch_size': 512, 'num_inducing': 580, 'initialize_fe': True, 'minit': 'random'}. Best is trial 22 with value: 0.00010434334399178624.
INFO:root:After model training
INFO:root:32.10009765625
INFO:root:68.0
INFO:optuna.study.study:Trial 42 finished with value: 0.00023611591313965619 and parameters: {'n_max': 174, 'n_layers': 2, 'n_out': 15, 'mean_type': 'linear', 'kernel_type': 'matern1.5', 'lr': 0.0001599217073618847, 'batch_size': 512, 'num_inducing': 568, 'initialize_fe': True, 'minit': 'random'}. Best is trial 22 with value: 0.00010434334399178624.
INFO:root:After model training
INFO:root:30.98486328125
INFO:root:70.0
INFO:optuna.study.study:Trial 43 finished with value: 0.0004622379783540964 and parameters: {'n_max': 281, 'n_layers': 2, 'n_out': 17, 'mean_type': 'linear', 'kernel_type': 'matern1.5', 'lr': 0.0003346896758373609, 'batch_size': 512, 'num_inducing': 410, 'initialize_fe': True, 'minit': 'random'}. Best is trial 22 with value: 0.00010434334399178624.
INFO:root:After model training
INFO:root:37.580078125
INFO:root:70.0
INFO:optuna.study.study:Trial 44 finished with value: 0.0004514697939157486 and parameters: {'n_max': 110, 'n_layers': 2, 'n_out': 13, 'mean_type': 'linear', 'kernel_type': 'matern1.5', 'lr': 0.0002460857369172222, 'batch_size': 512, 'num_inducing': 1283, 'initialize_fe': False, 'minit': 'random'}. Best is trial 22 with value: 0.00010434334399178624.
INFO:root:After model training
INFO:root:42.49365234375
INFO:root:100.0
INFO:optuna.study.study:Trial 45 finished with value: 0.0005892640328966081 and parameters: {'n_max': 195, 'n_layers': 3, 'n_out': 15, 'mean_type': 'linear', 'kernel_type': 'matern1.5', 'lr': 0.00013997931021248895, 'batch_size': 2048, 'num_inducing': 648, 'initialize_fe': True, 'minit': 'kmeans'}. Best is trial 22 with value: 0.00010434334399178624.
INFO:root:After model training
INFO:root:32.2626953125
INFO:root:74.0
INFO:optuna.study.study:Trial 46 finished with value: 0.00025707745226100087 and parameters: {'n_max': 109, 'n_layers': 2, 'n_out': 19, 'mean_type': 'constant', 'kernel_type': 'matern1.5', 'lr': 0.00039497168307296433, 'batch_size': 512, 'num_inducing': 513, 'initialize_fe': True, 'minit': 'random'}. Best is trial 22 with value: 0.00010434334399178624.
INFO:root:After model training
INFO:root:30.35595703125
INFO:root:72.0
INFO:optuna.study.study:Trial 47 finished with value: 0.0005354968598112464 and parameters: {'n_max': 327, 'n_layers': 2, 'n_out': 12, 'mean_type': 'linear', 'kernel_type': 'matern0.5', 'lr': 0.00012362529888218287, 'batch_size': 512, 'num_inducing': 235, 'initialize_fe': False, 'minit': 'random'}. Best is trial 22 with value: 0.00010434334399178624.
INFO:root:After model training
INFO:root:41.310546875
INFO:root:70.0
INFO:optuna.study.study:Trial 48 finished with value: 0.00011238650040468201 and parameters: {'n_max': 254, 'n_layers': 2, 'n_out': 16, 'mean_type': 'linear', 'kernel_type': 'matern1.5', 'lr': 0.0006894542478621741, 'batch_size': 512, 'num_inducing': 1591, 'initialize_fe': True, 'minit': 'random'}. Best is trial 22 with value: 0.00010434334399178624.
INFO:root:After model training
INFO:root:44.08642578125
INFO:root:86.0
INFO:optuna.study.study:Trial 49 finished with value: 0.003252295544371009 and parameters: {'n_max': 250, 'n_layers': 3, 'n_out': 16, 'mean_type': 'linear', 'kernel_type': 'matern1.5', 'lr': 0.004457286058314803, 'batch_size': 1024, 'num_inducing': 1781, 'initialize_fe': True, 'minit': 'random'}. Best is trial 22 with value: 0.00010434334399178624.
INFO:root:After model training
INFO:root:40.349609375
INFO:root:70.0
INFO:optuna.study.study:Trial 50 finished with value: 0.002170274732634425 and parameters: {'n_max': 401, 'n_layers': 4, 'n_out': 14, 'mean_type': 'linear', 'kernel_type': 'matern1.5', 'lr': 0.0014321822969745645, 'batch_size': 512, 'num_inducing': 1472, 'initialize_fe': True, 'minit': 'kmeans'}. Best is trial 22 with value: 0.00010434334399178624.
INFO:root:After model training
INFO:root:34.703125
INFO:root:70.0
INFO:optuna.study.study:Trial 51 finished with value: 0.00018909438222181052 and parameters: {'n_max': 91, 'n_layers': 2, 'n_out': 15, 'mean_type': 'linear', 'kernel_type': 'matern1.5', 'lr': 0.0002643192321809474, 'batch_size': 512, 'num_inducing': 989, 'initialize_fe': True, 'minit': 'random'}. Best is trial 22 with value: 0.00010434334399178624.
INFO:root:After model training
INFO:root:33.6220703125
INFO:root:68.0
INFO:optuna.study.study:Trial 52 finished with value: 0.00035526222200132906 and parameters: {'n_max': 211, 'n_layers': 2, 'n_out': 16, 'mean_type': 'linear', 'kernel_type': 'matern1.5', 'lr': 0.0006805393392030902, 'batch_size': 512, 'num_inducing': 826, 'initialize_fe': True, 'minit': 'random'}. Best is trial 22 with value: 0.00010434334399178624.
INFO:root:After model training
INFO:root:29.94384765625
INFO:root:68.0
INFO:optuna.study.study:Trial 53 finished with value: 8.952830103226006e-05 and parameters: {'n_max': 171, 'n_layers': 2, 'n_out': 13, 'mean_type': 'linear', 'kernel_type': 'matern1.5', 'lr': 0.0004050439060050127, 'batch_size': 512, 'num_inducing': 52, 'initialize_fe': True, 'minit': 'random'}. Best is trial 53 with value: 8.952830103226006e-05.
INFO:root:After model training
INFO:root:29.953125
INFO:root:70.0
INFO:optuna.study.study:Trial 54 finished with value: 0.0020454481709748507 and parameters: {'n_max': 278, 'n_layers': 2, 'n_out': 13, 'mean_type': 'linear', 'kernel_type': 'matern1.5', 'lr': 0.00048171380949354846, 'batch_size': 512, 'num_inducing': 54, 'initialize_fe': True, 'minit': 'random'}. Best is trial 53 with value: 8.952830103226006e-05.
INFO:root:After model training
INFO:root:29.96533203125
INFO:root:68.0
INFO:optuna.study.study:Trial 55 finished with value: 0.0009292904287576675 and parameters: {'n_max': 166, 'n_layers': 2, 'n_out': 11, 'mean_type': 'linear', 'kernel_type': 'matern1.5', 'lr': 0.0003981508148720103, 'batch_size': 512, 'num_inducing': 67, 'initialize_fe': True, 'minit': 'random'}. Best is trial 53 with value: 8.952830103226006e-05.
INFO:root:After model training
INFO:root:30.0068359375
INFO:root:68.0
INFO:optuna.study.study:Trial 56 finished with value: 0.00022798366262577474 and parameters: {'n_max': 234, 'n_layers': 2, 'n_out': 18, 'mean_type': 'linear', 'kernel_type': 'matern1.5', 'lr': 0.0012177826894996895, 'batch_size': 512, 'num_inducing': 86, 'initialize_fe': True, 'minit': 'random'}. Best is trial 53 with value: 8.952830103226006e-05.
INFO:root:After model training
INFO:root:30.5732421875
INFO:root:72.0
INFO:optuna.study.study:Trial 57 finished with value: 0.0002942826831713319 and parameters: {'n_max': 128, 'n_layers': 2, 'n_out': 14, 'mean_type': 'constant', 'kernel_type': 'rbf', 'lr': 0.0001833767685349388, 'batch_size': 512, 'num_inducing': 307, 'initialize_fe': True, 'minit': 'random'}. Best is trial 53 with value: 8.952830103226006e-05.
INFO:root:After model training
INFO:root:30.12255859375
INFO:root:70.0
INFO:optuna.study.study:Trial 58 finished with value: 0.0008173890528269112 and parameters: {'n_max': 356, 'n_layers': 2, 'n_out': 12, 'mean_type': 'linear', 'kernel_type': 'matern1.5', 'lr': 0.0008323825051230845, 'batch_size': 512, 'num_inducing': 143, 'initialize_fe': False, 'minit': 'random'}. Best is trial 53 with value: 8.952830103226006e-05.
INFO:root:After model training
INFO:root:37.39599609375
INFO:root:86.0
INFO:optuna.study.study:Trial 59 finished with value: 0.0012414350640028715 and parameters: {'n_max': 309, 'n_layers': 3, 'n_out': 15, 'mean_type': 'linear', 'kernel_type': 'matern1.5', 'lr': 0.00027488739296366673, 'batch_size': 2048, 'num_inducing': 222, 'initialize_fe': True, 'minit': 'random'}. Best is trial 53 with value: 8.952830103226006e-05.
INFO:root:After model training
INFO:root:30.8212890625
INFO:root:72.0
INFO:optuna.study.study:Trial 60 finished with value: 0.00019294080266263336 and parameters: {'n_max': 194, 'n_layers': 2, 'n_out': 17, 'mean_type': 'linear', 'kernel_type': 'matern0.5', 'lr': 0.0024254427375152406, 'batch_size': 512, 'num_inducing': 372, 'initialize_fe': True, 'minit': 'random'}. Best is trial 53 with value: 8.952830103226006e-05.
INFO:root:After model training
INFO:root:32.22412109375
INFO:root:72.0
INFO:optuna.study.study:Trial 61 finished with value: 0.00017817036132328212 and parameters: {'n_max': 94, 'n_layers': 2, 'n_out': 13, 'mean_type': 'linear', 'kernel_type': 'matern1.5', 'lr': 0.0001974521424384911, 'batch_size': 512, 'num_inducing': 653, 'initialize_fe': True, 'minit': 'random'}. Best is trial 53 with value: 8.952830103226006e-05.
INFO:root:After model training
INFO:root:31.32177734375
INFO:root:70.0
INFO:optuna.study.study:Trial 62 finished with value: 0.00012185492960270494 and parameters: {'n_max': 165, 'n_layers': 2, 'n_out': 14, 'mean_type': 'linear', 'kernel_type': 'matern1.5', 'lr': 0.00012027023893078454, 'batch_size': 512, 'num_inducing': 487, 'initialize_fe': True, 'minit': 'random'}. Best is trial 53 with value: 8.952830103226006e-05.
INFO:root:After model training
INFO:root:31.21826171875
INFO:root:72.0
INFO:optuna.study.study:Trial 63 finished with value: 0.000476176937809214 and parameters: {'n_max': 168, 'n_layers': 2, 'n_out': 14, 'mean_type': 'linear', 'kernel_type': 'matern1.5', 'lr': 0.00012344813132720856, 'batch_size': 512, 'num_inducing': 465, 'initialize_fe': True, 'minit': 'random'}. Best is trial 53 with value: 8.952830103226006e-05.
INFO:root:After model training
INFO:root:30.05859375
INFO:root:70.0
INFO:optuna.study.study:Trial 64 finished with value: 0.0005140628200024366 and parameters: {'n_max': 622, 'n_layers': 2, 'n_out': 13, 'mean_type': 'linear', 'kernel_type': 'matern1.5', 'lr': 0.0003714587537410642, 'batch_size': 512, 'num_inducing': 103, 'initialize_fe': True, 'minit': 'random'}. Best is trial 53 with value: 8.952830103226006e-05.
INFO:root:After model training
INFO:root:31.416015625
INFO:root:72.0
INFO:optuna.study.study:Trial 65 finished with value: 0.0006801126874051988 and parameters: {'n_max': 221, 'n_layers': 2, 'n_out': 16, 'mean_type': 'linear', 'kernel_type': 'matern1.5', 'lr': 0.0006331353862478282, 'batch_size': 512, 'num_inducing': 505, 'initialize_fe': True, 'minit': 'random'}. Best is trial 53 with value: 8.952830103226006e-05.
INFO:root:After model training
INFO:root:30.5302734375
INFO:root:70.0
INFO:optuna.study.study:Trial 66 finished with value: 0.0006919731968082488 and parameters: {'n_max': 152, 'n_layers': 2, 'n_out': 12, 'mean_type': 'linear', 'kernel_type': 'matern1.5', 'lr': 0.00022103603728810037, 'batch_size': 1024, 'num_inducing': 294, 'initialize_fe': True, 'minit': 'random'}. Best is trial 53 with value: 8.952830103226006e-05.
INFO:root:After model training
INFO:root:30.2294921875
INFO:root:70.0
INFO:optuna.study.study:Trial 67 finished with value: 0.0006435312679968774 and parameters: {'n_max': 844, 'n_layers': 2, 'n_out': 15, 'mean_type': 'linear', 'kernel_type': 'matern1.5', 'lr': 0.00017533841838420278, 'batch_size': 512, 'num_inducing': 172, 'initialize_fe': True, 'minit': 'random'}. Best is trial 53 with value: 8.952830103226006e-05.
INFO:root:After model training
INFO:root:40.84619140625
INFO:root:70.0
INFO:optuna.study.study:Trial 68 finished with value: 0.0001795497810235247 and parameters: {'n_max': 256, 'n_layers': 2, 'n_out': 10, 'mean_type': 'linear', 'kernel_type': 'rbf', 'lr': 0.00030871634691780764, 'batch_size': 512, 'num_inducing': 1556, 'initialize_fe': True, 'minit': 'kmeans'}. Best is trial 53 with value: 8.952830103226006e-05.
INFO:root:After model training
INFO:root:31.0712890625
INFO:root:74.0
INFO:optuna.study.study:Trial 69 finished with value: 0.0003272825852036476 and parameters: {'n_max': 130, 'n_layers': 2, 'n_out': 14, 'mean_type': 'linear', 'kernel_type': 'matern1.5', 'lr': 0.0005080232702575252, 'batch_size': 512, 'num_inducing': 433, 'initialize_fe': True, 'minit': 'random'}. Best is trial 53 with value: 8.952830103226006e-05.
INFO:root:After model training
INFO:root:32.07861328125
INFO:root:72.0
INFO:optuna.study.study:Trial 70 finished with value: 0.0007123734103515744 and parameters: {'n_max': 198, 'n_layers': 3, 'n_out': 16, 'mean_type': 'linear', 'kernel_type': 'matern1.5', 'lr': 0.00011959256567313907, 'batch_size': 512, 'num_inducing': 598, 'initialize_fe': True, 'minit': 'random'}. Best is trial 53 with value: 8.952830103226006e-05.
INFO:root:After model training
INFO:root:33.5185546875
INFO:root:70.0
INFO:optuna.study.study:Trial 71 finished with value: 0.0001660989801166579 and parameters: {'n_max': 68, 'n_layers': 2, 'n_out': 15, 'mean_type': 'linear', 'kernel_type': 'matern1.5', 'lr': 0.00010867159322209607, 'batch_size': 512, 'num_inducing': 744, 'initialize_fe': True, 'minit': 'random'}. Best is trial 53 with value: 8.952830103226006e-05.
INFO:root:After model training
INFO:root:32.091796875
INFO:root:70.0
INFO:optuna.study.study:Trial 72 finished with value: 0.0001718340499792248 and parameters: {'n_max': 110, 'n_layers': 2, 'n_out': 13, 'mean_type': 'linear', 'kernel_type': 'matern1.5', 'lr': 0.00014280818605077027, 'batch_size': 512, 'num_inducing': 569, 'initialize_fe': True, 'minit': 'random'}. Best is trial 53 with value: 8.952830103226006e-05.
INFO:root:After model training
INFO:root:30.876953125
INFO:root:72.0
INFO:optuna.study.study:Trial 73 finished with value: 0.0003054433036595583 and parameters: {'n_max': 141, 'n_layers': 2, 'n_out': 14, 'mean_type': 'linear', 'kernel_type': 'matern1.5', 'lr': 0.00021363388856504413, 'batch_size': 512, 'num_inducing': 387, 'initialize_fe': True, 'minit': 'random'}. Best is trial 53 with value: 8.952830103226006e-05.
INFO:root:After model training
INFO:root:31.34130859375
INFO:root:68.0
INFO:optuna.study.study:Trial 74 finished with value: 0.00025838156579993665 and parameters: {'n_max': 83, 'n_layers': 2, 'n_out': 16, 'mean_type': 'linear', 'kernel_type': 'matern1.5', 'lr': 0.00017876098360606574, 'batch_size': 512, 'num_inducing': 492, 'initialize_fe': True, 'minit': 'random'}. Best is trial 53 with value: 8.952830103226006e-05.
INFO:root:After model training
INFO:root:36.607421875
INFO:root:70.0
INFO:optuna.study.study:Trial 75 finished with value: 0.00016443512868136168 and parameters: {'n_max': 496, 'n_layers': 2, 'n_out': 15, 'mean_type': 'constant', 'kernel_type': 'matern1.5', 'lr': 0.00025317569149324495, 'batch_size': 512, 'num_inducing': 1128, 'initialize_fe': True, 'minit': 'random'}. Best is trial 53 with value: 8.952830103226006e-05.
INFO:root:After model training
INFO:root:40.10205078125
INFO:root:100.0
INFO:optuna.study.study:Trial 76 finished with value: 0.0003637823392637074 and parameters: {'n_max': 184, 'n_layers': 2, 'n_out': 17, 'mean_type': 'linear', 'kernel_type': 'matern1.5', 'lr': 0.0001465329936813998, 'batch_size': 2048, 'num_inducing': 325, 'initialize_fe': True, 'minit': 'random'}. Best is trial 53 with value: 8.952830103226006e-05.
INFO:root:After model training
INFO:root:33.5869140625
INFO:root:72.0
INFO:optuna.study.study:Trial 77 finished with value: 0.0005171132506802678 and parameters: {'n_max': 118, 'n_layers': 2, 'n_out': 11, 'mean_type': 'linear', 'kernel_type': 'matern0.5', 'lr': 0.00010106900132690634, 'batch_size': 512, 'num_inducing': 803, 'initialize_fe': False, 'minit': 'random'}. Best is trial 53 with value: 8.952830103226006e-05.
INFO:root:After model training
INFO:root:31.08935546875
INFO:root:68.0
INFO:optuna.study.study:Trial 78 finished with value: 0.0010631574550643563 and parameters: {'n_max': 153, 'n_layers': 2, 'n_out': 14, 'mean_type': 'linear', 'kernel_type': 'matern1.5', 'lr': 0.0003302935751192548, 'batch_size': 1024, 'num_inducing': 437, 'initialize_fe': True, 'minit': 'random'}. Best is trial 53 with value: 8.952830103226006e-05.
INFO:root:After model training
INFO:root:32.13330078125
INFO:root:70.0
INFO:optuna.study.study:Trial 79 finished with value: 0.0014381732326000929 and parameters: {'n_max': 92, 'n_layers': 2, 'n_out': 15, 'mean_type': 'linear', 'kernel_type': 'matern1.5', 'lr': 0.025246446032642308, 'batch_size': 512, 'num_inducing': 638, 'initialize_fe': True, 'minit': 'kmeans'}. Best is trial 53 with value: 8.952830103226006e-05.
INFO:root:After model training
INFO:root:34.3828125
INFO:root:74.0
