INFO:optuna.study.study:Trial 31 finished with value: 0.00022865674691274762 and parameters: {'n_max': 825, 'n_layers': 2, 'n_out': 20, 'mean_type': 'constant', 'kernel_type': 'rbf', 'lr': 0.0030603871339969415, 'batch_size': 512, 'num_inducing': 922, 'initialize_fe': False, 'minit': 'kmeans'}. Best is trial 16 with value: 0.00012855012028012425.
INFO:root:After model training
INFO:root:9.30615234375
INFO:root:30.0
INFO:optuna.study.study:Trial 32 finished with value: 0.0001457040780223906 and parameters: {'n_max': 774, 'n_layers': 2, 'n_out': 19, 'mean_type': 'constant', 'kernel_type': 'rbf', 'lr': 0.004656600275175447, 'batch_size': 512, 'num_inducing': 1365, 'initialize_fe': False, 'minit': 'kmeans'}. Best is trial 16 with value: 0.00012855012028012425.
INFO:root:After model training
INFO:root:8.08349609375
INFO:root:30.0
INFO:optuna.study.study:Trial 33 finished with value: 0.00016985164256766438 and parameters: {'n_max': 745, 'n_layers': 2, 'n_out': 16, 'mean_type': 'constant', 'kernel_type': 'rbf', 'lr': 0.0054620905104271825, 'batch_size': 512, 'num_inducing': 1256, 'initialize_fe': False, 'minit': 'kmeans'}. Best is trial 16 with value: 0.00012855012028012425.
INFO:root:After model training
INFO:root:14.6318359375
INFO:root:52.0
INFO:optuna.study.study:Trial 34 finished with value: 0.00032939185621216893 and parameters: {'n_max': 746, 'n_layers': 5, 'n_out': 19, 'mean_type': 'constant', 'kernel_type': 'rbf', 'lr': 0.020489613739602737, 'batch_size': 512, 'num_inducing': 1579, 'initialize_fe': False, 'minit': 'kmeans'}. Best is trial 16 with value: 0.00012855012028012425.
INFO:root:After model training
INFO:root:3.2421875
INFO:root:28.0
INFO:optuna.study.study:Trial 35 finished with value: 0.00018889385682996362 and parameters: {'n_max': 441, 'n_layers': 2, 'n_out': 16, 'mean_type': 'constant', 'kernel_type': 'rbf', 'lr': 0.00720667541912197, 'batch_size': 512, 'num_inducing': 692, 'initialize_fe': True, 'minit': 'kmeans'}. Best is trial 16 with value: 0.00012855012028012425.
INFO:root:After model training
INFO:root:17.326171875
INFO:root:48.0
INFO:optuna.study.study:Trial 36 finished with value: 0.0005609673680737615 and parameters: {'n_max': 895, 'n_layers': 3, 'n_out': 14, 'mean_type': 'constant', 'kernel_type': 'matern1.5', 'lr': 0.0015374409572889798, 'batch_size': 1024, 'num_inducing': 1839, 'initialize_fe': False, 'minit': 'random'}. Best is trial 16 with value: 0.00012855012028012425.
INFO:root:After model training
INFO:root:9.63525390625
INFO:root:26.0
INFO:optuna.study.study:Trial 37 finished with value: 0.00021400899277068675 and parameters: {'n_max': 679, 'n_layers': 2, 'n_out': 19, 'mean_type': 'constant', 'kernel_type': 'matern0.5', 'lr': 0.00440039087630354, 'batch_size': 512, 'num_inducing': 1394, 'initialize_fe': True, 'minit': 'kmeans'}. Best is trial 16 with value: 0.00012855012028012425.
INFO:root:After model training
INFO:root:12.40576171875
INFO:root:60.0
INFO:optuna.study.study:Trial 38 finished with value: 0.014826265163719654 and parameters: {'n_max': 781, 'n_layers': 5, 'n_out': 17, 'mean_type': 'linear', 'kernel_type': 'rbf', 'lr': 0.016377601670632482, 'batch_size': 2048, 'num_inducing': 272, 'initialize_fe': False, 'minit': 'random'}. Best is trial 16 with value: 0.00012855012028012425.
INFO:root:After model training
INFO:root:2.42236328125
INFO:root:14.0
INFO:optuna.study.study:Trial 39 finished with value: 0.0007805617060512304 and parameters: {'n_max': 639, 'n_layers': 3, 'n_out': 2, 'mean_type': 'constant', 'kernel_type': 'matern0.5', 'lr': 0.000777783812352775, 'batch_size': 1024, 'num_inducing': 391, 'initialize_fe': True, 'minit': 'kmeans'}. Best is trial 16 with value: 0.00012855012028012425.
INFO:root:After model training
INFO:root:5.7978515625
INFO:root:28.0
INFO:optuna.study.study:Trial 40 finished with value: 0.000282665976556018 and parameters: {'n_max': 602, 'n_layers': 2, 'n_out': 12, 'mean_type': 'constant', 'kernel_type': 'matern1.5', 'lr': 0.00032601158797621103, 'batch_size': 512, 'num_inducing': 1025, 'initialize_fe': False, 'minit': 'random'}. Best is trial 16 with value: 0.00012855012028012425.
INFO:root:After model training
INFO:root:4.40478515625
INFO:root:28.0
INFO:optuna.study.study:Trial 41 finished with value: 0.0001261512516066432 and parameters: {'n_max': 833, 'n_layers': 2, 'n_out': 20, 'mean_type': 'constant', 'kernel_type': 'rbf', 'lr': 0.0030120283003769867, 'batch_size': 512, 'num_inducing': 852, 'initialize_fe': False, 'minit': 'kmeans'}. Best is trial 41 with value: 0.0001261512516066432.
INFO:root:After model training
INFO:root:2.939453125
INFO:root:26.0
INFO:optuna.study.study:Trial 42 finished with value: 0.00028358501731418073 and parameters: {'n_max': 896, 'n_layers': 2, 'n_out': 19, 'mean_type': 'constant', 'kernel_type': 'rbf', 'lr': 0.0023810148258600014, 'batch_size': 512, 'num_inducing': 636, 'initialize_fe': False, 'minit': 'kmeans'}. Best is trial 41 with value: 0.0001261512516066432.
INFO:root:After model training
INFO:root:4.5390625
INFO:root:28.0
INFO:optuna.study.study:Trial 43 finished with value: 0.0001193952193716541 and parameters: {'n_max': 954, 'n_layers': 2, 'n_out': 18, 'mean_type': 'constant', 'kernel_type': 'rbf', 'lr': 0.006418358474735037, 'batch_size': 512, 'num_inducing': 869, 'initialize_fe': False, 'minit': 'kmeans'}. Best is trial 43 with value: 0.0001193952193716541.
INFO:root:After model training
INFO:root:2.01953125
INFO:root:10.0
INFO:optuna.study.study:Trial 44 finished with value: 9.939751907950267e-05 and parameters: {'n_max': 964, 'n_layers': 2, 'n_out': 18, 'mean_type': 'constant', 'kernel_type': 'rbf', 'lr': 0.0013457649538871864, 'batch_size': 512, 'num_inducing': 462, 'initialize_fe': False, 'minit': 'kmeans'}. Best is trial 44 with value: 9.939751907950267e-05.
INFO:root:After model training
INFO:root:3.81591796875
INFO:root:30.0
INFO:optuna.study.study:Trial 45 finished with value: 0.0172742810100317 and parameters: {'n_max': 986, 'n_layers': 3, 'n_out': 15, 'mean_type': 'linear', 'kernel_type': 'rbf', 'lr': 0.0012794514498282808, 'batch_size': 1024, 'num_inducing': 451, 'initialize_fe': False, 'minit': 'kmeans'}. Best is trial 44 with value: 9.939751907950267e-05.
INFO:root:After model training
INFO:root:1.56787109375
INFO:root:12.0
INFO:optuna.study.study:Trial 46 finished with value: 0.0001983880647458136 and parameters: {'n_max': 1024, 'n_layers': 2, 'n_out': 17, 'mean_type': 'constant', 'kernel_type': 'rbf', 'lr': 0.007116373806566918, 'batch_size': 512, 'num_inducing': 355, 'initialize_fe': True, 'minit': 'random'}. Best is trial 44 with value: 9.939751907950267e-05.
INFO:root:After model training
INFO:root:4.32568359375
INFO:root:28.0
INFO:optuna.study.study:Trial 47 finished with value: 0.00026711676036939025 and parameters: {'n_max': 971, 'n_layers': 2, 'n_out': 20, 'mean_type': 'constant', 'kernel_type': 'rbf', 'lr': 0.0008959987864733362, 'batch_size': 512, 'num_inducing': 840, 'initialize_fe': False, 'minit': 'kmeans'}. Best is trial 44 with value: 9.939751907950267e-05.
INFO:root:After model training
INFO:root:4.623046875
INFO:root:28.0
INFO:optuna.study.study:Trial 48 finished with value: 0.0004565828712657094 and parameters: {'n_max': 949, 'n_layers': 3, 'n_out': 8, 'mean_type': 'constant', 'kernel_type': 'rbf', 'lr': 0.00013433309751189793, 'batch_size': 512, 'num_inducing': 636, 'initialize_fe': False, 'minit': 'kmeans'}. Best is trial 44 with value: 9.939751907950267e-05.
INFO:root:After model training
INFO:root:7.7275390625
INFO:root:28.0
INFO:optuna.study.study:Trial 49 finished with value: 0.00786258839070797 and parameters: {'n_max': 817, 'n_layers': 2, 'n_out': 10, 'mean_type': 'linear', 'kernel_type': 'rbf', 'lr': 0.0015466564548110475, 'batch_size': 2048, 'num_inducing': 198, 'initialize_fe': False, 'minit': 'kmeans'}. Best is trial 44 with value: 9.939751907950267e-05.
INFO:root:After model training
INFO:root:2.07080078125
INFO:root:12.0
INFO:optuna.study.study:Trial 50 finished with value: 0.0002963220467790961 and parameters: {'n_max': 157, 'n_layers': 4, 'n_out': 20, 'mean_type': 'constant', 'kernel_type': 'rbf', 'lr': 0.0004858981795605443, 'batch_size': 1024, 'num_inducing': 468, 'initialize_fe': True, 'minit': 'kmeans'}. Best is trial 44 with value: 9.939751907950267e-05.
INFO:root:After model training
INFO:root:4.70751953125
INFO:root:28.0
INFO:optuna.study.study:Trial 51 finished with value: 0.00017888389993458986 and parameters: {'n_max': 910, 'n_layers': 2, 'n_out': 18, 'mean_type': 'constant', 'kernel_type': 'matern0.5', 'lr': 0.00350637619922725, 'batch_size': 512, 'num_inducing': 891, 'initialize_fe': False, 'minit': 'kmeans'}. Best is trial 44 with value: 9.939751907950267e-05.
INFO:root:After model training
INFO:root:3.392578125
INFO:root:30.0
INFO:optuna.study.study:Trial 52 finished with value: 0.0002530347846914083 and parameters: {'n_max': 857, 'n_layers': 2, 'n_out': 17, 'mean_type': 'constant', 'kernel_type': 'rbf', 'lr': 0.0026935191780043067, 'batch_size': 512, 'num_inducing': 710, 'initialize_fe': False, 'minit': 'kmeans'}. Best is trial 44 with value: 9.939751907950267e-05.
INFO:root:After model training
INFO:root:0.9521484375
INFO:root:10.0
INFO:optuna.study.study:Trial 53 finished with value: 0.00017301876505371183 and parameters: {'n_max': 870, 'n_layers': 2, 'n_out': 18, 'mean_type': 'constant', 'kernel_type': 'matern1.5', 'lr': 0.004170381151061285, 'batch_size': 512, 'num_inducing': 157, 'initialize_fe': False, 'minit': 'kmeans'}. Best is trial 44 with value: 9.939751907950267e-05.
INFO:root:After model training
INFO:root:1.4443359375
INFO:root:10.0
INFO:optuna.study.study:Trial 54 finished with value: 0.00013928984117228538 and parameters: {'n_max': 1001, 'n_layers': 2, 'n_out': 19, 'mean_type': 'constant', 'kernel_type': 'rbf', 'lr': 0.005875398598030732, 'batch_size': 512, 'num_inducing': 320, 'initialize_fe': False, 'minit': 'kmeans'}. Best is trial 44 with value: 9.939751907950267e-05.
INFO:root:After model training
INFO:root:1.345703125
INFO:root:10.0
INFO:optuna.study.study:Trial 55 finished with value: 0.0001734107790980488 and parameters: {'n_max': 998, 'n_layers': 2, 'n_out': 20, 'mean_type': 'constant', 'kernel_type': 'rbf', 'lr': 0.011668556891670795, 'batch_size': 512, 'num_inducing': 290, 'initialize_fe': False, 'minit': 'kmeans'}. Best is trial 44 with value: 9.939751907950267e-05.
INFO:root:After model training
INFO:root:1.4658203125
INFO:root:14.0
INFO:optuna.study.study:Trial 56 finished with value: 0.00019114732276648283 and parameters: {'n_max': 951, 'n_layers': 2, 'n_out': 19, 'mean_type': 'constant', 'kernel_type': 'rbf', 'lr': 0.005826992732723295, 'batch_size': 512, 'num_inducing': 327, 'initialize_fe': False, 'minit': 'kmeans'}. Best is trial 44 with value: 9.939751907950267e-05.
INFO:root:After model training
INFO:root:1.078125
INFO:root:10.0
INFO:optuna.study.study:Trial 57 finished with value: 0.0002305720845470205 and parameters: {'n_max': 367, 'n_layers': 2, 'n_out': 16, 'mean_type': 'constant', 'kernel_type': 'rbf', 'lr': 0.001660343940737198, 'batch_size': 512, 'num_inducing': 224, 'initialize_fe': False, 'minit': 'random'}. Best is trial 44 with value: 9.939751907950267e-05.
INFO:root:After model training
INFO:root:2.40185546875
INFO:root:30.0
INFO:optuna.study.study:Trial 58 finished with value: 0.0001072779850801453 and parameters: {'n_max': 921, 'n_layers': 2, 'n_out': 9, 'mean_type': 'constant', 'kernel_type': 'rbf', 'lr': 0.007729890831666519, 'batch_size': 512, 'num_inducing': 546, 'initialize_fe': False, 'minit': 'kmeans'}. Best is trial 44 with value: 9.939751907950267e-05.
INFO:root:After model training
INFO:root:2.7431640625
INFO:root:30.0
INFO:optuna.study.study:Trial 59 finished with value: 0.0012199294287711382 and parameters: {'n_max': 507, 'n_layers': 3, 'n_out': 8, 'mean_type': 'linear', 'kernel_type': 'rbf', 'lr': 0.029428965218783645, 'batch_size': 512, 'num_inducing': 521, 'initialize_fe': False, 'minit': 'kmeans'}. Best is trial 44 with value: 9.939751907950267e-05.
INFO:root:After model training
INFO:root:13.73779296875
INFO:root:50.0
INFO:optuna.study.study:Trial 60 finished with value: 0.0006069971714168787 and parameters: {'n_max': 707, 'n_layers': 2, 'n_out': 9, 'mean_type': 'constant', 'kernel_type': 'matern0.5', 'lr': 0.008736807001386085, 'batch_size': 2048, 'num_inducing': 660, 'initialize_fe': False, 'minit': 'kmeans'}. Best is trial 44 with value: 9.939751907950267e-05.
INFO:root:After model training
INFO:root:1.65869140625
INFO:root:10.0
INFO:optuna.study.study:Trial 61 finished with value: 0.00019065984815824777 and parameters: {'n_max': 925, 'n_layers': 2, 'n_out': 11, 'mean_type': 'constant', 'kernel_type': 'rbf', 'lr': 0.005968759141112347, 'batch_size': 512, 'num_inducing': 385, 'initialize_fe': False, 'minit': 'kmeans'}. Best is trial 44 with value: 9.939751907950267e-05.
INFO:root:After model training
INFO:root:2.57666015625
INFO:root:30.0
INFO:optuna.study.study:Trial 62 finished with value: 0.0002357171179028228 and parameters: {'n_max': 1008, 'n_layers': 2, 'n_out': 7, 'mean_type': 'constant', 'kernel_type': 'rbf', 'lr': 0.013088142470030937, 'batch_size': 512, 'num_inducing': 579, 'initialize_fe': False, 'minit': 'kmeans'}. Best is trial 44 with value: 9.939751907950267e-05.
INFO:root:After model training
INFO:root:4.1220703125
INFO:root:26.0
INFO:optuna.study.study:Trial 63 finished with value: 8.309746044687927e-05 and parameters: {'n_max': 967, 'n_layers': 2, 'n_out': 9, 'mean_type': 'constant', 'kernel_type': 'rbf', 'lr': 0.0037831488612904284, 'batch_size': 512, 'num_inducing': 818, 'initialize_fe': False, 'minit': 'kmeans'}. Best is trial 63 with value: 8.309746044687927e-05.
INFO:root:After model training
INFO:root:3.841796875
INFO:root:28.0
INFO:optuna.study.study:Trial 64 finished with value: 0.00020958753884769976 and parameters: {'n_max': 839, 'n_layers': 2, 'n_out': 9, 'mean_type': 'constant', 'kernel_type': 'rbf', 'lr': 0.002252726064189433, 'batch_size': 512, 'num_inducing': 780, 'initialize_fe': False, 'minit': 'kmeans'}. Best is trial 63 with value: 8.309746044687927e-05.
INFO:root:After model training
INFO:root:2.15966796875
INFO:root:16.0
INFO:optuna.study.study:Trial 65 finished with value: 8.524788427166641e-05 and parameters: {'n_max': 926, 'n_layers': 2, 'n_out': 7, 'mean_type': 'constant', 'kernel_type': 'rbf', 'lr': 0.002741056212120167, 'batch_size': 512, 'num_inducing': 500, 'initialize_fe': False, 'minit': 'kmeans'}. Best is trial 63 with value: 8.309746044687927e-05.
INFO:root:After model training
INFO:root:2.04638671875
INFO:root:12.0
INFO:optuna.study.study:Trial 66 finished with value: 0.00013537397899199277 and parameters: {'n_max': 969, 'n_layers': 2, 'n_out': 6, 'mean_type': 'constant', 'kernel_type': 'rbf', 'lr': 0.002580314241385439, 'batch_size': 512, 'num_inducing': 477, 'initialize_fe': False, 'minit': 'kmeans'}. Best is trial 63 with value: 8.309746044687927e-05.
INFO:root:After model training
INFO:root:6.47265625
INFO:root:26.0
INFO:optuna.study.study:Trial 67 finished with value: 0.0003597609174903482 and parameters: {'n_max': 924, 'n_layers': 2, 'n_out': 10, 'mean_type': 'constant', 'kernel_type': 'rbf', 'lr': 0.0011146703881389612, 'batch_size': 512, 'num_inducing': 1097, 'initialize_fe': False, 'minit': 'kmeans'}. Best is trial 63 with value: 8.309746044687927e-05.
INFO:root:After model training
INFO:root:0.80322265625
INFO:root:8.0
INFO:optuna.study.study:Trial 68 finished with value: 0.0001729169161990285 and parameters: {'n_max': 874, 'n_layers': 2, 'n_out': 7, 'mean_type': 'constant', 'kernel_type': 'rbf', 'lr': 0.004230143125269661, 'batch_size': 512, 'num_inducing': 104, 'initialize_fe': False, 'minit': 'kmeans'}. Best is trial 63 with value: 8.309746044687927e-05.
INFO:root:After model training
INFO:root:5.98974609375
INFO:root:30.0
INFO:optuna.study.study:Trial 69 finished with value: 0.0001265311148017645 and parameters: {'n_max': 952, 'n_layers': 3, 'n_out': 12, 'mean_type': 'constant', 'kernel_type': 'rbf', 'lr': 0.008077710632672288, 'batch_size': 512, 'num_inducing': 835, 'initialize_fe': False, 'minit': 'kmeans'}. Best is trial 63 with value: 8.309746044687927e-05.
INFO:root:After model training
INFO:root:5.91552734375
INFO:root:28.0
INFO:optuna.study.study:Trial 70 finished with value: 0.00011988472397206351 and parameters: {'n_max': 940, 'n_layers': 3, 'n_out': 12, 'mean_type': 'constant', 'kernel_type': 'rbf', 'lr': 0.008926645165854319, 'batch_size': 512, 'num_inducing': 831, 'initialize_fe': False, 'minit': 'kmeans'}. Best is trial 63 with value: 8.309746044687927e-05.
INFO:root:After model training
INFO:root:5.77587890625
INFO:root:26.0
INFO:optuna.study.study:Trial 71 finished with value: 0.00012425475870259106 and parameters: {'n_max': 945, 'n_layers': 3, 'n_out': 13, 'mean_type': 'constant', 'kernel_type': 'rbf', 'lr': 0.00842090146743338, 'batch_size': 512, 'num_inducing': 809, 'initialize_fe': False, 'minit': 'kmeans'}. Best is trial 63 with value: 8.309746044687927e-05.
INFO:root:After model training
INFO:root:8.728515625
INFO:root:32.0
INFO:optuna.study.study:Trial 72 finished with value: 0.00026609355700202286 and parameters: {'n_max': 980, 'n_layers': 4, 'n_out': 13, 'mean_type': 'constant', 'kernel_type': 'rbf', 'lr': 0.010188750762211287, 'batch_size': 512, 'num_inducing': 983, 'initialize_fe': False, 'minit': 'kmeans'}. Best is trial 63 with value: 8.309746044687927e-05.
INFO:root:After model training
INFO:root:5.11474609375
INFO:root:28.0
INFO:optuna.study.study:Trial 73 finished with value: 0.00016218118253163993 and parameters: {'n_max': 912, 'n_layers': 3, 'n_out': 12, 'mean_type': 'constant', 'kernel_type': 'rbf', 'lr': 0.009402460280355367, 'batch_size': 512, 'num_inducing': 732, 'initialize_fe': False, 'minit': 'kmeans'}. Best is trial 63 with value: 8.309746044687927e-05.
INFO:root:After model training
INFO:root:4.24658203125
INFO:root:28.0
INFO:optuna.study.study:Trial 74 finished with value: 0.00023078004596754909 and parameters: {'n_max': 1023, 'n_layers': 3, 'n_out': 6, 'mean_type': 'constant', 'kernel_type': 'rbf', 'lr': 0.015348848586264832, 'batch_size': 512, 'num_inducing': 518, 'initialize_fe': False, 'minit': 'kmeans'}. Best is trial 63 with value: 8.309746044687927e-05.
INFO:root:After model training
INFO:root:7.94189453125
INFO:root:28.0
INFO:optuna.study.study:Trial 75 finished with value: 0.0015005174791440368 and parameters: {'n_max': 941, 'n_layers': 3, 'n_out': 10, 'mean_type': 'constant', 'kernel_type': 'rbf', 'lr': 0.045326193269179166, 'batch_size': 512, 'num_inducing': 1073, 'initialize_fe': False, 'minit': 'kmeans'}. Best is trial 63 with value: 8.309746044687927e-05.
INFO:root:After model training
INFO:root:6.4365234375
INFO:root:28.0
INFO:optuna.study.study:Trial 76 finished with value: 0.00040740135591477156 and parameters: {'n_max': 889, 'n_layers': 4, 'n_out': 14, 'mean_type': 'constant', 'kernel_type': 'rbf', 'lr': 0.00510925328645668, 'batch_size': 1024, 'num_inducing': 763, 'initialize_fe': True, 'minit': 'kmeans'}. Best is trial 63 with value: 8.309746044687927e-05.
INFO:root:After model training
INFO:root:5.7900390625
INFO:root:28.0
INFO:optuna.study.study:Trial 77 finished with value: 0.00022257055388763547 and parameters: {'n_max': 815, 'n_layers': 3, 'n_out': 11, 'mean_type': 'constant', 'kernel_type': 'rbf', 'lr': 0.007027791560993391, 'batch_size': 512, 'num_inducing': 871, 'initialize_fe': False, 'minit': 'random'}. Best is trial 63 with value: 8.309746044687927e-05.
INFO:root:After model training
INFO:root:2.76806640625
INFO:root:26.0
INFO:optuna.study.study:Trial 78 finished with value: 0.00013465731171891093 and parameters: {'n_max': 849, 'n_layers': 2, 'n_out': 7, 'mean_type': 'linear', 'kernel_type': 'rbf', 'lr': 0.0038151113421388667, 'batch_size': 512, 'num_inducing': 614, 'initialize_fe': False, 'minit': 'kmeans'}. Best is trial 63 with value: 8.309746044687927e-05.
INFO:root:After model training
INFO:root:21.70263671875
INFO:root:72.0
INFO:optuna.study.study:Trial 79 finished with value: 0.0012478105491027236 and parameters: {'n_max': 974, 'n_layers': 2, 'n_out': 11, 'mean_type': 'constant', 'kernel_type': 'rbf', 'lr': 0.01834944571867159, 'batch_size': 2048, 'num_inducing': 1182, 'initialize_fe': False, 'minit': 'kmeans'}. Best is trial 63 with value: 8.309746044687927e-05.
INFO:root:After model training
INFO:root:3.35595703125
INFO:root:32.0
INFO:optuna.study.study:Trial 80 finished with value: 0.0001591579057276249 and parameters: {'n_max': 916, 'n_layers': 3, 'n_out': 4, 'mean_type': 'constant', 'kernel_type': 'rbf', 'lr': 0.0111783874358965, 'batch_size': 512, 'num_inducing': 414, 'initialize_fe': False, 'minit': 'kmeans'}. Best is trial 63 with value: 8.309746044687927e-05.
INFO:root:After model training
INFO:root:6.64306640625
INFO:root:26.0
INFO:optuna.study.study:Trial 81 finished with value: 0.0002027106238529086 and parameters: {'n_max': 950, 'n_layers': 3, 'n_out': 13, 'mean_type': 'constant', 'kernel_type': 'rbf', 'lr': 0.008123389118578113, 'batch_size': 512, 'num_inducing': 919, 'initialize_fe': False, 'minit': 'kmeans'}. Best is trial 63 with value: 8.309746044687927e-05.
INFO:root:After model training
INFO:root:5.8603515625
INFO:root:28.0
INFO:optuna.study.study:Trial 82 finished with value: 0.0001332937681581825 and parameters: {'n_max': 882, 'n_layers': 3, 'n_out': 12, 'mean_type': 'constant', 'kernel_type': 'rbf', 'lr': 0.007624996387619241, 'batch_size': 512, 'num_inducing': 851, 'initialize_fe': False, 'minit': 'kmeans'}. Best is trial 63 with value: 8.309746044687927e-05.
INFO:root:After model training
INFO:root:5.0986328125
INFO:root:28.0
