INFO:optuna.study.study:Trial 68 finished with value: 0.06935326755046844 and parameters: {'n_max': 198, 'n_layers': 4, 'n_out': 2, 'mean_type': 'constant', 'kernel_type': 'matern1.5', 'lr': 0.03246702873059211, 'batch_size': 2048, 'num_inducing': 1177, 'initialize_fe': False, 'minit': 'random'}. Best is trial 0 with value: 0.06891942769289017.
INFO:root:After model training
INFO:root:46.38330078125
INFO:root:160.0
INFO:optuna.study.study:Trial 69 finished with value: 0.07384638488292694 and parameters: {'n_max': 201, 'n_layers': 4, 'n_out': 2, 'mean_type': 'constant', 'kernel_type': 'matern1.5', 'lr': 0.03284914920567004, 'batch_size': 2048, 'num_inducing': 1177, 'initialize_fe': False, 'minit': 'random'}. Best is trial 0 with value: 0.06891942769289017.
INFO:root:After model training
INFO:root:59.81005859375
INFO:root:192.0
INFO:optuna.study.study:Trial 70 finished with value: 0.08915191888809204 and parameters: {'n_max': 243, 'n_layers': 4, 'n_out': 3, 'mean_type': 'linear', 'kernel_type': 'matern1.5', 'lr': 0.06975954138309742, 'batch_size': 2048, 'num_inducing': 1787, 'initialize_fe': False, 'minit': 'kmeans'}. Best is trial 0 with value: 0.06891942769289017.
INFO:root:After model training
INFO:root:52.0009765625
INFO:root:144.0
INFO:optuna.study.study:Trial 71 finished with value: 0.07430160790681839 and parameters: {'n_max': 191, 'n_layers': 4, 'n_out': 2, 'mean_type': 'constant', 'kernel_type': 'matern1.5', 'lr': 0.01969876413984735, 'batch_size': 2048, 'num_inducing': 1402, 'initialize_fe': False, 'minit': 'random'}. Best is trial 0 with value: 0.06891942769289017.
INFO:root:After model training
INFO:root:49.1552734375
INFO:root:148.0
INFO:optuna.study.study:Trial 72 finished with value: 0.08183850347995758 and parameters: {'n_max': 306, 'n_layers': 4, 'n_out': 3, 'mean_type': 'constant', 'kernel_type': 'matern1.5', 'lr': 0.09994665873151025, 'batch_size': 2048, 'num_inducing': 1246, 'initialize_fe': False, 'minit': 'random'}. Best is trial 0 with value: 0.06891942769289017.
INFO:root:After model training
INFO:root:42.4287109375
INFO:root:160.0
INFO:optuna.study.study:Trial 73 finished with value: 0.07371624559164047 and parameters: {'n_max': 121, 'n_layers': 4, 'n_out': 2, 'mean_type': 'constant', 'kernel_type': 'matern1.5', 'lr': 0.05321359641164869, 'batch_size': 2048, 'num_inducing': 943, 'initialize_fe': False, 'minit': 'random'}. Best is trial 0 with value: 0.06891942769289017.
INFO:root:After model training
INFO:root:38.546875
INFO:root:120.0
INFO:optuna.study.study:Trial 74 finished with value: 0.07231597602367401 and parameters: {'n_max': 179, 'n_layers': 4, 'n_out': 11, 'mean_type': 'constant', 'kernel_type': 'matern1.5', 'lr': 0.03962931650033787, 'batch_size': 2048, 'num_inducing': 690, 'initialize_fe': False, 'minit': 'random'}. Best is trial 0 with value: 0.06891942769289017.
INFO:root:After model training
INFO:root:38.8818359375
INFO:root:124.0
INFO:optuna.study.study:Trial 75 finished with value: 0.07513964176177979 and parameters: {'n_max': 124, 'n_layers': 4, 'n_out': 11, 'mean_type': 'constant', 'kernel_type': 'matern1.5', 'lr': 0.040596043185639655, 'batch_size': 2048, 'num_inducing': 682, 'initialize_fe': False, 'minit': 'random'}. Best is trial 0 with value: 0.06891942769289017.
INFO:root:After model training
INFO:root:44.9677734375
INFO:root:164.0
INFO:optuna.study.study:Trial 76 finished with value: 0.1255986988544464 and parameters: {'n_max': 256, 'n_layers': 4, 'n_out': 10, 'mean_type': 'constant', 'kernel_type': 'matern1.5', 'lr': 0.00010974316682584074, 'batch_size': 2048, 'num_inducing': 1091, 'initialize_fe': True, 'minit': 'random'}. Best is trial 0 with value: 0.06891942769289017.
INFO:root:After model training
INFO:root:39.9443359375
INFO:root:136.0
INFO:optuna.study.study:Trial 77 finished with value: 0.0728088840842247 and parameters: {'n_max': 175, 'n_layers': 4, 'n_out': 4, 'mean_type': 'constant', 'kernel_type': 'matern1.5', 'lr': 0.02991008746879256, 'batch_size': 2048, 'num_inducing': 755, 'initialize_fe': False, 'minit': 'random'}. Best is trial 0 with value: 0.06891942769289017.
INFO:root:After model training
INFO:root:28.6923828125
INFO:root:108.0
INFO:optuna.study.study:Trial 78 finished with value: 0.0752444639801979 and parameters: {'n_max': 185, 'n_layers': 4, 'n_out': 14, 'mean_type': 'constant', 'kernel_type': 'matern1.5', 'lr': 0.03105916244118093, 'batch_size': 512, 'num_inducing': 791, 'initialize_fe': False, 'minit': 'random'}. Best is trial 0 with value: 0.06891942769289017.
INFO:root:After model training
INFO:root:42.94677734375
INFO:root:164.0
INFO:optuna.study.study:Trial 79 finished with value: 0.07586576789617538 and parameters: {'n_max': 314, 'n_layers': 4, 'n_out': 4, 'mean_type': 'constant', 'kernel_type': 'matern1.5', 'lr': 0.022475926324300847, 'batch_size': 2048, 'num_inducing': 908, 'initialize_fe': False, 'minit': 'random'}. Best is trial 0 with value: 0.06891942769289017.
INFO:root:After model training
INFO:root:57.0234375
INFO:root:136.0
INFO:optuna.study.study:Trial 80 finished with value: 0.0812612995505333 and parameters: {'n_max': 165, 'n_layers': 5, 'n_out': 8, 'mean_type': 'constant', 'kernel_type': 'matern1.5', 'lr': 0.013043255917414457, 'batch_size': 2048, 'num_inducing': 1694, 'initialize_fe': False, 'minit': 'random'}. Best is trial 0 with value: 0.06891942769289017.
INFO:root:After model training
INFO:root:37.36181640625
INFO:root:124.0
INFO:optuna.study.study:Trial 81 finished with value: 0.07368584722280502 and parameters: {'n_max': 214, 'n_layers': 4, 'n_out': 3, 'mean_type': 'constant', 'kernel_type': 'matern1.5', 'lr': 0.05538995025953883, 'batch_size': 2048, 'num_inducing': 597, 'initialize_fe': False, 'minit': 'random'}. Best is trial 0 with value: 0.06891942769289017.
INFO:root:After model training
INFO:root:39.6865234375
INFO:root:152.0
INFO:optuna.study.study:Trial 82 finished with value: 0.06930659711360931 and parameters: {'n_max': 132, 'n_layers': 4, 'n_out': 2, 'mean_type': 'constant', 'kernel_type': 'matern1.5', 'lr': 0.04391632868755308, 'batch_size': 2048, 'num_inducing': 680, 'initialize_fe': False, 'minit': 'random'}. Best is trial 0 with value: 0.06891942769289017.
INFO:root:After model training
INFO:root:41.07080078125
INFO:root:124.0
INFO:optuna.study.study:Trial 83 finished with value: 0.07349596917629242 and parameters: {'n_max': 141, 'n_layers': 4, 'n_out': 2, 'mean_type': 'constant', 'kernel_type': 'matern1.5', 'lr': 0.028641165652448456, 'batch_size': 2048, 'num_inducing': 724, 'initialize_fe': False, 'minit': 'random'}. Best is trial 0 with value: 0.06891942769289017.
INFO:root:After model training
INFO:root:38.56103515625
INFO:root:136.0
INFO:optuna.study.study:Trial 84 finished with value: 0.07787226885557175 and parameters: {'n_max': 97, 'n_layers': 4, 'n_out': 9, 'mean_type': 'constant', 'kernel_type': 'matern1.5', 'lr': 0.04213642275435242, 'batch_size': 2048, 'num_inducing': 667, 'initialize_fe': False, 'minit': 'random'}. Best is trial 0 with value: 0.06891942769289017.
INFO:root:After model training
INFO:root:43.86767578125
INFO:root:164.0
INFO:optuna.study.study:Trial 85 finished with value: 0.07953812181949615 and parameters: {'n_max': 179, 'n_layers': 4, 'n_out': 5, 'mean_type': 'constant', 'kernel_type': 'matern1.5', 'lr': 0.047975719682479795, 'batch_size': 2048, 'num_inducing': 994, 'initialize_fe': False, 'minit': 'random'}. Best is trial 0 with value: 0.06891942769289017.
INFO:root:After model training
INFO:root:36.267578125
INFO:root:110.0
INFO:optuna.study.study:Trial 86 finished with value: 0.07258676737546921 and parameters: {'n_max': 234, 'n_layers': 4, 'n_out': 4, 'mean_type': 'constant', 'kernel_type': 'matern1.5', 'lr': 0.03720582762045129, 'batch_size': 2048, 'num_inducing': 494, 'initialize_fe': False, 'minit': 'random'}. Best is trial 0 with value: 0.06891942769289017.
INFO:root:After model training
INFO:root:36.81103515625
INFO:root:124.0
INFO:optuna.study.study:Trial 87 finished with value: 0.09338691830635071 and parameters: {'n_max': 391, 'n_layers': 4, 'n_out': 2, 'mean_type': 'linear', 'kernel_type': 'matern1.5', 'lr': 0.07897267536874811, 'batch_size': 2048, 'num_inducing': 469, 'initialize_fe': False, 'minit': 'kmeans'}. Best is trial 0 with value: 0.06891942769289017.
INFO:root:After model training
INFO:root:35.28271484375
INFO:root:108.0
INFO:optuna.study.study:Trial 88 finished with value: 0.07237107306718826 and parameters: {'n_max': 261, 'n_layers': 4, 'n_out': 13, 'mean_type': 'constant', 'kernel_type': 'matern1.5', 'lr': 0.03579424096550424, 'batch_size': 2048, 'num_inducing': 397, 'initialize_fe': True, 'minit': 'random'}. Best is trial 0 with value: 0.06891942769289017.
INFO:root:After model training
INFO:root:26.21142578125
INFO:root:108.0
INFO:optuna.study.study:Trial 89 finished with value: 0.07781056314706802 and parameters: {'n_max': 259, 'n_layers': 4, 'n_out': 12, 'mean_type': 'constant', 'kernel_type': 'matern1.5', 'lr': 0.025425548622842783, 'batch_size': 1024, 'num_inducing': 298, 'initialize_fe': True, 'minit': 'random'}. Best is trial 0 with value: 0.06891942769289017.
INFO:root:After model training
INFO:root:26.2841796875
INFO:root:116.0
INFO:optuna.study.study:Trial 90 finished with value: 0.09459371119737625 and parameters: {'n_max': 134, 'n_layers': 4, 'n_out': 14, 'mean_type': 'constant', 'kernel_type': 'matern1.5', 'lr': 0.01838372755511745, 'batch_size': 512, 'num_inducing': 366, 'initialize_fe': True, 'minit': 'random'}. Best is trial 0 with value: 0.06891942769289017.
INFO:root:After model training
INFO:root:37.09033203125
INFO:root:128.0
INFO:optuna.study.study:Trial 91 finished with value: 0.07905120402574539 and parameters: {'n_max': 228, 'n_layers': 4, 'n_out': 17, 'mean_type': 'constant', 'kernel_type': 'matern1.5', 'lr': 0.03494073926018569, 'batch_size': 2048, 'num_inducing': 505, 'initialize_fe': True, 'minit': 'random'}. Best is trial 0 with value: 0.06891942769289017.
INFO:root:After model training
INFO:root:36.17236328125
INFO:root:124.0
INFO:optuna.study.study:Trial 92 finished with value: 0.0753420740365982 and parameters: {'n_max': 339, 'n_layers': 4, 'n_out': 13, 'mean_type': 'constant', 'kernel_type': 'matern1.5', 'lr': 0.043437877485290696, 'batch_size': 2048, 'num_inducing': 433, 'initialize_fe': True, 'minit': 'random'}. Best is trial 0 with value: 0.06891942769289017.
INFO:root:After model training
INFO:root:34.2900390625
INFO:root:108.0
INFO:optuna.study.study:Trial 93 finished with value: 0.06962687522172928 and parameters: {'n_max': 302, 'n_layers': 4, 'n_out': 3, 'mean_type': 'constant', 'kernel_type': 'matern1.5', 'lr': 0.055950677807650326, 'batch_size': 2048, 'num_inducing': 344, 'initialize_fe': True, 'minit': 'random'}. Best is trial 0 with value: 0.06891942769289017.
INFO:root:After model training
INFO:root:33.3974609375
INFO:root:108.0
INFO:optuna.study.study:Trial 94 finished with value: 0.07128914445638657 and parameters: {'n_max': 98, 'n_layers': 4, 'n_out': 3, 'mean_type': 'constant', 'kernel_type': 'matern1.5', 'lr': 0.05376925029625969, 'batch_size': 2048, 'num_inducing': 264, 'initialize_fe': True, 'minit': 'random'}. Best is trial 0 with value: 0.06891942769289017.
INFO:root:After model training
INFO:root:34.0908203125
INFO:root:108.0
INFO:optuna.study.study:Trial 95 finished with value: 0.08911514282226562 and parameters: {'n_max': 90, 'n_layers': 4, 'n_out': 15, 'mean_type': 'constant', 'kernel_type': 'matern1.5', 'lr': 0.00018466054579844156, 'batch_size': 2048, 'num_inducing': 251, 'initialize_fe': True, 'minit': 'random'}. Best is trial 0 with value: 0.06891942769289017.
INFO:root:After model training
INFO:root:49.30859375
INFO:root:156.0
INFO:optuna.study.study:Trial 96 finished with value: 0.07815410196781158 and parameters: {'n_max': 109, 'n_layers': 4, 'n_out': 3, 'mean_type': 'constant', 'kernel_type': 'matern1.5', 'lr': 0.055002621253146054, 'batch_size': 2048, 'num_inducing': 1327, 'initialize_fe': True, 'minit': 'random'}. Best is trial 0 with value: 0.06891942769289017.
INFO:root:After model training
INFO:root:34.30908203125
INFO:root:108.0
INFO:optuna.study.study:Trial 97 finished with value: 0.0812477320432663 and parameters: {'n_max': 69, 'n_layers': 4, 'n_out': 15, 'mean_type': 'constant', 'kernel_type': 'matern1.5', 'lr': 0.023276748905557115, 'batch_size': 2048, 'num_inducing': 339, 'initialize_fe': True, 'minit': 'random'}. Best is trial 0 with value: 0.06891942769289017.
INFO:root:After model training
INFO:root:25.91748046875
INFO:root:108.0
INFO:optuna.study.study:Trial 98 finished with value: 0.07573894411325455 and parameters: {'n_max': 295, 'n_layers': 4, 'n_out': 12, 'mean_type': 'constant', 'kernel_type': 'rbf', 'lr': 0.015091979674616434, 'batch_size': 1024, 'num_inducing': 173, 'initialize_fe': True, 'minit': 'random'}. Best is trial 0 with value: 0.06891942769289017.
INFO:root:After model training
INFO:root:46.36181640625
INFO:root:140.0
INFO:optuna.study.study:Trial 99 finished with value: 0.06990799307823181 and parameters: {'n_max': 251, 'n_layers': 4, 'n_out': 9, 'mean_type': 'constant', 'kernel_type': 'matern1.5', 'lr': 0.04893667032513406, 'batch_size': 2048, 'num_inducing': 1171, 'initialize_fe': True, 'minit': 'random'}. Best is trial 0 with value: 0.06891942769289017.
INFO:root:Outer Run: 4: MSE - 0.015618445351719856, MAE - 0.10304802656173706. MAX - 0.34766125679016113
INFO:optuna.storages._in_memory:A new study created in memory with name: Nested Resampling VDKL 5
INFO:root:After model training
INFO:root:62.5859375
INFO:root:130.0
INFO:optuna.study.study:Trial 0 finished with value: 0.07445996254682541 and parameters: {'n_max': 1024, 'n_layers': 4, 'n_out': 2, 'mean_type': 'constant', 'kernel_type': 'rbf', 'lr': 0.01, 'batch_size': 512, 'num_inducing': 1000, 'initialize_fe': False, 'minit': 'kmeans'}. Best is trial 0 with value: 0.07445996254682541.
INFO:root:After model training
INFO:root:61.0419921875
INFO:root:126.0
INFO:optuna.study.study:Trial 1 finished with value: 0.07589487731456757 and parameters: {'n_max': 831, 'n_layers': 4, 'n_out': 9, 'mean_type': 'constant', 'kernel_type': 'matern0.5', 'lr': 0.041340558146535436, 'batch_size': 1024, 'num_inducing': 902, 'initialize_fe': True, 'minit': 'kmeans'}. Best is trial 0 with value: 0.07445996254682541.
INFO:root:After model training
INFO:root:71.4697265625
INFO:root:156.0
INFO:optuna.study.study:Trial 2 finished with value: 0.12153446674346924 and parameters: {'n_max': 254, 'n_layers': 3, 'n_out': 7, 'mean_type': 'linear', 'kernel_type': 'matern0.5', 'lr': 0.003222708903446496, 'batch_size': 2048, 'num_inducing': 961, 'initialize_fe': False, 'minit': 'kmeans'}. Best is trial 0 with value: 0.07445996254682541.
INFO:root:After model training
INFO:root:55.1279296875
INFO:root:128.0
INFO:optuna.study.study:Trial 3 finished with value: 0.12543758749961853 and parameters: {'n_max': 515, 'n_layers': 2, 'n_out': 16, 'mean_type': 'linear', 'kernel_type': 'matern0.5', 'lr': 0.00015207224840725384, 'batch_size': 512, 'num_inducing': 475, 'initialize_fe': True, 'minit': 'kmeans'}. Best is trial 0 with value: 0.07445996254682541.
INFO:root:After model training
INFO:root:54.5341796875
INFO:root:128.0
INFO:optuna.study.study:Trial 4 finished with value: 0.11335355043411255 and parameters: {'n_max': 400, 'n_layers': 4, 'n_out': 5, 'mean_type': 'linear', 'kernel_type': 'matern1.5', 'lr': 0.010587832404361024, 'batch_size': 512, 'num_inducing': 160, 'initialize_fe': True, 'minit': 'kmeans'}. Best is trial 0 with value: 0.07445996254682541.
INFO:root:After model training
INFO:root:64.755859375
INFO:root:124.0
INFO:optuna.study.study:Trial 5 finished with value: 0.11798237264156342 and parameters: {'n_max': 219, 'n_layers': 4, 'n_out': 9, 'mean_type': 'linear', 'kernel_type': 'rbf', 'lr': 0.0011668898413416476, 'batch_size': 2048, 'num_inducing': 383, 'initialize_fe': False, 'minit': 'random'}. Best is trial 0 with value: 0.07445996254682541.
INFO:root:After model training
INFO:root:64.5615234375
INFO:root:126.0
INFO:optuna.study.study:Trial 6 finished with value: 0.0770585834980011 and parameters: {'n_max': 173, 'n_layers': 3, 'n_out': 3, 'mean_type': 'constant', 'kernel_type': 'rbf', 'lr': 0.0022779597864216366, 'batch_size': 512, 'num_inducing': 1543, 'initialize_fe': True, 'minit': 'kmeans'}. Best is trial 0 with value: 0.07445996254682541.
INFO:root:After model training
INFO:root:54.4697265625
INFO:root:132.0
INFO:optuna.study.study:Trial 7 finished with value: 0.12846873700618744 and parameters: {'n_max': 172, 'n_layers': 5, 'n_out': 14, 'mean_type': 'linear', 'kernel_type': 'matern1.5', 'lr': 0.0003773808544293523, 'batch_size': 512, 'num_inducing': 280, 'initialize_fe': True, 'minit': 'kmeans'}. Best is trial 0 with value: 0.07445996254682541.
INFO:root:After model training
INFO:root:56.80029296875
INFO:root:128.0
INFO:optuna.study.study:Trial 8 finished with value: 0.10555882751941681 and parameters: {'n_max': 1016, 'n_layers': 3, 'n_out': 5, 'mean_type': 'linear', 'kernel_type': 'matern0.5', 'lr': 0.05715076146623279, 'batch_size': 512, 'num_inducing': 410, 'initialize_fe': False, 'minit': 'kmeans'}. Best is trial 0 with value: 0.07445996254682541.
INFO:root:After model training
INFO:root:62.84228515625
INFO:root:128.0
INFO:optuna.study.study:Trial 9 finished with value: 0.09488314390182495 and parameters: {'n_max': 587, 'n_layers': 4, 'n_out': 5, 'mean_type': 'constant', 'kernel_type': 'matern0.5', 'lr': 0.04288426846152445, 'batch_size': 512, 'num_inducing': 1305, 'initialize_fe': True, 'minit': 'kmeans'}. Best is trial 0 with value: 0.07445996254682541.
INFO:root:After model training
INFO:root:56.80419921875
INFO:root:126.0
INFO:optuna.study.study:Trial 10 finished with value: 0.07450578361749649 and parameters: {'n_max': 783, 'n_layers': 5, 'n_out': 20, 'mean_type': 'constant', 'kernel_type': 'rbf', 'lr': 0.011095568893278406, 'batch_size': 1024, 'num_inducing': 55, 'initialize_fe': False, 'minit': 'random'}. Best is trial 0 with value: 0.07445996254682541.
INFO:root:After model training
INFO:root:57.46826171875
INFO:root:124.0
INFO:optuna.study.study:Trial 11 finished with value: 0.0780102014541626 and parameters: {'n_max': 861, 'n_layers': 5, 'n_out': 20, 'mean_type': 'constant', 'kernel_type': 'rbf', 'lr': 0.011465005712936129, 'batch_size': 1024, 'num_inducing': 58, 'initialize_fe': False, 'minit': 'random'}. Best is trial 0 with value: 0.07445996254682541.
INFO:root:After model training
INFO:root:58.7783203125
INFO:root:126.0
INFO:optuna.study.study:Trial 12 finished with value: 0.07857472449541092 and parameters: {'n_max': 1015, 'n_layers': 5, 'n_out': 13, 'mean_type': 'constant', 'kernel_type': 'rbf', 'lr': 0.011728015086433435, 'batch_size': 1024, 'num_inducing': 54, 'initialize_fe': False, 'minit': 'random'}. Best is trial 0 with value: 0.07445996254682541.
INFO:root:After model training
INFO:root:56.71484375
INFO:root:126.0
INFO:optuna.study.study:Trial 13 finished with value: 0.07478981465101242 and parameters: {'n_max': 760, 'n_layers': 5, 'n_out': 20, 'mean_type': 'constant', 'kernel_type': 'rbf', 'lr': 0.006104726047142104, 'batch_size': 1024, 'num_inducing': 104, 'initialize_fe': False, 'minit': 'random'}. Best is trial 0 with value: 0.07445996254682541.
INFO:root:After model training
INFO:root:56.3701171875
INFO:root:128.0
INFO:optuna.study.study:Trial 14 finished with value: 0.07045677304267883 and parameters: {'n_max': 693, 'n_layers': 5, 'n_out': 17, 'mean_type': 'constant', 'kernel_type': 'rbf', 'lr': 0.02101048899836911, 'batch_size': 1024, 'num_inducing': 169, 'initialize_fe': False, 'minit': 'random'}. Best is trial 14 with value: 0.07045677304267883.
INFO:root:After model training
INFO:root:62.4345703125
INFO:root:128.0
INFO:optuna.study.study:Trial 15 finished with value: 0.07648605853319168 and parameters: {'n_max': 647, 'n_layers': 4, 'n_out': 17, 'mean_type': 'constant', 'kernel_type': 'rbf', 'lr': 0.023545883884677654, 'batch_size': 2048, 'num_inducing': 215, 'initialize_fe': False, 'minit': 'random'}. Best is trial 14 with value: 0.07045677304267883.
INFO:root:After model training
INFO:root:55.603515625
INFO:root:130.0
INFO:optuna.study.study:Trial 16 finished with value: 0.06854934990406036 and parameters: {'n_max': 403, 'n_layers': 2, 'n_out': 2, 'mean_type': 'constant', 'kernel_type': 'rbf', 'lr': 0.09477475672875721, 'batch_size': 1024, 'num_inducing': 574, 'initialize_fe': False, 'minit': 'random'}. Best is trial 16 with value: 0.06854934990406036.
INFO:root:After model training
INFO:root:55.9296875
INFO:root:124.0
INFO:optuna.study.study:Trial 17 finished with value: 0.08267548680305481 and parameters: {'n_max': 393, 'n_layers': 2, 'n_out': 11, 'mean_type': 'constant', 'kernel_type': 'matern1.5', 'lr': 0.08845448004672281, 'batch_size': 1024, 'num_inducing': 629, 'initialize_fe': False, 'minit': 'random'}. Best is trial 16 with value: 0.06854934990406036.
INFO:root:After model training
INFO:root:53.91650390625
INFO:root:128.0
INFO:optuna.study.study:Trial 18 finished with value: 0.0750574991106987 and parameters: {'n_max': 435, 'n_layers': 2, 'n_out': 17, 'mean_type': 'constant', 'kernel_type': 'rbf', 'lr': 0.09526779208776294, 'batch_size': 1024, 'num_inducing': 118, 'initialize_fe': False, 'minit': 'random'}. Best is trial 16 with value: 0.06854934990406036.
INFO:root:After model training
INFO:root:54.16064453125
INFO:root:128.0
INFO:optuna.study.study:Trial 19 finished with value: 0.07669724524021149 and parameters: {'n_max': 73, 'n_layers': 3, 'n_out': 13, 'mean_type': 'constant', 'kernel_type': 'rbf', 'lr': 0.019870017532232078, 'batch_size': 1024, 'num_inducing': 226, 'initialize_fe': False, 'minit': 'random'}. Best is trial 16 with value: 0.06854934990406036.
INFO:root:After model training
INFO:root:55.80126953125
INFO:root:124.0
