INFO:optuna.study.study:Trial 24 finished with value: 0.0010085360845550895 and parameters: {'n_max': 691, 'n_layers': 5, 'n_out': 5, 'mean_type': 'constant', 'kernel_type': 'rbf', 'lr': 0.027087612597284736, 'batch_size': 512, 'num_inducing': 417, 'initialize_fe': True, 'minit': 'random'}. Best is trial 15 with value: 0.00013297305849846452.
INFO:root:After model training
INFO:root:6.2060546875
INFO:root:26.0
INFO:optuna.study.study:Trial 25 finished with value: 0.0001499541540397331 and parameters: {'n_max': 875, 'n_layers': 3, 'n_out': 9, 'mean_type': 'constant', 'kernel_type': 'rbf', 'lr': 0.005321330409759731, 'batch_size': 512, 'num_inducing': 744, 'initialize_fe': True, 'minit': 'random'}. Best is trial 15 with value: 0.00013297305849846452.
INFO:root:After model training
INFO:root:5.91650390625
INFO:root:32.0
INFO:optuna.study.study:Trial 26 finished with value: 0.0004637298407033086 and parameters: {'n_max': 631, 'n_layers': 3, 'n_out': 13, 'mean_type': 'constant', 'kernel_type': 'rbf', 'lr': 0.018076892557631882, 'batch_size': 512, 'num_inducing': 803, 'initialize_fe': True, 'minit': 'random'}. Best is trial 15 with value: 0.00013297305849846452.
INFO:root:After model training
INFO:root:3.9482421875
INFO:root:28.0
INFO:optuna.study.study:Trial 27 finished with value: 0.004655550699681044 and parameters: {'n_max': 478, 'n_layers': 3, 'n_out': 10, 'mean_type': 'linear', 'kernel_type': 'matern1.5', 'lr': 0.003967214998071804, 'batch_size': 1024, 'num_inducing': 542, 'initialize_fe': True, 'minit': 'random'}. Best is trial 15 with value: 0.00013297305849846452.
INFO:root:After model training
INFO:root:3.7568359375
INFO:root:32.0
INFO:optuna.study.study:Trial 28 finished with value: 0.0003372116480022669 and parameters: {'n_max': 856, 'n_layers': 3, 'n_out': 10, 'mean_type': 'constant', 'kernel_type': 'matern0.5', 'lr': 0.0011719868528951424, 'batch_size': 512, 'num_inducing': 261, 'initialize_fe': True, 'minit': 'kmeans'}. Best is trial 15 with value: 0.00013297305849846452.
INFO:root:After model training
INFO:root:16.26904296875
INFO:root:64.0
INFO:optuna.study.study:Trial 29 finished with value: 0.0008789029670879245 and parameters: {'n_max': 746, 'n_layers': 2, 'n_out': 15, 'mean_type': 'constant', 'kernel_type': 'rbf', 'lr': 0.01595958562064001, 'batch_size': 2048, 'num_inducing': 781, 'initialize_fe': True, 'minit': 'random'}. Best is trial 15 with value: 0.00013297305849846452.
INFO:root:After model training
INFO:root:4.5517578125
INFO:root:18.0
INFO:optuna.study.study:Trial 30 finished with value: 0.0001768361107679084 and parameters: {'n_max': 596, 'n_layers': 4, 'n_out': 9, 'mean_type': 'constant', 'kernel_type': 'rbf', 'lr': 0.006362577544821024, 'batch_size': 512, 'num_inducing': 508, 'initialize_fe': True, 'minit': 'random'}. Best is trial 15 with value: 0.00013297305849846452.
INFO:root:After model training
INFO:root:12.22216796875
INFO:root:28.0
INFO:optuna.study.study:Trial 31 finished with value: 0.0001830279070418328 and parameters: {'n_max': 863, 'n_layers': 4, 'n_out': 6, 'mean_type': 'constant', 'kernel_type': 'rbf', 'lr': 0.005072472966637919, 'batch_size': 512, 'num_inducing': 1300, 'initialize_fe': True, 'minit': 'random'}. Best is trial 15 with value: 0.00013297305849846452.
INFO:root:After model training
INFO:root:8.125
INFO:root:28.0
INFO:optuna.study.study:Trial 32 finished with value: 0.00011679909948725253 and parameters: {'n_max': 909, 'n_layers': 4, 'n_out': 12, 'mean_type': 'constant', 'kernel_type': 'rbf', 'lr': 0.002186245545954635, 'batch_size': 512, 'num_inducing': 822, 'initialize_fe': True, 'minit': 'random'}. Best is trial 32 with value: 0.00011679909948725253.
INFO:root:After model training
INFO:root:7.13623046875
INFO:root:28.0
INFO:optuna.study.study:Trial 33 finished with value: 0.00015723011165391654 and parameters: {'n_max': 921, 'n_layers': 3, 'n_out': 13, 'mean_type': 'constant', 'kernel_type': 'rbf', 'lr': 0.002692372865192358, 'batch_size': 512, 'num_inducing': 849, 'initialize_fe': True, 'minit': 'random'}. Best is trial 32 with value: 0.00011679909948725253.
INFO:root:After model training
INFO:root:4.32177734375
INFO:root:26.0
INFO:optuna.study.study:Trial 34 finished with value: 0.0007971922168508172 and parameters: {'n_max': 950, 'n_layers': 3, 'n_out': 14, 'mean_type': 'linear', 'kernel_type': 'matern1.5', 'lr': 0.0020446619280309708, 'batch_size': 512, 'num_inducing': 327, 'initialize_fe': True, 'minit': 'random'}. Best is trial 32 with value: 0.00011679909948725253.
INFO:root:After model training
INFO:root:8.10400390625
INFO:root:28.0
INFO:optuna.study.study:Trial 35 finished with value: 0.00019705883460119367 and parameters: {'n_max': 709, 'n_layers': 4, 'n_out': 12, 'mean_type': 'constant', 'kernel_type': 'rbf', 'lr': 0.0007456117778292102, 'batch_size': 512, 'num_inducing': 960, 'initialize_fe': True, 'minit': 'random'}. Best is trial 32 with value: 0.00011679909948725253.
INFO:root:After model training
INFO:root:7.04052734375
INFO:root:34.0
INFO:optuna.study.study:Trial 36 finished with value: 0.00029188540065661073 and parameters: {'n_max': 780, 'n_layers': 5, 'n_out': 16, 'mean_type': 'constant', 'kernel_type': 'rbf', 'lr': 0.0010035539292000996, 'batch_size': 512, 'num_inducing': 642, 'initialize_fe': True, 'minit': 'random'}. Best is trial 32 with value: 0.00011679909948725253.
INFO:root:After model training
INFO:root:6.2919921875
INFO:root:32.0
INFO:optuna.study.study:Trial 37 finished with value: 0.0021230133716017008 and parameters: {'n_max': 949, 'n_layers': 4, 'n_out': 12, 'mean_type': 'linear', 'kernel_type': 'matern1.5', 'lr': 0.0037567511627293764, 'batch_size': 1024, 'num_inducing': 478, 'initialize_fe': False, 'minit': 'random'}. Best is trial 32 with value: 0.00011679909948725253.
INFO:root:After model training
INFO:root:3.4345703125
INFO:root:12.0
INFO:optuna.study.study:Trial 38 finished with value: 0.00013634326751343906 and parameters: {'n_max': 600, 'n_layers': 3, 'n_out': 9, 'mean_type': 'constant', 'kernel_type': 'rbf', 'lr': 0.007875124141982362, 'batch_size': 512, 'num_inducing': 376, 'initialize_fe': True, 'minit': 'kmeans'}. Best is trial 32 with value: 0.00011679909948725253.
INFO:root:After model training
INFO:root:12.32666015625
INFO:root:62.0
INFO:optuna.study.study:Trial 39 finished with value: 0.016918331384658813 and parameters: {'n_max': 599, 'n_layers': 5, 'n_out': 7, 'mean_type': 'linear', 'kernel_type': 'rbf', 'lr': 0.00034016178456809984, 'batch_size': 2048, 'num_inducing': 343, 'initialize_fe': False, 'minit': 'kmeans'}. Best is trial 32 with value: 0.00011679909948725253.
INFO:root:After model training
INFO:root:2.462890625
INFO:root:8.0
INFO:optuna.study.study:Trial 40 finished with value: 0.002159574069082737 and parameters: {'n_max': 499, 'n_layers': 3, 'n_out': 17, 'mean_type': 'constant', 'kernel_type': 'matern0.5', 'lr': 0.00016931431478837028, 'batch_size': 1024, 'num_inducing': 119, 'initialize_fe': True, 'minit': 'kmeans'}. Best is trial 32 with value: 0.00011679909948725253.
INFO:root:After model training
INFO:root:5.04931640625
INFO:root:28.0
INFO:optuna.study.study:Trial 41 finished with value: 0.00023580159177072346 and parameters: {'n_max': 696, 'n_layers': 3, 'n_out': 9, 'mean_type': 'constant', 'kernel_type': 'rbf', 'lr': 0.008085384090207115, 'batch_size': 512, 'num_inducing': 649, 'initialize_fe': True, 'minit': 'kmeans'}. Best is trial 32 with value: 0.00011679909948725253.
INFO:root:After model training
INFO:root:7.05615234375
INFO:root:30.0
INFO:optuna.study.study:Trial 42 finished with value: 0.00024342055257875472 and parameters: {'n_max': 563, 'n_layers': 3, 'n_out': 9, 'mean_type': 'constant', 'kernel_type': 'rbf', 'lr': 0.014011418517580445, 'batch_size': 512, 'num_inducing': 969, 'initialize_fe': True, 'minit': 'kmeans'}. Best is trial 32 with value: 0.00011679909948725253.
INFO:root:After model training
INFO:root:4.5712890625
INFO:root:28.0
INFO:optuna.study.study:Trial 43 finished with value: 0.0001332314423052594 and parameters: {'n_max': 973, 'n_layers': 3, 'n_out': 12, 'mean_type': 'constant', 'kernel_type': 'rbf', 'lr': 0.0025687787310242774, 'batch_size': 512, 'num_inducing': 373, 'initialize_fe': True, 'minit': 'kmeans'}. Best is trial 32 with value: 0.00011679909948725253.
INFO:root:After model training
INFO:root:5.5
INFO:root:28.0
INFO:optuna.study.study:Trial 44 finished with value: 0.00017824064707383513 and parameters: {'n_max': 961, 'n_layers': 4, 'n_out': 12, 'mean_type': 'constant', 'kernel_type': 'rbf', 'lr': 0.002062711022157091, 'batch_size': 512, 'num_inducing': 256, 'initialize_fe': True, 'minit': 'kmeans'}. Best is trial 32 with value: 0.00011679909948725253.
INFO:root:After model training
INFO:root:2.873046875
INFO:root:6.0
INFO:optuna.study.study:Trial 45 finished with value: 0.00024290198052767664 and parameters: {'n_max': 1013, 'n_layers': 2, 'n_out': 14, 'mean_type': 'constant', 'kernel_type': 'matern1.5', 'lr': 0.002647770112602629, 'batch_size': 512, 'num_inducing': 397, 'initialize_fe': False, 'minit': 'kmeans'}. Best is trial 32 with value: 0.00011679909948725253.
INFO:root:After model training
INFO:root:2.9619140625
INFO:root:12.0
INFO:optuna.study.study:Trial 46 finished with value: 0.00020054468768648803 and parameters: {'n_max': 524, 'n_layers': 3, 'n_out': 11, 'mean_type': 'constant', 'kernel_type': 'rbf', 'lr': 0.009410073133495704, 'batch_size': 512, 'num_inducing': 290, 'initialize_fe': True, 'minit': 'kmeans'}. Best is trial 32 with value: 0.00011679909948725253.
INFO:root:After model training
INFO:root:2.74365234375
INFO:root:14.0
INFO:optuna.study.study:Trial 47 finished with value: 0.00027088256319984794 and parameters: {'n_max': 395, 'n_layers': 4, 'n_out': 14, 'mean_type': 'constant', 'kernel_type': 'matern0.5', 'lr': 0.007372325036317453, 'batch_size': 512, 'num_inducing': 216, 'initialize_fe': True, 'minit': 'kmeans'}. Best is trial 32 with value: 0.00011679909948725253.
INFO:root:After model training
INFO:root:4.279296875
INFO:root:26.0
INFO:optuna.study.study:Trial 48 finished with value: 0.0009431839571334422 and parameters: {'n_max': 815, 'n_layers': 3, 'n_out': 12, 'mean_type': 'constant', 'kernel_type': 'rbf', 'lr': 0.0006959379478429891, 'batch_size': 1024, 'num_inducing': 433, 'initialize_fe': True, 'minit': 'kmeans'}. Best is trial 32 with value: 0.00011679909948725253.
INFO:root:After model training
INFO:root:5.42236328125
INFO:root:32.0
INFO:optuna.study.study:Trial 49 finished with value: 0.0001601570111233741 and parameters: {'n_max': 903, 'n_layers': 4, 'n_out': 7, 'mean_type': 'constant', 'kernel_type': 'rbf', 'lr': 0.003443282945968362, 'batch_size': 512, 'num_inducing': 348, 'initialize_fe': False, 'minit': 'kmeans'}. Best is trial 32 with value: 0.00011679909948725253.
INFO:root:After model training
INFO:root:16.47021484375
INFO:root:80.0
INFO:optuna.study.study:Trial 50 finished with value: 0.01629582606256008 and parameters: {'n_max': 753, 'n_layers': 5, 'n_out': 11, 'mean_type': 'linear', 'kernel_type': 'rbf', 'lr': 0.00172504099531234, 'batch_size': 2048, 'num_inducing': 604, 'initialize_fe': True, 'minit': 'kmeans'}. Best is trial 32 with value: 0.00011679909948725253.
INFO:root:After model training
INFO:root:6.43896484375
INFO:root:26.0
INFO:optuna.study.study:Trial 51 finished with value: 0.00010282052971888334 and parameters: {'n_max': 983, 'n_layers': 3, 'n_out': 8, 'mean_type': 'constant', 'kernel_type': 'rbf', 'lr': 0.004559615177677537, 'batch_size': 512, 'num_inducing': 721, 'initialize_fe': True, 'minit': 'random'}. Best is trial 51 with value: 0.00010282052971888334.
INFO:root:After model training
INFO:root:10.30859375
INFO:root:26.0
INFO:optuna.study.study:Trial 52 finished with value: 0.00011467224976513535 and parameters: {'n_max': 994, 'n_layers': 3, 'n_out': 8, 'mean_type': 'constant', 'kernel_type': 'rbf', 'lr': 0.010821271412600118, 'batch_size': 512, 'num_inducing': 1179, 'initialize_fe': True, 'minit': 'random'}. Best is trial 51 with value: 0.00010282052971888334.
INFO:root:After model training
INFO:root:11.08349609375
INFO:root:28.0
INFO:optuna.study.study:Trial 53 finished with value: 0.00018342756084166467 and parameters: {'n_max': 976, 'n_layers': 3, 'n_out': 8, 'mean_type': 'constant', 'kernel_type': 'rbf', 'lr': 0.012698117720751956, 'batch_size': 512, 'num_inducing': 1260, 'initialize_fe': True, 'minit': 'kmeans'}. Best is trial 51 with value: 0.00010282052971888334.
INFO:root:After model training
INFO:root:15.3369140625
INFO:root:48.0
INFO:optuna.study.study:Trial 54 finished with value: 0.0004422103811521083 and parameters: {'n_max': 1015, 'n_layers': 3, 'n_out': 8, 'mean_type': 'constant', 'kernel_type': 'rbf', 'lr': 0.02857150943104047, 'batch_size': 512, 'num_inducing': 1601, 'initialize_fe': True, 'minit': 'random'}. Best is trial 51 with value: 0.00010282052971888334.
INFO:root:After model training
INFO:root:9.0498046875
INFO:root:28.0
INFO:optuna.study.study:Trial 55 finished with value: 0.00030719954520463943 and parameters: {'n_max': 919, 'n_layers': 3, 'n_out': 6, 'mean_type': 'constant', 'kernel_type': 'rbf', 'lr': 0.01985238600537697, 'batch_size': 512, 'num_inducing': 1079, 'initialize_fe': True, 'minit': 'kmeans'}. Best is trial 51 with value: 0.00010282052971888334.
INFO:root:After model training
INFO:root:3.18994140625
INFO:root:12.0
INFO:optuna.study.study:Trial 56 finished with value: 0.0014385869726538658 and parameters: {'n_max': 978, 'n_layers': 2, 'n_out': 3, 'mean_type': 'constant', 'kernel_type': 'rbf', 'lr': 0.04903365261310981, 'batch_size': 512, 'num_inducing': 478, 'initialize_fe': True, 'minit': 'random'}. Best is trial 51 with value: 0.00010282052971888334.
INFO:root:After model training
INFO:root:6.34130859375
INFO:root:28.0
INFO:optuna.study.study:Trial 57 finished with value: 0.00020301324548199773 and parameters: {'n_max': 1021, 'n_layers': 3, 'n_out': 10, 'mean_type': 'constant', 'kernel_type': 'rbf', 'lr': 0.009071590022364106, 'batch_size': 512, 'num_inducing': 682, 'initialize_fe': True, 'minit': 'kmeans'}. Best is trial 51 with value: 0.00010282052971888334.
INFO:root:After model training
INFO:root:5.46435546875
INFO:root:30.0
INFO:optuna.study.study:Trial 58 finished with value: 0.0004686534812208265 and parameters: {'n_max': 987, 'n_layers': 3, 'n_out': 20, 'mean_type': 'constant', 'kernel_type': 'matern0.5', 'lr': 0.00484475671081932, 'batch_size': 512, 'num_inducing': 547, 'initialize_fe': True, 'minit': 'random'}. Best is trial 51 with value: 0.00010282052971888334.
INFO:root:After model training
INFO:root:6.2880859375
INFO:root:26.0
INFO:optuna.study.study:Trial 59 finished with value: 6.413160735974088e-05 and parameters: {'n_max': 930, 'n_layers': 2, 'n_out': 6, 'mean_type': 'constant', 'kernel_type': 'rbf', 'lr': 0.0029324123323659175, 'batch_size': 512, 'num_inducing': 949, 'initialize_fe': True, 'minit': 'kmeans'}. Best is trial 59 with value: 6.413160735974088e-05.
INFO:root:After model training
INFO:root:31.7763671875
INFO:root:52.0
INFO:optuna.study.study:Trial 60 finished with value: 0.0004948395071551204 and parameters: {'n_max': 831, 'n_layers': 2, 'n_out': 4, 'mean_type': 'constant', 'kernel_type': 'matern1.5', 'lr': 0.0013054619678064961, 'batch_size': 2048, 'num_inducing': 1637, 'initialize_fe': False, 'minit': 'random'}. Best is trial 59 with value: 6.413160735974088e-05.
INFO:root:After model training
INFO:root:8.453125
INFO:root:28.0
INFO:optuna.study.study:Trial 61 finished with value: 0.0001429964177077636 and parameters: {'n_max': 891, 'n_layers': 2, 'n_out': 7, 'mean_type': 'constant', 'kernel_type': 'rbf', 'lr': 0.0027730114823131275, 'batch_size': 512, 'num_inducing': 1183, 'initialize_fe': True, 'minit': 'kmeans'}. Best is trial 59 with value: 6.413160735974088e-05.
INFO:root:After model training
INFO:root:6.59423828125
INFO:root:26.0
INFO:optuna.study.study:Trial 62 finished with value: 0.00011311088019283488 and parameters: {'n_max': 930, 'n_layers': 2, 'n_out': 6, 'mean_type': 'constant', 'kernel_type': 'rbf', 'lr': 0.00429409230970073, 'batch_size': 512, 'num_inducing': 985, 'initialize_fe': True, 'minit': 'kmeans'}. Best is trial 59 with value: 6.413160735974088e-05.
INFO:root:After model training
INFO:root:6.27197265625
INFO:root:26.0
INFO:optuna.study.study:Trial 63 finished with value: 9.42436236073263e-05 and parameters: {'n_max': 921, 'n_layers': 2, 'n_out': 6, 'mean_type': 'constant', 'kernel_type': 'rbf', 'lr': 0.0033784792653427974, 'batch_size': 512, 'num_inducing': 947, 'initialize_fe': True, 'minit': 'kmeans'}. Best is trial 59 with value: 6.413160735974088e-05.
INFO:root:After model training
INFO:root:5.76123046875
INFO:root:28.0
INFO:optuna.study.study:Trial 64 finished with value: 0.00014311693666968495 and parameters: {'n_max': 925, 'n_layers': 2, 'n_out': 6, 'mean_type': 'constant', 'kernel_type': 'rbf', 'lr': 0.0043420795252976565, 'batch_size': 512, 'num_inducing': 884, 'initialize_fe': True, 'minit': 'kmeans'}. Best is trial 59 with value: 6.413160735974088e-05.
INFO:root:After model training
INFO:root:6.77294921875
INFO:root:28.0
INFO:optuna.study.study:Trial 65 finished with value: 0.00017147918697446585 and parameters: {'n_max': 884, 'n_layers': 2, 'n_out': 3, 'mean_type': 'constant', 'kernel_type': 'rbf', 'lr': 0.006228813629942123, 'batch_size': 512, 'num_inducing': 1007, 'initialize_fe': True, 'minit': 'kmeans'}. Best is trial 59 with value: 6.413160735974088e-05.
INFO:root:After model training
INFO:root:4.50732421875
INFO:root:26.0
INFO:optuna.study.study:Trial 66 finished with value: 0.00021415523951873183 and parameters: {'n_max': 791, 'n_layers': 2, 'n_out': 5, 'mean_type': 'constant', 'kernel_type': 'rbf', 'lr': 0.003187002527996859, 'batch_size': 512, 'num_inducing': 711, 'initialize_fe': True, 'minit': 'random'}. Best is trial 59 with value: 6.413160735974088e-05.
INFO:root:After model training
INFO:root:8.1650390625
INFO:root:28.0
INFO:optuna.study.study:Trial 67 finished with value: 9.191785647999495e-05 and parameters: {'n_max': 933, 'n_layers': 2, 'n_out': 4, 'mean_type': 'constant', 'kernel_type': 'rbf', 'lr': 0.0021092737250550616, 'batch_size': 512, 'num_inducing': 1155, 'initialize_fe': True, 'minit': 'kmeans'}. Best is trial 59 with value: 6.413160735974088e-05.
INFO:root:After model training
INFO:root:7.728515625
INFO:root:28.0
INFO:optuna.study.study:Trial 68 finished with value: 0.00047976113273762167 and parameters: {'n_max': 842, 'n_layers': 2, 'n_out': 6, 'mean_type': 'constant', 'kernel_type': 'rbf', 'lr': 0.00204331699589759, 'batch_size': 1024, 'num_inducing': 1110, 'initialize_fe': True, 'minit': 'kmeans'}. Best is trial 59 with value: 6.413160735974088e-05.
INFO:root:After model training
INFO:root:18.93505859375
INFO:root:36.0
INFO:optuna.study.study:Trial 69 finished with value: 0.00026639035786502063 and parameters: {'n_max': 940, 'n_layers': 2, 'n_out': 7, 'mean_type': 'linear', 'kernel_type': 'rbf', 'lr': 0.0009270627207623013, 'batch_size': 512, 'num_inducing': 1976, 'initialize_fe': True, 'minit': 'random'}. Best is trial 59 with value: 6.413160735974088e-05.
INFO:root:After model training
INFO:root:10.01806640625
INFO:root:28.0
INFO:optuna.study.study:Trial 70 finished with value: 0.00012443157902453095 and parameters: {'n_max': 909, 'n_layers': 2, 'n_out': 4, 'mean_type': 'constant', 'kernel_type': 'rbf', 'lr': 0.0016428770955041823, 'batch_size': 512, 'num_inducing': 1330, 'initialize_fe': True, 'minit': 'random'}. Best is trial 59 with value: 6.413160735974088e-05.
INFO:root:After model training
INFO:root:10.94384765625
INFO:root:28.0
INFO:optuna.study.study:Trial 71 finished with value: 9.899373253574595e-05 and parameters: {'n_max': 915, 'n_layers': 2, 'n_out': 4, 'mean_type': 'constant', 'kernel_type': 'rbf', 'lr': 0.001635978391533552, 'batch_size': 512, 'num_inducing': 1410, 'initialize_fe': True, 'minit': 'random'}. Best is trial 59 with value: 6.413160735974088e-05.
INFO:root:After model training
INFO:root:11.17138671875
INFO:root:28.0
INFO:optuna.study.study:Trial 72 finished with value: 0.0002628493821248412 and parameters: {'n_max': 867, 'n_layers': 2, 'n_out': 5, 'mean_type': 'constant', 'kernel_type': 'rbf', 'lr': 0.0021595897645270753, 'batch_size': 512, 'num_inducing': 1429, 'initialize_fe': True, 'minit': 'random'}. Best is trial 59 with value: 6.413160735974088e-05.
INFO:root:After model training
INFO:root:5.8994140625
INFO:root:28.0
INFO:optuna.study.study:Trial 73 finished with value: 0.00011505935981404036 and parameters: {'n_max': 989, 'n_layers': 2, 'n_out': 2, 'mean_type': 'constant', 'kernel_type': 'rbf', 'lr': 0.0032753581349585894, 'batch_size': 512, 'num_inducing': 903, 'initialize_fe': True, 'minit': 'random'}. Best is trial 59 with value: 6.413160735974088e-05.
INFO:root:After model training
INFO:root:14.2685546875
INFO:root:20.0
INFO:optuna.study.study:Trial 74 finished with value: 0.0001565949060022831 and parameters: {'n_max': 996, 'n_layers': 2, 'n_out': 2, 'mean_type': 'constant', 'kernel_type': 'rbf', 'lr': 0.0032213148995226593, 'batch_size': 512, 'num_inducing': 1669, 'initialize_fe': True, 'minit': 'random'}. Best is trial 59 with value: 6.413160735974088e-05.
INFO:root:After model training
INFO:root:6.080078125
INFO:root:26.0
INFO:optuna.study.study:Trial 75 finished with value: 0.0001400501496391371 and parameters: {'n_max': 943, 'n_layers': 2, 'n_out': 3, 'mean_type': 'constant', 'kernel_type': 'rbf', 'lr': 0.004244730302711968, 'batch_size': 512, 'num_inducing': 925, 'initialize_fe': True, 'minit': 'random'}. Best is trial 59 with value: 6.413160735974088e-05.
INFO:root:After model training
INFO:root:8.33837890625
INFO:root:26.0
