INFO:optuna.study.study:Trial 35 finished with value: 0.00021844913135282695 and parameters: {'n_max': 738, 'n_layers': 2, 'n_out': 4, 'mean_type': 'constant', 'kernel_type': 'rbf', 'lr': 0.0007136623401156149, 'batch_size': 512, 'num_inducing': 544, 'initialize_fe': False, 'minit': 'kmeans'}. Best is trial 26 with value: 9.643709927331656e-05.
INFO:root:After model training
INFO:root:23.6103515625
INFO:root:70.0
INFO:optuna.study.study:Trial 36 finished with value: 0.00034449712256900966 and parameters: {'n_max': 926, 'n_layers': 2, 'n_out': 6, 'mean_type': 'constant', 'kernel_type': 'rbf', 'lr': 0.0003144062861578489, 'batch_size': 512, 'num_inducing': 365, 'initialize_fe': True, 'minit': 'kmeans'}. Best is trial 26 with value: 9.643709927331656e-05.
INFO:root:After model training
INFO:root:28.724609375
INFO:root:82.0
INFO:optuna.study.study:Trial 37 finished with value: 0.007589699234813452 and parameters: {'n_max': 1023, 'n_layers': 2, 'n_out': 3, 'mean_type': 'linear', 'kernel_type': 'rbf', 'lr': 0.0015069214068344913, 'batch_size': 2048, 'num_inducing': 54, 'initialize_fe': False, 'minit': 'kmeans'}. Best is trial 26 with value: 9.643709927331656e-05.
INFO:root:After model training
INFO:root:23.12451171875
INFO:root:72.0
INFO:optuna.study.study:Trial 38 finished with value: 0.00011880562669830397 and parameters: {'n_max': 828, 'n_layers': 2, 'n_out': 6, 'mean_type': 'constant', 'kernel_type': 'rbf', 'lr': 0.0026589758445971223, 'batch_size': 512, 'num_inducing': 221, 'initialize_fe': True, 'minit': 'random'}. Best is trial 26 with value: 9.643709927331656e-05.
INFO:root:After model training
INFO:root:22.99951171875
INFO:root:70.0
INFO:optuna.study.study:Trial 39 finished with value: 0.0006716516800224781 and parameters: {'n_max': 836, 'n_layers': 2, 'n_out': 2, 'mean_type': 'constant', 'kernel_type': 'rbf', 'lr': 0.00072104530399457, 'batch_size': 1024, 'num_inducing': 178, 'initialize_fe': True, 'minit': 'random'}. Best is trial 26 with value: 9.643709927331656e-05.
INFO:root:After model training
INFO:root:25.59912109375
INFO:root:72.0
INFO:optuna.study.study:Trial 40 finished with value: 0.0005923290736973286 and parameters: {'n_max': 733, 'n_layers': 4, 'n_out': 8, 'mean_type': 'linear', 'kernel_type': 'rbf', 'lr': 0.0036238084128579007, 'batch_size': 512, 'num_inducing': 276, 'initialize_fe': True, 'minit': 'random'}. Best is trial 26 with value: 9.643709927331656e-05.
INFO:root:After model training
INFO:root:22.80322265625
INFO:root:66.0
INFO:optuna.study.study:Trial 41 finished with value: 0.0002969384950120002 and parameters: {'n_max': 873, 'n_layers': 2, 'n_out': 6, 'mean_type': 'constant', 'kernel_type': 'rbf', 'lr': 0.009064955890522936, 'batch_size': 512, 'num_inducing': 78, 'initialize_fe': True, 'minit': 'random'}. Best is trial 26 with value: 9.643709927331656e-05.
INFO:root:After model training
INFO:root:23.142578125
INFO:root:70.0
INFO:optuna.study.study:Trial 42 finished with value: 0.00017467059660702944 and parameters: {'n_max': 944, 'n_layers': 2, 'n_out': 5, 'mean_type': 'constant', 'kernel_type': 'rbf', 'lr': 0.00255550192484742, 'batch_size': 512, 'num_inducing': 227, 'initialize_fe': True, 'minit': 'random'}. Best is trial 26 with value: 9.643709927331656e-05.
INFO:root:After model training
INFO:root:23.55078125
INFO:root:68.0
INFO:optuna.study.study:Trial 43 finished with value: 0.00013959029456600547 and parameters: {'n_max': 328, 'n_layers': 2, 'n_out': 4, 'mean_type': 'constant', 'kernel_type': 'rbf', 'lr': 0.0030022483951689595, 'batch_size': 512, 'num_inducing': 356, 'initialize_fe': True, 'minit': 'random'}. Best is trial 26 with value: 9.643709927331656e-05.
INFO:root:After model training
INFO:root:22.90966796875
INFO:root:70.0
INFO:optuna.study.study:Trial 44 finished with value: 0.000300996849546209 and parameters: {'n_max': 976, 'n_layers': 2, 'n_out': 6, 'mean_type': 'constant', 'kernel_type': 'matern0.5', 'lr': 0.0013923266448178353, 'batch_size': 512, 'num_inducing': 131, 'initialize_fe': True, 'minit': 'random'}. Best is trial 26 with value: 9.643709927331656e-05.
INFO:root:After model training
INFO:root:52.6875
INFO:root:108.0
INFO:optuna.study.study:Trial 45 finished with value: 0.0009911832166835666 and parameters: {'n_max': 780, 'n_layers': 2, 'n_out': 8, 'mean_type': 'constant', 'kernel_type': 'rbf', 'lr': 0.0037662571914508303, 'batch_size': 2048, 'num_inducing': 1637, 'initialize_fe': False, 'minit': 'kmeans'}. Best is trial 26 with value: 9.643709927331656e-05.
INFO:root:After model training
INFO:root:25.83642578125
INFO:root:70.0
INFO:optuna.study.study:Trial 46 finished with value: 0.0001233090879395604 and parameters: {'n_max': 679, 'n_layers': 5, 'n_out': 3, 'mean_type': 'constant', 'kernel_type': 'rbf', 'lr': 0.002086625448088002, 'batch_size': 512, 'num_inducing': 217, 'initialize_fe': True, 'minit': 'random'}. Best is trial 26 with value: 9.643709927331656e-05.
INFO:root:After model training
INFO:root:25.7861328125
INFO:root:70.0
INFO:optuna.study.study:Trial 47 finished with value: 0.0004256766405887902 and parameters: {'n_max': 648, 'n_layers': 5, 'n_out': 3, 'mean_type': 'constant', 'kernel_type': 'rbf', 'lr': 0.001028132826671169, 'batch_size': 512, 'num_inducing': 227, 'initialize_fe': True, 'minit': 'random'}. Best is trial 26 with value: 9.643709927331656e-05.
INFO:root:After model training
INFO:root:23.5791015625
INFO:root:72.0
INFO:optuna.study.study:Trial 48 finished with value: 0.000798285414930433 and parameters: {'n_max': 343, 'n_layers': 5, 'n_out': 3, 'mean_type': 'linear', 'kernel_type': 'matern0.5', 'lr': 0.00020015187183291145, 'batch_size': 512, 'num_inducing': 187, 'initialize_fe': True, 'minit': 'random'}. Best is trial 26 with value: 9.643709927331656e-05.
INFO:root:After model training
INFO:root:25.12646484375
INFO:root:68.0
INFO:optuna.study.study:Trial 49 finished with value: 0.0001744189066812396 and parameters: {'n_max': 691, 'n_layers': 4, 'n_out': 2, 'mean_type': 'constant', 'kernel_type': 'rbf', 'lr': 0.0019900169504204193, 'batch_size': 512, 'num_inducing': 122, 'initialize_fe': True, 'minit': 'random'}. Best is trial 26 with value: 9.643709927331656e-05.
INFO:root:After model training
INFO:root:26.51953125
INFO:root:74.0
INFO:optuna.study.study:Trial 50 finished with value: 0.00032372702844440937 and parameters: {'n_max': 785, 'n_layers': 5, 'n_out': 17, 'mean_type': 'constant', 'kernel_type': 'rbf', 'lr': 0.0009692581329375171, 'batch_size': 512, 'num_inducing': 321, 'initialize_fe': True, 'minit': 'random'}. Best is trial 26 with value: 9.643709927331656e-05.
INFO:root:After model training
INFO:root:30.2236328125
INFO:root:70.0
INFO:optuna.study.study:Trial 51 finished with value: 0.00013706344179809093 and parameters: {'n_max': 849, 'n_layers': 4, 'n_out': 4, 'mean_type': 'constant', 'kernel_type': 'rbf', 'lr': 0.0023475222309817297, 'batch_size': 512, 'num_inducing': 1018, 'initialize_fe': False, 'minit': 'kmeans'}. Best is trial 26 with value: 9.643709927331656e-05.
INFO:root:After model training
INFO:root:22.93408203125
INFO:root:66.0
INFO:optuna.study.study:Trial 52 finished with value: 0.00010474979353602976 and parameters: {'n_max': 536, 'n_layers': 2, 'n_out': 5, 'mean_type': 'constant', 'kernel_type': 'rbf', 'lr': 0.0016040745217860645, 'batch_size': 512, 'num_inducing': 151, 'initialize_fe': True, 'minit': 'random'}. Best is trial 26 with value: 9.643709927331656e-05.
INFO:root:After model training
INFO:root:22.81982421875
INFO:root:68.0
INFO:optuna.study.study:Trial 53 finished with value: 7.535546319559216e-05 and parameters: {'n_max': 538, 'n_layers': 2, 'n_out': 7, 'mean_type': 'constant', 'kernel_type': 'rbf', 'lr': 0.001551202995973096, 'batch_size': 512, 'num_inducing': 93, 'initialize_fe': True, 'minit': 'random'}. Best is trial 53 with value: 7.535546319559216e-05.
INFO:root:After model training
INFO:root:23.2666015625
INFO:root:68.0
INFO:optuna.study.study:Trial 54 finished with value: 0.00011877054203068838 and parameters: {'n_max': 478, 'n_layers': 3, 'n_out': 7, 'mean_type': 'constant', 'kernel_type': 'rbf', 'lr': 0.0015199104461084282, 'batch_size': 512, 'num_inducing': 100, 'initialize_fe': True, 'minit': 'random'}. Best is trial 53 with value: 7.535546319559216e-05.
INFO:root:After model training
INFO:root:23.40234375
INFO:root:66.0
INFO:optuna.study.study:Trial 55 finished with value: 7.734308746876195e-05 and parameters: {'n_max': 559, 'n_layers': 3, 'n_out': 8, 'mean_type': 'constant', 'kernel_type': 'rbf', 'lr': 0.004227628916909494, 'batch_size': 512, 'num_inducing': 82, 'initialize_fe': True, 'minit': 'random'}. Best is trial 53 with value: 7.535546319559216e-05.
INFO:root:After model training
INFO:root:23.38916015625
INFO:root:70.0
INFO:optuna.study.study:Trial 56 finished with value: 0.00035117389052174985 and parameters: {'n_max': 544, 'n_layers': 3, 'n_out': 9, 'mean_type': 'constant', 'kernel_type': 'rbf', 'lr': 0.0045226151003375775, 'batch_size': 1024, 'num_inducing': 93, 'initialize_fe': True, 'minit': 'random'}. Best is trial 53 with value: 7.535546319559216e-05.
INFO:root:After model training
INFO:root:23.2666015625
INFO:root:66.0
INFO:optuna.study.study:Trial 57 finished with value: 0.00027599575696513057 and parameters: {'n_max': 478, 'n_layers': 3, 'n_out': 7, 'mean_type': 'constant', 'kernel_type': 'matern0.5', 'lr': 0.000866867346490332, 'batch_size': 512, 'num_inducing': 100, 'initialize_fe': True, 'minit': 'random'}. Best is trial 53 with value: 7.535546319559216e-05.
INFO:root:After model training
INFO:root:23.171875
INFO:root:68.0
INFO:optuna.study.study:Trial 58 finished with value: 0.00016156610217876732 and parameters: {'n_max': 459, 'n_layers': 3, 'n_out': 8, 'mean_type': 'constant', 'kernel_type': 'rbf', 'lr': 0.007123814815720355, 'batch_size': 512, 'num_inducing': 64, 'initialize_fe': True, 'minit': 'random'}. Best is trial 53 with value: 7.535546319559216e-05.
INFO:root:After model training
INFO:root:23.466796875
INFO:root:70.0
INFO:optuna.study.study:Trial 59 finished with value: 0.00020477556972764432 and parameters: {'n_max': 572, 'n_layers': 3, 'n_out': 10, 'mean_type': 'constant', 'kernel_type': 'rbf', 'lr': 0.01235456663544747, 'batch_size': 512, 'num_inducing': 100, 'initialize_fe': True, 'minit': 'random'}. Best is trial 53 with value: 7.535546319559216e-05.
INFO:root:After model training
INFO:root:29.82763671875
INFO:root:88.0
INFO:optuna.study.study:Trial 60 finished with value: 0.0005119050038047135 and parameters: {'n_max': 561, 'n_layers': 3, 'n_out': 7, 'mean_type': 'constant', 'kernel_type': 'matern1.5', 'lr': 0.0012920616204602088, 'batch_size': 2048, 'num_inducing': 146, 'initialize_fe': True, 'minit': 'random'}. Best is trial 53 with value: 7.535546319559216e-05.
INFO:root:After model training
INFO:root:23.73486328125
INFO:root:68.0
INFO:optuna.study.study:Trial 61 finished with value: 0.00010180928074987605 and parameters: {'n_max': 526, 'n_layers': 4, 'n_out': 6, 'mean_type': 'constant', 'kernel_type': 'rbf', 'lr': 0.003560318647912044, 'batch_size': 512, 'num_inducing': 78, 'initialize_fe': True, 'minit': 'random'}. Best is trial 53 with value: 7.535546319559216e-05.
INFO:root:After model training
INFO:root:23.72607421875
INFO:root:70.0
INFO:optuna.study.study:Trial 62 finished with value: 9.292060713050887e-05 and parameters: {'n_max': 523, 'n_layers': 4, 'n_out': 6, 'mean_type': 'constant', 'kernel_type': 'rbf', 'lr': 0.0036854472046999667, 'batch_size': 512, 'num_inducing': 79, 'initialize_fe': True, 'minit': 'random'}. Best is trial 53 with value: 7.535546319559216e-05.
INFO:root:After model training
INFO:root:23.71826171875
INFO:root:68.0
INFO:optuna.study.study:Trial 63 finished with value: 0.00044173881178721786 and parameters: {'n_max': 524, 'n_layers': 4, 'n_out': 7, 'mean_type': 'constant', 'kernel_type': 'rbf', 'lr': 0.003874041305624347, 'batch_size': 512, 'num_inducing': 71, 'initialize_fe': True, 'minit': 'random'}. Best is trial 53 with value: 7.535546319559216e-05.
INFO:root:After model training
INFO:root:23.4833984375
INFO:root:66.0
INFO:optuna.study.study:Trial 64 finished with value: 0.00015678141789976507 and parameters: {'n_max': 446, 'n_layers': 4, 'n_out': 8, 'mean_type': 'constant', 'kernel_type': 'rbf', 'lr': 0.005150411324133691, 'batch_size': 512, 'num_inducing': 85, 'initialize_fe': True, 'minit': 'random'}. Best is trial 53 with value: 7.535546319559216e-05.
INFO:root:After model training
INFO:root:23.97998046875
INFO:root:68.0
INFO:optuna.study.study:Trial 65 finished with value: 0.0001562968536745757 and parameters: {'n_max': 595, 'n_layers': 4, 'n_out': 9, 'mean_type': 'constant', 'kernel_type': 'rbf', 'lr': 0.001750288387808399, 'batch_size': 512, 'num_inducing': 60, 'initialize_fe': True, 'minit': 'random'}. Best is trial 53 with value: 7.535546319559216e-05.
INFO:root:After model training
INFO:root:23.65576171875
INFO:root:68.0
INFO:optuna.study.study:Trial 66 finished with value: 0.00019801300368271768 and parameters: {'n_max': 486, 'n_layers': 4, 'n_out': 7, 'mean_type': 'constant', 'kernel_type': 'matern1.5', 'lr': 0.0031935457437025807, 'batch_size': 512, 'num_inducing': 110, 'initialize_fe': True, 'minit': 'random'}. Best is trial 53 with value: 7.535546319559216e-05.
INFO:root:After model training
INFO:root:24.99560546875
INFO:root:66.0
INFO:optuna.study.study:Trial 67 finished with value: 0.0003613024018704891 and parameters: {'n_max': 646, 'n_layers': 4, 'n_out': 6, 'mean_type': 'linear', 'kernel_type': 'rbf', 'lr': 0.008602687096458237, 'batch_size': 512, 'num_inducing': 75, 'initialize_fe': True, 'minit': 'random'}. Best is trial 53 with value: 7.535546319559216e-05.
INFO:root:After model training
INFO:root:23.4560546875
INFO:root:72.0
INFO:optuna.study.study:Trial 68 finished with value: 0.00020863405370619148 and parameters: {'n_max': 432, 'n_layers': 4, 'n_out': 14, 'mean_type': 'constant', 'kernel_type': 'rbf', 'lr': 0.0045243111964601975, 'batch_size': 512, 'num_inducing': 86, 'initialize_fe': True, 'minit': 'random'}. Best is trial 53 with value: 7.535546319559216e-05.
INFO:root:After model training
INFO:root:23.26904296875
INFO:root:66.0
INFO:optuna.study.study:Trial 69 finished with value: 0.0003419608692638576 and parameters: {'n_max': 513, 'n_layers': 3, 'n_out': 5, 'mean_type': 'constant', 'kernel_type': 'matern1.5', 'lr': 0.000535129152353414, 'batch_size': 1024, 'num_inducing': 64, 'initialize_fe': True, 'minit': 'random'}. Best is trial 53 with value: 7.535546319559216e-05.
INFO:root:After model training
INFO:root:23.33642578125
INFO:root:70.0
INFO:optuna.study.study:Trial 70 finished with value: 0.00023470213636755943 and parameters: {'n_max': 361, 'n_layers': 4, 'n_out': 11, 'mean_type': 'constant', 'kernel_type': 'matern0.5', 'lr': 0.006592934467105225, 'batch_size': 512, 'num_inducing': 129, 'initialize_fe': True, 'minit': 'random'}. Best is trial 53 with value: 7.535546319559216e-05.
INFO:root:After model training
INFO:root:23.61279296875
INFO:root:72.0
INFO:optuna.study.study:Trial 71 finished with value: 7.619843381689861e-05 and parameters: {'n_max': 601, 'n_layers': 3, 'n_out': 6, 'mean_type': 'constant', 'kernel_type': 'rbf', 'lr': 0.0032193495056688044, 'batch_size': 512, 'num_inducing': 143, 'initialize_fe': True, 'minit': 'random'}. Best is trial 53 with value: 7.535546319559216e-05.
INFO:root:After model training
INFO:root:23.58251953125
INFO:root:68.0
INFO:optuna.study.study:Trial 72 finished with value: 0.0002320778148714453 and parameters: {'n_max': 587, 'n_layers': 3, 'n_out': 8, 'mean_type': 'constant', 'kernel_type': 'rbf', 'lr': 0.0033331853051568336, 'batch_size': 512, 'num_inducing': 142, 'initialize_fe': True, 'minit': 'random'}. Best is trial 53 with value: 7.535546319559216e-05.
INFO:root:After model training
INFO:root:23.3330078125
INFO:root:68.0
INFO:optuna.study.study:Trial 73 finished with value: 0.0001468316768296063 and parameters: {'n_max': 494, 'n_layers': 3, 'n_out': 20, 'mean_type': 'constant', 'kernel_type': 'rbf', 'lr': 0.0023116193614682477, 'batch_size': 512, 'num_inducing': 105, 'initialize_fe': True, 'minit': 'random'}. Best is trial 53 with value: 7.535546319559216e-05.
INFO:root:After model training
INFO:root:23.49755859375
INFO:root:66.0
INFO:optuna.study.study:Trial 74 finished with value: 0.0001594511850271374 and parameters: {'n_max': 625, 'n_layers': 3, 'n_out': 6, 'mean_type': 'constant', 'kernel_type': 'rbf', 'lr': 0.0015119396903405025, 'batch_size': 512, 'num_inducing': 50, 'initialize_fe': True, 'minit': 'random'}. Best is trial 53 with value: 7.535546319559216e-05.
INFO:root:After model training
INFO:root:23.35791015625
INFO:root:70.0
INFO:optuna.study.study:Trial 75 finished with value: 0.00024849153123795986 and parameters: {'n_max': 538, 'n_layers': 3, 'n_out': 5, 'mean_type': 'constant', 'kernel_type': 'rbf', 'lr': 0.0010958849929848357, 'batch_size': 512, 'num_inducing': 86, 'initialize_fe': True, 'minit': 'random'}. Best is trial 53 with value: 7.535546319559216e-05.
INFO:root:After model training
INFO:root:23.4619140625
INFO:root:66.0
INFO:optuna.study.study:Trial 76 finished with value: 0.00012873002560809255 and parameters: {'n_max': 561, 'n_layers': 3, 'n_out': 6, 'mean_type': 'constant', 'kernel_type': 'rbf', 'lr': 0.0016952385854547725, 'batch_size': 512, 'num_inducing': 114, 'initialize_fe': True, 'minit': 'random'}. Best is trial 53 with value: 7.535546319559216e-05.
INFO:root:After model training
INFO:root:29.40673828125
INFO:root:86.0
INFO:optuna.study.study:Trial 77 finished with value: 0.0012760007521137595 and parameters: {'n_max': 401, 'n_layers': 4, 'n_out': 7, 'mean_type': 'constant', 'kernel_type': 'rbf', 'lr': 0.011580689868050007, 'batch_size': 2048, 'num_inducing': 69, 'initialize_fe': True, 'minit': 'random'}. Best is trial 53 with value: 7.535546319559216e-05.
INFO:root:After model training
INFO:root:24.0908203125
INFO:root:68.0
INFO:optuna.study.study:Trial 78 finished with value: 0.00033911221544258296 and parameters: {'n_max': 618, 'n_layers': 4, 'n_out': 4, 'mean_type': 'constant', 'kernel_type': 'matern1.5', 'lr': 0.020839109973727316, 'batch_size': 512, 'num_inducing': 79, 'initialize_fe': True, 'minit': 'random'}. Best is trial 53 with value: 7.535546319559216e-05.
INFO:root:After model training
INFO:root:23.57421875
INFO:root:70.0
INFO:optuna.study.study:Trial 79 finished with value: 0.0005789028946310282 and parameters: {'n_max': 652, 'n_layers': 3, 'n_out': 5, 'mean_type': 'linear', 'kernel_type': 'rbf', 'lr': 0.006025943601404571, 'batch_size': 512, 'num_inducing': 59, 'initialize_fe': True, 'minit': 'random'}. Best is trial 53 with value: 7.535546319559216e-05.
INFO:root:After model training
INFO:root:23.4765625
INFO:root:68.0
INFO:optuna.study.study:Trial 80 finished with value: 0.00013698500697501004 and parameters: {'n_max': 514, 'n_layers': 3, 'n_out': 9, 'mean_type': 'constant', 'kernel_type': 'rbf', 'lr': 0.000844123549733804, 'batch_size': 512, 'num_inducing': 163, 'initialize_fe': True, 'minit': 'random'}. Best is trial 53 with value: 7.535546319559216e-05.
INFO:root:After model training
INFO:root:23.02685546875
INFO:root:70.0
INFO:optuna.study.study:Trial 81 finished with value: 0.0001509830472059548 and parameters: {'n_max': 432, 'n_layers': 2, 'n_out': 6, 'mean_type': 'constant', 'kernel_type': 'rbf', 'lr': 0.0030396375561147827, 'batch_size': 512, 'num_inducing': 190, 'initialize_fe': True, 'minit': 'random'}. Best is trial 53 with value: 7.535546319559216e-05.
INFO:root:After model training
INFO:root:23.2109375
INFO:root:72.0
INFO:optuna.study.study:Trial 82 finished with value: 0.00019071242422796786 and parameters: {'n_max': 574, 'n_layers': 2, 'n_out': 6, 'mean_type': 'constant', 'kernel_type': 'rbf', 'lr': 0.0023392750927507724, 'batch_size': 512, 'num_inducing': 254, 'initialize_fe': True, 'minit': 'random'}. Best is trial 53 with value: 7.535546319559216e-05.
INFO:root:After model training
INFO:root:22.814453125
INFO:root:68.0
INFO:optuna.study.study:Trial 83 finished with value: 0.0002399273798801005 and parameters: {'n_max': 220, 'n_layers': 2, 'n_out': 7, 'mean_type': 'constant', 'kernel_type': 'rbf', 'lr': 0.004657842041018352, 'batch_size': 512, 'num_inducing': 97, 'initialize_fe': True, 'minit': 'random'}. Best is trial 53 with value: 7.535546319559216e-05.
INFO:root:After model training
INFO:root:22.95849609375
INFO:root:68.0
INFO:optuna.study.study:Trial 84 finished with value: 0.0002635465352796018 and parameters: {'n_max': 544, 'n_layers': 2, 'n_out': 8, 'mean_type': 'constant', 'kernel_type': 'rbf', 'lr': 0.0011931953952076667, 'batch_size': 512, 'num_inducing': 159, 'initialize_fe': True, 'minit': 'random'}. Best is trial 53 with value: 7.535546319559216e-05.
INFO:root:After model training
INFO:root:22.86083984375
INFO:root:68.0
INFO:optuna.study.study:Trial 85 finished with value: 0.00014770604320801795 and parameters: {'n_max': 474, 'n_layers': 2, 'n_out': 5, 'mean_type': 'constant', 'kernel_type': 'rbf', 'lr': 0.0039678414866978155, 'batch_size': 512, 'num_inducing': 118, 'initialize_fe': True, 'minit': 'random'}. Best is trial 53 with value: 7.535546319559216e-05.
INFO:root:After model training
INFO:root:23.03759765625
INFO:root:68.0
INFO:optuna.study.study:Trial 86 finished with value: 0.0002722195058595389 and parameters: {'n_max': 111, 'n_layers': 2, 'n_out': 7, 'mean_type': 'constant', 'kernel_type': 'rbf', 'lr': 0.0025668364056682194, 'batch_size': 1024, 'num_inducing': 199, 'initialize_fe': True, 'minit': 'random'}. Best is trial 53 with value: 7.535546319559216e-05.
INFO:root:After model training
INFO:root:22.91650390625
INFO:root:68.0
