INFO:optuna.study.study:Trial 76 finished with value: 0.00020433886675164104 and parameters: {'n_max': 1000, 'n_layers': 2, 'n_out': 2, 'mean_type': 'constant', 'kernel_type': 'matern0.5', 'lr': 0.0014108873995525221, 'batch_size': 512, 'num_inducing': 1173, 'initialize_fe': True, 'minit': 'random'}. Best is trial 59 with value: 6.413160735974088e-05.
INFO:root:After model training
INFO:root:8.984375
INFO:root:28.0
INFO:optuna.study.study:Trial 77 finished with value: 0.0004140714299865067 and parameters: {'n_max': 302, 'n_layers': 2, 'n_out': 4, 'mean_type': 'constant', 'kernel_type': 'rbf', 'lr': 0.0004756197706190712, 'batch_size': 512, 'num_inducing': 1237, 'initialize_fe': True, 'minit': 'kmeans'}. Best is trial 59 with value: 6.413160735974088e-05.
INFO:root:After model training
INFO:root:7.17236328125
INFO:root:28.0
INFO:optuna.study.study:Trial 78 finished with value: 0.0002329365670448169 and parameters: {'n_max': 951, 'n_layers': 2, 'n_out': 6, 'mean_type': 'constant', 'kernel_type': 'rbf', 'lr': 0.0010554864122063986, 'batch_size': 512, 'num_inducing': 1050, 'initialize_fe': True, 'minit': 'random'}. Best is trial 59 with value: 6.413160735974088e-05.
INFO:root:After model training
INFO:root:28.03271484375
INFO:root:80.0
INFO:optuna.study.study:Trial 79 finished with value: 0.00038982328260317445 and parameters: {'n_max': 971, 'n_layers': 2, 'n_out': 5, 'mean_type': 'constant', 'kernel_type': 'matern1.5', 'lr': 0.004699941667086795, 'batch_size': 2048, 'num_inducing': 1456, 'initialize_fe': True, 'minit': 'random'}. Best is trial 59 with value: 6.413160735974088e-05.
INFO:root:After model training
INFO:root:4.8818359375
INFO:root:26.0
INFO:optuna.study.study:Trial 80 finished with value: 0.00012948919902555645 and parameters: {'n_max': 875, 'n_layers': 2, 'n_out': 3, 'mean_type': 'linear', 'kernel_type': 'rbf', 'lr': 0.003658929978359958, 'batch_size': 512, 'num_inducing': 767, 'initialize_fe': False, 'minit': 'kmeans'}. Best is trial 59 with value: 6.413160735974088e-05.
INFO:root:After model training
INFO:root:5.69775390625
INFO:root:28.0
INFO:optuna.study.study:Trial 81 finished with value: 0.00012859993148595095 and parameters: {'n_max': 925, 'n_layers': 2, 'n_out': 8, 'mean_type': 'constant', 'kernel_type': 'rbf', 'lr': 0.002302088345720027, 'batch_size': 512, 'num_inducing': 875, 'initialize_fe': True, 'minit': 'random'}. Best is trial 59 with value: 6.413160735974088e-05.
INFO:root:After model training
INFO:root:5.3369140625
INFO:root:28.0
INFO:optuna.study.study:Trial 82 finished with value: 0.000320960592944175 and parameters: {'n_max': 898, 'n_layers': 2, 'n_out': 5, 'mean_type': 'constant', 'kernel_type': 'rbf', 'lr': 0.0015637965632524114, 'batch_size': 512, 'num_inducing': 829, 'initialize_fe': True, 'minit': 'random'}. Best is trial 59 with value: 6.413160735974088e-05.
INFO:root:After model training
INFO:root:6.30322265625
INFO:root:26.0
INFO:optuna.study.study:Trial 83 finished with value: 0.00012608218821696937 and parameters: {'n_max': 1022, 'n_layers': 2, 'n_out': 7, 'mean_type': 'constant', 'kernel_type': 'rbf', 'lr': 0.002962584004423882, 'batch_size': 512, 'num_inducing': 950, 'initialize_fe': True, 'minit': 'random'}. Best is trial 59 with value: 6.413160735974088e-05.
INFO:root:After model training
INFO:root:7.7353515625
INFO:root:28.0
INFO:optuna.study.study:Trial 84 finished with value: 0.00010216239024884999 and parameters: {'n_max': 955, 'n_layers': 2, 'n_out': 4, 'mean_type': 'constant', 'kernel_type': 'rbf', 'lr': 0.0017568386409195402, 'batch_size': 512, 'num_inducing': 1111, 'initialize_fe': True, 'minit': 'random'}. Best is trial 59 with value: 6.413160735974088e-05.
INFO:root:After model training
INFO:root:10.22412109375
INFO:root:28.0
INFO:optuna.study.study:Trial 85 finished with value: 0.00021779013331979513 and parameters: {'n_max': 994, 'n_layers': 2, 'n_out': 4, 'mean_type': 'constant', 'kernel_type': 'rbf', 'lr': 0.0008373058134237127, 'batch_size': 512, 'num_inducing': 1348, 'initialize_fe': True, 'minit': 'random'}. Best is trial 59 with value: 6.413160735974088e-05.
INFO:root:After model training
INFO:root:7.83447265625
INFO:root:28.0
INFO:optuna.study.study:Trial 86 finished with value: 0.00037544319638982415 and parameters: {'n_max': 956, 'n_layers': 2, 'n_out': 2, 'mean_type': 'constant', 'kernel_type': 'rbf', 'lr': 0.0011893930027601141, 'batch_size': 1024, 'num_inducing': 1122, 'initialize_fe': True, 'minit': 'random'}. Best is trial 59 with value: 6.413160735974088e-05.
INFO:root:After model training
INFO:root:15.7275390625
INFO:root:20.0
INFO:optuna.study.study:Trial 87 finished with value: 7.399637252092361e-05 and parameters: {'n_max': 936, 'n_layers': 2, 'n_out': 4, 'mean_type': 'constant', 'kernel_type': 'rbf', 'lr': 0.0018214009764810377, 'batch_size': 512, 'num_inducing': 1741, 'initialize_fe': True, 'minit': 'kmeans'}. Best is trial 59 with value: 6.413160735974088e-05.
INFO:root:After model training
INFO:root:1.8544921875
INFO:root:6.0
INFO:optuna.study.study:Trial 88 finished with value: 0.0003542156482581049 and parameters: {'n_max': 839, 'n_layers': 2, 'n_out': 5, 'mean_type': 'constant', 'kernel_type': 'rbf', 'lr': 0.0017223717247719403, 'batch_size': 512, 'num_inducing': 50, 'initialize_fe': True, 'minit': 'kmeans'}. Best is trial 59 with value: 6.413160735974088e-05.
INFO:root:After model training
INFO:root:15.953125
INFO:root:22.0
INFO:optuna.study.study:Trial 89 finished with value: 0.00014501290570478886 and parameters: {'n_max': 932, 'n_layers': 2, 'n_out': 6, 'mean_type': 'constant', 'kernel_type': 'rbf', 'lr': 0.00242913135851761, 'batch_size': 512, 'num_inducing': 1786, 'initialize_fe': True, 'minit': 'kmeans'}. Best is trial 59 with value: 6.413160735974088e-05.
INFO:root:After model training
INFO:root:12.255859375
INFO:root:28.0
INFO:optuna.study.study:Trial 90 finished with value: 0.00029406161047518253 and parameters: {'n_max': 84, 'n_layers': 2, 'n_out': 4, 'mean_type': 'constant', 'kernel_type': 'matern0.5', 'lr': 0.00194938426414273, 'batch_size': 512, 'num_inducing': 1519, 'initialize_fe': True, 'minit': 'kmeans'}. Best is trial 59 with value: 6.413160735974088e-05.
INFO:root:After model training
INFO:root:6.69677734375
INFO:root:26.0
INFO:optuna.study.study:Trial 91 finished with value: 8.42396475491114e-05 and parameters: {'n_max': 965, 'n_layers': 2, 'n_out': 3, 'mean_type': 'constant', 'kernel_type': 'rbf', 'lr': 0.0036346354303123806, 'batch_size': 512, 'num_inducing': 998, 'initialize_fe': True, 'minit': 'kmeans'}. Best is trial 59 with value: 6.413160735974088e-05.
INFO:root:After model training
INFO:root:15.75830078125
INFO:root:20.0
INFO:optuna.study.study:Trial 92 finished with value: 9.61733894655481e-05 and parameters: {'n_max': 962, 'n_layers': 2, 'n_out': 3, 'mean_type': 'constant', 'kernel_type': 'rbf', 'lr': 0.005649288031275171, 'batch_size': 512, 'num_inducing': 1771, 'initialize_fe': True, 'minit': 'kmeans'}. Best is trial 59 with value: 6.413160735974088e-05.
INFO:root:After model training
INFO:root:16.3271484375
INFO:root:26.0
INFO:optuna.study.study:Trial 93 finished with value: 0.00016675458755344152 and parameters: {'n_max': 860, 'n_layers': 2, 'n_out': 3, 'mean_type': 'constant', 'kernel_type': 'rbf', 'lr': 0.005503665923322152, 'batch_size': 512, 'num_inducing': 1812, 'initialize_fe': True, 'minit': 'kmeans'}. Best is trial 59 with value: 6.413160735974088e-05.
INFO:root:After model training
INFO:root:15.716796875
INFO:root:18.0
INFO:optuna.study.study:Trial 94 finished with value: 0.00014466868015006185 and parameters: {'n_max': 963, 'n_layers': 2, 'n_out': 3, 'mean_type': 'constant', 'kernel_type': 'rbf', 'lr': 0.003857908587892802, 'batch_size': 512, 'num_inducing': 1734, 'initialize_fe': True, 'minit': 'kmeans'}. Best is trial 59 with value: 6.413160735974088e-05.
INFO:root:After model training
INFO:root:6.83056640625
INFO:root:28.0
INFO:optuna.study.study:Trial 95 finished with value: 0.00013989635044708848 and parameters: {'n_max': 908, 'n_layers': 2, 'n_out': 4, 'mean_type': 'constant', 'kernel_type': 'rbf', 'lr': 0.0065461177275720345, 'batch_size': 512, 'num_inducing': 1013, 'initialize_fe': True, 'minit': 'kmeans'}. Best is trial 59 with value: 6.413160735974088e-05.
INFO:root:After model training
INFO:root:19.74658203125
INFO:root:44.0
INFO:optuna.study.study:Trial 96 finished with value: 0.00021677318727597594 and parameters: {'n_max': 935, 'n_layers': 2, 'n_out': 3, 'mean_type': 'constant', 'kernel_type': 'rbf', 'lr': 0.002609117451406209, 'batch_size': 512, 'num_inducing': 1979, 'initialize_fe': True, 'minit': 'kmeans'}. Best is trial 59 with value: 6.413160735974088e-05.
INFO:root:After model training
INFO:root:12.03173828125
INFO:root:26.0
INFO:optuna.study.study:Trial 97 finished with value: 0.00012144757783971727 and parameters: {'n_max': 887, 'n_layers': 2, 'n_out': 5, 'mean_type': 'constant', 'kernel_type': 'matern1.5', 'lr': 0.004544123856060129, 'batch_size': 512, 'num_inducing': 1499, 'initialize_fe': False, 'minit': 'kmeans'}. Best is trial 59 with value: 6.413160735974088e-05.
INFO:root:After model training
INFO:root:26.8515625
INFO:root:60.0
INFO:optuna.study.study:Trial 98 finished with value: 0.0026472629979252815 and parameters: {'n_max': 959, 'n_layers': 2, 'n_out': 5, 'mean_type': 'linear', 'kernel_type': 'rbf', 'lr': 0.0013749217184683333, 'batch_size': 2048, 'num_inducing': 1358, 'initialize_fe': True, 'minit': 'kmeans'}. Best is trial 59 with value: 6.413160735974088e-05.
INFO:root:After model training
INFO:root:9.1162109375
INFO:root:28.0
INFO:optuna.study.study:Trial 99 finished with value: 0.00021100585581734776 and parameters: {'n_max': 811, 'n_layers': 2, 'n_out': 4, 'mean_type': 'constant', 'kernel_type': 'rbf', 'lr': 0.0018833653531371347, 'batch_size': 512, 'num_inducing': 1248, 'initialize_fe': True, 'minit': 'kmeans'}. Best is trial 59 with value: 6.413160735974088e-05.
INFO:root:Outer Run: 2: MSE - 4.357638161422983e-08, MAE - 0.00014120656123850495. MAX - 0.0020034313201904297
INFO:optuna.storages._in_memory:A new study created in memory with name: Nested Resampling VDKL 3
INFO:root:After model training
INFO:root:38.52978515625
INFO:root:74.0
INFO:optuna.study.study:Trial 0 finished with value: 0.0003447018389124423 and parameters: {'n_max': 1024, 'n_layers': 4, 'n_out': 2, 'mean_type': 'constant', 'kernel_type': 'rbf', 'lr': 0.01, 'batch_size': 1024, 'num_inducing': 1000, 'initialize_fe': False, 'minit': 'kmeans'}. Best is trial 0 with value: 0.0003447018389124423.
INFO:root:After model training
INFO:root:39.86279296875
INFO:root:88.0
INFO:optuna.study.study:Trial 1 finished with value: 0.009057318791747093 and parameters: {'n_max': 453, 'n_layers': 4, 'n_out': 18, 'mean_type': 'linear', 'kernel_type': 'matern0.5', 'lr': 0.017535921098263442, 'batch_size': 2048, 'num_inducing': 393, 'initialize_fe': True, 'minit': 'random'}. Best is trial 0 with value: 0.0003447018389124423.
INFO:root:After model training
INFO:root:39.42919921875
INFO:root:100.0
INFO:optuna.study.study:Trial 2 finished with value: 0.0012355917133390903 and parameters: {'n_max': 341, 'n_layers': 5, 'n_out': 11, 'mean_type': 'constant', 'kernel_type': 'matern0.5', 'lr': 0.00594597426352862, 'batch_size': 2048, 'num_inducing': 370, 'initialize_fe': False, 'minit': 'random'}. Best is trial 0 with value: 0.0003447018389124423.
INFO:root:After model training
INFO:root:39.947265625
INFO:root:84.0
INFO:optuna.study.study:Trial 3 finished with value: 0.0020684939809143543 and parameters: {'n_max': 818, 'n_layers': 3, 'n_out': 19, 'mean_type': 'constant', 'kernel_type': 'rbf', 'lr': 0.0009576993847059685, 'batch_size': 2048, 'num_inducing': 301, 'initialize_fe': False, 'minit': 'kmeans'}. Best is trial 0 with value: 0.0003447018389124423.
INFO:root:After model training
INFO:root:32.45751953125
INFO:root:72.0
INFO:optuna.study.study:Trial 4 finished with value: 0.000772658153437078 and parameters: {'n_max': 590, 'n_layers': 5, 'n_out': 11, 'mean_type': 'linear', 'kernel_type': 'matern1.5', 'lr': 0.002801336584235898, 'batch_size': 512, 'num_inducing': 50, 'initialize_fe': False, 'minit': 'kmeans'}. Best is trial 0 with value: 0.0003447018389124423.
INFO:root:After model training
INFO:root:36.5029296875
INFO:root:70.0
INFO:optuna.study.study:Trial 5 finished with value: 0.0002577480918262154 and parameters: {'n_max': 81, 'n_layers': 2, 'n_out': 17, 'mean_type': 'constant', 'kernel_type': 'matern1.5', 'lr': 0.0004662137970308345, 'batch_size': 512, 'num_inducing': 1138, 'initialize_fe': False, 'minit': 'random'}. Best is trial 5 with value: 0.0002577480918262154.
INFO:root:After model training
INFO:root:35.82421875
INFO:root:68.0
INFO:optuna.study.study:Trial 6 finished with value: 0.012344028800725937 and parameters: {'n_max': 895, 'n_layers': 3, 'n_out': 19, 'mean_type': 'linear', 'kernel_type': 'matern0.5', 'lr': 0.05483073832088278, 'batch_size': 1024, 'num_inducing': 932, 'initialize_fe': False, 'minit': 'kmeans'}. Best is trial 5 with value: 0.0002577480918262154.
INFO:root:After model training
INFO:root:55.6630859375
INFO:root:112.0
INFO:optuna.study.study:Trial 7 finished with value: 0.0006601695204153657 and parameters: {'n_max': 498, 'n_layers': 4, 'n_out': 4, 'mean_type': 'constant', 'kernel_type': 'matern1.5', 'lr': 0.006845082458624804, 'batch_size': 2048, 'num_inducing': 1350, 'initialize_fe': True, 'minit': 'kmeans'}. Best is trial 5 with value: 0.0002577480918262154.
INFO:root:After model training
INFO:root:39.50732421875
INFO:root:70.0
INFO:optuna.study.study:Trial 8 finished with value: 0.0005870601162314415 and parameters: {'n_max': 778, 'n_layers': 3, 'n_out': 12, 'mean_type': 'constant', 'kernel_type': 'matern0.5', 'lr': 0.004855398832502579, 'batch_size': 1024, 'num_inducing': 1306, 'initialize_fe': False, 'minit': 'random'}. Best is trial 5 with value: 0.0002577480918262154.
INFO:root:After model training
INFO:root:30.3564453125
INFO:root:72.0
INFO:optuna.study.study:Trial 9 finished with value: 0.0002962605212815106 and parameters: {'n_max': 281, 'n_layers': 4, 'n_out': 8, 'mean_type': 'constant', 'kernel_type': 'rbf', 'lr': 0.002918826049136996, 'batch_size': 1024, 'num_inducing': 129, 'initialize_fe': False, 'minit': 'kmeans'}. Best is trial 5 with value: 0.0002577480918262154.
INFO:root:After model training
INFO:root:31.99560546875
INFO:root:70.0
INFO:optuna.study.study:Trial 10 finished with value: 0.00016151988529600203 and parameters: {'n_max': 69, 'n_layers': 2, 'n_out': 15, 'mean_type': 'linear', 'kernel_type': 'matern1.5', 'lr': 0.00010632084861885985, 'batch_size': 512, 'num_inducing': 597, 'initialize_fe': True, 'minit': 'random'}. Best is trial 10 with value: 0.00016151988529600203.
INFO:root:After model training
INFO:root:32.03857421875
INFO:root:72.0
INFO:optuna.study.study:Trial 11 finished with value: 0.0001756741403369233 and parameters: {'n_max': 88, 'n_layers': 2, 'n_out': 15, 'mean_type': 'linear', 'kernel_type': 'matern1.5', 'lr': 0.00012467959551597281, 'batch_size': 512, 'num_inducing': 585, 'initialize_fe': True, 'minit': 'random'}. Best is trial 10 with value: 0.00016151988529600203.
INFO:root:After model training
INFO:root:32.2412109375
INFO:root:72.0
INFO:optuna.study.study:Trial 12 finished with value: 0.00021278546773828566 and parameters: {'n_max': 73, 'n_layers': 2, 'n_out': 15, 'mean_type': 'linear', 'kernel_type': 'matern1.5', 'lr': 0.0001062796305516558, 'batch_size': 512, 'num_inducing': 519, 'initialize_fe': True, 'minit': 'random'}. Best is trial 10 with value: 0.00016151988529600203.
INFO:root:After model training
INFO:root:30.24853515625
INFO:root:70.0
INFO:optuna.study.study:Trial 13 finished with value: 0.00033172493567690253 and parameters: {'n_max': 217, 'n_layers': 2, 'n_out': 14, 'mean_type': 'linear', 'kernel_type': 'matern1.5', 'lr': 0.00010275476898916852, 'batch_size': 512, 'num_inducing': 198, 'initialize_fe': True, 'minit': 'random'}. Best is trial 10 with value: 0.00016151988529600203.
INFO:root:After model training
INFO:root:32.05810546875
INFO:root:72.0
INFO:optuna.study.study:Trial 14 finished with value: 0.00016222713747993112 and parameters: {'n_max': 185, 'n_layers': 2, 'n_out': 15, 'mean_type': 'linear', 'kernel_type': 'matern1.5', 'lr': 0.0003473553029778486, 'batch_size': 512, 'num_inducing': 581, 'initialize_fe': True, 'minit': 'random'}. Best is trial 10 with value: 0.00016151988529600203.
INFO:root:After model training
INFO:root:47.8251953125
INFO:root:100.0
INFO:optuna.study.study:Trial 15 finished with value: 0.0016849676612764597 and parameters: {'n_max': 214, 'n_layers': 2, 'n_out': 8, 'mean_type': 'linear', 'kernel_type': 'matern1.5', 'lr': 0.00043192776004755487, 'batch_size': 512, 'num_inducing': 1921, 'initialize_fe': True, 'minit': 'random'}. Best is trial 10 with value: 0.00016151988529600203.
INFO:root:After model training
INFO:root:32.5283203125
INFO:root:70.0
INFO:optuna.study.study:Trial 16 finished with value: 0.0010666986927390099 and parameters: {'n_max': 378, 'n_layers': 3, 'n_out': 13, 'mean_type': 'linear', 'kernel_type': 'matern1.5', 'lr': 0.00031297456810421123, 'batch_size': 512, 'num_inducing': 655, 'initialize_fe': True, 'minit': 'random'}. Best is trial 10 with value: 0.00016151988529600203.
INFO:root:After model training
INFO:root:30.2451171875
INFO:root:70.0
INFO:optuna.study.study:Trial 17 finished with value: 0.00030905037419870496 and parameters: {'n_max': 214, 'n_layers': 2, 'n_out': 16, 'mean_type': 'linear', 'kernel_type': 'matern1.5', 'lr': 0.0009317734719110267, 'batch_size': 512, 'num_inducing': 196, 'initialize_fe': True, 'minit': 'random'}. Best is trial 10 with value: 0.00016151988529600203.
INFO:root:After model training
INFO:root:30.0478515625
INFO:root:70.0
INFO:optuna.study.study:Trial 18 finished with value: 0.0008259139722213149 and parameters: {'n_max': 160, 'n_layers': 3, 'n_out': 9, 'mean_type': 'linear', 'kernel_type': 'matern1.5', 'lr': 0.00021850775387522646, 'batch_size': 512, 'num_inducing': 88, 'initialize_fe': True, 'minit': 'random'}. Best is trial 10 with value: 0.00016151988529600203.
INFO:root:After model training
INFO:root:30.43505859375
INFO:root:74.0
INFO:optuna.study.study:Trial 19 finished with value: 0.0018154226709157228 and parameters: {'n_max': 596, 'n_layers': 2, 'n_out': 20, 'mean_type': 'linear', 'kernel_type': 'rbf', 'lr': 0.0010291057322812736, 'batch_size': 512, 'num_inducing': 250, 'initialize_fe': True, 'minit': 'random'}. Best is trial 10 with value: 0.00016151988529600203.
INFO:root:After model training
INFO:root:33.7978515625
INFO:root:72.0
INFO:optuna.study.study:Trial 20 finished with value: 0.0013877227902412415 and parameters: {'n_max': 367, 'n_layers': 3, 'n_out': 17, 'mean_type': 'linear', 'kernel_type': 'matern1.5', 'lr': 0.00021507965566179582, 'batch_size': 512, 'num_inducing': 740, 'initialize_fe': True, 'minit': 'random'}. Best is trial 10 with value: 0.00016151988529600203.
INFO:root:After model training
INFO:root:32.1337890625
INFO:root:72.0
INFO:optuna.study.study:Trial 21 finished with value: 0.00012635192251764238 and parameters: {'n_max': 66, 'n_layers': 2, 'n_out': 15, 'mean_type': 'linear', 'kernel_type': 'matern1.5', 'lr': 0.0001474386971934371, 'batch_size': 512, 'num_inducing': 555, 'initialize_fe': True, 'minit': 'random'}. Best is trial 21 with value: 0.00012635192251764238.
INFO:root:After model training
INFO:root:31.19384765625
INFO:root:76.0
INFO:optuna.study.study:Trial 22 finished with value: 0.00010434334399178624 and parameters: {'n_max': 153, 'n_layers': 2, 'n_out': 14, 'mean_type': 'linear', 'kernel_type': 'matern1.5', 'lr': 0.00020750048239819482, 'batch_size': 512, 'num_inducing': 460, 'initialize_fe': True, 'minit': 'random'}. Best is trial 22 with value: 0.00010434334399178624.
INFO:root:After model training
INFO:root:30.92041015625
INFO:root:74.0
INFO:optuna.study.study:Trial 23 finished with value: 0.00014845712576061487 and parameters: {'n_max': 135, 'n_layers': 2, 'n_out': 13, 'mean_type': 'linear', 'kernel_type': 'matern1.5', 'lr': 0.00016714568320740105, 'batch_size': 512, 'num_inducing': 398, 'initialize_fe': True, 'minit': 'random'}. Best is trial 22 with value: 0.00010434334399178624.
INFO:root:After model training
INFO:root:31.2255859375
INFO:root:76.0
INFO:optuna.study.study:Trial 24 finished with value: 0.00016700438573025167 and parameters: {'n_max': 291, 'n_layers': 2, 'n_out': 13, 'mean_type': 'linear', 'kernel_type': 'matern1.5', 'lr': 0.0005858990087285167, 'batch_size': 512, 'num_inducing': 465, 'initialize_fe': True, 'minit': 'random'}. Best is trial 22 with value: 0.00010434334399178624.
INFO:root:After model training
INFO:root:30.4755859375
INFO:root:74.0
INFO:optuna.study.study:Trial 25 finished with value: 0.0008427503635175526 and parameters: {'n_max': 150, 'n_layers': 3, 'n_out': 10, 'mean_type': 'linear', 'kernel_type': 'matern1.5', 'lr': 0.00021169217676477004, 'batch_size': 512, 'num_inducing': 264, 'initialize_fe': True, 'minit': 'random'}. Best is trial 22 with value: 0.00010434334399178624.
INFO:root:After model training
INFO:root:30.763671875
INFO:root:70.0
INFO:optuna.study.study:Trial 26 finished with value: 0.0005565284518525004 and parameters: {'n_max': 256, 'n_layers': 2, 'n_out': 6, 'mean_type': 'linear', 'kernel_type': 'matern1.5', 'lr': 0.00018716034274295068, 'batch_size': 512, 'num_inducing': 359, 'initialize_fe': True, 'minit': 'random'}. Best is trial 22 with value: 0.00010434334399178624.
INFO:root:After model training
INFO:root:30.2666015625
INFO:root:70.0
INFO:optuna.study.study:Trial 27 finished with value: 0.004196407273411751 and parameters: {'n_max': 136, 'n_layers': 3, 'n_out': 13, 'mean_type': 'linear', 'kernel_type': 'matern0.5', 'lr': 0.0014258392858478841, 'batch_size': 1024, 'num_inducing': 193, 'initialize_fe': True, 'minit': 'random'}. Best is trial 22 with value: 0.00010434334399178624.
INFO:root:After model training
INFO:root:31.10888671875
INFO:root:70.0
