INFO:optuna.study.study:Trial 15 finished with value: 0.08891799300909042 and parameters: {'n_max': 865, 'n_layers': 3, 'n_out': 4, 'mean_type': 'constant', 'kernel_type': 'matern1.5', 'lr': 0.007849927621926251, 'batch_size': 2048, 'num_inducing': 417, 'initialize_fe': True, 'minit': 'random'}. Best is trial 0 with value: 0.06891942769289017.
INFO:root:After model training
INFO:root:33.3603515625
INFO:root:110.0
INFO:optuna.study.study:Trial 16 finished with value: 0.08616921305656433 and parameters: {'n_max': 705, 'n_layers': 5, 'n_out': 5, 'mean_type': 'constant', 'kernel_type': 'matern0.5', 'lr': 0.018096611353076157, 'batch_size': 1024, 'num_inducing': 1074, 'initialize_fe': False, 'minit': 'random'}. Best is trial 0 with value: 0.06891942769289017.
INFO:root:After model training
INFO:root:43.3505859375
INFO:root:122.0
INFO:optuna.study.study:Trial 17 finished with value: 0.07468000799417496 and parameters: {'n_max': 519, 'n_layers': 4, 'n_out': 8, 'mean_type': 'constant', 'kernel_type': 'rbf', 'lr': 0.004788101757017071, 'batch_size': 1024, 'num_inducing': 1885, 'initialize_fe': False, 'minit': 'random'}. Best is trial 0 with value: 0.06891942769289017.
INFO:root:After model training
INFO:root:28.8095703125
INFO:root:112.0
INFO:optuna.study.study:Trial 18 finished with value: 0.08110132813453674 and parameters: {'n_max': 1023, 'n_layers': 3, 'n_out': 4, 'mean_type': 'linear', 'kernel_type': 'matern0.5', 'lr': 0.05205765546153908, 'batch_size': 512, 'num_inducing': 495, 'initialize_fe': True, 'minit': 'kmeans'}. Best is trial 0 with value: 0.06891942769289017.
INFO:root:After model training
INFO:root:35.111328125
INFO:root:112.0
INFO:optuna.study.study:Trial 19 finished with value: 0.07293350249528885 and parameters: {'n_max': 893, 'n_layers': 4, 'n_out': 20, 'mean_type': 'constant', 'kernel_type': 'matern1.5', 'lr': 0.01634158789121273, 'batch_size': 2048, 'num_inducing': 50, 'initialize_fe': False, 'minit': 'random'}. Best is trial 0 with value: 0.06891942769289017.
INFO:root:After model training
INFO:root:35.427734375
INFO:root:114.0
INFO:optuna.study.study:Trial 20 finished with value: 0.08447705954313278 and parameters: {'n_max': 790, 'n_layers': 5, 'n_out': 20, 'mean_type': 'constant', 'kernel_type': 'matern1.5', 'lr': 0.0014213207768591697, 'batch_size': 2048, 'num_inducing': 116, 'initialize_fe': False, 'minit': 'random'}. Best is trial 0 with value: 0.06891942769289017.
INFO:root:After model training
INFO:root:33.8701171875
INFO:root:114.0
INFO:optuna.study.study:Trial 21 finished with value: 0.07516421377658844 and parameters: {'n_max': 924, 'n_layers': 4, 'n_out': 12, 'mean_type': 'constant', 'kernel_type': 'matern1.5', 'lr': 0.014137829025782494, 'batch_size': 2048, 'num_inducing': 50, 'initialize_fe': False, 'minit': 'random'}. Best is trial 0 with value: 0.06891942769289017.
INFO:root:After model training
INFO:root:34.12353515625
INFO:root:108.0
INFO:optuna.study.study:Trial 22 finished with value: 0.08710089325904846 and parameters: {'n_max': 930, 'n_layers': 4, 'n_out': 14, 'mean_type': 'constant', 'kernel_type': 'matern1.5', 'lr': 0.004386703706928942, 'batch_size': 2048, 'num_inducing': 72, 'initialize_fe': False, 'minit': 'random'}. Best is trial 0 with value: 0.06891942769289017.
INFO:root:After model training
INFO:root:32.81982421875
INFO:root:110.0
INFO:optuna.study.study:Trial 23 finished with value: 0.07738875597715378 and parameters: {'n_max': 895, 'n_layers': 3, 'n_out': 20, 'mean_type': 'constant', 'kernel_type': 'matern1.5', 'lr': 0.028808702381598876, 'batch_size': 2048, 'num_inducing': 82, 'initialize_fe': False, 'minit': 'random'}. Best is trial 0 with value: 0.06891942769289017.
INFO:root:After model training
INFO:root:29.4951171875
INFO:root:112.0
INFO:optuna.study.study:Trial 24 finished with value: 0.0841464102268219 and parameters: {'n_max': 1024, 'n_layers': 4, 'n_out': 11, 'mean_type': 'constant', 'kernel_type': 'matern1.5', 'lr': 0.012393646504077031, 'batch_size': 1024, 'num_inducing': 269, 'initialize_fe': False, 'minit': 'random'}. Best is trial 0 with value: 0.06891942769289017.
INFO:root:After model training
INFO:root:32.75048828125
INFO:root:108.0
INFO:optuna.study.study:Trial 25 finished with value: 0.07294642180204391 and parameters: {'n_max': 747, 'n_layers': 3, 'n_out': 4, 'mean_type': 'constant', 'kernel_type': 'rbf', 'lr': 0.0051002146837934035, 'batch_size': 2048, 'num_inducing': 87, 'initialize_fe': False, 'minit': 'random'}. Best is trial 0 with value: 0.06891942769289017.
INFO:root:After model training
INFO:root:32.69580078125
INFO:root:114.0
INFO:optuna.study.study:Trial 26 finished with value: 0.07310310006141663 and parameters: {'n_max': 618, 'n_layers': 4, 'n_out': 3, 'mean_type': 'constant', 'kernel_type': 'rbf', 'lr': 0.003714986985243788, 'batch_size': 2048, 'num_inducing': 100, 'initialize_fe': False, 'minit': 'random'}. Best is trial 0 with value: 0.06891942769289017.
INFO:root:After model training
INFO:root:34.66162109375
INFO:root:128.0
INFO:optuna.study.study:Trial 27 finished with value: 0.12777771055698395 and parameters: {'n_max': 766, 'n_layers': 5, 'n_out': 8, 'mean_type': 'linear', 'kernel_type': 'rbf', 'lr': 0.055614008000233625, 'batch_size': 2048, 'num_inducing': 144, 'initialize_fe': True, 'minit': 'kmeans'}. Best is trial 0 with value: 0.06891942769289017.
INFO:root:After model training
INFO:root:31.70654296875
INFO:root:110.0
INFO:optuna.study.study:Trial 28 finished with value: 0.07349056005477905 and parameters: {'n_max': 460, 'n_layers': 3, 'n_out': 18, 'mean_type': 'constant', 'kernel_type': 'rbf', 'lr': 0.029062251036207975, 'batch_size': 2048, 'num_inducing': 88, 'initialize_fe': False, 'minit': 'random'}. Best is trial 0 with value: 0.06891942769289017.
INFO:root:After model training
INFO:root:33.5400390625
INFO:root:108.0
INFO:optuna.study.study:Trial 29 finished with value: 0.08480008691549301 and parameters: {'n_max': 756, 'n_layers': 2, 'n_out': 4, 'mean_type': 'constant', 'kernel_type': 'rbf', 'lr': 0.0013040884201465104, 'batch_size': 2048, 'num_inducing': 286, 'initialize_fe': False, 'minit': 'random'}. Best is trial 0 with value: 0.06891942769289017.
INFO:root:After model training
INFO:root:32.79443359375
INFO:root:108.0
INFO:optuna.study.study:Trial 30 finished with value: 0.07430656254291534 and parameters: {'n_max': 647, 'n_layers': 4, 'n_out': 10, 'mean_type': 'constant', 'kernel_type': 'rbf', 'lr': 0.0007652275799914139, 'batch_size': 2048, 'num_inducing': 51, 'initialize_fe': False, 'minit': 'random'}. Best is trial 0 with value: 0.06891942769289017.
INFO:root:After model training
INFO:root:32.62890625
INFO:root:114.0
INFO:optuna.study.study:Trial 31 finished with value: 0.0763922929763794 and parameters: {'n_max': 623, 'n_layers': 4, 'n_out': 3, 'mean_type': 'constant', 'kernel_type': 'rbf', 'lr': 0.004257736077848756, 'batch_size': 2048, 'num_inducing': 91, 'initialize_fe': False, 'minit': 'random'}. Best is trial 0 with value: 0.06891942769289017.
INFO:root:After model training
INFO:root:33.02392578125
INFO:root:112.0
INFO:optuna.study.study:Trial 32 finished with value: 0.07888130843639374 and parameters: {'n_max': 595, 'n_layers': 4, 'n_out': 3, 'mean_type': 'constant', 'kernel_type': 'rbf', 'lr': 0.0034562345016235035, 'batch_size': 2048, 'num_inducing': 143, 'initialize_fe': False, 'minit': 'random'}. Best is trial 0 with value: 0.06891942769289017.
INFO:root:After model training
INFO:root:34.3671875
INFO:root:108.0
INFO:optuna.study.study:Trial 33 finished with value: 0.07393647730350494 and parameters: {'n_max': 858, 'n_layers': 4, 'n_out': 3, 'mean_type': 'constant', 'kernel_type': 'rbf', 'lr': 0.005645953934204712, 'batch_size': 2048, 'num_inducing': 72, 'initialize_fe': False, 'minit': 'random'}. Best is trial 0 with value: 0.06891942769289017.
INFO:root:After model training
INFO:root:27.208984375
INFO:root:108.0
INFO:optuna.study.study:Trial 34 finished with value: 0.07714982330799103 and parameters: {'n_max': 953, 'n_layers': 3, 'n_out': 6, 'mean_type': 'constant', 'kernel_type': 'rbf', 'lr': 0.012346267530725345, 'batch_size': 512, 'num_inducing': 97, 'initialize_fe': False, 'minit': 'random'}. Best is trial 0 with value: 0.06891942769289017.
INFO:root:After model training
INFO:root:33.57177734375
INFO:root:116.0
INFO:optuna.study.study:Trial 35 finished with value: 0.07361233979463577 and parameters: {'n_max': 526, 'n_layers': 4, 'n_out': 2, 'mean_type': 'constant', 'kernel_type': 'rbf', 'lr': 0.0020221908841573126, 'batch_size': 2048, 'num_inducing': 222, 'initialize_fe': True, 'minit': 'kmeans'}. Best is trial 0 with value: 0.06891942769289017.
INFO:root:After model training
INFO:root:34.23291015625
INFO:root:110.0
INFO:optuna.study.study:Trial 36 finished with value: 0.1366167813539505 and parameters: {'n_max': 682, 'n_layers': 5, 'n_out': 15, 'mean_type': 'linear', 'kernel_type': 'rbf', 'lr': 0.0029849067654340432, 'batch_size': 2048, 'num_inducing': 143, 'initialize_fe': False, 'minit': 'random'}. Best is trial 0 with value: 0.06891942769289017.
INFO:root:After model training
INFO:root:26.0859375
INFO:root:110.0
INFO:optuna.study.study:Trial 37 finished with value: 0.07536815106868744 and parameters: {'n_max': 449, 'n_layers': 4, 'n_out': 7, 'mean_type': 'constant', 'kernel_type': 'rbf', 'lr': 0.020501563837863637, 'batch_size': 512, 'num_inducing': 63, 'initialize_fe': False, 'minit': 'random'}. Best is trial 0 with value: 0.06891942769289017.
INFO:root:After model training
INFO:root:44.72216796875
INFO:root:144.0
INFO:optuna.study.study:Trial 38 finished with value: 0.11506525427103043 and parameters: {'n_max': 371, 'n_layers': 3, 'n_out': 5, 'mean_type': 'linear', 'kernel_type': 'rbf', 'lr': 0.0019527607305594725, 'batch_size': 2048, 'num_inducing': 1046, 'initialize_fe': False, 'minit': 'kmeans'}. Best is trial 0 with value: 0.06891942769289017.
INFO:root:After model training
INFO:root:32.13330078125
INFO:root:112.0
INFO:optuna.study.study:Trial 39 finished with value: 0.10207392275333405 and parameters: {'n_max': 881, 'n_layers': 2, 'n_out': 16, 'mean_type': 'constant', 'kernel_type': 'matern1.5', 'lr': 0.0005611905968677769, 'batch_size': 2048, 'num_inducing': 169, 'initialize_fe': True, 'minit': 'random'}. Best is trial 0 with value: 0.06891942769289017.
INFO:root:After model training
INFO:root:33.38427734375
INFO:root:110.0
INFO:optuna.study.study:Trial 40 finished with value: 0.07455278933048248 and parameters: {'n_max': 727, 'n_layers': 4, 'n_out': 18, 'mean_type': 'constant', 'kernel_type': 'rbf', 'lr': 0.010616329561372054, 'batch_size': 2048, 'num_inducing': 102, 'initialize_fe': False, 'minit': 'random'}. Best is trial 0 with value: 0.06891942769289017.
INFO:root:After model training
INFO:root:27.10400390625
INFO:root:108.0
INFO:optuna.study.study:Trial 41 finished with value: 0.07778064161539078 and parameters: {'n_max': 945, 'n_layers': 3, 'n_out': 5, 'mean_type': 'constant', 'kernel_type': 'matern0.5', 'lr': 0.005958750269511112, 'batch_size': 1024, 'num_inducing': 56, 'initialize_fe': False, 'minit': 'random'}. Best is trial 0 with value: 0.06891942769289017.
INFO:root:After model training
INFO:root:27.27099609375
INFO:root:110.0
INFO:optuna.study.study:Trial 42 finished with value: 0.07622857391834259 and parameters: {'n_max': 984, 'n_layers': 3, 'n_out': 3, 'mean_type': 'constant', 'kernel_type': 'matern0.5', 'lr': 0.0067375920605562255, 'batch_size': 1024, 'num_inducing': 73, 'initialize_fe': False, 'minit': 'random'}. Best is trial 0 with value: 0.06891942769289017.
INFO:root:After model training
INFO:root:27.2021484375
INFO:root:108.0
INFO:optuna.study.study:Trial 43 finished with value: 0.07542157918214798 and parameters: {'n_max': 972, 'n_layers': 3, 'n_out': 2, 'mean_type': 'constant', 'kernel_type': 'matern0.5', 'lr': 0.0168951882617438, 'batch_size': 1024, 'num_inducing': 62, 'initialize_fe': False, 'minit': 'random'}. Best is trial 0 with value: 0.06891942769289017.
INFO:root:After model training
INFO:root:26.98828125
INFO:root:108.0
INFO:optuna.study.study:Trial 44 finished with value: 0.08131512999534607 and parameters: {'n_max': 820, 'n_layers': 3, 'n_out': 7, 'mean_type': 'constant', 'kernel_type': 'rbf', 'lr': 0.008802058333069315, 'batch_size': 1024, 'num_inducing': 116, 'initialize_fe': False, 'minit': 'random'}. Best is trial 0 with value: 0.06891942769289017.
INFO:root:After model training
INFO:root:28.19384765625
INFO:root:110.0
INFO:optuna.study.study:Trial 45 finished with value: 0.07821724563837051 and parameters: {'n_max': 902, 'n_layers': 4, 'n_out': 4, 'mean_type': 'constant', 'kernel_type': 'matern1.5', 'lr': 0.003512821729486251, 'batch_size': 1024, 'num_inducing': 76, 'initialize_fe': False, 'minit': 'random'}. Best is trial 0 with value: 0.06891942769289017.
INFO:root:After model training
INFO:root:25.3857421875
INFO:root:108.0
INFO:optuna.study.study:Trial 46 finished with value: 0.10967130959033966 and parameters: {'n_max': 807, 'n_layers': 2, 'n_out': 5, 'mean_type': 'linear', 'kernel_type': 'matern0.5', 'lr': 0.02660979486874928, 'batch_size': 512, 'num_inducing': 50, 'initialize_fe': False, 'minit': 'kmeans'}. Best is trial 0 with value: 0.06891942769289017.
INFO:root:After model training
INFO:root:36.75537109375
INFO:root:108.0
INFO:optuna.study.study:Trial 47 finished with value: 0.0786728709936142 and parameters: {'n_max': 859, 'n_layers': 3, 'n_out': 2, 'mean_type': 'constant', 'kernel_type': 'rbf', 'lr': 0.007083270721575311, 'batch_size': 1024, 'num_inducing': 1476, 'initialize_fe': False, 'minit': 'random'}. Best is trial 0 with value: 0.06891942769289017.
INFO:root:After model training
INFO:root:30.75830078125
INFO:root:112.0
INFO:optuna.study.study:Trial 48 finished with value: 0.09443267434835434 and parameters: {'n_max': 983, 'n_layers': 4, 'n_out': 6, 'mean_type': 'constant', 'kernel_type': 'matern1.5', 'lr': 0.0023944107094119025, 'batch_size': 1024, 'num_inducing': 586, 'initialize_fe': True, 'minit': 'random'}. Best is trial 0 with value: 0.06891942769289017.
INFO:root:After model training
INFO:root:28.14501953125
INFO:root:110.0
INFO:optuna.study.study:Trial 49 finished with value: 0.07831168174743652 and parameters: {'n_max': 748, 'n_layers': 4, 'n_out': 4, 'mean_type': 'constant', 'kernel_type': 'matern0.5', 'lr': 0.015713500567349468, 'batch_size': 1024, 'num_inducing': 352, 'initialize_fe': False, 'minit': 'random'}. Best is trial 0 with value: 0.06891942769289017.
INFO:root:After model training
INFO:root:32.310546875
INFO:root:112.0
INFO:optuna.study.study:Trial 50 finished with value: 0.07669331878423691 and parameters: {'n_max': 670, 'n_layers': 3, 'n_out': 13, 'mean_type': 'constant', 'kernel_type': 'rbf', 'lr': 0.009480152718351436, 'batch_size': 2048, 'num_inducing': 103, 'initialize_fe': False, 'minit': 'random'}. Best is trial 0 with value: 0.06891942769289017.
INFO:root:After model training
INFO:root:31.68603515625
INFO:root:112.0
INFO:optuna.study.study:Trial 51 finished with value: 0.07682769000530243 and parameters: {'n_max': 483, 'n_layers': 3, 'n_out': 19, 'mean_type': 'constant', 'kernel_type': 'rbf', 'lr': 0.03676565724773791, 'batch_size': 2048, 'num_inducing': 81, 'initialize_fe': False, 'minit': 'random'}. Best is trial 0 with value: 0.06891942769289017.
INFO:root:After model training
INFO:root:31.2802734375
INFO:root:108.0
INFO:optuna.study.study:Trial 52 finished with value: 0.07578766345977783 and parameters: {'n_max': 343, 'n_layers': 3, 'n_out': 18, 'mean_type': 'constant', 'kernel_type': 'rbf', 'lr': 0.02301372237131614, 'batch_size': 2048, 'num_inducing': 63, 'initialize_fe': False, 'minit': 'random'}. Best is trial 0 with value: 0.06891942769289017.
INFO:root:After model training
INFO:root:32.2490234375
INFO:root:110.0
INFO:optuna.study.study:Trial 53 finished with value: 0.07963433116674423 and parameters: {'n_max': 549, 'n_layers': 3, 'n_out': 19, 'mean_type': 'constant', 'kernel_type': 'rbf', 'lr': 0.08833357812355742, 'batch_size': 2048, 'num_inducing': 125, 'initialize_fe': False, 'minit': 'random'}. Best is trial 0 with value: 0.06891942769289017.
INFO:root:After model training
INFO:root:31.416015625
INFO:root:110.0
INFO:optuna.study.study:Trial 54 finished with value: 0.07066130638122559 and parameters: {'n_max': 261, 'n_layers': 3, 'n_out': 17, 'mean_type': 'constant', 'kernel_type': 'rbf', 'lr': 0.032077945822086666, 'batch_size': 2048, 'num_inducing': 88, 'initialize_fe': False, 'minit': 'random'}. Best is trial 0 with value: 0.06891942769289017.
INFO:root:After model training
INFO:root:31.09912109375
INFO:root:110.0
INFO:optuna.study.study:Trial 55 finished with value: 0.06938410550355911 and parameters: {'n_max': 190, 'n_layers': 4, 'n_out': 3, 'mean_type': 'constant', 'kernel_type': 'matern1.5', 'lr': 0.04409790000946565, 'batch_size': 2048, 'num_inducing': 57, 'initialize_fe': False, 'minit': 'random'}. Best is trial 0 with value: 0.06891942769289017.
INFO:root:After model training
INFO:root:31.126953125
INFO:root:108.0
INFO:optuna.study.study:Trial 56 finished with value: 0.07390723377466202 and parameters: {'n_max': 207, 'n_layers': 4, 'n_out': 17, 'mean_type': 'constant', 'kernel_type': 'matern1.5', 'lr': 0.0633705407214074, 'batch_size': 2048, 'num_inducing': 56, 'initialize_fe': False, 'minit': 'random'}. Best is trial 0 with value: 0.06891942769289017.
INFO:root:After model training
INFO:root:32.65087890625
INFO:root:112.0
INFO:optuna.study.study:Trial 57 finished with value: 0.11199310421943665 and parameters: {'n_max': 91, 'n_layers': 4, 'n_out': 3, 'mean_type': 'linear', 'kernel_type': 'matern1.5', 'lr': 0.040869794899149436, 'batch_size': 2048, 'num_inducing': 222, 'initialize_fe': False, 'minit': 'kmeans'}. Best is trial 0 with value: 0.06891942769289017.
INFO:root:After model training
INFO:root:41.7900390625
INFO:root:164.0
INFO:optuna.study.study:Trial 58 finished with value: 0.07616130262613297 and parameters: {'n_max': 157, 'n_layers': 5, 'n_out': 16, 'mean_type': 'constant', 'kernel_type': 'matern1.5', 'lr': 0.034148538063365486, 'batch_size': 2048, 'num_inducing': 902, 'initialize_fe': False, 'minit': 'random'}. Best is trial 0 with value: 0.06891942769289017.
INFO:root:After model training
INFO:root:31.3857421875
INFO:root:110.0
INFO:optuna.study.study:Trial 59 finished with value: 0.0731566846370697 and parameters: {'n_max': 278, 'n_layers': 4, 'n_out': 19, 'mean_type': 'constant', 'kernel_type': 'matern1.5', 'lr': 0.046940639724916966, 'batch_size': 2048, 'num_inducing': 70, 'initialize_fe': True, 'minit': 'random'}. Best is trial 0 with value: 0.06891942769289017.
INFO:root:After model training
INFO:root:35.8994140625
INFO:root:128.0
INFO:optuna.study.study:Trial 60 finished with value: 0.07252426445484161 and parameters: {'n_max': 166, 'n_layers': 4, 'n_out': 2, 'mean_type': 'constant', 'kernel_type': 'matern1.5', 'lr': 0.07224305253328639, 'batch_size': 2048, 'num_inducing': 495, 'initialize_fe': False, 'minit': 'random'}. Best is trial 0 with value: 0.06891942769289017.
INFO:root:After model training
INFO:root:36.34521484375
INFO:root:124.0
INFO:optuna.study.study:Trial 61 finished with value: 0.07382401078939438 and parameters: {'n_max': 150, 'n_layers': 4, 'n_out': 2, 'mean_type': 'constant', 'kernel_type': 'matern1.5', 'lr': 0.08810655241509097, 'batch_size': 2048, 'num_inducing': 458, 'initialize_fe': False, 'minit': 'random'}. Best is trial 0 with value: 0.06891942769289017.
INFO:root:After model training
INFO:root:37.84130859375
INFO:root:124.0
INFO:optuna.study.study:Trial 62 finished with value: 0.07281024754047394 and parameters: {'n_max': 212, 'n_layers': 4, 'n_out': 3, 'mean_type': 'constant', 'kernel_type': 'matern1.5', 'lr': 0.062464817242731875, 'batch_size': 2048, 'num_inducing': 555, 'initialize_fe': False, 'minit': 'random'}. Best is trial 0 with value: 0.06891942769289017.
INFO:root:After model training
INFO:root:37.33544921875
INFO:root:124.0
INFO:optuna.study.study:Trial 63 finished with value: 0.07423365116119385 and parameters: {'n_max': 237, 'n_layers': 4, 'n_out': 4, 'mean_type': 'constant', 'kernel_type': 'matern1.5', 'lr': 0.06400202255162413, 'batch_size': 2048, 'num_inducing': 538, 'initialize_fe': False, 'minit': 'random'}. Best is trial 0 with value: 0.06891942769289017.
INFO:root:After model training
INFO:root:41.19384765625
INFO:root:140.0
INFO:optuna.study.study:Trial 64 finished with value: 0.07339920848608017 and parameters: {'n_max': 286, 'n_layers': 4, 'n_out': 2, 'mean_type': 'constant', 'kernel_type': 'matern1.5', 'lr': 0.07255242725412034, 'batch_size': 2048, 'num_inducing': 716, 'initialize_fe': False, 'minit': 'random'}. Best is trial 0 with value: 0.06891942769289017.
INFO:root:After model training
INFO:root:36.49169921875
INFO:root:126.0
INFO:optuna.study.study:Trial 65 finished with value: 0.07502120733261108 and parameters: {'n_max': 158, 'n_layers': 4, 'n_out': 3, 'mean_type': 'constant', 'kernel_type': 'matern1.5', 'lr': 0.04649273816281234, 'batch_size': 2048, 'num_inducing': 407, 'initialize_fe': False, 'minit': 'random'}. Best is trial 0 with value: 0.06891942769289017.
INFO:root:After model training
INFO:root:28.7421875
INFO:root:112.0
INFO:optuna.study.study:Trial 66 finished with value: 0.0858134776353836 and parameters: {'n_max': 71, 'n_layers': 5, 'n_out': 20, 'mean_type': 'constant', 'kernel_type': 'matern1.5', 'lr': 0.02549084381715981, 'batch_size': 512, 'num_inducing': 811, 'initialize_fe': False, 'minit': 'random'}. Best is trial 0 with value: 0.06891942769289017.
INFO:root:After model training
INFO:root:45.53955078125
INFO:root:180.0
INFO:optuna.study.study:Trial 67 finished with value: 0.0718291699886322 and parameters: {'n_max': 201, 'n_layers': 4, 'n_out': 2, 'mean_type': 'constant', 'kernel_type': 'matern1.5', 'lr': 0.031533696929701, 'batch_size': 2048, 'num_inducing': 1117, 'initialize_fe': False, 'minit': 'random'}. Best is trial 0 with value: 0.06891942769289017.
INFO:root:After model training
INFO:root:46.37939453125
INFO:root:160.0
