INFO:optuna.study.study:Trial 72 finished with value: 0.00012466128100641072 and parameters: {'n_max': 447, 'n_layers': 3, 'n_out': 5, 'mean_type': 'constant', 'kernel_type': 'rbf', 'lr': 0.004098778479505467, 'batch_size': 512, 'num_inducing': 88, 'initialize_fe': False, 'minit': 'random'}. Best is trial 55 with value: 7.945439574541524e-05.
INFO:root:After model training
INFO:root:0.72412109375
INFO:root:6.0
INFO:optuna.study.study:Trial 73 finished with value: 0.00017373953596688807 and parameters: {'n_max': 460, 'n_layers': 3, 'n_out': 5, 'mean_type': 'constant', 'kernel_type': 'rbf', 'lr': 0.0039281219898638425, 'batch_size': 512, 'num_inducing': 91, 'initialize_fe': False, 'minit': 'random'}. Best is trial 55 with value: 7.945439574541524e-05.
INFO:root:After model training
INFO:root:0.63134765625
INFO:root:10.0
INFO:optuna.study.study:Trial 74 finished with value: 0.0001029958002618514 and parameters: {'n_max': 418, 'n_layers': 3, 'n_out': 6, 'mean_type': 'constant', 'kernel_type': 'rbf', 'lr': 0.005946039068869238, 'batch_size': 512, 'num_inducing': 78, 'initialize_fe': False, 'minit': 'random'}. Best is trial 55 with value: 7.945439574541524e-05.
INFO:root:After model training
INFO:root:0.634765625
INFO:root:6.0
INFO:optuna.study.study:Trial 75 finished with value: 0.00022669837926514447 and parameters: {'n_max': 424, 'n_layers': 3, 'n_out': 2, 'mean_type': 'constant', 'kernel_type': 'rbf', 'lr': 0.011472805143215995, 'batch_size': 512, 'num_inducing': 78, 'initialize_fe': False, 'minit': 'random'}. Best is trial 55 with value: 7.945439574541524e-05.
INFO:root:After model training
INFO:root:6.6708984375
INFO:root:24.0
INFO:optuna.study.study:Trial 76 finished with value: 0.0009262015228159726 and parameters: {'n_max': 351, 'n_layers': 3, 'n_out': 3, 'mean_type': 'constant', 'kernel_type': 'rbf', 'lr': 0.00636981857644843, 'batch_size': 2048, 'num_inducing': 77, 'initialize_fe': False, 'minit': 'random'}. Best is trial 55 with value: 7.945439574541524e-05.
INFO:root:After model training
INFO:root:0.49462890625
INFO:root:8.0
INFO:optuna.study.study:Trial 77 finished with value: 0.0001020230702124536 and parameters: {'n_max': 289, 'n_layers': 3, 'n_out': 4, 'mean_type': 'constant', 'kernel_type': 'rbf', 'lr': 0.0028040585006227467, 'batch_size': 512, 'num_inducing': 103, 'initialize_fe': False, 'minit': 'random'}. Best is trial 55 with value: 7.945439574541524e-05.
INFO:root:After model training
INFO:root:0.49169921875
INFO:root:8.0
INFO:optuna.study.study:Trial 78 finished with value: 0.00028546893736347556 and parameters: {'n_max': 284, 'n_layers': 3, 'n_out': 4, 'mean_type': 'constant', 'kernel_type': 'rbf', 'lr': 0.002684897541960905, 'batch_size': 512, 'num_inducing': 104, 'initialize_fe': False, 'minit': 'random'}. Best is trial 55 with value: 7.945439574541524e-05.
INFO:root:After model training
INFO:root:0.43505859375
INFO:root:8.0
INFO:optuna.study.study:Trial 79 finished with value: 0.000425761187216267 and parameters: {'n_max': 302, 'n_layers': 3, 'n_out': 3, 'mean_type': 'constant', 'kernel_type': 'rbf', 'lr': 0.0016529776672631767, 'batch_size': 1024, 'num_inducing': 60, 'initialize_fe': False, 'minit': 'random'}. Best is trial 55 with value: 7.945439574541524e-05.
INFO:root:After model training
INFO:root:0.86962890625
INFO:root:8.0
INFO:optuna.study.study:Trial 80 finished with value: 0.00013582799874711782 and parameters: {'n_max': 406, 'n_layers': 4, 'n_out': 6, 'mean_type': 'constant', 'kernel_type': 'rbf', 'lr': 0.00565073988738187, 'batch_size': 512, 'num_inducing': 83, 'initialize_fe': False, 'minit': 'random'}. Best is trial 55 with value: 7.945439574541524e-05.
INFO:root:After model training
INFO:root:0.6298828125
INFO:root:8.0
INFO:optuna.study.study:Trial 81 finished with value: 0.0001514976902399212 and parameters: {'n_max': 375, 'n_layers': 3, 'n_out': 5, 'mean_type': 'constant', 'kernel_type': 'rbf', 'lr': 0.007814786351444785, 'batch_size': 512, 'num_inducing': 114, 'initialize_fe': False, 'minit': 'random'}. Best is trial 55 with value: 7.945439574541524e-05.
INFO:root:After model training
INFO:root:0.50439453125
INFO:root:8.0
INFO:optuna.study.study:Trial 82 finished with value: 0.00014508113963529468 and parameters: {'n_max': 322, 'n_layers': 3, 'n_out': 4, 'mean_type': 'constant', 'kernel_type': 'rbf', 'lr': 0.0019205309409135456, 'batch_size': 512, 'num_inducing': 86, 'initialize_fe': False, 'minit': 'random'}. Best is trial 55 with value: 7.945439574541524e-05.
INFO:root:After model training
INFO:root:0.7646484375
INFO:root:8.0
INFO:optuna.study.study:Trial 83 finished with value: 0.00013612602197099477 and parameters: {'n_max': 476, 'n_layers': 3, 'n_out': 6, 'mean_type': 'constant', 'kernel_type': 'rbf', 'lr': 0.004476560815026864, 'batch_size': 512, 'num_inducing': 96, 'initialize_fe': False, 'minit': 'random'}. Best is trial 55 with value: 7.945439574541524e-05.
INFO:root:After model training
INFO:root:0.71875
INFO:root:10.0
INFO:optuna.study.study:Trial 84 finished with value: 0.0001450227719033137 and parameters: {'n_max': 445, 'n_layers': 3, 'n_out': 5, 'mean_type': 'constant', 'kernel_type': 'rbf', 'lr': 0.0029044119662254893, 'batch_size': 512, 'num_inducing': 102, 'initialize_fe': False, 'minit': 'random'}. Best is trial 55 with value: 7.945439574541524e-05.
INFO:root:After model training
INFO:root:0.607421875
INFO:root:4.0
INFO:optuna.study.study:Trial 85 finished with value: 0.0001462367654312402 and parameters: {'n_max': 413, 'n_layers': 3, 'n_out': 7, 'mean_type': 'constant', 'kernel_type': 'rbf', 'lr': 0.0056833505796021104, 'batch_size': 512, 'num_inducing': 67, 'initialize_fe': False, 'minit': 'random'}. Best is trial 55 with value: 7.945439574541524e-05.
INFO:root:After model training
INFO:root:0.7431640625
INFO:root:6.0
INFO:optuna.study.study:Trial 86 finished with value: 0.00012327241711318493 and parameters: {'n_max': 507, 'n_layers': 3, 'n_out': 3, 'mean_type': 'constant', 'kernel_type': 'rbf', 'lr': 0.003537181546287643, 'batch_size': 512, 'num_inducing': 51, 'initialize_fe': False, 'minit': 'random'}. Best is trial 55 with value: 7.945439574541524e-05.
INFO:root:After model training
INFO:root:0.7685546875
INFO:root:8.0
INFO:optuna.study.study:Trial 87 finished with value: 0.0001798803568817675 and parameters: {'n_max': 519, 'n_layers': 3, 'n_out': 3, 'mean_type': 'constant', 'kernel_type': 'rbf', 'lr': 0.003624432169011662, 'batch_size': 512, 'num_inducing': 51, 'initialize_fe': False, 'minit': 'random'}. Best is trial 55 with value: 7.945439574541524e-05.
INFO:root:After model training
INFO:root:0.37158203125
INFO:root:4.0
INFO:optuna.study.study:Trial 88 finished with value: 0.0002308645925950259 and parameters: {'n_max': 244, 'n_layers': 3, 'n_out': 3, 'mean_type': 'constant', 'kernel_type': 'rbf', 'lr': 0.015364988594335301, 'batch_size': 512, 'num_inducing': 59, 'initialize_fe': False, 'minit': 'random'}. Best is trial 55 with value: 7.945439574541524e-05.
INFO:root:After model training
INFO:root:6.4580078125
INFO:root:26.0
INFO:optuna.study.study:Trial 89 finished with value: 0.0019825196359306574 and parameters: {'n_max': 494, 'n_layers': 3, 'n_out': 2, 'mean_type': 'constant', 'kernel_type': 'rbf', 'lr': 0.002171529831104101, 'batch_size': 2048, 'num_inducing': 71, 'initialize_fe': False, 'minit': 'random'}. Best is trial 55 with value: 7.945439574541524e-05.
INFO:root:After model training
INFO:root:1.8671875
INFO:root:10.0
INFO:optuna.study.study:Trial 90 finished with value: 0.0002314643788849935 and parameters: {'n_max': 549, 'n_layers': 5, 'n_out': 4, 'mean_type': 'constant', 'kernel_type': 'rbf', 'lr': 0.0025801597886623844, 'batch_size': 512, 'num_inducing': 141, 'initialize_fe': False, 'minit': 'random'}. Best is trial 55 with value: 7.945439574541524e-05.
INFO:root:After model training
INFO:root:0.802734375
INFO:root:8.0
INFO:optuna.study.study:Trial 91 finished with value: 0.00010911327990470454 and parameters: {'n_max': 469, 'n_layers': 3, 'n_out': 5, 'mean_type': 'constant', 'kernel_type': 'rbf', 'lr': 0.004778851428174245, 'batch_size': 512, 'num_inducing': 123, 'initialize_fe': False, 'minit': 'random'}. Best is trial 55 with value: 7.945439574541524e-05.
INFO:root:After model training
INFO:root:0.72509765625
INFO:root:6.0
INFO:optuna.study.study:Trial 92 finished with value: 0.0038194856606423855 and parameters: {'n_max': 369, 'n_layers': 3, 'n_out': 6, 'mean_type': 'constant', 'kernel_type': 'rbf', 'lr': 0.08947971226111112, 'batch_size': 512, 'num_inducing': 161, 'initialize_fe': False, 'minit': 'random'}. Best is trial 55 with value: 7.945439574541524e-05.
INFO:root:After model training
INFO:root:0.802734375
INFO:root:6.0
INFO:optuna.study.study:Trial 93 finished with value: 0.00010479009506525472 and parameters: {'n_max': 468, 'n_layers': 3, 'n_out': 4, 'mean_type': 'constant', 'kernel_type': 'rbf', 'lr': 0.0030894299833195025, 'batch_size': 512, 'num_inducing': 125, 'initialize_fe': False, 'minit': 'random'}. Best is trial 55 with value: 7.945439574541524e-05.
INFO:root:After model training
INFO:root:0.82421875
INFO:root:8.0
INFO:optuna.study.study:Trial 94 finished with value: 0.0002030295436270535 and parameters: {'n_max': 477, 'n_layers': 3, 'n_out': 4, 'mean_type': 'constant', 'kernel_type': 'rbf', 'lr': 0.0012643263635746553, 'batch_size': 512, 'num_inducing': 128, 'initialize_fe': False, 'minit': 'random'}. Best is trial 55 with value: 7.945439574541524e-05.
INFO:root:After model training
INFO:root:0.755859375
INFO:root:10.0
INFO:optuna.study.study:Trial 95 finished with value: 0.00024058874987531453 and parameters: {'n_max': 341, 'n_layers': 4, 'n_out': 7, 'mean_type': 'constant', 'kernel_type': 'matern0.5', 'lr': 0.004936140590774298, 'batch_size': 512, 'num_inducing': 112, 'initialize_fe': False, 'minit': 'random'}. Best is trial 55 with value: 7.945439574541524e-05.
INFO:root:After model training
INFO:root:0.6337890625
INFO:root:8.0
INFO:optuna.study.study:Trial 96 finished with value: 0.0001791655959095806 and parameters: {'n_max': 398, 'n_layers': 3, 'n_out': 5, 'mean_type': 'constant', 'kernel_type': 'rbf', 'lr': 0.0029202676039023975, 'batch_size': 512, 'num_inducing': 97, 'initialize_fe': False, 'minit': 'random'}. Best is trial 55 with value: 7.945439574541524e-05.
INFO:root:After model training
INFO:root:1.0703125
INFO:root:10.0
INFO:optuna.study.study:Trial 97 finished with value: 0.00022162741515785456 and parameters: {'n_max': 579, 'n_layers': 3, 'n_out': 6, 'mean_type': 'constant', 'kernel_type': 'rbf', 'lr': 0.0014513991420192285, 'batch_size': 1024, 'num_inducing': 143, 'initialize_fe': False, 'minit': 'random'}. Best is trial 55 with value: 7.945439574541524e-05.
INFO:root:After model training
INFO:root:0.56201171875
INFO:root:8.0
INFO:optuna.study.study:Trial 98 finished with value: 0.00013019503967370838 and parameters: {'n_max': 320, 'n_layers': 2, 'n_out': 19, 'mean_type': 'constant', 'kernel_type': 'rbf', 'lr': 0.0017929621195462092, 'batch_size': 512, 'num_inducing': 195, 'initialize_fe': False, 'minit': 'random'}. Best is trial 55 with value: 7.945439574541524e-05.
INFO:root:After model training
INFO:root:0.384765625
INFO:root:6.0
INFO:optuna.study.study:Trial 99 finished with value: 0.00015939184231683612 and parameters: {'n_max': 532, 'n_layers': 2, 'n_out': 7, 'mean_type': 'constant', 'kernel_type': 'rbf', 'lr': 0.009677583229742945, 'batch_size': 512, 'num_inducing': 121, 'initialize_fe': False, 'minit': 'random'}. Best is trial 55 with value: 7.945439574541524e-05.
INFO:root:Outer Run: 1: MSE - 1.9545598206605064e-06, MAE - 0.0012612248538061976. MAX - 0.0028361082077026367
INFO:optuna.storages._in_memory:A new study created in memory with name: Nested Resampling VDKL 2
INFO:root:After model training
INFO:root:10.2724609375
INFO:root:30.0
INFO:optuna.study.study:Trial 0 finished with value: 0.00020350448903627694 and parameters: {'n_max': 1024, 'n_layers': 4, 'n_out': 2, 'mean_type': 'constant', 'kernel_type': 'rbf', 'lr': 0.01, 'batch_size': 512, 'num_inducing': 1000, 'initialize_fe': False, 'minit': 'random'}. Best is trial 0 with value: 0.00020350448903627694.
INFO:root:After model training
INFO:root:5.90771484375
INFO:root:32.0
INFO:optuna.study.study:Trial 1 finished with value: 0.0009667870472185314 and parameters: {'n_max': 937, 'n_layers': 4, 'n_out': 13, 'mean_type': 'linear', 'kernel_type': 'matern1.5', 'lr': 0.00010981665533791488, 'batch_size': 512, 'num_inducing': 409, 'initialize_fe': False, 'minit': 'random'}. Best is trial 0 with value: 0.00020350448903627694.
INFO:root:After model training
INFO:root:9.20458984375
INFO:root:26.0
INFO:optuna.study.study:Trial 2 finished with value: 0.0004953981842845678 and parameters: {'n_max': 944, 'n_layers': 3, 'n_out': 15, 'mean_type': 'constant', 'kernel_type': 'matern1.5', 'lr': 0.0005583581122549358, 'batch_size': 1024, 'num_inducing': 1082, 'initialize_fe': False, 'minit': 'random'}. Best is trial 0 with value: 0.00020350448903627694.
INFO:root:After model training
INFO:root:2.5107421875
INFO:root:10.0
INFO:optuna.study.study:Trial 3 finished with value: 0.0004228182078804821 and parameters: {'n_max': 566, 'n_layers': 3, 'n_out': 6, 'mean_type': 'linear', 'kernel_type': 'matern1.5', 'lr': 0.000625073149783642, 'batch_size': 512, 'num_inducing': 81, 'initialize_fe': False, 'minit': 'kmeans'}. Best is trial 0 with value: 0.00020350448903627694.
INFO:root:After model training
INFO:root:8.28125
INFO:root:28.0
INFO:optuna.study.study:Trial 4 finished with value: 0.011873729526996613 and parameters: {'n_max': 291, 'n_layers': 4, 'n_out': 7, 'mean_type': 'linear', 'kernel_type': 'rbf', 'lr': 0.00047216798228472573, 'batch_size': 1024, 'num_inducing': 1139, 'initialize_fe': False, 'minit': 'random'}. Best is trial 0 with value: 0.00020350448903627694.
INFO:root:After model training
INFO:root:13.82861328125
INFO:root:54.0
INFO:optuna.study.study:Trial 5 finished with value: 0.013604854233562946 and parameters: {'n_max': 559, 'n_layers': 3, 'n_out': 8, 'mean_type': 'constant', 'kernel_type': 'rbf', 'lr': 0.00028877491717675435, 'batch_size': 2048, 'num_inducing': 567, 'initialize_fe': False, 'minit': 'kmeans'}. Best is trial 0 with value: 0.00020350448903627694.
INFO:root:After model training
INFO:root:8.4248046875
INFO:root:28.0
INFO:optuna.study.study:Trial 6 finished with value: 0.044454529881477356 and parameters: {'n_max': 414, 'n_layers': 5, 'n_out': 8, 'mean_type': 'linear', 'kernel_type': 'matern0.5', 'lr': 0.002515679647515144, 'batch_size': 2048, 'num_inducing': 72, 'initialize_fe': False, 'minit': 'random'}. Best is trial 0 with value: 0.00020350448903627694.
INFO:root:After model training
INFO:root:6.7421875
INFO:root:26.0
INFO:optuna.study.study:Trial 7 finished with value: 0.0005648748483508825 and parameters: {'n_max': 1003, 'n_layers': 5, 'n_out': 8, 'mean_type': 'constant', 'kernel_type': 'matern1.5', 'lr': 0.009326834813877664, 'batch_size': 1024, 'num_inducing': 81, 'initialize_fe': False, 'minit': 'random'}. Best is trial 0 with value: 0.00020350448903627694.
INFO:root:After model training
INFO:root:6.8681640625
INFO:root:26.0
INFO:optuna.study.study:Trial 8 finished with value: 0.0005376653862185776 and parameters: {'n_max': 1013, 'n_layers': 5, 'n_out': 19, 'mean_type': 'constant', 'kernel_type': 'matern0.5', 'lr': 0.0014355964687577031, 'batch_size': 1024, 'num_inducing': 61, 'initialize_fe': True, 'minit': 'random'}. Best is trial 0 with value: 0.00020350448903627694.
INFO:root:After model training
INFO:root:1.90234375
INFO:root:8.0
INFO:optuna.study.study:Trial 9 finished with value: 0.00025594112230464816 and parameters: {'n_max': 360, 'n_layers': 2, 'n_out': 7, 'mean_type': 'constant', 'kernel_type': 'matern0.5', 'lr': 0.0029929462141604483, 'batch_size': 512, 'num_inducing': 88, 'initialize_fe': True, 'minit': 'kmeans'}. Best is trial 0 with value: 0.00020350448903627694.
INFO:root:After model training
INFO:root:2.24267578125
INFO:root:10.0
INFO:optuna.study.study:Trial 10 finished with value: 0.004610955249518156 and parameters: {'n_max': 74, 'n_layers': 2, 'n_out': 3, 'mean_type': 'constant', 'kernel_type': 'rbf', 'lr': 0.09810953648701393, 'batch_size': 512, 'num_inducing': 238, 'initialize_fe': True, 'minit': 'random'}. Best is trial 0 with value: 0.00020350448903627694.
INFO:root:After model training
INFO:root:2.0712890625
INFO:root:6.0
INFO:optuna.study.study:Trial 11 finished with value: 0.00030626400257460773 and parameters: {'n_max': 733, 'n_layers': 2, 'n_out': 2, 'mean_type': 'constant', 'kernel_type': 'matern0.5', 'lr': 0.011776708804102132, 'batch_size': 512, 'num_inducing': 168, 'initialize_fe': True, 'minit': 'kmeans'}. Best is trial 0 with value: 0.00020350448903627694.
INFO:root:After model training
INFO:root:2.26220703125
INFO:root:8.0
INFO:optuna.study.study:Trial 12 finished with value: 0.00023613730445504189 and parameters: {'n_max': 257, 'n_layers': 4, 'n_out': 4, 'mean_type': 'constant', 'kernel_type': 'rbf', 'lr': 0.010794225131014924, 'batch_size': 512, 'num_inducing': 156, 'initialize_fe': True, 'minit': 'kmeans'}. Best is trial 0 with value: 0.00020350448903627694.
INFO:root:After model training
INFO:root:17.1640625
INFO:root:34.0
INFO:optuna.study.study:Trial 13 finished with value: 0.00034830105141736567 and parameters: {'n_max': 149, 'n_layers': 4, 'n_out': 4, 'mean_type': 'constant', 'kernel_type': 'rbf', 'lr': 0.017938610354868222, 'batch_size': 512, 'num_inducing': 1825, 'initialize_fe': True, 'minit': 'kmeans'}. Best is trial 0 with value: 0.00020350448903627694.
INFO:root:After model training
INFO:root:4.1611328125
INFO:root:34.0
INFO:optuna.study.study:Trial 14 finished with value: 0.0012876844266429543 and parameters: {'n_max': 770, 'n_layers': 4, 'n_out': 11, 'mean_type': 'constant', 'kernel_type': 'rbf', 'lr': 0.044859250554926275, 'batch_size': 512, 'num_inducing': 184, 'initialize_fe': True, 'minit': 'kmeans'}. Best is trial 0 with value: 0.00020350448903627694.
INFO:root:After model training
INFO:root:5.32958984375
INFO:root:32.0
INFO:optuna.study.study:Trial 15 finished with value: 0.00013297305849846452 and parameters: {'n_max': 737, 'n_layers': 4, 'n_out': 4, 'mean_type': 'constant', 'kernel_type': 'rbf', 'lr': 0.00699815609583173, 'batch_size': 512, 'num_inducing': 537, 'initialize_fe': True, 'minit': 'kmeans'}. Best is trial 15 with value: 0.00013297305849846452.
INFO:root:After model training
INFO:root:15.76171875
INFO:root:72.0
INFO:optuna.study.study:Trial 16 finished with value: 0.004725835286080837 and parameters: {'n_max': 801, 'n_layers': 3, 'n_out': 2, 'mean_type': 'constant', 'kernel_type': 'rbf', 'lr': 0.030507408926994654, 'batch_size': 2048, 'num_inducing': 640, 'initialize_fe': False, 'minit': 'kmeans'}. Best is trial 15 with value: 0.00013297305849846452.
INFO:root:After model training
INFO:root:7.73486328125
INFO:root:30.0
INFO:optuna.study.study:Trial 17 finished with value: 0.0001479361962992698 and parameters: {'n_max': 668, 'n_layers': 5, 'n_out': 11, 'mean_type': 'constant', 'kernel_type': 'rbf', 'lr': 0.0058355376608595745, 'batch_size': 512, 'num_inducing': 861, 'initialize_fe': True, 'minit': 'random'}. Best is trial 15 with value: 0.00013297305849846452.
INFO:root:After model training
INFO:root:4.95751953125
INFO:root:32.0
INFO:optuna.study.study:Trial 18 finished with value: 0.0006669436115771532 and parameters: {'n_max': 655, 'n_layers': 5, 'n_out': 11, 'mean_type': 'linear', 'kernel_type': 'rbf', 'lr': 0.005432635475802509, 'batch_size': 512, 'num_inducing': 409, 'initialize_fe': True, 'minit': 'random'}. Best is trial 15 with value: 0.00013297305849846452.
INFO:root:After model training
INFO:root:18.8017578125
INFO:root:74.0
INFO:optuna.study.study:Trial 19 finished with value: 0.00166226364672184 and parameters: {'n_max': 661, 'n_layers': 5, 'n_out': 17, 'mean_type': 'constant', 'kernel_type': 'rbf', 'lr': 0.0014214503723111588, 'batch_size': 2048, 'num_inducing': 745, 'initialize_fe': True, 'minit': 'kmeans'}. Best is trial 15 with value: 0.00013297305849846452.
INFO:root:After model training
INFO:root:18.3779296875
INFO:root:64.0
INFO:optuna.study.study:Trial 20 finished with value: 0.00023456965573132038 and parameters: {'n_max': 457, 'n_layers': 5, 'n_out': 13, 'mean_type': 'constant', 'kernel_type': 'rbf', 'lr': 0.004015638026657417, 'batch_size': 512, 'num_inducing': 1880, 'initialize_fe': True, 'minit': 'kmeans'}. Best is trial 15 with value: 0.00013297305849846452.
INFO:root:After model training
INFO:root:9.609375
INFO:root:28.0
INFO:optuna.study.study:Trial 21 finished with value: 0.00018990752869285643 and parameters: {'n_max': 817, 'n_layers': 4, 'n_out': 5, 'mean_type': 'constant', 'kernel_type': 'rbf', 'lr': 0.007638867642330661, 'batch_size': 512, 'num_inducing': 1069, 'initialize_fe': True, 'minit': 'random'}. Best is trial 15 with value: 0.00013297305849846452.
INFO:root:After model training
INFO:root:13.330078125
INFO:root:30.0
INFO:optuna.study.study:Trial 22 finished with value: 0.00015340532991103828 and parameters: {'n_max': 844, 'n_layers': 4, 'n_out': 5, 'mean_type': 'constant', 'kernel_type': 'rbf', 'lr': 0.00564955451710619, 'batch_size': 512, 'num_inducing': 1407, 'initialize_fe': True, 'minit': 'random'}. Best is trial 15 with value: 0.00013297305849846452.
INFO:root:After model training
INFO:root:14.583984375
INFO:root:48.0
INFO:optuna.study.study:Trial 23 finished with value: 0.0001695866958471015 and parameters: {'n_max': 892, 'n_layers': 4, 'n_out': 10, 'mean_type': 'constant', 'kernel_type': 'rbf', 'lr': 0.0017981457709028178, 'batch_size': 512, 'num_inducing': 1485, 'initialize_fe': True, 'minit': 'random'}. Best is trial 15 with value: 0.00013297305849846452.
INFO:root:After model training
INFO:root:5.20263671875
INFO:root:34.0
