INFO:optuna.study.study:Trial 52 finished with value: 0.06966634094715118 and parameters: {'n_max': 357, 'n_layers': 3, 'n_out': 15, 'mean_type': 'constant', 'kernel_type': 'matern0.5', 'lr': 0.00016430377344434506, 'batch_size': 1024, 'num_inducing': 119, 'initialize_fe': False, 'minit': 'kmeans'}. Best is trial 46 with value: 0.06935665011405945.
INFO:root:After model training
INFO:root:0.68359375
INFO:root:6.0
INFO:optuna.study.study:Trial 53 finished with value: 0.07109799981117249 and parameters: {'n_max': 342, 'n_layers': 3, 'n_out': 13, 'mean_type': 'constant', 'kernel_type': 'matern0.5', 'lr': 0.00026820636593108773, 'batch_size': 1024, 'num_inducing': 155, 'initialize_fe': False, 'minit': 'kmeans'}. Best is trial 46 with value: 0.06935665011405945.
INFO:root:After model training
INFO:root:0.7802734375
INFO:root:10.0
INFO:optuna.study.study:Trial 54 finished with value: 0.07314449548721313 and parameters: {'n_max': 284, 'n_layers': 3, 'n_out': 15, 'mean_type': 'constant', 'kernel_type': 'matern0.5', 'lr': 0.00015723642354432531, 'batch_size': 1024, 'num_inducing': 221, 'initialize_fe': False, 'minit': 'kmeans'}. Best is trial 46 with value: 0.06935665011405945.
INFO:root:After model training
INFO:root:0.3642578125
INFO:root:8.0
INFO:optuna.study.study:Trial 55 finished with value: 0.08346763253211975 and parameters: {'n_max': 381, 'n_layers': 2, 'n_out': 12, 'mean_type': 'constant', 'kernel_type': 'matern1.5', 'lr': 0.00014141989195745833, 'batch_size': 1024, 'num_inducing': 111, 'initialize_fe': False, 'minit': 'kmeans'}. Best is trial 46 with value: 0.06935665011405945.
INFO:root:After model training
INFO:root:0.38134765625
INFO:root:10.0
INFO:optuna.study.study:Trial 56 finished with value: 0.08258821070194244 and parameters: {'n_max': 88, 'n_layers': 3, 'n_out': 14, 'mean_type': 'constant', 'kernel_type': 'matern0.5', 'lr': 0.00025922171325652054, 'batch_size': 1024, 'num_inducing': 120, 'initialize_fe': True, 'minit': 'kmeans'}. Best is trial 46 with value: 0.06935665011405945.
INFO:root:After model training
INFO:root:0.3037109375
INFO:root:6.0
INFO:optuna.study.study:Trial 57 finished with value: 0.06796970963478088 and parameters: {'n_max': 138, 'n_layers': 3, 'n_out': 15, 'mean_type': 'constant', 'kernel_type': 'matern0.5', 'lr': 0.00018819017759137414, 'batch_size': 1024, 'num_inducing': 63, 'initialize_fe': False, 'minit': 'kmeans'}. Best is trial 57 with value: 0.06796970963478088.
INFO:root:After model training
INFO:root:0.30126953125
INFO:root:4.0
INFO:optuna.study.study:Trial 58 finished with value: 0.08164478838443756 and parameters: {'n_max': 134, 'n_layers': 3, 'n_out': 12, 'mean_type': 'constant', 'kernel_type': 'rbf', 'lr': 0.00017911200388029102, 'batch_size': 1024, 'num_inducing': 64, 'initialize_fe': False, 'minit': 'kmeans'}. Best is trial 57 with value: 0.06796970963478088.
INFO:root:After model training
INFO:root:0.35400390625
INFO:root:8.0
INFO:optuna.study.study:Trial 59 finished with value: 0.07153554260730743 and parameters: {'n_max': 334, 'n_layers': 2, 'n_out': 10, 'mean_type': 'constant', 'kernel_type': 'matern0.5', 'lr': 0.0005047211888989789, 'batch_size': 1024, 'num_inducing': 108, 'initialize_fe': False, 'minit': 'kmeans'}. Best is trial 57 with value: 0.06796970963478088.
INFO:root:After model training
INFO:root:0.42333984375
INFO:root:12.0
INFO:optuna.study.study:Trial 60 finished with value: 0.0680190697312355 and parameters: {'n_max': 265, 'n_layers': 3, 'n_out': 20, 'mean_type': 'constant', 'kernel_type': 'matern0.5', 'lr': 0.00010212859888750824, 'batch_size': 1024, 'num_inducing': 67, 'initialize_fe': False, 'minit': 'kmeans'}. Best is trial 57 with value: 0.06796970963478088.
INFO:root:After model training
INFO:root:0.41259765625
INFO:root:6.0
INFO:optuna.study.study:Trial 61 finished with value: 0.06710710376501083 and parameters: {'n_max': 262, 'n_layers': 3, 'n_out': 20, 'mean_type': 'constant', 'kernel_type': 'matern0.5', 'lr': 0.000107986305814599, 'batch_size': 1024, 'num_inducing': 62, 'initialize_fe': False, 'minit': 'kmeans'}. Best is trial 61 with value: 0.06710710376501083.
INFO:root:After model training
INFO:root:0.4033203125
INFO:root:4.0
INFO:optuna.study.study:Trial 62 finished with value: 0.0666956752538681 and parameters: {'n_max': 261, 'n_layers': 3, 'n_out': 20, 'mean_type': 'constant', 'kernel_type': 'matern0.5', 'lr': 0.00010908772594808467, 'batch_size': 1024, 'num_inducing': 57, 'initialize_fe': False, 'minit': 'kmeans'}. Best is trial 62 with value: 0.0666956752538681.
INFO:root:After model training
INFO:root:0.3974609375
INFO:root:8.0
INFO:optuna.study.study:Trial 63 finished with value: 0.0671832337975502 and parameters: {'n_max': 251, 'n_layers': 3, 'n_out': 20, 'mean_type': 'constant', 'kernel_type': 'matern0.5', 'lr': 0.00010485671170922775, 'batch_size': 1024, 'num_inducing': 60, 'initialize_fe': False, 'minit': 'kmeans'}. Best is trial 62 with value: 0.0666956752538681.
INFO:root:After model training
INFO:root:0.6142578125
INFO:root:6.0
INFO:optuna.study.study:Trial 64 finished with value: 0.06749740242958069 and parameters: {'n_max': 414, 'n_layers': 3, 'n_out': 20, 'mean_type': 'constant', 'kernel_type': 'matern0.5', 'lr': 0.00010407709096734271, 'batch_size': 1024, 'num_inducing': 57, 'initialize_fe': False, 'minit': 'kmeans'}. Best is trial 62 with value: 0.0666956752538681.
INFO:root:After model training
INFO:root:0.62451171875
INFO:root:8.0
INFO:optuna.study.study:Trial 65 finished with value: 0.06776069849729538 and parameters: {'n_max': 418, 'n_layers': 3, 'n_out': 20, 'mean_type': 'constant', 'kernel_type': 'matern0.5', 'lr': 0.00011114128808606009, 'batch_size': 1024, 'num_inducing': 59, 'initialize_fe': False, 'minit': 'random'}. Best is trial 62 with value: 0.0666956752538681.
INFO:root:After model training
INFO:root:0.650390625
INFO:root:6.0
INFO:optuna.study.study:Trial 66 finished with value: 0.08066046237945557 and parameters: {'n_max': 431, 'n_layers': 3, 'n_out': 20, 'mean_type': 'constant', 'kernel_type': 'matern1.5', 'lr': 0.00010046930723944946, 'batch_size': 1024, 'num_inducing': 61, 'initialize_fe': True, 'minit': 'random'}. Best is trial 62 with value: 0.0666956752538681.
INFO:root:After model training
INFO:root:0.80419921875
INFO:root:6.0
INFO:optuna.study.study:Trial 67 finished with value: 0.06713929772377014 and parameters: {'n_max': 521, 'n_layers': 3, 'n_out': 20, 'mean_type': 'constant', 'kernel_type': 'matern0.5', 'lr': 0.00012141146091653382, 'batch_size': 1024, 'num_inducing': 50, 'initialize_fe': False, 'minit': 'random'}. Best is trial 62 with value: 0.0666956752538681.
INFO:root:After model training
INFO:root:0.2841796875
INFO:root:6.0
INFO:optuna.study.study:Trial 68 finished with value: 0.11932627856731415 and parameters: {'n_max': 526, 'n_layers': 2, 'n_out': 19, 'mean_type': 'linear', 'kernel_type': 'rbf', 'lr': 0.00013333738222452915, 'batch_size': 1024, 'num_inducing': 50, 'initialize_fe': False, 'minit': 'random'}. Best is trial 62 with value: 0.0666956752538681.
INFO:root:After model training
INFO:root:1.10986328125
INFO:root:6.0
INFO:optuna.study.study:Trial 69 finished with value: 0.06859427690505981 and parameters: {'n_max': 650, 'n_layers': 3, 'n_out': 19, 'mean_type': 'constant', 'kernel_type': 'matern0.5', 'lr': 0.0001314905997580473, 'batch_size': 1024, 'num_inducing': 56, 'initialize_fe': False, 'minit': 'random'}. Best is trial 62 with value: 0.0666956752538681.
INFO:root:After model training
INFO:root:0.63916015625
INFO:root:8.0
INFO:optuna.study.study:Trial 70 finished with value: 0.06794194877147675 and parameters: {'n_max': 427, 'n_layers': 3, 'n_out': 20, 'mean_type': 'constant', 'kernel_type': 'matern0.5', 'lr': 0.00018754803365000062, 'batch_size': 1024, 'num_inducing': 58, 'initialize_fe': False, 'minit': 'random'}. Best is trial 62 with value: 0.0666956752538681.
INFO:root:After model training
INFO:root:0.7744140625
INFO:root:6.0
INFO:optuna.study.study:Trial 71 finished with value: 0.06706263870000839 and parameters: {'n_max': 499, 'n_layers': 3, 'n_out': 20, 'mean_type': 'constant', 'kernel_type': 'matern0.5', 'lr': 0.00011829805825877423, 'batch_size': 1024, 'num_inducing': 59, 'initialize_fe': False, 'minit': 'random'}. Best is trial 62 with value: 0.0666956752538681.
INFO:root:After model training
INFO:root:0.626953125
INFO:root:10.0
INFO:optuna.study.study:Trial 72 finished with value: 0.0672493726015091 and parameters: {'n_max': 421, 'n_layers': 3, 'n_out': 20, 'mean_type': 'constant', 'kernel_type': 'matern0.5', 'lr': 0.00011907296492022765, 'batch_size': 1024, 'num_inducing': 58, 'initialize_fe': False, 'minit': 'random'}. Best is trial 62 with value: 0.0666956752538681.
INFO:root:After model training
INFO:root:0.88916015625
INFO:root:8.0
INFO:optuna.study.study:Trial 73 finished with value: 0.06725940108299255 and parameters: {'n_max': 560, 'n_layers': 3, 'n_out': 20, 'mean_type': 'constant', 'kernel_type': 'matern0.5', 'lr': 0.0001252006194626532, 'batch_size': 1024, 'num_inducing': 50, 'initialize_fe': False, 'minit': 'random'}. Best is trial 62 with value: 0.0666956752538681.
INFO:root:After model training
INFO:root:0.76220703125
INFO:root:8.0
INFO:optuna.study.study:Trial 74 finished with value: 0.06672364473342896 and parameters: {'n_max': 500, 'n_layers': 3, 'n_out': 19, 'mean_type': 'constant', 'kernel_type': 'matern0.5', 'lr': 0.00012247607785973726, 'batch_size': 1024, 'num_inducing': 51, 'initialize_fe': False, 'minit': 'random'}. Best is trial 62 with value: 0.0666956752538681.
INFO:root:After model training
INFO:root:0.78662109375
INFO:root:8.0
INFO:optuna.study.study:Trial 75 finished with value: 0.06762196868658066 and parameters: {'n_max': 496, 'n_layers': 3, 'n_out': 19, 'mean_type': 'constant', 'kernel_type': 'matern0.5', 'lr': 0.0001239461161272786, 'batch_size': 1024, 'num_inducing': 72, 'initialize_fe': False, 'minit': 'random'}. Best is trial 62 with value: 0.0666956752538681.
INFO:root:After model training
INFO:root:0.90087890625
INFO:root:8.0
INFO:optuna.study.study:Trial 76 finished with value: 0.06772585958242416 and parameters: {'n_max': 567, 'n_layers': 3, 'n_out': 18, 'mean_type': 'constant', 'kernel_type': 'matern0.5', 'lr': 0.000153470086634027, 'batch_size': 1024, 'num_inducing': 51, 'initialize_fe': False, 'minit': 'random'}. Best is trial 62 with value: 0.0666956752538681.
INFO:root:After model training
INFO:root:1.0439453125
INFO:root:10.0
INFO:optuna.study.study:Trial 77 finished with value: 0.06706835329532623 and parameters: {'n_max': 627, 'n_layers': 3, 'n_out': 19, 'mean_type': 'constant', 'kernel_type': 'matern0.5', 'lr': 0.00016476773466098237, 'batch_size': 1024, 'num_inducing': 50, 'initialize_fe': False, 'minit': 'random'}. Best is trial 62 with value: 0.0666956752538681.
INFO:root:After model training
INFO:root:0.9873046875
INFO:root:8.0
INFO:optuna.study.study:Trial 78 finished with value: 0.06785062700510025 and parameters: {'n_max': 592, 'n_layers': 3, 'n_out': 19, 'mean_type': 'constant', 'kernel_type': 'matern0.5', 'lr': 0.0001614746040051881, 'batch_size': 1024, 'num_inducing': 67, 'initialize_fe': False, 'minit': 'random'}. Best is trial 62 with value: 0.0666956752538681.
INFO:root:After model training
INFO:root:6.4892578125
INFO:root:22.0
INFO:optuna.study.study:Trial 79 finished with value: 0.1280304193496704 and parameters: {'n_max': 643, 'n_layers': 2, 'n_out': 18, 'mean_type': 'linear', 'kernel_type': 'rbf', 'lr': 0.00023267725987776493, 'batch_size': 2048, 'num_inducing': 78, 'initialize_fe': False, 'minit': 'random'}. Best is trial 62 with value: 0.0666956752538681.
INFO:root:After model training
INFO:root:1.1826171875
INFO:root:6.0
INFO:optuna.study.study:Trial 80 finished with value: 0.06849374622106552 and parameters: {'n_max': 678, 'n_layers': 3, 'n_out': 19, 'mean_type': 'constant', 'kernel_type': 'matern0.5', 'lr': 0.00019085345437389297, 'batch_size': 1024, 'num_inducing': 56, 'initialize_fe': True, 'minit': 'random'}. Best is trial 62 with value: 0.0666956752538681.
INFO:root:After model training
INFO:root:1.34033203125
INFO:root:24.0
INFO:optuna.study.study:Trial 81 finished with value: 0.06776490062475204 and parameters: {'n_max': 736, 'n_layers': 3, 'n_out': 20, 'mean_type': 'constant', 'kernel_type': 'matern0.5', 'lr': 0.00012152513806418762, 'batch_size': 1024, 'num_inducing': 50, 'initialize_fe': False, 'minit': 'random'}. Best is trial 62 with value: 0.0666956752538681.
INFO:root:After model training
INFO:root:0.875
INFO:root:8.0
INFO:optuna.study.study:Trial 82 finished with value: 0.06774231791496277 and parameters: {'n_max': 547, 'n_layers': 3, 'n_out': 20, 'mean_type': 'constant', 'kernel_type': 'matern0.5', 'lr': 0.00014730045750449984, 'batch_size': 1024, 'num_inducing': 59, 'initialize_fe': False, 'minit': 'random'}. Best is trial 62 with value: 0.0666956752538681.
INFO:root:After model training
INFO:root:0.99169921875
INFO:root:6.0
INFO:optuna.study.study:Trial 83 finished with value: 0.067442387342453 and parameters: {'n_max': 607, 'n_layers': 3, 'n_out': 18, 'mean_type': 'constant', 'kernel_type': 'matern0.5', 'lr': 0.00012527469327841924, 'batch_size': 1024, 'num_inducing': 50, 'initialize_fe': False, 'minit': 'random'}. Best is trial 62 with value: 0.0666956752538681.
INFO:root:After model training
INFO:root:0.7744140625
INFO:root:10.0
INFO:optuna.study.study:Trial 84 finished with value: 0.06753987073898315 and parameters: {'n_max': 488, 'n_layers': 3, 'n_out': 19, 'mean_type': 'constant', 'kernel_type': 'matern0.5', 'lr': 0.00010075835931663049, 'batch_size': 1024, 'num_inducing': 74, 'initialize_fe': False, 'minit': 'random'}. Best is trial 62 with value: 0.0666956752538681.
INFO:root:After model training
INFO:root:0.69677734375
INFO:root:6.0
INFO:optuna.study.study:Trial 85 finished with value: 0.06777098774909973 and parameters: {'n_max': 451, 'n_layers': 3, 'n_out': 20, 'mean_type': 'constant', 'kernel_type': 'matern0.5', 'lr': 0.00016781639371711438, 'batch_size': 1024, 'num_inducing': 68, 'initialize_fe': False, 'minit': 'random'}. Best is trial 62 with value: 0.0666956752538681.
INFO:root:After model training
INFO:root:0.78369140625
INFO:root:8.0
INFO:optuna.study.study:Trial 86 finished with value: 0.06847892701625824 and parameters: {'n_max': 508, 'n_layers': 3, 'n_out': 19, 'mean_type': 'constant', 'kernel_type': 'matern1.5', 'lr': 0.00012112291331959088, 'batch_size': 1024, 'num_inducing': 55, 'initialize_fe': False, 'minit': 'random'}. Best is trial 62 with value: 0.0666956752538681.
INFO:root:After model training
INFO:root:0.95654296875
INFO:root:10.0
INFO:optuna.study.study:Trial 87 finished with value: 0.06868063658475876 and parameters: {'n_max': 556, 'n_layers': 3, 'n_out': 18, 'mean_type': 'constant', 'kernel_type': 'matern0.5', 'lr': 0.00020726877571625025, 'batch_size': 1024, 'num_inducing': 98, 'initialize_fe': False, 'minit': 'random'}. Best is trial 62 with value: 0.0666956752538681.
INFO:root:After model training
INFO:root:1.046875
INFO:root:8.0
INFO:optuna.study.study:Trial 88 finished with value: 0.06750035285949707 and parameters: {'n_max': 621, 'n_layers': 3, 'n_out': 20, 'mean_type': 'constant', 'kernel_type': 'matern0.5', 'lr': 0.00013564481454852371, 'batch_size': 1024, 'num_inducing': 61, 'initialize_fe': False, 'minit': 'random'}. Best is trial 62 with value: 0.0666956752538681.
INFO:root:After model training
INFO:root:6.6240234375
INFO:root:26.0
INFO:optuna.study.study:Trial 89 finished with value: 0.06874960660934448 and parameters: {'n_max': 531, 'n_layers': 3, 'n_out': 19, 'mean_type': 'constant', 'kernel_type': 'matern0.5', 'lr': 0.00024611453404075424, 'batch_size': 2048, 'num_inducing': 77, 'initialize_fe': False, 'minit': 'random'}. Best is trial 62 with value: 0.0666956752538681.
INFO:root:After model training
INFO:root:0.677734375
INFO:root:8.0
INFO:optuna.study.study:Trial 90 finished with value: 0.06757143884897232 and parameters: {'n_max': 454, 'n_layers': 3, 'n_out': 20, 'mean_type': 'constant', 'kernel_type': 'matern0.5', 'lr': 0.0003364375442461171, 'batch_size': 1024, 'num_inducing': 53, 'initialize_fe': False, 'minit': 'random'}. Best is trial 62 with value: 0.0666956752538681.
INFO:root:After model training
INFO:root:0.9716796875
INFO:root:6.0
INFO:optuna.study.study:Trial 91 finished with value: 0.06803502887487411 and parameters: {'n_max': 598, 'n_layers': 3, 'n_out': 18, 'mean_type': 'constant', 'kernel_type': 'matern0.5', 'lr': 0.000149245069747613, 'batch_size': 1024, 'num_inducing': 50, 'initialize_fe': False, 'minit': 'random'}. Best is trial 62 with value: 0.0666956752538681.
INFO:root:After model training
INFO:root:1.03369140625
INFO:root:6.0
INFO:optuna.study.study:Trial 92 finished with value: 0.06829482316970825 and parameters: {'n_max': 613, 'n_layers': 3, 'n_out': 18, 'mean_type': 'constant', 'kernel_type': 'matern0.5', 'lr': 0.00011783394165012628, 'batch_size': 1024, 'num_inducing': 66, 'initialize_fe': False, 'minit': 'random'}. Best is trial 62 with value: 0.0666956752538681.
INFO:root:After model training
INFO:root:1.2744140625
INFO:root:10.0
INFO:optuna.study.study:Trial 93 finished with value: 0.06731284409761429 and parameters: {'n_max': 711, 'n_layers': 3, 'n_out': 19, 'mean_type': 'constant', 'kernel_type': 'matern0.5', 'lr': 0.00012147914722007407, 'batch_size': 1024, 'num_inducing': 56, 'initialize_fe': False, 'minit': 'random'}. Best is trial 62 with value: 0.0666956752538681.
INFO:root:After model training
INFO:root:1.3759765625
INFO:root:26.0
INFO:optuna.study.study:Trial 94 finished with value: 0.06718147546052933 and parameters: {'n_max': 747, 'n_layers': 3, 'n_out': 19, 'mean_type': 'constant', 'kernel_type': 'matern0.5', 'lr': 0.00011379801175172918, 'batch_size': 1024, 'num_inducing': 55, 'initialize_fe': False, 'minit': 'random'}. Best is trial 62 with value: 0.0666956752538681.
INFO:root:After model training
INFO:root:1.65478515625
INFO:root:30.0
INFO:optuna.study.study:Trial 95 finished with value: 0.06742050498723984 and parameters: {'n_max': 833, 'n_layers': 3, 'n_out': 20, 'mean_type': 'constant', 'kernel_type': 'matern0.5', 'lr': 0.0001876815988196655, 'batch_size': 1024, 'num_inducing': 61, 'initialize_fe': False, 'minit': 'random'}. Best is trial 62 with value: 0.0666956752538681.
INFO:root:After model training
INFO:root:1.5673828125
INFO:root:26.0
INFO:optuna.study.study:Trial 96 finished with value: 0.06728846579790115 and parameters: {'n_max': 802, 'n_layers': 3, 'n_out': 19, 'mean_type': 'constant', 'kernel_type': 'matern0.5', 'lr': 0.0001638160245837622, 'batch_size': 1024, 'num_inducing': 71, 'initialize_fe': False, 'minit': 'random'}. Best is trial 62 with value: 0.0666956752538681.
INFO:root:After model training
INFO:root:0.775390625
INFO:root:10.0
INFO:optuna.study.study:Trial 97 finished with value: 0.11778019368648529 and parameters: {'n_max': 504, 'n_layers': 3, 'n_out': 20, 'mean_type': 'linear', 'kernel_type': 'matern0.5', 'lr': 0.00010080072952074882, 'batch_size': 1024, 'num_inducing': 54, 'initialize_fe': False, 'minit': 'random'}. Best is trial 62 with value: 0.0666956752538681.
INFO:root:After model training
INFO:root:0.5029296875
INFO:root:10.0
INFO:optuna.study.study:Trial 98 finished with value: 0.06922876834869385 and parameters: {'n_max': 314, 'n_layers': 3, 'n_out': 17, 'mean_type': 'constant', 'kernel_type': 'matern0.5', 'lr': 0.0001444696391443081, 'batch_size': 1024, 'num_inducing': 81, 'initialize_fe': False, 'minit': 'random'}. Best is trial 62 with value: 0.0666956752538681.
INFO:root:After model training
INFO:root:1.544921875
INFO:root:28.0
INFO:optuna.study.study:Trial 99 finished with value: 0.06924784928560257 and parameters: {'n_max': 796, 'n_layers': 3, 'n_out': 19, 'mean_type': 'constant', 'kernel_type': 'matern0.5', 'lr': 0.00021280436481267318, 'batch_size': 1024, 'num_inducing': 66, 'initialize_fe': True, 'minit': 'random'}. Best is trial 62 with value: 0.0666956752538681.
INFO:root:Outer Run: 1: MSE - 0.013951386325061321, MAE - 0.1011342778801918. MAX - 0.2809517979621887
INFO:optuna.storages._in_memory:A new study created in memory with name: Nested Resampling VDKL 2
INFO:root:After model training
INFO:root:24.58251953125
INFO:root:80.0
INFO:optuna.study.study:Trial 0 finished with value: 0.0721203088760376 and parameters: {'n_max': 1024, 'n_layers': 4, 'n_out': 2, 'mean_type': 'constant', 'kernel_type': 'rbf', 'lr': 0.01, 'batch_size': 2048, 'num_inducing': 1000, 'initialize_fe': False, 'minit': 'random'}. Best is trial 0 with value: 0.0721203088760376.
INFO:root:After model training
INFO:root:15.9970703125
INFO:root:48.0
INFO:optuna.study.study:Trial 1 finished with value: 0.12971000373363495 and parameters: {'n_max': 645, 'n_layers': 4, 'n_out': 10, 'mean_type': 'linear', 'kernel_type': 'matern0.5', 'lr': 0.006850239654473908, 'batch_size': 1024, 'num_inducing': 1592, 'initialize_fe': False, 'minit': 'random'}. Best is trial 0 with value: 0.0721203088760376.
INFO:root:After model training
INFO:root:4.5966796875
INFO:root:36.0
INFO:optuna.study.study:Trial 2 finished with value: 0.08403076231479645 and parameters: {'n_max': 546, 'n_layers': 2, 'n_out': 3, 'mean_type': 'constant', 'kernel_type': 'matern1.5', 'lr': 0.021303884900016223, 'batch_size': 1024, 'num_inducing': 494, 'initialize_fe': False, 'minit': 'random'}. Best is trial 0 with value: 0.0721203088760376.
INFO:root:After model training
INFO:root:3.642578125
INFO:root:36.0
INFO:optuna.study.study:Trial 3 finished with value: 0.09439697861671448 and parameters: {'n_max': 115, 'n_layers': 4, 'n_out': 12, 'mean_type': 'constant', 'kernel_type': 'matern1.5', 'lr': 0.036597032764891534, 'batch_size': 512, 'num_inducing': 240, 'initialize_fe': False, 'minit': 'random'}. Best is trial 0 with value: 0.0721203088760376.
INFO:root:After model training
INFO:root:5.09228515625
INFO:root:28.0
