INFO:optuna.study.study:Trial 80 finished with value: 0.0012971218675374985 and parameters: {'n_max': 730, 'n_layers': 5, 'n_out': 17, 'mean_type': 'linear', 'kernel_type': 'rbf', 'lr': 0.00042050744912094793, 'batch_size': 512, 'num_inducing': 541, 'initialize_fe': True, 'minit': 'random'}. Best is trial 53 with value: 8.952830103226006e-05.
INFO:root:After model training
INFO:root:32.03271484375
INFO:root:68.0
INFO:optuna.study.study:Trial 81 finished with value: 0.00040424385224469006 and parameters: {'n_max': 229, 'n_layers': 2, 'n_out': 13, 'mean_type': 'linear', 'kernel_type': 'matern1.5', 'lr': 0.008165397003700614, 'batch_size': 512, 'num_inducing': 589, 'initialize_fe': True, 'minit': 'random'}. Best is trial 53 with value: 8.952830103226006e-05.
INFO:root:After model training
INFO:root:33.9853515625
INFO:root:68.0
INFO:optuna.study.study:Trial 82 finished with value: 0.0004726005718111992 and parameters: {'n_max': 179, 'n_layers': 2, 'n_out': 15, 'mean_type': 'linear', 'kernel_type': 'matern1.5', 'lr': 0.00022467721676985847, 'batch_size': 512, 'num_inducing': 902, 'initialize_fe': True, 'minit': 'random'}. Best is trial 53 with value: 8.952830103226006e-05.
INFO:root:After model training
INFO:root:33.4951171875
INFO:root:72.0
INFO:optuna.study.study:Trial 83 finished with value: 0.0004585616406984627 and parameters: {'n_max': 267, 'n_layers': 2, 'n_out': 14, 'mean_type': 'linear', 'kernel_type': 'matern1.5', 'lr': 0.0002779584328517366, 'batch_size': 512, 'num_inducing': 710, 'initialize_fe': True, 'minit': 'random'}. Best is trial 53 with value: 8.952830103226006e-05.
INFO:root:After model training
INFO:root:30.7431640625
INFO:root:72.0
INFO:optuna.study.study:Trial 84 finished with value: 0.00018601678311824799 and parameters: {'n_max': 204, 'n_layers': 2, 'n_out': 16, 'mean_type': 'linear', 'kernel_type': 'matern1.5', 'lr': 0.0001650348972773522, 'batch_size': 512, 'num_inducing': 352, 'initialize_fe': True, 'minit': 'random'}. Best is trial 53 with value: 8.952830103226006e-05.
INFO:root:After model training
INFO:root:30.45166015625
INFO:root:70.0
INFO:optuna.study.study:Trial 85 finished with value: 0.00022355260443873703 and parameters: {'n_max': 303, 'n_layers': 2, 'n_out': 14, 'mean_type': 'linear', 'kernel_type': 'matern1.5', 'lr': 0.00012313914972384178, 'batch_size': 512, 'num_inducing': 266, 'initialize_fe': True, 'minit': 'random'}. Best is trial 53 with value: 8.952830103226006e-05.
INFO:root:After model training
INFO:root:31.2099609375
INFO:root:74.0
INFO:optuna.study.study:Trial 86 finished with value: 0.00021072811796329916 and parameters: {'n_max': 64, 'n_layers': 2, 'n_out': 12, 'mean_type': 'constant', 'kernel_type': 'matern1.5', 'lr': 0.0003500786806139006, 'batch_size': 512, 'num_inducing': 465, 'initialize_fe': True, 'minit': 'random'}. Best is trial 53 with value: 8.952830103226006e-05.
INFO:root:After model training
INFO:root:30.93603515625
INFO:root:70.0
INFO:optuna.study.study:Trial 87 finished with value: 0.00029006716795265675 and parameters: {'n_max': 157, 'n_layers': 2, 'n_out': 15, 'mean_type': 'linear', 'kernel_type': 'matern1.5', 'lr': 0.0005021800924469402, 'batch_size': 512, 'num_inducing': 401, 'initialize_fe': False, 'minit': 'random'}. Best is trial 53 with value: 8.952830103226006e-05.
INFO:root:After model training
INFO:root:35.0
INFO:root:70.0
INFO:optuna.study.study:Trial 88 finished with value: 0.0023609998170286417 and parameters: {'n_max': 119, 'n_layers': 3, 'n_out': 5, 'mean_type': 'linear', 'kernel_type': 'matern1.5', 'lr': 0.00015547709711881343, 'batch_size': 512, 'num_inducing': 1020, 'initialize_fe': True, 'minit': 'random'}. Best is trial 53 with value: 8.952830103226006e-05.
INFO:root:After model training
INFO:root:42.015625
INFO:root:84.0
INFO:optuna.study.study:Trial 89 finished with value: 0.0031568913254886866 and parameters: {'n_max': 141, 'n_layers': 2, 'n_out': 13, 'mean_type': 'linear', 'kernel_type': 'matern0.5', 'lr': 0.0010302446654272559, 'batch_size': 2048, 'num_inducing': 610, 'initialize_fe': True, 'minit': 'random'}. Best is trial 53 with value: 8.952830103226006e-05.
INFO:root:After model training
INFO:root:33.4951171875
INFO:root:70.0
INFO:optuna.study.study:Trial 90 finished with value: 0.0002232260740129277 and parameters: {'n_max': 238, 'n_layers': 2, 'n_out': 19, 'mean_type': 'linear', 'kernel_type': 'matern1.5', 'lr': 0.00023655514287690614, 'batch_size': 512, 'num_inducing': 708, 'initialize_fe': True, 'minit': 'kmeans'}. Best is trial 53 with value: 8.952830103226006e-05.
INFO:root:After model training
INFO:root:36.564453125
INFO:root:70.0
INFO:optuna.study.study:Trial 91 finished with value: 0.00015388827887363732 and parameters: {'n_max': 492, 'n_layers': 2, 'n_out': 15, 'mean_type': 'constant', 'kernel_type': 'matern1.5', 'lr': 0.00028430481554172734, 'batch_size': 512, 'num_inducing': 1184, 'initialize_fe': True, 'minit': 'random'}. Best is trial 53 with value: 8.952830103226006e-05.
INFO:root:After model training
INFO:root:46.39794921875
INFO:root:124.0
INFO:optuna.study.study:Trial 92 finished with value: 0.00019148329738527536 and parameters: {'n_max': 104, 'n_layers': 2, 'n_out': 16, 'mean_type': 'constant', 'kernel_type': 'matern1.5', 'lr': 0.0001944313683957746, 'batch_size': 512, 'num_inducing': 1867, 'initialize_fe': True, 'minit': 'random'}. Best is trial 53 with value: 8.952830103226006e-05.
INFO:root:After model training
INFO:root:39.15234375
INFO:root:68.0
INFO:optuna.study.study:Trial 93 finished with value: 0.00019524813978932798 and parameters: {'n_max': 646, 'n_layers': 4, 'n_out': 15, 'mean_type': 'constant', 'kernel_type': 'matern1.5', 'lr': 0.00030292583255395054, 'batch_size': 512, 'num_inducing': 1230, 'initialize_fe': True, 'minit': 'random'}. Best is trial 53 with value: 8.952830103226006e-05.
INFO:root:After model training
INFO:root:42.28466796875
INFO:root:84.0
INFO:optuna.study.study:Trial 94 finished with value: 0.0002475213259458542 and parameters: {'n_max': 488, 'n_layers': 2, 'n_out': 14, 'mean_type': 'constant', 'kernel_type': 'matern1.5', 'lr': 0.0004094314660445788, 'batch_size': 512, 'num_inducing': 1662, 'initialize_fe': True, 'minit': 'random'}. Best is trial 53 with value: 8.952830103226006e-05.
INFO:root:After model training
INFO:root:32.19677734375
INFO:root:72.0
INFO:optuna.study.study:Trial 95 finished with value: 0.00027041431167162955 and parameters: {'n_max': 929, 'n_layers': 2, 'n_out': 17, 'mean_type': 'constant', 'kernel_type': 'matern1.5', 'lr': 0.00013145176629349037, 'batch_size': 512, 'num_inducing': 557, 'initialize_fe': True, 'minit': 'random'}. Best is trial 53 with value: 8.952830103226006e-05.
INFO:root:After model training
INFO:root:39.5419921875
INFO:root:70.0
INFO:optuna.study.study:Trial 96 finished with value: 0.00023736791627015918 and parameters: {'n_max': 566, 'n_layers': 2, 'n_out': 16, 'mean_type': 'constant', 'kernel_type': 'matern1.5', 'lr': 0.0007783433861752112, 'batch_size': 1024, 'num_inducing': 1450, 'initialize_fe': True, 'minit': 'random'}. Best is trial 53 with value: 8.952830103226006e-05.
INFO:root:After model training
INFO:root:31.34375
INFO:root:74.0
INFO:optuna.study.study:Trial 97 finished with value: 0.00011521125998115167 and parameters: {'n_max': 214, 'n_layers': 2, 'n_out': 18, 'mean_type': 'linear', 'kernel_type': 'matern1.5', 'lr': 0.0006145339282223201, 'batch_size': 512, 'num_inducing': 490, 'initialize_fe': True, 'minit': 'random'}. Best is trial 53 with value: 8.952830103226006e-05.
INFO:root:After model training
INFO:root:31.3427734375
INFO:root:74.0
INFO:optuna.study.study:Trial 98 finished with value: 0.00016935422900132835 and parameters: {'n_max': 212, 'n_layers': 2, 'n_out': 18, 'mean_type': 'linear', 'kernel_type': 'matern1.5', 'lr': 0.001750058426166097, 'batch_size': 512, 'num_inducing': 490, 'initialize_fe': True, 'minit': 'random'}. Best is trial 53 with value: 8.952830103226006e-05.
INFO:root:After model training
INFO:root:31.01904296875
INFO:root:70.0
INFO:optuna.study.study:Trial 99 finished with value: 0.0011167731136083603 and parameters: {'n_max': 176, 'n_layers': 2, 'n_out': 17, 'mean_type': 'linear', 'kernel_type': 'rbf', 'lr': 0.0006530680306252491, 'batch_size': 512, 'num_inducing': 420, 'initialize_fe': True, 'minit': 'random'}. Best is trial 53 with value: 8.952830103226006e-05.
INFO:root:Outer Run: 3: MSE - 4.689571539984172e-07, MAE - 0.0005656765424646437. MAX - 0.0022872090339660645
INFO:optuna.storages._in_memory:A new study created in memory with name: Nested Resampling VDKL 4
INFO:root:After model training
INFO:root:9.12255859375
INFO:root:32.0
INFO:optuna.study.study:Trial 0 finished with value: 0.00017371212015859783 and parameters: {'n_max': 1024, 'n_layers': 4, 'n_out': 2, 'mean_type': 'constant', 'kernel_type': 'rbf', 'lr': 0.01, 'batch_size': 512, 'num_inducing': 1000, 'initialize_fe': False, 'minit': 'random'}. Best is trial 0 with value: 0.00017371212015859783.
INFO:root:After model training
INFO:root:14.93505859375
INFO:root:30.0
INFO:optuna.study.study:Trial 1 finished with value: 0.0003676495107356459 and parameters: {'n_max': 743, 'n_layers': 3, 'n_out': 15, 'mean_type': 'constant', 'kernel_type': 'rbf', 'lr': 0.0010599921948573775, 'batch_size': 512, 'num_inducing': 1721, 'initialize_fe': False, 'minit': 'kmeans'}. Best is trial 0 with value: 0.00017371212015859783.
INFO:root:After model training
INFO:root:29.8466796875
INFO:root:70.0
INFO:optuna.study.study:Trial 2 finished with value: 0.0010679550468921661 and parameters: {'n_max': 428, 'n_layers': 5, 'n_out': 3, 'mean_type': 'constant', 'kernel_type': 'rbf', 'lr': 0.015482310188708485, 'batch_size': 2048, 'num_inducing': 1559, 'initialize_fe': True, 'minit': 'kmeans'}. Best is trial 0 with value: 0.00017371212015859783.
INFO:root:After model training
INFO:root:3.6357421875
INFO:root:34.0
INFO:optuna.study.study:Trial 3 finished with value: 0.0005058845854364336 and parameters: {'n_max': 629, 'n_layers': 5, 'n_out': 13, 'mean_type': 'constant', 'kernel_type': 'matern0.5', 'lr': 0.006715827408218268, 'batch_size': 1024, 'num_inducing': 405, 'initialize_fe': True, 'minit': 'random'}. Best is trial 0 with value: 0.00017371212015859783.
INFO:root:After model training
INFO:root:1.3056640625
INFO:root:10.0
INFO:optuna.study.study:Trial 4 finished with value: 0.0010747690685093403 and parameters: {'n_max': 95, 'n_layers': 3, 'n_out': 3, 'mean_type': 'constant', 'kernel_type': 'rbf', 'lr': 0.00033997086523617745, 'batch_size': 1024, 'num_inducing': 299, 'initialize_fe': True, 'minit': 'random'}. Best is trial 0 with value: 0.00017371212015859783.
INFO:root:After model training
INFO:root:3.07763671875
INFO:root:30.0
INFO:optuna.study.study:Trial 5 finished with value: 0.003253518370911479 and parameters: {'n_max': 892, 'n_layers': 3, 'n_out': 10, 'mean_type': 'linear', 'kernel_type': 'matern0.5', 'lr': 0.00011270145155097814, 'batch_size': 1024, 'num_inducing': 361, 'initialize_fe': False, 'minit': 'random'}. Best is trial 0 with value: 0.00017371212015859783.
INFO:root:After model training
INFO:root:1.48291015625
INFO:root:12.0
INFO:optuna.study.study:Trial 6 finished with value: 0.0037264851853251457 and parameters: {'n_max': 386, 'n_layers': 4, 'n_out': 17, 'mean_type': 'constant', 'kernel_type': 'matern0.5', 'lr': 0.0626151461944355, 'batch_size': 1024, 'num_inducing': 181, 'initialize_fe': True, 'minit': 'random'}. Best is trial 0 with value: 0.00017371212015859783.
INFO:root:After model training
INFO:root:10.3740234375
INFO:root:58.0
INFO:optuna.study.study:Trial 7 finished with value: 0.033223237842321396 and parameters: {'n_max': 687, 'n_layers': 2, 'n_out': 12, 'mean_type': 'linear', 'kernel_type': 'matern0.5', 'lr': 0.0008744755858082621, 'batch_size': 2048, 'num_inducing': 325, 'initialize_fe': False, 'minit': 'random'}. Best is trial 0 with value: 0.00017371212015859783.
INFO:root:After model training
INFO:root:18.3583984375
INFO:root:38.0
INFO:optuna.study.study:Trial 8 finished with value: 0.0027039123233407736 and parameters: {'n_max': 111, 'n_layers': 3, 'n_out': 13, 'mean_type': 'linear', 'kernel_type': 'matern0.5', 'lr': 0.0006132436522057511, 'batch_size': 1024, 'num_inducing': 1937, 'initialize_fe': True, 'minit': 'random'}. Best is trial 0 with value: 0.00017371212015859783.
INFO:root:After model training
INFO:root:4.0302734375
INFO:root:28.0
INFO:optuna.study.study:Trial 9 finished with value: 0.0005285987281240523 and parameters: {'n_max': 491, 'n_layers': 3, 'n_out': 16, 'mean_type': 'linear', 'kernel_type': 'rbf', 'lr': 0.0010746966134534731, 'batch_size': 512, 'num_inducing': 741, 'initialize_fe': True, 'minit': 'kmeans'}. Best is trial 0 with value: 0.00017371212015859783.
INFO:root:After model training
INFO:root:4.30126953125
INFO:root:28.0
INFO:optuna.study.study:Trial 10 finished with value: 0.004273832775652409 and parameters: {'n_max': 1021, 'n_layers': 4, 'n_out': 7, 'mean_type': 'constant', 'kernel_type': 'matern1.5', 'lr': 0.09055142681696245, 'batch_size': 512, 'num_inducing': 74, 'initialize_fe': False, 'minit': 'kmeans'}. Best is trial 0 with value: 0.00017371212015859783.
INFO:root:After model training
INFO:root:5.28076171875
INFO:root:28.0
INFO:optuna.study.study:Trial 11 finished with value: 0.00016267498722299933 and parameters: {'n_max': 837, 'n_layers': 2, 'n_out': 20, 'mean_type': 'constant', 'kernel_type': 'rbf', 'lr': 0.003340634012133886, 'batch_size': 512, 'num_inducing': 961, 'initialize_fe': False, 'minit': 'kmeans'}. Best is trial 11 with value: 0.00016267498722299933.
INFO:root:After model training
INFO:root:3.88427734375
INFO:root:28.0
INFO:optuna.study.study:Trial 12 finished with value: 0.0001709367206785828 and parameters: {'n_max': 997, 'n_layers': 2, 'n_out': 20, 'mean_type': 'constant', 'kernel_type': 'rbf', 'lr': 0.005481665936366323, 'batch_size': 512, 'num_inducing': 779, 'initialize_fe': False, 'minit': 'kmeans'}. Best is trial 11 with value: 0.00016267498722299933.
INFO:root:After model training
INFO:root:3.91357421875
INFO:root:28.0
INFO:optuna.study.study:Trial 13 finished with value: 0.00016276644601020962 and parameters: {'n_max': 850, 'n_layers': 2, 'n_out': 20, 'mean_type': 'constant', 'kernel_type': 'matern1.5', 'lr': 0.0035445308395917014, 'batch_size': 512, 'num_inducing': 785, 'initialize_fe': False, 'minit': 'kmeans'}. Best is trial 11 with value: 0.00016267498722299933.
INFO:root:After model training
INFO:root:2.681640625
INFO:root:30.0
INFO:optuna.study.study:Trial 14 finished with value: 0.0001335970446234569 and parameters: {'n_max': 827, 'n_layers': 2, 'n_out': 20, 'mean_type': 'constant', 'kernel_type': 'matern1.5', 'lr': 0.003297218102472147, 'batch_size': 512, 'num_inducing': 592, 'initialize_fe': False, 'minit': 'kmeans'}. Best is trial 14 with value: 0.0001335970446234569.
INFO:root:After model training
INFO:root:2.32275390625
INFO:root:28.0
INFO:optuna.study.study:Trial 15 finished with value: 0.00043778412509709597 and parameters: {'n_max': 785, 'n_layers': 2, 'n_out': 18, 'mean_type': 'constant', 'kernel_type': 'matern1.5', 'lr': 0.023757087217177914, 'batch_size': 512, 'num_inducing': 527, 'initialize_fe': False, 'minit': 'kmeans'}. Best is trial 14 with value: 0.0001335970446234569.
INFO:root:After model training
INFO:root:0.95654296875
INFO:root:10.0
INFO:optuna.study.study:Trial 16 finished with value: 0.00012855012028012425 and parameters: {'n_max': 584, 'n_layers': 2, 'n_out': 9, 'mean_type': 'constant', 'kernel_type': 'matern1.5', 'lr': 0.002628106521920829, 'batch_size': 512, 'num_inducing': 177, 'initialize_fe': False, 'minit': 'kmeans'}. Best is trial 16 with value: 0.00012855012028012425.
INFO:root:After model training
INFO:root:7.1572265625
INFO:root:26.0
INFO:optuna.study.study:Trial 17 finished with value: 0.0005517376121133566 and parameters: {'n_max': 591, 'n_layers': 2, 'n_out': 8, 'mean_type': 'constant', 'kernel_type': 'matern1.5', 'lr': 0.0020137164497624864, 'batch_size': 2048, 'num_inducing': 144, 'initialize_fe': False, 'minit': 'kmeans'}. Best is trial 16 with value: 0.00012855012028012425.
INFO:root:After model training
INFO:root:0.9697265625
INFO:root:10.0
INFO:optuna.study.study:Trial 18 finished with value: 0.0009810441406443715 and parameters: {'n_max': 314, 'n_layers': 2, 'n_out': 6, 'mean_type': 'linear', 'kernel_type': 'matern1.5', 'lr': 0.03221580251166459, 'batch_size': 512, 'num_inducing': 189, 'initialize_fe': False, 'minit': 'kmeans'}. Best is trial 16 with value: 0.00012855012028012425.
INFO:root:After model training
INFO:root:0.8916015625
INFO:root:12.0
INFO:optuna.study.study:Trial 19 finished with value: 0.0007225084118545055 and parameters: {'n_max': 253, 'n_layers': 3, 'n_out': 10, 'mean_type': 'constant', 'kernel_type': 'matern1.5', 'lr': 0.00028754448645844897, 'batch_size': 512, 'num_inducing': 97, 'initialize_fe': False, 'minit': 'kmeans'}. Best is trial 16 with value: 0.00012855012028012425.
INFO:root:After model training
INFO:root:6.86181640625
INFO:root:28.0
INFO:optuna.study.study:Trial 20 finished with value: 0.0006659491336904466 and parameters: {'n_max': 528, 'n_layers': 2, 'n_out': 5, 'mean_type': 'constant', 'kernel_type': 'matern1.5', 'lr': 0.0018909254649985211, 'batch_size': 2048, 'num_inducing': 115, 'initialize_fe': False, 'minit': 'kmeans'}. Best is trial 16 with value: 0.00012855012028012425.
INFO:root:After model training
INFO:root:7.62841796875
INFO:root:28.0
INFO:optuna.study.study:Trial 21 finished with value: 0.0001438992767361924 and parameters: {'n_max': 894, 'n_layers': 2, 'n_out': 18, 'mean_type': 'constant', 'kernel_type': 'matern1.5', 'lr': 0.003116629297457287, 'batch_size': 512, 'num_inducing': 1211, 'initialize_fe': False, 'minit': 'kmeans'}. Best is trial 16 with value: 0.00012855012028012425.
INFO:root:After model training
INFO:root:0.75390625
INFO:root:8.0
INFO:optuna.study.study:Trial 22 finished with value: 0.0001836719602579251 and parameters: {'n_max': 931, 'n_layers': 2, 'n_out': 18, 'mean_type': 'constant', 'kernel_type': 'matern1.5', 'lr': 0.002095192341315483, 'batch_size': 512, 'num_inducing': 50, 'initialize_fe': False, 'minit': 'kmeans'}. Best is trial 16 with value: 0.00012855012028012425.
INFO:root:After model training
INFO:root:1.11376953125
INFO:root:8.0
INFO:optuna.study.study:Trial 23 finished with value: 0.0001702289009699598 and parameters: {'n_max': 701, 'n_layers': 2, 'n_out': 15, 'mean_type': 'constant', 'kernel_type': 'matern1.5', 'lr': 0.008449067349286426, 'batch_size': 512, 'num_inducing': 228, 'initialize_fe': False, 'minit': 'kmeans'}. Best is trial 16 with value: 0.00012855012028012425.
INFO:root:After model training
INFO:root:3.64501953125
INFO:root:34.0
INFO:optuna.study.study:Trial 24 finished with value: 0.00022466579684987664 and parameters: {'n_max': 798, 'n_layers': 3, 'n_out': 9, 'mean_type': 'constant', 'kernel_type': 'matern1.5', 'lr': 0.0045355245975040835, 'batch_size': 512, 'num_inducing': 552, 'initialize_fe': False, 'minit': 'kmeans'}. Best is trial 16 with value: 0.00012855012028012425.
INFO:root:After model training
INFO:root:10.3125
INFO:root:30.0
INFO:optuna.study.study:Trial 25 finished with value: 0.00016350872465409338 and parameters: {'n_max': 932, 'n_layers': 2, 'n_out': 18, 'mean_type': 'constant', 'kernel_type': 'matern1.5', 'lr': 0.002085577759786618, 'batch_size': 512, 'num_inducing': 1449, 'initialize_fe': False, 'minit': 'kmeans'}. Best is trial 16 with value: 0.00012855012028012425.
INFO:root:After model training
INFO:root:8.396484375
INFO:root:34.0
INFO:optuna.study.study:Trial 26 finished with value: 0.00021296256454661489 and parameters: {'n_max': 654, 'n_layers': 3, 'n_out': 14, 'mean_type': 'constant', 'kernel_type': 'matern1.5', 'lr': 0.012480439525483734, 'batch_size': 512, 'num_inducing': 1209, 'initialize_fe': False, 'minit': 'kmeans'}. Best is trial 16 with value: 0.00012855012028012425.
INFO:root:After model training
INFO:root:2.453125
INFO:root:32.0
INFO:optuna.study.study:Trial 27 finished with value: 0.0013062696671113372 and parameters: {'n_max': 580, 'n_layers': 2, 'n_out': 11, 'mean_type': 'linear', 'kernel_type': 'matern1.5', 'lr': 0.0005157832667234128, 'batch_size': 512, 'num_inducing': 558, 'initialize_fe': False, 'minit': 'kmeans'}. Best is trial 16 with value: 0.00012855012028012425.
INFO:root:After model training
INFO:root:3.794921875
INFO:root:34.0
INFO:optuna.study.study:Trial 28 finished with value: 0.0003150913689751178 and parameters: {'n_max': 739, 'n_layers': 4, 'n_out': 19, 'mean_type': 'constant', 'kernel_type': 'matern1.5', 'lr': 0.0031516314642547364, 'batch_size': 512, 'num_inducing': 445, 'initialize_fe': False, 'minit': 'kmeans'}. Best is trial 16 with value: 0.00012855012028012425.
INFO:root:After model training
INFO:root:8.3134765625
INFO:root:56.0
INFO:optuna.study.study:Trial 29 finished with value: 0.0008697871817275882 and parameters: {'n_max': 959, 'n_layers': 2, 'n_out': 17, 'mean_type': 'constant', 'kernel_type': 'matern1.5', 'lr': 0.0013050977010264767, 'batch_size': 2048, 'num_inducing': 250, 'initialize_fe': False, 'minit': 'kmeans'}. Best is trial 16 with value: 0.00012855012028012425.
INFO:root:After model training
INFO:root:7.88525390625
INFO:root:30.0
INFO:optuna.study.study:Trial 30 finished with value: 0.00016432575648650527 and parameters: {'n_max': 869, 'n_layers': 3, 'n_out': 5, 'mean_type': 'constant', 'kernel_type': 'matern1.5', 'lr': 0.009997959773611124, 'batch_size': 512, 'num_inducing': 1096, 'initialize_fe': False, 'minit': 'kmeans'}. Best is trial 16 with value: 0.00012855012028012425.
INFO:root:After model training
INFO:root:4.9560546875
INFO:root:28.0
