INFO:optuna.study.study:Trial 20 finished with value: 0.0010470334673300385 and parameters: {'n_max': 186, 'n_layers': 2, 'n_out': 13, 'mean_type': 'linear', 'kernel_type': 'matern1.5', 'lr': 0.0011678577542767238, 'batch_size': 512, 'num_inducing': 54, 'initialize_fe': False, 'minit': 'kmeans'}. Best is trial 17 with value: 0.00014549537445418537.
INFO:root:After model training
INFO:root:0.53662109375
INFO:root:14.0
INFO:optuna.study.study:Trial 21 finished with value: 0.00013768358621746302 and parameters: {'n_max': 204, 'n_layers': 2, 'n_out': 13, 'mean_type': 'linear', 'kernel_type': 'matern1.5', 'lr': 0.0031885183738615823, 'batch_size': 512, 'num_inducing': 191, 'initialize_fe': False, 'minit': 'kmeans'}. Best is trial 21 with value: 0.00013768358621746302.
INFO:root:After model training
INFO:root:0.6162109375
INFO:root:10.0
INFO:optuna.study.study:Trial 22 finished with value: 0.00017504714196547866 and parameters: {'n_max': 434, 'n_layers': 2, 'n_out': 13, 'mean_type': 'linear', 'kernel_type': 'matern1.5', 'lr': 0.0032305206996368313, 'batch_size': 512, 'num_inducing': 215, 'initialize_fe': False, 'minit': 'kmeans'}. Best is trial 21 with value: 0.00013768358621746302.
INFO:root:After model training
INFO:root:0.58447265625
INFO:root:12.0
INFO:optuna.study.study:Trial 23 finished with value: 0.0001509029243607074 and parameters: {'n_max': 399, 'n_layers': 2, 'n_out': 7, 'mean_type': 'linear', 'kernel_type': 'matern1.5', 'lr': 0.005176351981204506, 'batch_size': 512, 'num_inducing': 208, 'initialize_fe': False, 'minit': 'kmeans'}. Best is trial 21 with value: 0.00013768358621746302.
INFO:root:After model training
INFO:root:0.3466796875
INFO:root:8.0
INFO:optuna.study.study:Trial 24 finished with value: 0.0002519605914130807 and parameters: {'n_max': 395, 'n_layers': 2, 'n_out': 6, 'mean_type': 'linear', 'kernel_type': 'matern1.5', 'lr': 0.00517223825768063, 'batch_size': 512, 'num_inducing': 105, 'initialize_fe': False, 'minit': 'kmeans'}. Best is trial 21 with value: 0.00013768358621746302.
INFO:root:After model training
INFO:root:0.4033203125
INFO:root:8.0
INFO:optuna.study.study:Trial 25 finished with value: 0.00023808935657143593 and parameters: {'n_max': 162, 'n_layers': 2, 'n_out': 7, 'mean_type': 'linear', 'kernel_type': 'matern1.5', 'lr': 0.006440162758217849, 'batch_size': 512, 'num_inducing': 137, 'initialize_fe': False, 'minit': 'kmeans'}. Best is trial 21 with value: 0.00013768358621746302.
INFO:root:After model training
INFO:root:10.19677734375
INFO:root:54.0
INFO:optuna.study.study:Trial 26 finished with value: 0.003266866086050868 and parameters: {'n_max': 262, 'n_layers': 2, 'n_out': 4, 'mean_type': 'linear', 'kernel_type': 'matern1.5', 'lr': 0.0007211180442530906, 'batch_size': 2048, 'num_inducing': 418, 'initialize_fe': False, 'minit': 'kmeans'}. Best is trial 21 with value: 0.00013768358621746302.
INFO:root:After model training
INFO:root:0.28759765625
INFO:root:6.0
INFO:optuna.study.study:Trial 27 finished with value: 0.0001700163702480495 and parameters: {'n_max': 546, 'n_layers': 2, 'n_out': 8, 'mean_type': 'linear', 'kernel_type': 'rbf', 'lr': 0.003438674199188793, 'batch_size': 512, 'num_inducing': 66, 'initialize_fe': False, 'minit': 'kmeans'}. Best is trial 21 with value: 0.00013768358621746302.
INFO:root:After model training
INFO:root:14.13623046875
INFO:root:20.0
INFO:optuna.study.study:Trial 28 finished with value: 0.0009249621070921421 and parameters: {'n_max': 144, 'n_layers': 3, 'n_out': 5, 'mean_type': 'linear', 'kernel_type': 'matern0.5', 'lr': 0.008332956482381103, 'batch_size': 512, 'num_inducing': 1723, 'initialize_fe': False, 'minit': 'kmeans'}. Best is trial 21 with value: 0.00013768358621746302.
INFO:root:After model training
INFO:root:7.3447265625
INFO:root:26.0
INFO:optuna.study.study:Trial 29 finished with value: 0.008561854250729084 and parameters: {'n_max': 288, 'n_layers': 2, 'n_out': 11, 'mean_type': 'linear', 'kernel_type': 'matern1.5', 'lr': 0.00023912102253188086, 'batch_size': 2048, 'num_inducing': 206, 'initialize_fe': False, 'minit': 'kmeans'}. Best is trial 21 with value: 0.00013768358621746302.
INFO:root:After model training
INFO:root:0.3720703125
INFO:root:6.0
INFO:optuna.study.study:Trial 30 finished with value: 0.0015719722723588347 and parameters: {'n_max': 384, 'n_layers': 2, 'n_out': 10, 'mean_type': 'linear', 'kernel_type': 'rbf', 'lr': 0.0009324788810577323, 'batch_size': 512, 'num_inducing': 116, 'initialize_fe': False, 'minit': 'kmeans'}. Best is trial 21 with value: 0.00013768358621746302.
INFO:root:After model training
INFO:root:0.64306640625
INFO:root:6.0
INFO:optuna.study.study:Trial 31 finished with value: 0.00012650334974750876 and parameters: {'n_max': 583, 'n_layers': 2, 'n_out': 7, 'mean_type': 'linear', 'kernel_type': 'rbf', 'lr': 0.003521744360755351, 'batch_size': 512, 'num_inducing': 226, 'initialize_fe': False, 'minit': 'kmeans'}. Best is trial 31 with value: 0.00012650334974750876.
INFO:root:After model training
INFO:root:0.67529296875
INFO:root:12.0
INFO:optuna.study.study:Trial 32 finished with value: 0.00010389254020992666 and parameters: {'n_max': 624, 'n_layers': 2, 'n_out': 8, 'mean_type': 'linear', 'kernel_type': 'rbf', 'lr': 0.0022981263270174922, 'batch_size': 512, 'num_inducing': 236, 'initialize_fe': False, 'minit': 'kmeans'}. Best is trial 32 with value: 0.00010389254020992666.
INFO:root:After model training
INFO:root:2.63427734375
INFO:root:30.0
INFO:optuna.study.study:Trial 33 finished with value: 0.00017545907758176327 and parameters: {'n_max': 626, 'n_layers': 5, 'n_out': 4, 'mean_type': 'linear', 'kernel_type': 'rbf', 'lr': 0.0023722687562743915, 'batch_size': 512, 'num_inducing': 266, 'initialize_fe': False, 'minit': 'kmeans'}. Best is trial 32 with value: 0.00010389254020992666.
INFO:root:After model training
INFO:root:1.1728515625
INFO:root:12.0
INFO:optuna.study.study:Trial 34 finished with value: 0.00014475415810011327 and parameters: {'n_max': 616, 'n_layers': 2, 'n_out': 11, 'mean_type': 'linear', 'kernel_type': 'rbf', 'lr': 0.0013602253928449435, 'batch_size': 512, 'num_inducing': 378, 'initialize_fe': True, 'minit': 'kmeans'}. Best is trial 32 with value: 0.00010389254020992666.
INFO:root:After model training
INFO:root:1.4091796875
INFO:root:10.0
INFO:optuna.study.study:Trial 35 finished with value: 0.00010671434574760497 and parameters: {'n_max': 613, 'n_layers': 2, 'n_out': 11, 'mean_type': 'linear', 'kernel_type': 'rbf', 'lr': 0.0014598987706305362, 'batch_size': 512, 'num_inducing': 434, 'initialize_fe': True, 'minit': 'kmeans'}. Best is trial 32 with value: 0.00010389254020992666.
INFO:root:After model training
INFO:root:13.0048828125
INFO:root:70.0
INFO:optuna.study.study:Trial 36 finished with value: 0.004369369708001614 and parameters: {'n_max': 512, 'n_layers': 3, 'n_out': 8, 'mean_type': 'linear', 'kernel_type': 'rbf', 'lr': 0.0014520779266203737, 'batch_size': 2048, 'num_inducing': 619, 'initialize_fe': True, 'minit': 'kmeans'}. Best is trial 32 with value: 0.00010389254020992666.
INFO:root:After model training
INFO:root:3.4033203125
INFO:root:26.0
INFO:optuna.study.study:Trial 37 finished with value: 0.00013705581659451127 and parameters: {'n_max': 684, 'n_layers': 2, 'n_out': 9, 'mean_type': 'linear', 'kernel_type': 'rbf', 'lr': 0.0003997775067996332, 'batch_size': 512, 'num_inducing': 781, 'initialize_fe': True, 'minit': 'kmeans'}. Best is trial 32 with value: 0.00010389254020992666.
INFO:root:After model training
INFO:root:7.212890625
INFO:root:26.0
INFO:optuna.study.study:Trial 38 finished with value: 0.0025484722573310137 and parameters: {'n_max': 879, 'n_layers': 5, 'n_out': 9, 'mean_type': 'linear', 'kernel_type': 'rbf', 'lr': 0.00038220105300741067, 'batch_size': 1024, 'num_inducing': 794, 'initialize_fe': True, 'minit': 'kmeans'}. Best is trial 32 with value: 0.00010389254020992666.
INFO:root:After model training
INFO:root:6.2001953125
INFO:root:28.0
INFO:optuna.study.study:Trial 39 finished with value: 0.00032992492197081447 and parameters: {'n_max': 678, 'n_layers': 4, 'n_out': 7, 'mean_type': 'linear', 'kernel_type': 'rbf', 'lr': 0.00021182313986101747, 'batch_size': 512, 'num_inducing': 942, 'initialize_fe': True, 'minit': 'kmeans'}. Best is trial 32 with value: 0.00010389254020992666.
INFO:root:After model training
INFO:root:12.01953125
INFO:root:56.0
INFO:optuna.study.study:Trial 40 finished with value: 0.004176759161055088 and parameters: {'n_max': 573, 'n_layers': 3, 'n_out': 10, 'mean_type': 'linear', 'kernel_type': 'rbf', 'lr': 0.0005466413244962379, 'batch_size': 2048, 'num_inducing': 508, 'initialize_fe': True, 'minit': 'kmeans'}. Best is trial 32 with value: 0.00010389254020992666.
INFO:root:After model training
INFO:root:0.74365234375
INFO:root:12.0
INFO:optuna.study.study:Trial 41 finished with value: 0.00015436594549100846 and parameters: {'n_max': 711, 'n_layers': 2, 'n_out': 12, 'mean_type': 'linear', 'kernel_type': 'rbf', 'lr': 0.0019097330338549128, 'batch_size': 512, 'num_inducing': 254, 'initialize_fe': True, 'minit': 'kmeans'}. Best is trial 32 with value: 0.00010389254020992666.
INFO:root:After model training
INFO:root:1.56005859375
INFO:root:12.0
INFO:optuna.study.study:Trial 42 finished with value: 0.000179388647666201 and parameters: {'n_max': 597, 'n_layers': 2, 'n_out': 8, 'mean_type': 'linear', 'kernel_type': 'rbf', 'lr': 0.0041986441304527064, 'batch_size': 512, 'num_inducing': 469, 'initialize_fe': True, 'minit': 'kmeans'}. Best is trial 32 with value: 0.00010389254020992666.
INFO:root:After model training
INFO:root:1.1416015625
INFO:root:16.0
INFO:optuna.study.study:Trial 43 finished with value: 0.0004481684882193804 and parameters: {'n_max': 488, 'n_layers': 2, 'n_out': 9, 'mean_type': 'linear', 'kernel_type': 'rbf', 'lr': 0.00010581563593142297, 'batch_size': 1024, 'num_inducing': 373, 'initialize_fe': True, 'minit': 'kmeans'}. Best is trial 32 with value: 0.00010389254020992666.
INFO:root:After model training
INFO:root:0.96533203125
INFO:root:10.0
INFO:optuna.study.study:Trial 44 finished with value: 0.00026998063549399376 and parameters: {'n_max': 838, 'n_layers': 2, 'n_out': 6, 'mean_type': 'linear', 'kernel_type': 'rbf', 'lr': 0.00027554880430711746, 'batch_size': 512, 'num_inducing': 324, 'initialize_fe': True, 'minit': 'kmeans'}. Best is trial 32 with value: 0.00010389254020992666.
INFO:root:After model training
INFO:root:2.3408203125
INFO:root:24.0
INFO:optuna.study.study:Trial 45 finished with value: 0.0029104240238666534 and parameters: {'n_max': 683, 'n_layers': 2, 'n_out': 14, 'mean_type': 'linear', 'kernel_type': 'rbf', 'lr': 0.0011204743144940781, 'batch_size': 512, 'num_inducing': 614, 'initialize_fe': True, 'minit': 'kmeans'}. Best is trial 32 with value: 0.00010389254020992666.
INFO:root:After model training
INFO:root:0.89990234375
INFO:root:12.0
INFO:optuna.study.study:Trial 46 finished with value: 0.00020670282538048923 and parameters: {'n_max': 761, 'n_layers': 2, 'n_out': 10, 'mean_type': 'linear', 'kernel_type': 'matern0.5', 'lr': 0.001722604989211469, 'batch_size': 512, 'num_inducing': 303, 'initialize_fe': True, 'minit': 'kmeans'}. Best is trial 32 with value: 0.00010389254020992666.
INFO:root:After model training
INFO:root:9.22607421875
INFO:root:28.0
INFO:optuna.study.study:Trial 47 finished with value: 0.005010333843529224 and parameters: {'n_max': 457, 'n_layers': 3, 'n_out': 12, 'mean_type': 'linear', 'kernel_type': 'rbf', 'lr': 0.00898370361179448, 'batch_size': 1024, 'num_inducing': 1365, 'initialize_fe': True, 'minit': 'kmeans'}. Best is trial 32 with value: 0.00010389254020992666.
INFO:root:After model training
INFO:root:0.6806640625
INFO:root:8.0
INFO:optuna.study.study:Trial 48 finished with value: 0.00017201060836669058 and parameters: {'n_max': 538, 'n_layers': 2, 'n_out': 5, 'mean_type': 'linear', 'kernel_type': 'rbf', 'lr': 0.000941000560407279, 'batch_size': 512, 'num_inducing': 241, 'initialize_fe': True, 'minit': 'kmeans'}. Best is trial 32 with value: 0.00010389254020992666.
INFO:root:After model training
INFO:root:5.10400390625
INFO:root:26.0
INFO:optuna.study.study:Trial 49 finished with value: 0.0002941182756330818 and parameters: {'n_max': 920, 'n_layers': 3, 'n_out': 11, 'mean_type': 'linear', 'kernel_type': 'rbf', 'lr': 0.002396316387890046, 'batch_size': 512, 'num_inducing': 790, 'initialize_fe': True, 'minit': 'kmeans'}. Best is trial 32 with value: 0.00010389254020992666.
INFO:root:After model training
INFO:root:1.04833984375
INFO:root:14.0
INFO:optuna.study.study:Trial 50 finished with value: 0.0007866577943786979 and parameters: {'n_max': 581, 'n_layers': 2, 'n_out': 8, 'mean_type': 'linear', 'kernel_type': 'matern0.5', 'lr': 0.0001788690250419512, 'batch_size': 512, 'num_inducing': 348, 'initialize_fe': False, 'minit': 'kmeans'}. Best is trial 32 with value: 0.00010389254020992666.
INFO:root:After model training
INFO:root:1.423828125
INFO:root:10.0
INFO:optuna.study.study:Trial 51 finished with value: 0.00015282788081094623 and parameters: {'n_max': 720, 'n_layers': 2, 'n_out': 11, 'mean_type': 'linear', 'kernel_type': 'rbf', 'lr': 0.0013025734769858029, 'batch_size': 512, 'num_inducing': 436, 'initialize_fe': True, 'minit': 'kmeans'}. Best is trial 32 with value: 0.00010389254020992666.
INFO:root:After model training
INFO:root:2.384765625
INFO:root:24.0
INFO:optuna.study.study:Trial 52 finished with value: 0.0003489591763354838 and parameters: {'n_max': 647, 'n_layers': 2, 'n_out': 14, 'mean_type': 'linear', 'kernel_type': 'rbf', 'lr': 0.004119664729721397, 'batch_size': 512, 'num_inducing': 622, 'initialize_fe': True, 'minit': 'kmeans'}. Best is trial 32 with value: 0.00010389254020992666.
INFO:root:After model training
INFO:root:0.85595703125
INFO:root:10.0
INFO:optuna.study.study:Trial 53 finished with value: 0.00159023841843009 and parameters: {'n_max': 613, 'n_layers': 2, 'n_out': 9, 'mean_type': 'linear', 'kernel_type': 'rbf', 'lr': 0.00040196815822306995, 'batch_size': 512, 'num_inducing': 293, 'initialize_fe': True, 'minit': 'kmeans'}. Best is trial 32 with value: 0.00010389254020992666.
INFO:root:After model training
INFO:root:1.0869140625
INFO:root:10.0
INFO:optuna.study.study:Trial 54 finished with value: 0.0002459949173498899 and parameters: {'n_max': 807, 'n_layers': 2, 'n_out': 11, 'mean_type': 'linear', 'kernel_type': 'rbf', 'lr': 0.001605979437616658, 'batch_size': 512, 'num_inducing': 353, 'initialize_fe': True, 'minit': 'kmeans'}. Best is trial 32 with value: 0.00010389254020992666.
INFO:root:After model training
INFO:root:0.5185546875
INFO:root:8.0
INFO:optuna.study.study:Trial 55 finished with value: 7.945439574541524e-05 and parameters: {'n_max': 645, 'n_layers': 2, 'n_out': 10, 'mean_type': 'linear', 'kernel_type': 'rbf', 'lr': 0.0006540069644750126, 'batch_size': 512, 'num_inducing': 175, 'initialize_fe': True, 'minit': 'kmeans'}. Best is trial 55 with value: 7.945439574541524e-05.
INFO:root:After model training
INFO:root:0.4990234375
INFO:root:8.0
INFO:optuna.study.study:Trial 56 finished with value: 0.0019436621805652976 and parameters: {'n_max': 695, 'n_layers': 2, 'n_out': 7, 'mean_type': 'linear', 'kernel_type': 'rbf', 'lr': 0.0006469642378332913, 'batch_size': 512, 'num_inducing': 169, 'initialize_fe': False, 'minit': 'kmeans'}. Best is trial 55 with value: 7.945439574541524e-05.
INFO:root:After model training
INFO:root:0.52880859375
INFO:root:6.0
INFO:optuna.study.study:Trial 57 finished with value: 0.014287298545241356 and parameters: {'n_max': 648, 'n_layers': 2, 'n_out': 10, 'mean_type': 'linear', 'kernel_type': 'rbf', 'lr': 0.0004837407476209352, 'batch_size': 1024, 'num_inducing': 179, 'initialize_fe': False, 'minit': 'random'}. Best is trial 55 with value: 7.945439574541524e-05.
INFO:root:After model training
INFO:root:1.0029296875
INFO:root:8.0
INFO:optuna.study.study:Trial 58 finished with value: 0.0004614345380105078 and parameters: {'n_max': 557, 'n_layers': 3, 'n_out': 9, 'mean_type': 'constant', 'kernel_type': 'matern0.5', 'lr': 0.00031898885723034235, 'batch_size': 512, 'num_inducing': 130, 'initialize_fe': True, 'minit': 'kmeans'}. Best is trial 55 with value: 7.945439574541524e-05.
INFO:root:After model training
INFO:root:7.66064453125
INFO:root:36.0
INFO:optuna.study.study:Trial 59 finished with value: 0.0255973432213068 and parameters: {'n_max': 742, 'n_layers': 2, 'n_out': 12, 'mean_type': 'linear', 'kernel_type': 'rbf', 'lr': 0.0009411453845391021, 'batch_size': 2048, 'num_inducing': 233, 'initialize_fe': False, 'minit': 'kmeans'}. Best is trial 55 with value: 7.945439574541524e-05.
INFO:root:After model training
INFO:root:0.310546875
INFO:root:6.0
INFO:optuna.study.study:Trial 60 finished with value: 0.00037324786535464227 and parameters: {'n_max': 499, 'n_layers': 2, 'n_out': 14, 'mean_type': 'linear', 'kernel_type': 'rbf', 'lr': 0.006952650234723498, 'batch_size': 512, 'num_inducing': 75, 'initialize_fe': False, 'minit': 'random'}. Best is trial 55 with value: 7.945439574541524e-05.
INFO:root:After model training
INFO:root:0.78271484375
INFO:root:8.0
INFO:optuna.study.study:Trial 61 finished with value: 0.0005367033882066607 and parameters: {'n_max': 612, 'n_layers': 2, 'n_out': 11, 'mean_type': 'linear', 'kernel_type': 'rbf', 'lr': 0.002326028432766036, 'batch_size': 512, 'num_inducing': 269, 'initialize_fe': True, 'minit': 'kmeans'}. Best is trial 55 with value: 7.945439574541524e-05.
INFO:root:After model training
INFO:root:0.54345703125
INFO:root:10.0
INFO:optuna.study.study:Trial 62 finished with value: 0.00032420866773463786 and parameters: {'n_max': 660, 'n_layers': 2, 'n_out': 12, 'mean_type': 'linear', 'kernel_type': 'rbf', 'lr': 0.0032519543275638754, 'batch_size': 512, 'num_inducing': 183, 'initialize_fe': True, 'minit': 'kmeans'}. Best is trial 55 with value: 7.945439574541524e-05.
INFO:root:After model training
INFO:root:0.453125
INFO:root:4.0
INFO:optuna.study.study:Trial 63 finished with value: 0.0008415558259002864 and parameters: {'n_max': 526, 'n_layers': 2, 'n_out': 9, 'mean_type': 'linear', 'kernel_type': 'rbf', 'lr': 0.000814853485939894, 'batch_size': 512, 'num_inducing': 151, 'initialize_fe': True, 'minit': 'kmeans'}. Best is trial 55 with value: 7.945439574541524e-05.
INFO:root:After model training
INFO:root:0.63232421875
INFO:root:10.0
INFO:optuna.study.study:Trial 64 finished with value: 0.0008136434480547905 and parameters: {'n_max': 633, 'n_layers': 2, 'n_out': 10, 'mean_type': 'linear', 'kernel_type': 'rbf', 'lr': 0.0006130808386608943, 'batch_size': 512, 'num_inducing': 219, 'initialize_fe': True, 'minit': 'kmeans'}. Best is trial 55 with value: 7.945439574541524e-05.
INFO:root:After model training
INFO:root:1.833984375
INFO:root:26.0
INFO:optuna.study.study:Trial 65 finished with value: 0.0011885997373610735 and parameters: {'n_max': 783, 'n_layers': 2, 'n_out': 8, 'mean_type': 'linear', 'kernel_type': 'rbf', 'lr': 0.0011046836811286263, 'batch_size': 512, 'num_inducing': 523, 'initialize_fe': True, 'minit': 'kmeans'}. Best is trial 55 with value: 7.945439574541524e-05.
INFO:root:After model training
INFO:root:0.39306640625
INFO:root:10.0
INFO:optuna.study.study:Trial 66 finished with value: 0.00010053320147562772 and parameters: {'n_max': 450, 'n_layers': 2, 'n_out': 13, 'mean_type': 'constant', 'kernel_type': 'rbf', 'lr': 0.0026918986634593793, 'batch_size': 512, 'num_inducing': 122, 'initialize_fe': False, 'minit': 'kmeans'}. Best is trial 55 with value: 7.945439574541524e-05.
INFO:root:After model training
INFO:root:0.42626953125
INFO:root:8.0
INFO:optuna.study.study:Trial 67 finished with value: 0.0002134726382791996 and parameters: {'n_max': 114, 'n_layers': 4, 'n_out': 13, 'mean_type': 'constant', 'kernel_type': 'rbf', 'lr': 0.0027329110316161418, 'batch_size': 512, 'num_inducing': 126, 'initialize_fe': False, 'minit': 'kmeans'}. Best is trial 55 with value: 7.945439574541524e-05.
INFO:root:After model training
INFO:root:0.376953125
INFO:root:8.0
INFO:optuna.study.study:Trial 68 finished with value: 0.00022568418353330344 and parameters: {'n_max': 358, 'n_layers': 2, 'n_out': 16, 'mean_type': 'constant', 'kernel_type': 'matern0.5', 'lr': 0.004998157958989047, 'batch_size': 512, 'num_inducing': 115, 'initialize_fe': False, 'minit': 'kmeans'}. Best is trial 55 with value: 7.945439574541524e-05.
INFO:root:After model training
INFO:root:0.31787109375
INFO:root:8.0
INFO:optuna.study.study:Trial 69 finished with value: 0.00011129392078146338 and parameters: {'n_max': 428, 'n_layers': 2, 'n_out': 6, 'mean_type': 'constant', 'kernel_type': 'rbf', 'lr': 0.0036535692125988315, 'batch_size': 512, 'num_inducing': 89, 'initialize_fe': False, 'minit': 'kmeans'}. Best is trial 55 with value: 7.945439574541524e-05.
INFO:root:After model training
INFO:root:0.6298828125
INFO:root:10.0
INFO:optuna.study.study:Trial 70 finished with value: 0.00011527979222591966 and parameters: {'n_max': 411, 'n_layers': 3, 'n_out': 6, 'mean_type': 'constant', 'kernel_type': 'rbf', 'lr': 0.002041851601370345, 'batch_size': 512, 'num_inducing': 84, 'initialize_fe': False, 'minit': 'random'}. Best is trial 55 with value: 7.945439574541524e-05.
INFO:root:After model training
INFO:root:0.921875
INFO:root:6.0
INFO:optuna.study.study:Trial 71 finished with value: 0.0001412528072251007 and parameters: {'n_max': 434, 'n_layers': 4, 'n_out': 6, 'mean_type': 'constant', 'kernel_type': 'rbf', 'lr': 0.002115259242151818, 'batch_size': 512, 'num_inducing': 66, 'initialize_fe': False, 'minit': 'random'}. Best is trial 55 with value: 7.945439574541524e-05.
INFO:root:After model training
INFO:root:0.6962890625
INFO:root:6.0
