INFO:optuna.study.study:Trial 83 finished with value: 0.00020898155344184488 and parameters: {'n_max': 988, 'n_layers': 3, 'n_out': 8, 'mean_type': 'constant', 'kernel_type': 'rbf', 'lr': 0.006532236380412873, 'batch_size': 512, 'num_inducing': 689, 'initialize_fe': False, 'minit': 'kmeans'}. Best is trial 63 with value: 8.309746044687927e-05.
INFO:root:After model training
INFO:root:5.6669921875
INFO:root:28.0
INFO:optuna.study.study:Trial 84 finished with value: 0.00016546796541661024 and parameters: {'n_max': 959, 'n_layers': 3, 'n_out': 12, 'mean_type': 'constant', 'kernel_type': 'rbf', 'lr': 0.0028965069404548404, 'batch_size': 512, 'num_inducing': 787, 'initialize_fe': False, 'minit': 'kmeans'}. Best is trial 63 with value: 8.309746044687927e-05.
INFO:root:After model training
INFO:root:5.50634765625
INFO:root:26.0
INFO:optuna.study.study:Trial 85 finished with value: 0.00017781363567337394 and parameters: {'n_max': 935, 'n_layers': 2, 'n_out': 9, 'mean_type': 'constant', 'kernel_type': 'rbf', 'lr': 0.0048746186077892155, 'batch_size': 512, 'num_inducing': 991, 'initialize_fe': False, 'minit': 'kmeans'}. Best is trial 63 with value: 8.309746044687927e-05.
INFO:root:After model training
INFO:root:4.98779296875
INFO:root:34.0
INFO:optuna.study.study:Trial 86 finished with value: 0.0002109052293235436 and parameters: {'n_max': 909, 'n_layers': 4, 'n_out': 14, 'mean_type': 'constant', 'kernel_type': 'rbf', 'lr': 0.013313967684400383, 'batch_size': 512, 'num_inducing': 497, 'initialize_fe': False, 'minit': 'kmeans'}. Best is trial 63 with value: 8.309746044687927e-05.
INFO:root:After model training
INFO:root:2.67236328125
INFO:root:28.0
INFO:optuna.study.study:Trial 87 finished with value: 0.0001632914791116491 and parameters: {'n_max': 997, 'n_layers': 2, 'n_out': 15, 'mean_type': 'constant', 'kernel_type': 'rbf', 'lr': 0.001974106198640395, 'batch_size': 512, 'num_inducing': 591, 'initialize_fe': True, 'minit': 'kmeans'}. Best is trial 63 with value: 8.309746044687927e-05.
INFO:root:After model training
INFO:root:9.73291015625
INFO:root:28.0
INFO:optuna.study.study:Trial 88 finished with value: 0.0002886776055675 and parameters: {'n_max': 799, 'n_layers': 3, 'n_out': 13, 'mean_type': 'constant', 'kernel_type': 'matern0.5', 'lr': 0.003703988163548013, 'batch_size': 512, 'num_inducing': 1296, 'initialize_fe': False, 'minit': 'kmeans'}. Best is trial 63 with value: 8.309746044687927e-05.
INFO:root:After model training
INFO:root:2.42724609375
INFO:root:26.0
INFO:optuna.study.study:Trial 89 finished with value: 0.0005930807092227042 and parameters: {'n_max': 857, 'n_layers': 2, 'n_out': 10, 'mean_type': 'constant', 'kernel_type': 'rbf', 'lr': 0.009019210559835771, 'batch_size': 1024, 'num_inducing': 551, 'initialize_fe': False, 'minit': 'random'}. Best is trial 63 with value: 8.309746044687927e-05.
INFO:root:After model training
INFO:root:1.83251953125
INFO:root:12.0
INFO:optuna.study.study:Trial 90 finished with value: 0.0003888565697707236 and parameters: {'n_max': 893, 'n_layers': 2, 'n_out': 11, 'mean_type': 'constant', 'kernel_type': 'rbf', 'lr': 0.014873560378360007, 'batch_size': 512, 'num_inducing': 427, 'initialize_fe': False, 'minit': 'kmeans'}. Best is trial 63 with value: 8.309746044687927e-05.
INFO:root:After model training
INFO:root:4.07080078125
INFO:root:28.0
INFO:optuna.study.study:Trial 91 finished with value: 8.091007475741208e-05 and parameters: {'n_max': 963, 'n_layers': 2, 'n_out': 9, 'mean_type': 'constant', 'kernel_type': 'rbf', 'lr': 0.00305603779732229, 'batch_size': 512, 'num_inducing': 811, 'initialize_fe': False, 'minit': 'kmeans'}. Best is trial 91 with value: 8.091007475741208e-05.
INFO:root:After model training
INFO:root:4.09619140625
INFO:root:30.0
INFO:optuna.study.study:Trial 92 finished with value: 0.00011021128011634573 and parameters: {'n_max': 961, 'n_layers': 2, 'n_out': 8, 'mean_type': 'constant', 'kernel_type': 'rbf', 'lr': 0.0033972366681948407, 'batch_size': 512, 'num_inducing': 815, 'initialize_fe': False, 'minit': 'kmeans'}. Best is trial 91 with value: 8.091007475741208e-05.
INFO:root:After model training
INFO:root:3.03955078125
INFO:root:28.0
INFO:optuna.study.study:Trial 93 finished with value: 0.00010630514589138329 and parameters: {'n_max': 967, 'n_layers': 2, 'n_out': 8, 'mean_type': 'constant', 'kernel_type': 'rbf', 'lr': 0.0028956184641818995, 'batch_size': 512, 'num_inducing': 658, 'initialize_fe': False, 'minit': 'kmeans'}. Best is trial 91 with value: 8.091007475741208e-05.
INFO:root:After model training
INFO:root:2.97802734375
INFO:root:26.0
INFO:optuna.study.study:Trial 94 finished with value: 9.434206003788859e-05 and parameters: {'n_max': 970, 'n_layers': 2, 'n_out': 8, 'mean_type': 'constant', 'kernel_type': 'rbf', 'lr': 0.0035891048859907552, 'batch_size': 512, 'num_inducing': 648, 'initialize_fe': False, 'minit': 'kmeans'}. Best is trial 91 with value: 8.091007475741208e-05.
INFO:root:After model training
INFO:root:3.078125
INFO:root:26.0
INFO:optuna.study.study:Trial 95 finished with value: 0.00014999843551777303 and parameters: {'n_max': 1009, 'n_layers': 2, 'n_out': 8, 'mean_type': 'linear', 'kernel_type': 'rbf', 'lr': 0.0023815121974106067, 'batch_size': 512, 'num_inducing': 664, 'initialize_fe': False, 'minit': 'kmeans'}. Best is trial 91 with value: 8.091007475741208e-05.
INFO:root:After model training
INFO:root:2.73779296875
INFO:root:26.0
INFO:optuna.study.study:Trial 96 finished with value: 0.00012026076728943735 and parameters: {'n_max': 970, 'n_layers': 2, 'n_out': 7, 'mean_type': 'constant', 'kernel_type': 'rbf', 'lr': 0.0016750953256156112, 'batch_size': 512, 'num_inducing': 608, 'initialize_fe': False, 'minit': 'kmeans'}. Best is trial 91 with value: 8.091007475741208e-05.
INFO:root:After model training
INFO:root:3.32958984375
INFO:root:28.0
INFO:optuna.study.study:Trial 97 finished with value: 0.00022495911980513483 and parameters: {'n_max': 984, 'n_layers': 2, 'n_out': 8, 'mean_type': 'constant', 'kernel_type': 'rbf', 'lr': 0.0034103585787996792, 'batch_size': 512, 'num_inducing': 704, 'initialize_fe': False, 'minit': 'kmeans'}. Best is trial 91 with value: 8.091007475741208e-05.
INFO:root:After model training
INFO:root:10.30126953125
INFO:root:38.0
INFO:optuna.study.study:Trial 98 finished with value: 0.0011054598726332188 and parameters: {'n_max': 925, 'n_layers': 2, 'n_out': 9, 'mean_type': 'constant', 'kernel_type': 'rbf', 'lr': 0.0013069326864380336, 'batch_size': 2048, 'num_inducing': 359, 'initialize_fe': False, 'minit': 'kmeans'}. Best is trial 91 with value: 8.091007475741208e-05.
INFO:root:After model training
INFO:root:5.08740234375
INFO:root:26.0
INFO:optuna.study.study:Trial 99 finished with value: 0.00010983488755300641 and parameters: {'n_max': 1022, 'n_layers': 2, 'n_out': 5, 'mean_type': 'constant', 'kernel_type': 'rbf', 'lr': 0.0018695776004845608, 'batch_size': 512, 'num_inducing': 943, 'initialize_fe': False, 'minit': 'kmeans'}. Best is trial 91 with value: 8.091007475741208e-05.
INFO:root:Outer Run: 4: MSE - 9.682231194574342e-08, MAE - 0.00023223372409120202. MAX - 0.0018957853317260742
INFO:optuna.storages._in_memory:A new study created in memory with name: Nested Resampling VDKL 5
INFO:root:After model training
INFO:root:45.203125
INFO:root:100.0
INFO:optuna.study.study:Trial 0 finished with value: 0.0014494064962491393 and parameters: {'n_max': 1024, 'n_layers': 4, 'n_out': 2, 'mean_type': 'constant', 'kernel_type': 'rbf', 'lr': 0.01, 'batch_size': 2048, 'num_inducing': 1000, 'initialize_fe': False, 'minit': 'kmeans'}. Best is trial 0 with value: 0.0014494064962491393.
INFO:root:After model training
INFO:root:23.34619140625
INFO:root:72.0
INFO:optuna.study.study:Trial 1 finished with value: 0.004881126806139946 and parameters: {'n_max': 321, 'n_layers': 3, 'n_out': 16, 'mean_type': 'linear', 'kernel_type': 'rbf', 'lr': 0.0007388203243493678, 'batch_size': 1024, 'num_inducing': 232, 'initialize_fe': True, 'minit': 'kmeans'}. Best is trial 0 with value: 0.0014494064962491393.
INFO:root:After model training
INFO:root:25.615234375
INFO:root:68.0
INFO:optuna.study.study:Trial 2 finished with value: 0.016063030809164047 and parameters: {'n_max': 793, 'n_layers': 4, 'n_out': 14, 'mean_type': 'linear', 'kernel_type': 'rbf', 'lr': 0.031118208322855605, 'batch_size': 1024, 'num_inducing': 250, 'initialize_fe': True, 'minit': 'kmeans'}. Best is trial 0 with value: 0.0014494064962491393.
INFO:root:After model training
INFO:root:31.97216796875
INFO:root:86.0
INFO:optuna.study.study:Trial 3 finished with value: 0.0009201441425830126 and parameters: {'n_max': 376, 'n_layers': 4, 'n_out': 15, 'mean_type': 'constant', 'kernel_type': 'matern0.5', 'lr': 0.007643586918062972, 'batch_size': 2048, 'num_inducing': 307, 'initialize_fe': True, 'minit': 'kmeans'}. Best is trial 3 with value: 0.0009201441425830126.
INFO:root:After model training
INFO:root:28.60595703125
INFO:root:68.0
INFO:optuna.study.study:Trial 4 finished with value: 0.00017716616275720298 and parameters: {'n_max': 403, 'n_layers': 2, 'n_out': 8, 'mean_type': 'constant', 'kernel_type': 'rbf', 'lr': 0.005045442203077277, 'batch_size': 512, 'num_inducing': 1109, 'initialize_fe': False, 'minit': 'kmeans'}. Best is trial 4 with value: 0.00017716616275720298.
INFO:root:After model training
INFO:root:28.2998046875
INFO:root:82.0
INFO:optuna.study.study:Trial 5 finished with value: 0.0009322339319624007 and parameters: {'n_max': 311, 'n_layers': 2, 'n_out': 18, 'mean_type': 'linear', 'kernel_type': 'matern1.5', 'lr': 0.00017041640225547107, 'batch_size': 2048, 'num_inducing': 50, 'initialize_fe': True, 'minit': 'random'}. Best is trial 4 with value: 0.00017716616275720298.
INFO:root:After model training
INFO:root:49.041015625
INFO:root:110.0
INFO:optuna.study.study:Trial 6 finished with value: 0.022410189732909203 and parameters: {'n_max': 710, 'n_layers': 2, 'n_out': 20, 'mean_type': 'constant', 'kernel_type': 'rbf', 'lr': 0.00011099612876475281, 'batch_size': 2048, 'num_inducing': 1441, 'initialize_fe': False, 'minit': 'random'}. Best is trial 4 with value: 0.00017716616275720298.
INFO:root:After model training
INFO:root:22.89599609375
INFO:root:70.0
INFO:optuna.study.study:Trial 7 finished with value: 0.0006641271756961942 and parameters: {'n_max': 84, 'n_layers': 5, 'n_out': 14, 'mean_type': 'constant', 'kernel_type': 'matern0.5', 'lr': 0.004109858230074923, 'batch_size': 1024, 'num_inducing': 121, 'initialize_fe': True, 'minit': 'random'}. Best is trial 4 with value: 0.00017716616275720298.
INFO:root:After model training
INFO:root:27.57470703125
INFO:root:68.0
INFO:optuna.study.study:Trial 8 finished with value: 0.0008374821627512574 and parameters: {'n_max': 187, 'n_layers': 4, 'n_out': 11, 'mean_type': 'linear', 'kernel_type': 'matern0.5', 'lr': 0.0040092844438327415, 'batch_size': 512, 'num_inducing': 983, 'initialize_fe': True, 'minit': 'kmeans'}. Best is trial 4 with value: 0.00017716616275720298.
INFO:root:After model training
INFO:root:24.80615234375
INFO:root:74.0
INFO:optuna.study.study:Trial 9 finished with value: 0.0076604560017585754 and parameters: {'n_max': 503, 'n_layers': 4, 'n_out': 18, 'mean_type': 'linear', 'kernel_type': 'matern0.5', 'lr': 0.05808527456170565, 'batch_size': 512, 'num_inducing': 441, 'initialize_fe': False, 'minit': 'random'}. Best is trial 4 with value: 0.00017716616275720298.
INFO:root:After model training
INFO:root:39.8056640625
INFO:root:98.0
INFO:optuna.study.study:Trial 10 finished with value: 0.0004183953860774636 and parameters: {'n_max': 609, 'n_layers': 2, 'n_out': 7, 'mean_type': 'constant', 'kernel_type': 'matern1.5', 'lr': 0.0009077473550553802, 'batch_size': 512, 'num_inducing': 1977, 'initialize_fe': False, 'minit': 'kmeans'}. Best is trial 4 with value: 0.00017716616275720298.
INFO:root:After model training
INFO:root:40.03076171875
INFO:root:98.0
INFO:optuna.study.study:Trial 11 finished with value: 0.0003060351009480655 and parameters: {'n_max': 607, 'n_layers': 2, 'n_out': 7, 'mean_type': 'constant', 'kernel_type': 'matern1.5', 'lr': 0.001060820386427968, 'batch_size': 512, 'num_inducing': 1962, 'initialize_fe': False, 'minit': 'kmeans'}. Best is trial 4 with value: 0.00017716616275720298.
INFO:root:After model training
INFO:root:25.83642578125
INFO:root:70.0
INFO:optuna.study.study:Trial 12 finished with value: 0.00021578228916041553 and parameters: {'n_max': 516, 'n_layers': 3, 'n_out': 7, 'mean_type': 'constant', 'kernel_type': 'matern1.5', 'lr': 0.0011446446580075432, 'batch_size': 512, 'num_inducing': 699, 'initialize_fe': False, 'minit': 'kmeans'}. Best is trial 4 with value: 0.00017716616275720298.
INFO:root:After model training
INFO:root:25.6103515625
INFO:root:74.0
INFO:optuna.study.study:Trial 13 finished with value: 0.00039804232073947787 and parameters: {'n_max': 463, 'n_layers': 3, 'n_out': 7, 'mean_type': 'constant', 'kernel_type': 'matern1.5', 'lr': 0.0004695931717915807, 'batch_size': 512, 'num_inducing': 602, 'initialize_fe': False, 'minit': 'kmeans'}. Best is trial 4 with value: 0.00017716616275720298.
INFO:root:After model training
INFO:root:26.6044921875
INFO:root:66.0
INFO:optuna.study.study:Trial 14 finished with value: 0.0002486547455191612 and parameters: {'n_max': 817, 'n_layers': 3, 'n_out': 3, 'mean_type': 'constant', 'kernel_type': 'rbf', 'lr': 0.001945466869036988, 'batch_size': 512, 'num_inducing': 680, 'initialize_fe': False, 'minit': 'kmeans'}. Best is trial 4 with value: 0.00017716616275720298.
INFO:root:After model training
INFO:root:26.5771484375
INFO:root:70.0
INFO:optuna.study.study:Trial 15 finished with value: 0.0002087299362756312 and parameters: {'n_max': 413, 'n_layers': 3, 'n_out': 10, 'mean_type': 'constant', 'kernel_type': 'matern1.5', 'lr': 0.014595389946889987, 'batch_size': 512, 'num_inducing': 832, 'initialize_fe': False, 'minit': 'kmeans'}. Best is trial 4 with value: 0.00017716616275720298.
INFO:root:After model training
INFO:root:28.83984375
INFO:root:68.0
INFO:optuna.study.study:Trial 16 finished with value: 0.0003164590452797711 and parameters: {'n_max': 210, 'n_layers': 2, 'n_out': 10, 'mean_type': 'constant', 'kernel_type': 'rbf', 'lr': 0.0197964162326092, 'batch_size': 512, 'num_inducing': 1134, 'initialize_fe': False, 'minit': 'kmeans'}. Best is trial 4 with value: 0.00017716616275720298.
INFO:root:After model training
INFO:root:24.4169921875
INFO:root:70.0
INFO:optuna.study.study:Trial 17 finished with value: 0.0022733635269105434 and parameters: {'n_max': 401, 'n_layers': 3, 'n_out': 9, 'mean_type': 'constant', 'kernel_type': 'matern1.5', 'lr': 0.07977892224129386, 'batch_size': 512, 'num_inducing': 483, 'initialize_fe': False, 'minit': 'kmeans'}. Best is trial 4 with value: 0.00017716616275720298.
INFO:root:After model training
INFO:root:23.2314453125
INFO:root:70.0
INFO:optuna.study.study:Trial 18 finished with value: 0.00037570964195765555 and parameters: {'n_max': 239, 'n_layers': 5, 'n_out': 12, 'mean_type': 'constant', 'kernel_type': 'rbf', 'lr': 0.013854932012038159, 'batch_size': 512, 'num_inducing': 160, 'initialize_fe': False, 'minit': 'random'}. Best is trial 4 with value: 0.00017716616275720298.
INFO:root:After model training
INFO:root:31.12646484375
INFO:root:68.0
INFO:optuna.study.study:Trial 19 finished with value: 0.0010416266741231084 and parameters: {'n_max': 615, 'n_layers': 2, 'n_out': 5, 'mean_type': 'constant', 'kernel_type': 'matern1.5', 'lr': 0.03321905781329378, 'batch_size': 1024, 'num_inducing': 1349, 'initialize_fe': False, 'minit': 'kmeans'}. Best is trial 4 with value: 0.00017716616275720298.
INFO:root:After model training
INFO:root:26.19970703125
INFO:root:72.0
INFO:optuna.study.study:Trial 20 finished with value: 0.0001928372512338683 and parameters: {'n_max': 138, 'n_layers': 3, 'n_out': 12, 'mean_type': 'constant', 'kernel_type': 'matern1.5', 'lr': 0.0057654661954692574, 'batch_size': 512, 'num_inducing': 822, 'initialize_fe': False, 'minit': 'kmeans'}. Best is trial 4 with value: 0.00017716616275720298.
INFO:root:After model training
INFO:root:26.26171875
INFO:root:68.0
INFO:optuna.study.study:Trial 21 finished with value: 0.0002097104152198881 and parameters: {'n_max': 98, 'n_layers': 3, 'n_out': 12, 'mean_type': 'constant', 'kernel_type': 'matern1.5', 'lr': 0.0064772741392211475, 'batch_size': 512, 'num_inducing': 833, 'initialize_fe': False, 'minit': 'kmeans'}. Best is trial 4 with value: 0.00017716616275720298.
INFO:root:After model training
INFO:root:24.30908203125
INFO:root:72.0
INFO:optuna.study.study:Trial 22 finished with value: 0.00022538429766427726 and parameters: {'n_max': 408, 'n_layers': 3, 'n_out': 9, 'mean_type': 'constant', 'kernel_type': 'matern1.5', 'lr': 0.0026222735112843695, 'batch_size': 512, 'num_inducing': 458, 'initialize_fe': False, 'minit': 'kmeans'}. Best is trial 4 with value: 0.00017716616275720298.
INFO:root:After model training
INFO:root:32.287109375
INFO:root:68.0
INFO:optuna.study.study:Trial 23 finished with value: 0.00014438145444728434 and parameters: {'n_max': 291, 'n_layers': 3, 'n_out': 5, 'mean_type': 'constant', 'kernel_type': 'matern1.5', 'lr': 0.005230247025903149, 'batch_size': 512, 'num_inducing': 1435, 'initialize_fe': False, 'minit': 'kmeans'}. Best is trial 23 with value: 0.00014438145444728434.
INFO:root:After model training
INFO:root:31.9404296875
INFO:root:68.0
INFO:optuna.study.study:Trial 24 finished with value: 0.00016289691848214716 and parameters: {'n_max': 158, 'n_layers': 2, 'n_out': 5, 'mean_type': 'constant', 'kernel_type': 'matern1.5', 'lr': 0.00560633737300226, 'batch_size': 512, 'num_inducing': 1420, 'initialize_fe': False, 'minit': 'kmeans'}. Best is trial 23 with value: 0.00014438145444728434.
INFO:root:After model training
INFO:root:32.232421875
INFO:root:68.0
INFO:optuna.study.study:Trial 25 finished with value: 0.00013519948697648942 and parameters: {'n_max': 290, 'n_layers': 2, 'n_out': 4, 'mean_type': 'constant', 'kernel_type': 'rbf', 'lr': 0.002003654214786929, 'batch_size': 512, 'num_inducing': 1444, 'initialize_fe': False, 'minit': 'kmeans'}. Best is trial 25 with value: 0.00013519948697648942.
INFO:root:After model training
INFO:root:33.34130859375
INFO:root:68.0
INFO:optuna.study.study:Trial 26 finished with value: 9.643709927331656e-05 and parameters: {'n_max': 264, 'n_layers': 2, 'n_out': 4, 'mean_type': 'constant', 'kernel_type': 'matern1.5', 'lr': 0.0020075777972473506, 'batch_size': 512, 'num_inducing': 1533, 'initialize_fe': False, 'minit': 'kmeans'}. Best is trial 26 with value: 9.643709927331656e-05.
INFO:root:After model training
INFO:root:53.51806640625
INFO:root:110.0
INFO:optuna.study.study:Trial 27 finished with value: 0.000981342513114214 and parameters: {'n_max': 284, 'n_layers': 2, 'n_out': 4, 'mean_type': 'linear', 'kernel_type': 'matern0.5', 'lr': 0.0020576065263128813, 'batch_size': 2048, 'num_inducing': 1651, 'initialize_fe': False, 'minit': 'random'}. Best is trial 26 with value: 9.643709927331656e-05.
INFO:root:After model training
INFO:root:34.69970703125
INFO:root:70.0
INFO:optuna.study.study:Trial 28 finished with value: 0.0008257586741819978 and parameters: {'n_max': 261, 'n_layers': 2, 'n_out': 2, 'mean_type': 'constant', 'kernel_type': 'matern1.5', 'lr': 0.0003831617701480195, 'batch_size': 1024, 'num_inducing': 1636, 'initialize_fe': False, 'minit': 'kmeans'}. Best is trial 26 with value: 9.643709927331656e-05.
INFO:root:After model training
INFO:root:29.1982421875
INFO:root:70.0
INFO:optuna.study.study:Trial 29 finished with value: 0.0001256984833162278 and parameters: {'n_max': 960, 'n_layers': 2, 'n_out': 5, 'mean_type': 'constant', 'kernel_type': 'rbf', 'lr': 0.001556618620945429, 'batch_size': 512, 'num_inducing': 1168, 'initialize_fe': False, 'minit': 'kmeans'}. Best is trial 26 with value: 9.643709927331656e-05.
INFO:root:After model training
INFO:root:43.72607421875
INFO:root:138.0
INFO:optuna.study.study:Trial 30 finished with value: 0.0011174060637131333 and parameters: {'n_max': 1002, 'n_layers': 2, 'n_out': 2, 'mean_type': 'constant', 'kernel_type': 'rbf', 'lr': 0.0017722073622208254, 'batch_size': 2048, 'num_inducing': 1138, 'initialize_fe': False, 'minit': 'kmeans'}. Best is trial 26 with value: 9.643709927331656e-05.
INFO:root:After model training
INFO:root:29.97216796875
INFO:root:68.0
INFO:optuna.study.study:Trial 31 finished with value: 0.00013634224887937307 and parameters: {'n_max': 963, 'n_layers': 2, 'n_out': 5, 'mean_type': 'constant', 'kernel_type': 'rbf', 'lr': 0.0027136076283046243, 'batch_size': 512, 'num_inducing': 1243, 'initialize_fe': False, 'minit': 'kmeans'}. Best is trial 26 with value: 9.643709927331656e-05.
INFO:root:After model training
INFO:root:27.216796875
INFO:root:66.0
INFO:optuna.study.study:Trial 32 finished with value: 0.00030290166614577174 and parameters: {'n_max': 962, 'n_layers': 2, 'n_out': 4, 'mean_type': 'constant', 'kernel_type': 'rbf', 'lr': 0.000549715902156552, 'batch_size': 512, 'num_inducing': 953, 'initialize_fe': False, 'minit': 'kmeans'}. Best is trial 26 with value: 9.643709927331656e-05.
INFO:root:After model training
INFO:root:41.07666015625
INFO:root:112.0
INFO:optuna.study.study:Trial 33 finished with value: 0.00015645186067558825 and parameters: {'n_max': 888, 'n_layers': 2, 'n_out': 6, 'mean_type': 'constant', 'kernel_type': 'rbf', 'lr': 0.0013057356266627017, 'batch_size': 512, 'num_inducing': 1930, 'initialize_fe': False, 'minit': 'kmeans'}. Best is trial 26 with value: 9.643709927331656e-05.
INFO:root:After model training
INFO:root:29.6904296875
INFO:root:70.0
INFO:optuna.study.study:Trial 34 finished with value: 0.0005947969038970768 and parameters: {'n_max': 893, 'n_layers': 2, 'n_out': 3, 'mean_type': 'linear', 'kernel_type': 'rbf', 'lr': 0.002828916970020575, 'batch_size': 1024, 'num_inducing': 1217, 'initialize_fe': True, 'minit': 'kmeans'}. Best is trial 26 with value: 9.643709927331656e-05.
INFO:root:After model training
INFO:root:25.13818359375
INFO:root:66.0
