INFO:optuna.study.study:Trial 4 finished with value: 0.07507320493459702 and parameters: {'n_max': 943, 'n_layers': 3, 'n_out': 14, 'mean_type': 'constant', 'kernel_type': 'matern0.5', 'lr': 0.0003791603874631529, 'batch_size': 1024, 'num_inducing': 139, 'initialize_fe': False, 'minit': 'random'}. Best is trial 0 with value: 0.0721203088760376.
INFO:root:After model training
INFO:root:7.546875
INFO:root:28.0
INFO:optuna.study.study:Trial 5 finished with value: 0.11178432404994965 and parameters: {'n_max': 629, 'n_layers': 2, 'n_out': 4, 'mean_type': 'linear', 'kernel_type': 'rbf', 'lr': 0.00034209657766083476, 'batch_size': 512, 'num_inducing': 867, 'initialize_fe': False, 'minit': 'random'}. Best is trial 0 with value: 0.0721203088760376.
INFO:root:After model training
INFO:root:8.8681640625
INFO:root:30.0
INFO:optuna.study.study:Trial 6 finished with value: 0.08520407974720001 and parameters: {'n_max': 1022, 'n_layers': 5, 'n_out': 4, 'mean_type': 'constant', 'kernel_type': 'matern1.5', 'lr': 0.00022533779374581583, 'batch_size': 512, 'num_inducing': 213, 'initialize_fe': True, 'minit': 'random'}. Best is trial 0 with value: 0.0721203088760376.
INFO:root:After model training
INFO:root:4.8134765625
INFO:root:30.0
INFO:optuna.study.study:Trial 7 finished with value: 0.09004069864749908 and parameters: {'n_max': 467, 'n_layers': 2, 'n_out': 18, 'mean_type': 'linear', 'kernel_type': 'matern1.5', 'lr': 0.00029989050374516047, 'batch_size': 1024, 'num_inducing': 532, 'initialize_fe': True, 'minit': 'random'}. Best is trial 0 with value: 0.0721203088760376.
INFO:root:After model training
INFO:root:40.6962890625
INFO:root:90.0
INFO:optuna.study.study:Trial 8 finished with value: 0.08230601251125336 and parameters: {'n_max': 498, 'n_layers': 5, 'n_out': 13, 'mean_type': 'constant', 'kernel_type': 'rbf', 'lr': 0.006735690804988676, 'batch_size': 2048, 'num_inducing': 1901, 'initialize_fe': False, 'minit': 'kmeans'}. Best is trial 0 with value: 0.0721203088760376.
INFO:root:After model training
INFO:root:36.10693359375
INFO:root:68.0
INFO:optuna.study.study:Trial 9 finished with value: 0.07700131833553314 and parameters: {'n_max': 798, 'n_layers': 4, 'n_out': 3, 'mean_type': 'constant', 'kernel_type': 'matern1.5', 'lr': 0.048026288627038435, 'batch_size': 2048, 'num_inducing': 1649, 'initialize_fe': True, 'minit': 'random'}. Best is trial 0 with value: 0.0721203088760376.
INFO:root:After model training
INFO:root:9.21728515625
INFO:root:46.0
INFO:optuna.study.study:Trial 10 finished with value: 0.12927953898906708 and parameters: {'n_max': 222, 'n_layers': 3, 'n_out': 8, 'mean_type': 'linear', 'kernel_type': 'rbf', 'lr': 0.0017151433397974238, 'batch_size': 2048, 'num_inducing': 92, 'initialize_fe': True, 'minit': 'kmeans'}. Best is trial 0 with value: 0.0721203088760376.
INFO:root:After model training
INFO:root:11.77587890625
INFO:root:62.0
INFO:optuna.study.study:Trial 11 finished with value: 0.07518450915813446 and parameters: {'n_max': 1024, 'n_layers': 3, 'n_out': 17, 'mean_type': 'constant', 'kernel_type': 'matern0.5', 'lr': 0.0014951435274669883, 'batch_size': 2048, 'num_inducing': 82, 'initialize_fe': False, 'minit': 'kmeans'}. Best is trial 0 with value: 0.0721203088760376.
INFO:root:After model training
INFO:root:4.79638671875
INFO:root:30.0
INFO:optuna.study.study:Trial 12 finished with value: 0.07401704788208008 and parameters: {'n_max': 857, 'n_layers': 3, 'n_out': 15, 'mean_type': 'constant', 'kernel_type': 'matern0.5', 'lr': 0.0008908605561544727, 'batch_size': 1024, 'num_inducing': 139, 'initialize_fe': False, 'minit': 'random'}. Best is trial 0 with value: 0.0721203088760376.
INFO:root:After model training
INFO:root:15.69677734375
INFO:root:64.0
INFO:optuna.study.study:Trial 13 finished with value: 0.07903722673654556 and parameters: {'n_max': 825, 'n_layers': 4, 'n_out': 20, 'mean_type': 'constant', 'kernel_type': 'rbf', 'lr': 0.0010427435974953926, 'batch_size': 2048, 'num_inducing': 404, 'initialize_fe': False, 'minit': 'random'}. Best is trial 0 with value: 0.0721203088760376.
INFO:root:After model training
INFO:root:4.50048828125
INFO:root:30.0
INFO:optuna.study.study:Trial 14 finished with value: 0.07421854138374329 and parameters: {'n_max': 821, 'n_layers': 3, 'n_out': 7, 'mean_type': 'constant', 'kernel_type': 'matern0.5', 'lr': 0.00797314765464936, 'batch_size': 1024, 'num_inducing': 57, 'initialize_fe': False, 'minit': 'random'}. Best is trial 0 with value: 0.0721203088760376.
INFO:root:After model training
INFO:root:12.005859375
INFO:root:28.0
INFO:optuna.study.study:Trial 15 finished with value: 0.0795898586511612 and parameters: {'n_max': 879, 'n_layers': 5, 'n_out': 16, 'mean_type': 'constant', 'kernel_type': 'rbf', 'lr': 0.00011101843345069737, 'batch_size': 1024, 'num_inducing': 910, 'initialize_fe': False, 'minit': 'kmeans'}. Best is trial 0 with value: 0.0721203088760376.
INFO:root:After model training
INFO:root:11.75244140625
INFO:root:46.0
INFO:optuna.study.study:Trial 16 finished with value: 0.08122526109218597 and parameters: {'n_max': 718, 'n_layers': 4, 'n_out': 7, 'mean_type': 'constant', 'kernel_type': 'matern0.5', 'lr': 0.0033077967726874973, 'batch_size': 2048, 'num_inducing': 151, 'initialize_fe': False, 'minit': 'random'}. Best is trial 0 with value: 0.0721203088760376.
INFO:root:After model training
INFO:root:19.6181640625
INFO:root:96.0
INFO:optuna.study.study:Trial 17 finished with value: 0.07345010340213776 and parameters: {'n_max': 943, 'n_layers': 3, 'n_out': 10, 'mean_type': 'constant', 'kernel_type': 'rbf', 'lr': 0.09801789749127389, 'batch_size': 2048, 'num_inducing': 802, 'initialize_fe': False, 'minit': 'random'}. Best is trial 0 with value: 0.0721203088760376.
INFO:root:After model training
INFO:root:19.892578125
INFO:root:100.0
INFO:optuna.study.study:Trial 18 finished with value: 0.1408669799566269 and parameters: {'n_max': 348, 'n_layers': 3, 'n_out': 9, 'mean_type': 'linear', 'kernel_type': 'rbf', 'lr': 0.021278849904889482, 'batch_size': 2048, 'num_inducing': 912, 'initialize_fe': True, 'minit': 'kmeans'}. Best is trial 0 with value: 0.0721203088760376.
INFO:root:After model training
INFO:root:19.22265625
INFO:root:60.0
INFO:optuna.study.study:Trial 19 finished with value: 0.07039467990398407 and parameters: {'n_max': 940, 'n_layers': 4, 'n_out': 6, 'mean_type': 'constant', 'kernel_type': 'rbf', 'lr': 0.07148880191784565, 'batch_size': 2048, 'num_inducing': 658, 'initialize_fe': False, 'minit': 'random'}. Best is trial 19 with value: 0.07039467990398407.
INFO:root:After model training
INFO:root:18.24169921875
INFO:root:92.0
INFO:optuna.study.study:Trial 20 finished with value: 0.07221341878175735 and parameters: {'n_max': 721, 'n_layers': 5, 'n_out': 6, 'mean_type': 'constant', 'kernel_type': 'rbf', 'lr': 0.08638159991696817, 'batch_size': 2048, 'num_inducing': 637, 'initialize_fe': False, 'minit': 'random'}. Best is trial 19 with value: 0.07039467990398407.
INFO:root:After model training
INFO:root:28.96630859375
INFO:root:80.0
INFO:optuna.study.study:Trial 21 finished with value: 0.06985922902822495 and parameters: {'n_max': 742, 'n_layers': 5, 'n_out': 6, 'mean_type': 'constant', 'kernel_type': 'rbf', 'lr': 0.0789583853700576, 'batch_size': 2048, 'num_inducing': 1224, 'initialize_fe': False, 'minit': 'random'}. Best is trial 21 with value: 0.06985922902822495.
INFO:root:After model training
INFO:root:29.65576171875
INFO:root:88.0
INFO:optuna.study.study:Trial 22 finished with value: 0.07067710906267166 and parameters: {'n_max': 942, 'n_layers': 5, 'n_out': 2, 'mean_type': 'constant', 'kernel_type': 'rbf', 'lr': 0.015953193678822912, 'batch_size': 2048, 'num_inducing': 1234, 'initialize_fe': False, 'minit': 'random'}. Best is trial 21 with value: 0.06985922902822495.
INFO:root:After model training
INFO:root:29.38427734375
INFO:root:128.0
INFO:optuna.study.study:Trial 23 finished with value: 0.0741000697016716 and parameters: {'n_max': 739, 'n_layers': 5, 'n_out': 5, 'mean_type': 'constant', 'kernel_type': 'rbf', 'lr': 0.05177753435112406, 'batch_size': 2048, 'num_inducing': 1266, 'initialize_fe': False, 'minit': 'random'}. Best is trial 21 with value: 0.06985922902822495.
INFO:root:After model training
INFO:root:32.9619140625
INFO:root:94.0
INFO:optuna.study.study:Trial 24 finished with value: 0.0697445273399353 and parameters: {'n_max': 923, 'n_layers': 5, 'n_out': 2, 'mean_type': 'constant', 'kernel_type': 'rbf', 'lr': 0.020621143578215748, 'batch_size': 2048, 'num_inducing': 1385, 'initialize_fe': False, 'minit': 'random'}. Best is trial 24 with value: 0.0697445273399353.
INFO:root:After model training
INFO:root:16.0654296875
INFO:root:60.0
INFO:optuna.study.study:Trial 25 finished with value: 0.07061855494976044 and parameters: {'n_max': 906, 'n_layers': 5, 'n_out': 6, 'mean_type': 'constant', 'kernel_type': 'rbf', 'lr': 0.034438233204869675, 'batch_size': 2048, 'num_inducing': 334, 'initialize_fe': False, 'minit': 'random'}. Best is trial 24 with value: 0.0697445273399353.
INFO:root:After model training
INFO:root:12.732421875
INFO:root:30.0
INFO:optuna.study.study:Trial 26 finished with value: 0.09378816187381744 and parameters: {'n_max': 649, 'n_layers': 5, 'n_out': 5, 'mean_type': 'constant', 'kernel_type': 'rbf', 'lr': 0.0818280607865996, 'batch_size': 512, 'num_inducing': 1272, 'initialize_fe': False, 'minit': 'random'}. Best is trial 24 with value: 0.0697445273399353.
INFO:root:After model training
INFO:root:19.283203125
INFO:root:84.0
INFO:optuna.study.study:Trial 27 finished with value: 0.13090576231479645 and parameters: {'n_max': 794, 'n_layers': 4, 'n_out': 8, 'mean_type': 'linear', 'kernel_type': 'rbf', 'lr': 0.05178835271683371, 'batch_size': 2048, 'num_inducing': 705, 'initialize_fe': True, 'minit': 'kmeans'}. Best is trial 24 with value: 0.0697445273399353.
INFO:root:After model training
INFO:root:17.44482421875
INFO:root:60.0
INFO:optuna.study.study:Trial 28 finished with value: 0.07142725586891174 and parameters: {'n_max': 576, 'n_layers': 5, 'n_out': 4, 'mean_type': 'constant', 'kernel_type': 'rbf', 'lr': 0.01599037527513439, 'batch_size': 2048, 'num_inducing': 556, 'initialize_fe': False, 'minit': 'random'}. Best is trial 24 with value: 0.0697445273399353.
INFO:root:After model training
INFO:root:26.46142578125
INFO:root:108.0
INFO:optuna.study.study:Trial 29 finished with value: 0.07391402125358582 and parameters: {'n_max': 967, 'n_layers': 4, 'n_out': 2, 'mean_type': 'constant', 'kernel_type': 'rbf', 'lr': 0.024810411888013327, 'batch_size': 2048, 'num_inducing': 1098, 'initialize_fe': False, 'minit': 'random'}. Best is trial 24 with value: 0.0697445273399353.
INFO:root:After model training
INFO:root:42.19482421875
INFO:root:76.0
INFO:optuna.study.study:Trial 30 finished with value: 0.07820997387170792 and parameters: {'n_max': 742, 'n_layers': 4, 'n_out': 2, 'mean_type': 'constant', 'kernel_type': 'rbf', 'lr': 0.004285073477246697, 'batch_size': 2048, 'num_inducing': 1955, 'initialize_fe': False, 'minit': 'random'}. Best is trial 24 with value: 0.0697445273399353.
INFO:root:After model training
INFO:root:17.38037109375
INFO:root:78.0
INFO:optuna.study.study:Trial 31 finished with value: 0.07162585854530334 and parameters: {'n_max': 896, 'n_layers': 5, 'n_out': 6, 'mean_type': 'constant', 'kernel_type': 'rbf', 'lr': 0.036763754210060715, 'batch_size': 2048, 'num_inducing': 402, 'initialize_fe': False, 'minit': 'random'}. Best is trial 24 with value: 0.0697445273399353.
INFO:root:After model training
INFO:root:16.28955078125
INFO:root:62.0
INFO:optuna.study.study:Trial 32 finished with value: 0.07166143506765366 and parameters: {'n_max': 879, 'n_layers': 5, 'n_out': 11, 'mean_type': 'constant', 'kernel_type': 'rbf', 'lr': 0.012819202327575305, 'batch_size': 2048, 'num_inducing': 333, 'initialize_fe': False, 'minit': 'random'}. Best is trial 24 with value: 0.0697445273399353.
INFO:root:After model training
INFO:root:17.021484375
INFO:root:80.0
INFO:optuna.study.study:Trial 33 finished with value: 0.07049529999494553 and parameters: {'n_max': 977, 'n_layers': 5, 'n_out': 6, 'mean_type': 'constant', 'kernel_type': 'rbf', 'lr': 0.03021915908680085, 'batch_size': 2048, 'num_inducing': 275, 'initialize_fe': False, 'minit': 'random'}. Best is trial 24 with value: 0.0697445273399353.
INFO:root:After model training
INFO:root:15.53125
INFO:root:60.0
INFO:optuna.study.study:Trial 34 finished with value: 0.07240685820579529 and parameters: {'n_max': 980, 'n_layers': 5, 'n_out': 9, 'mean_type': 'constant', 'kernel_type': 'rbf', 'lr': 0.06598933805153484, 'batch_size': 2048, 'num_inducing': 242, 'initialize_fe': False, 'minit': 'random'}. Best is trial 24 with value: 0.0697445273399353.
INFO:root:After model training
INFO:root:15.7548828125
INFO:root:52.0
INFO:optuna.study.study:Trial 35 finished with value: 0.07771343737840652 and parameters: {'n_max': 983, 'n_layers': 4, 'n_out': 5, 'mean_type': 'constant', 'kernel_type': 'rbf', 'lr': 0.027432042411686973, 'batch_size': 512, 'num_inducing': 1425, 'initialize_fe': False, 'minit': 'random'}. Best is trial 24 with value: 0.0697445273399353.
INFO:root:After model training
INFO:root:16.775390625
INFO:root:60.0
INFO:optuna.study.study:Trial 36 finished with value: 0.09644965082406998 and parameters: {'n_max': 781, 'n_layers': 5, 'n_out': 3, 'mean_type': 'linear', 'kernel_type': 'matern1.5', 'lr': 0.06138331588835776, 'batch_size': 2048, 'num_inducing': 433, 'initialize_fe': False, 'minit': 'random'}. Best is trial 24 with value: 0.0697445273399353.
INFO:root:After model training
INFO:root:9.92724609375
INFO:root:28.0
INFO:optuna.study.study:Trial 37 finished with value: 0.07941148430109024 and parameters: {'n_max': 634, 'n_layers': 4, 'n_out': 11, 'mean_type': 'constant', 'kernel_type': 'rbf', 'lr': 0.01022124742290003, 'batch_size': 512, 'num_inducing': 1033, 'initialize_fe': False, 'minit': 'random'}. Best is trial 24 with value: 0.0697445273399353.
INFO:root:After model training
INFO:root:19.9697265625
INFO:root:64.0
INFO:optuna.study.study:Trial 38 finished with value: 0.071205735206604 and parameters: {'n_max': 680, 'n_layers': 5, 'n_out': 7, 'mean_type': 'constant', 'kernel_type': 'rbf', 'lr': 0.04132637641370895, 'batch_size': 2048, 'num_inducing': 740, 'initialize_fe': False, 'minit': 'random'}. Best is trial 24 with value: 0.0697445273399353.
INFO:root:After model training
INFO:root:16.2724609375
INFO:root:68.0
INFO:optuna.study.study:Trial 39 finished with value: 0.13481469452381134 and parameters: {'n_max': 916, 'n_layers': 5, 'n_out': 4, 'mean_type': 'linear', 'kernel_type': 'matern1.5', 'lr': 0.0195077144785211, 'batch_size': 2048, 'num_inducing': 257, 'initialize_fe': True, 'minit': 'random'}. Best is trial 24 with value: 0.0697445273399353.
INFO:root:After model training
INFO:root:5.92919921875
INFO:root:30.0
INFO:optuna.study.study:Trial 40 finished with value: 0.07552137225866318 and parameters: {'n_max': 851, 'n_layers': 4, 'n_out': 9, 'mean_type': 'constant', 'kernel_type': 'rbf', 'lr': 0.028822295276001737, 'batch_size': 512, 'num_inducing': 178, 'initialize_fe': False, 'minit': 'random'}. Best is trial 24 with value: 0.0697445273399353.
INFO:root:After model training
INFO:root:15.32421875
INFO:root:50.0
INFO:optuna.study.study:Trial 41 finished with value: 0.07229068875312805 and parameters: {'n_max': 906, 'n_layers': 5, 'n_out': 6, 'mean_type': 'constant', 'kernel_type': 'rbf', 'lr': 0.036384802298118635, 'batch_size': 2048, 'num_inducing': 307, 'initialize_fe': False, 'minit': 'random'}. Best is trial 24 with value: 0.0697445273399353.
INFO:root:After model training
INFO:root:39.43505859375
INFO:root:82.0
INFO:optuna.study.study:Trial 42 finished with value: 0.0715891420841217 and parameters: {'n_max': 1018, 'n_layers': 5, 'n_out': 8, 'mean_type': 'constant', 'kernel_type': 'rbf', 'lr': 0.031919442845659354, 'batch_size': 2048, 'num_inducing': 1649, 'initialize_fe': False, 'minit': 'random'}. Best is trial 24 with value: 0.0697445273399353.
INFO:root:After model training
INFO:root:16.65625
INFO:root:60.0
INFO:optuna.study.study:Trial 43 finished with value: 0.07496875524520874 and parameters: {'n_max': 932, 'n_layers': 5, 'n_out': 4, 'mean_type': 'constant', 'kernel_type': 'rbf', 'lr': 0.06257683809611282, 'batch_size': 2048, 'num_inducing': 329, 'initialize_fe': False, 'minit': 'random'}. Best is trial 24 with value: 0.0697445273399353.
INFO:root:After model training
INFO:root:15.341796875
INFO:root:92.0
INFO:optuna.study.study:Trial 44 finished with value: 0.08295037597417831 and parameters: {'n_max': 70, 'n_layers': 5, 'n_out': 6, 'mean_type': 'constant', 'kernel_type': 'rbf', 'lr': 0.005775478216211297, 'batch_size': 2048, 'num_inducing': 624, 'initialize_fe': False, 'minit': 'random'}. Best is trial 24 with value: 0.0697445273399353.
INFO:root:After model training
INFO:root:3.47607421875
INFO:root:30.0
INFO:optuna.study.study:Trial 45 finished with value: 0.0800306648015976 and parameters: {'n_max': 432, 'n_layers': 2, 'n_out': 3, 'mean_type': 'constant', 'kernel_type': 'matern1.5', 'lr': 0.09921367655574291, 'batch_size': 1024, 'num_inducing': 195, 'initialize_fe': False, 'minit': 'kmeans'}. Best is trial 24 with value: 0.0697445273399353.
INFO:root:After model training
INFO:root:16.78564453125
INFO:root:62.0
INFO:optuna.study.study:Trial 46 finished with value: 0.07867994904518127 and parameters: {'n_max': 838, 'n_layers': 5, 'n_out': 5, 'mean_type': 'constant', 'kernel_type': 'matern0.5', 'lr': 0.011650767933517912, 'batch_size': 2048, 'num_inducing': 456, 'initialize_fe': True, 'minit': 'random'}. Best is trial 24 with value: 0.0697445273399353.
INFO:root:After model training
INFO:root:14.61669921875
INFO:root:66.0
INFO:optuna.study.study:Trial 47 finished with value: 0.11485616862773895 and parameters: {'n_max': 1003, 'n_layers': 4, 'n_out': 7, 'mean_type': 'linear', 'kernel_type': 'rbf', 'lr': 0.0696951530754795, 'batch_size': 2048, 'num_inducing': 274, 'initialize_fe': False, 'minit': 'random'}. Best is trial 24 with value: 0.0697445273399353.
INFO:root:After model training
INFO:root:16.4619140625
INFO:root:52.0
INFO:optuna.study.study:Trial 48 finished with value: 0.08225921541452408 and parameters: {'n_max': 779, 'n_layers': 5, 'n_out': 10, 'mean_type': 'constant', 'kernel_type': 'rbf', 'lr': 0.043730216592196676, 'batch_size': 1024, 'num_inducing': 1512, 'initialize_fe': False, 'minit': 'random'}. Best is trial 24 with value: 0.0697445273399353.
INFO:root:After model training
INFO:root:18.39697265625
INFO:root:60.0
INFO:optuna.study.study:Trial 49 finished with value: 0.07764022052288055 and parameters: {'n_max': 872, 'n_layers': 5, 'n_out': 13, 'mean_type': 'constant', 'kernel_type': 'matern0.5', 'lr': 0.01666522266182079, 'batch_size': 2048, 'num_inducing': 538, 'initialize_fe': False, 'minit': 'kmeans'}. Best is trial 24 with value: 0.0697445273399353.
INFO:root:After model training
INFO:root:13.4072265625
INFO:root:48.0
INFO:optuna.study.study:Trial 50 finished with value: 0.09392952173948288 and parameters: {'n_max': 588, 'n_layers': 4, 'n_out': 12, 'mean_type': 'constant', 'kernel_type': 'matern1.5', 'lr': 0.008487089966272043, 'batch_size': 2048, 'num_inducing': 379, 'initialize_fe': True, 'minit': 'random'}. Best is trial 24 with value: 0.0697445273399353.
INFO:root:After model training
INFO:root:29.25830078125
INFO:root:120.0
INFO:optuna.study.study:Trial 51 finished with value: 0.07139091938734055 and parameters: {'n_max': 952, 'n_layers': 5, 'n_out': 2, 'mean_type': 'constant', 'kernel_type': 'rbf', 'lr': 0.01753507522627337, 'batch_size': 2048, 'num_inducing': 1213, 'initialize_fe': False, 'minit': 'random'}. Best is trial 24 with value: 0.0697445273399353.
INFO:root:After model training
INFO:root:26.23291015625
INFO:root:88.0
INFO:optuna.study.study:Trial 52 finished with value: 0.07328493893146515 and parameters: {'n_max': 930, 'n_layers': 5, 'n_out': 3, 'mean_type': 'constant', 'kernel_type': 'rbf', 'lr': 0.027082172291713683, 'batch_size': 2048, 'num_inducing': 985, 'initialize_fe': False, 'minit': 'random'}. Best is trial 24 with value: 0.0697445273399353.
INFO:root:After model training
INFO:root:41.3291015625
INFO:root:84.0
INFO:optuna.study.study:Trial 53 finished with value: 0.0690351128578186 and parameters: {'n_max': 966, 'n_layers': 5, 'n_out': 2, 'mean_type': 'constant', 'kernel_type': 'rbf', 'lr': 0.04934795591073259, 'batch_size': 2048, 'num_inducing': 1753, 'initialize_fe': False, 'minit': 'random'}. Best is trial 53 with value: 0.0690351128578186.
INFO:root:After model training
INFO:root:43.16796875
INFO:root:90.0
INFO:optuna.study.study:Trial 54 finished with value: 0.07098100334405899 and parameters: {'n_max': 983, 'n_layers': 5, 'n_out': 4, 'mean_type': 'constant', 'kernel_type': 'rbf', 'lr': 0.04994015790328764, 'batch_size': 2048, 'num_inducing': 1797, 'initialize_fe': False, 'minit': 'random'}. Best is trial 53 with value: 0.0690351128578186.
INFO:root:After model training
INFO:root:13.677734375
INFO:root:50.0
INFO:optuna.study.study:Trial 55 finished with value: 0.07056783139705658 and parameters: {'n_max': 908, 'n_layers': 5, 'n_out': 5, 'mean_type': 'constant', 'kernel_type': 'rbf', 'lr': 0.07407316940367238, 'batch_size': 2048, 'num_inducing': 110, 'initialize_fe': False, 'minit': 'random'}. Best is trial 53 with value: 0.0690351128578186.
INFO:root:After model training
INFO:root:13.22900390625
INFO:root:66.0
INFO:optuna.study.study:Trial 56 finished with value: 0.07019736617803574 and parameters: {'n_max': 817, 'n_layers': 5, 'n_out': 3, 'mean_type': 'constant', 'kernel_type': 'rbf', 'lr': 0.07756638575543817, 'batch_size': 2048, 'num_inducing': 103, 'initialize_fe': False, 'minit': 'random'}. Best is trial 53 with value: 0.0690351128578186.
INFO:root:After model training
INFO:root:6.42236328125
INFO:root:30.0
